Severity,Date/Time,Latitude,Longitude,City,State,Number,Street,Description
3,2016-07-25 13:01:48,35.3628,-109.0469,Ganado,AZ,,Purple Heart Trail,At Arizona/New Mexico Stateline - Accident.
2,2020-09-30 17:54:10,33.4003,-111.857,Mesa,AZ,1169,W 8th Ave,Accident on 8th Ave at Alma School Rd.
2,2020-11-13 04:50:30,34.7243,-114.418,Lake Havasu City,AZ,,AZ-95 N,Slow traffic on AZ-95 N - I-40 W from AZ-95/Exit 9 (I-40) to Wildlife Refuge Rd/Exit 2 (I-40) due to accident.
1,2020-05-24 14:43:54,33.4731,-112.2033,Phoenix,AZ,6657, W Encanto Blvd,At W McDowell Rd - Accident.
2,2020-12-27 21:39:00,33.6614,-112.1138,Phoenix,AZ,,Black Canyon Fwy N,Incident on N I-17 near W YORKSHIRE DR Expect delays.
3,2018-08-02 07:27:09,33.4615,-112.2898,Avondale,AZ,,Pearl Harbor Memorial Highway,Accident on I-10 Eastbound at Exit 132 107th Ave.
2,2017-08-14 07:55:26,32.9735,-112.6716,Gila Bend,AZ,,S US Highway 85,At W Patterson Rd - Accident.
1,2020-04-02 11:06:24,32.2972,-110.9782,Tucson,AZ,,N Oracle Rd,At N 1st Ave - Accident.
2,2017-08-31 11:27:56,33.5088,-112.2377,Phoenix,AZ,4999,N 83rd Ave,Accident on 83rd Ave at Camelback Rd.
1,2020-04-03 20:06:12,33.4806,-112.1136,Phoenix,AZ,,N Black Canyon Hwy,At I-17/Black Canyon Hwy - Accident.
2,2017-02-20 16:09:20,33.485,-111.8887,Scottsdale,AZ,,Loop 101 S,At Thomas Rd/Exit 48 - Accident.
2,2017-10-14 05:22:28,33.4949,-112.13,Phoenix,AZ,,N 33rd Ave,Accident on 33rd Ave Northbound at Indian School Rd.
2,2019-04-01 14:43:03,32.2434,-110.8756,Tucson,AZ,5498,E Pima St,Accident on Pima St at Craycroft Rd.
3,2018-04-05 07:48:55,33.386,-111.8282,Mesa,AZ,,US-60 E,At Mesa Dr/Exit 180 - Accident.
4,2016-07-25 16:19:05,35.1721,-111.6525,Flagstaff,AZ,,Purple Heart Trail,Ramp closed to Exit 195 - Road closed due to accident.
2,2017-12-04 15:40:48,33.3882,-111.9395,Tempe,AZ,3802,S Mill Ave,Accident on Hermosa Dr at Mill Ave.
2,2018-12-31 06:16:33,35.8664,-114.6045,Willow Beach,AZ,,US-93 N,At US-93 - Accident. Lane blocked.
1,2020-04-07 18:06:09,33.5096,-112.1863,Phoenix,AZ,,N 59th Ave,At 59th Ave - Accident.
3,2017-08-22 04:17:17,33.4122,-112.0106,Phoenix,AZ,,Pearl Harbor Memorial Highway,Two lanes blocked due to accident on I-10 Eastbound at Exit 151 University Dr.
2,2020-09-10 23:39:00,33.4618,-112.0773,Phoenix,AZ,,Hance Deck Park Tunnel,Incident on I-10 WB near 7TH AVE Right lane blocked. Expect delays.
3,2017-10-24 18:54:00,32.6475,-111.3933,Eloy,AZ,,Picacho Peak Rd,Accident on I-10 Eastbound at Exit 219 Picacho Peak Rd.
2,2020-12-15 06:43:09,33.6127,-112.4388,Surprise,AZ,,N Verde Vista Dr,Accident on Hearn Rd at Verde Vista Dr.
2,2018-09-28 14:09:37,32.2612,-110.9909,Tucson,AZ,,N El Burrito Ave,Accident on AZ-77 Miracle Mile at El Burrito Ave.
2,2018-10-20 06:44:52,34.6495,-111.1087,Happy Jack,AZ,6690,State Route 87,Accident on AZ-87 Northbound at Starlight Dr.
3,2019-09-18 00:49:55,33.5428,-112.1124,Phoenix,AZ,,Black Canyon Fwy S,At Glendale Ave/Exit 205 - Accident.
2,2018-09-20 13:12:51,32.2649,-110.9395,Tucson,AZ,3199,N Wilson Ave,Accident on Fort Lowell Rd at Wilson Ave.
2,2020-12-02 17:39:00,33.5962,-111.9837,Phoenix,AZ,4466, E Paradise Village Pkwy S,Incident on PARADISE VILLAGE PW S near HOUSE 4500 Expect delays.
2,2019-09-03 09:37:23,32.238,-110.9097,Tucson,AZ,1203,N Alvernon Way,Accident on Alvernon Way at Bellevue St.
1,2020-06-09 16:15:48,32.1337,-110.9989,Tucson,AZ,,W Valencia Rd,At S Midvale Park Rd - Accident.
2,2018-01-26 19:20:49,33.2483,-111.7895,Chandler,AZ,,E Ocotillo Rd,Accident on Gilbert Rd at Ocotillo Rd.
3,2020-03-22 04:20:43,34.1494,-112.1494,Black Canyon City,AZ,,Arizona Veterans Highway,Left lane blocked due to accident on I-17 Southbound between Exit 252 and Exit 248 Bumble Bee Rd.
2,2016-09-02 20:01:45,33.4659,-111.8433,Scottsdale,AZ,,E McDowell Rd,At McDowell Rd - Accident.
2,2018-03-17 14:05:10,33.3671,-111.4781,Gold Canyon,AZ,,US-60 W,One lane blocked due to accident on US-60 Westbound at Superstition Mountain Dr.
2,2017-12-13 05:39:58,33.0827,-112.0388,Maricopa,AZ,22414,N John Wayne Pkwy,Accident on Cobblestone Farms Dr at John Wayne Pkwy.
2,2019-01-04 17:35:54,33.4727,-112.1131,Phoenix,AZ,2230,N Black Canyon Hwy,Accident on Black Canyon Hwy Southbound at I-17.
2,2019-03-06 16:26:30,33.3821,-112.0992,Phoenix,AZ,7014,S 19th Ave,Accident on Carter Rd at 19th Ave.
2,2019-04-12 13:52:22,33.6246,-111.9011,Scottsdale,AZ,15301,N Hayden Rd,Accident on Hayden Rd at 83rd Way.
2,2018-04-10 19:06:08,33.4145,-111.9783,Phoenix,AZ,,Hohokam Expy S,At I-10/Exit 1 - Accident. in the left lane.
3,2019-09-20 07:40:37,33.4595,-112.3061,Avondale,AZ,,I-10 W,Right lane blocked due to accident on I-10 Westbound after Exit 131 Avondale Blvd.
2,2020-11-26 18:48:49,33.4628,-112.1665,Phoenix,AZ,,I-10 W,Accident on 51st Ave at I-10 Exit 139.
2,2018-12-13 08:53:44,33.4842,-112.1,Phoenix,AZ,1898,W Earll Dr,Accident on 19th Ave at Earll Dr.
2,2020-02-21 16:47:21,33.4948,-112.0346,Phoenix,AZ,4098,N 22nd St,Accident on 22nd St at Indian School Rd.
2,2017-06-27 04:57:33,33.5276,-112.1124,Phoenix,AZ,,Black Canyon Fwy S,At Bethany Home Rd/Exit 204 - Accident.
1,2020-04-08 09:06:37,33.4518,-112.2383,Phoenix,AZ,303, N 83rd Ave,At N 75th Ave - Accident.
1,2020-06-12 15:14:39,32.2721,-110.9611,Tucson,AZ,683, E Prince Rd,At AZ-77/Oracle Rd - Accident.
2,2019-10-18 08:51:56,33.4785,-112.083,Phoenix,AZ,599,W Windsor Ave,Accident on 7th Ave at Windsor Ave.
3,2020-11-19 15:39:01,33.4579,-112.3581,Goodyear,AZ,,I-10 E,Lane blocked due to accident on I-10 Westbound at Exit 128 Litchfield Rd.
2,2018-04-21 10:44:36,33.6686,-112.083,Phoenix,AZ,,N 7th Ave,Right lane blocked due to accident on AZ-101 Loop Westbound at Exit 25 Beardsley Rd.
2,2019-04-16 13:21:10,32.2828,-110.9696,Tucson,AZ,204,E Limberlost Dr,Accident on Limberlost Dr at Stone Ave.
1,2020-05-27 14:24:40,33.449,-112.1175,Phoenix,AZ,80, N 27th Ave,At W Adams St - Accident.
2,2020-12-14 20:30:00,33.5237,-112.0997,Phoenix,AZ,5999, N 19th Ave,Incident on N 19TH AVE near W BETHANY HOME RD Expect delays.
2,2017-06-05 10:55:57,33.6088,-112.311,El Mirage,AZ,11642, W Grand Ave,Between Youngtown and Primrose St - Accident.
4,2018-01-08 09:35:55,33.3923,-112.0992,Phoenix,AZ,1998, W Southern Ave,Closed at Lynne Ln - Road closed due to accident.
2,2020-01-29 17:18:57,33.6107,-112.1512,Glendale,AZ,,W Thunderbird Rd,Accident on 43rd Ave at Thunderbird Rd.
2,2019-10-09 16:52:44,32.1036,-111.2345,Tucson,AZ,12598,W Hermans Rd,Accident on Marstellar Rd at Hermans Rd.
3,2020-04-04 16:13:07,35.1342,-111.1981,Flagstaff,AZ,,I-40 E,Right lane blocked due to accident on I-40 Eastbound at mile marker 224.
2,2020-02-19 18:40:12,33.5093,-112.0738,Phoenix,AZ,,E Camelback Rd,Accident on Camelback Rd at Central Ave.
2,2017-09-27 16:29:56,33.5785,-111.7744,Scottsdale,AZ,,E Shea Blvd,Accident on 142nd St at Shea Blvd.
2,2020-11-09 13:26:00,35.3026,-113.0065,Seligman,AZ,,I-40 W,Slow traffic on I-40 from I-40 Bus/Exit 121 (I-40) to Anvil Rock Rd/Exit 109 (I-40) due to accident.
2,2020-11-29 00:48:00,32.207,-110.8911,Tucson,AZ,4763, E 22nd St,Incident on E 22ND ST near S SWAN RD Expect delays.
2,2018-07-25 07:50:28,32.2866,-110.9867,Tucson,AZ,921,W Wetmore Rd,Accident on Wetmore Rd at Auto Mall Dr.
2,2020-09-08 15:21:40,33.5382,-111.882,Scottsdale,AZ,,AZ-101 Loop N,Lane blocked due to accident on AZ-101-LOOP Southbound at Exit 44 Talking Stick Way.
2,2017-08-11 09:36:34,33.2629,-111.7895,Chandler,AZ,20399,S Gilbert Rd,Accident on Gilbert Rd at Queen Creek Rd.
2,2020-07-03 10:50:44,32.272,-110.9781,Tucson,AZ,,W Prince Rd,Accident on AZ-77 Oracle Rd at Prince Rd.
2,2020-11-14 01:56:00,33.6465,-111.8936,Scottsdale,AZ,8599, E Princess Dr,Incident on AZ-101 LOOP SB near FRANK LLOYD WRIGHT BLVD Drive with caution.
2,2018-07-20 13:49:50,32.1998,-110.9009,Tucson,AZ,1929,S Columbus Blvd,Accident on 29th St at Columbus Blvd.
4,2017-03-04 08:18:16,32.7231,-109.1059,Duncan,AZ,284, Old West Hwy,Closed between Madison St and Hill St - Road closed due to accident.
1,2020-05-22 20:56:47,33.473,-112.0302,Phoenix,AZ,2353, E Oak St,At E McDowell Rd - Accident.
3,2020-07-29 13:38:29,33.5868,-112.1168,Phoenix,AZ,,Black Canyon Fwy N,Lane blocked due to accident on I-17 Black Canyon Fwy Southbound at Exit 208.
2,2018-04-26 09:12:28,33.5423,-112.0408,Phoenix,AZ,,Piestewa Fwy S,At Glendale Ave/Exit 5 - Accident. Carpool lane blocked.
2,2017-11-28 19:33:23,33.4913,-112.113,Phoenix,AZ,,Black Canyon Fwy N,At Indian School Rd/Exit 202 - Accident. in the right lane.
3,2019-09-16 22:00:14,33.4283,-112.0403,Phoenix,AZ,,I-17 N,Left lane blocked due to accident on I-10 Westbound around Exit 150 I-17 Exit 194.
3,2017-01-02 19:08:04,33.6946,-112.1134,Phoenix,AZ,,Black Canyon Fwy N,At Pinnacle Peak Rd/Exit 217 - Accident.
2,2020-04-12 22:50:16,33.466,-112.1691,Phoenix,AZ,,W McDowell Rd,At N 51st Ave - Accident.
2,2018-08-17 21:49:32,32.221,-110.8324,Tucson,AZ,,E Broadway Blvd,Accident on Broadway Blvd at Prudence Rd.
3,2018-09-26 19:00:13,33.4282,-112.0688,Phoenix,AZ,,US-60 E,At 7th St/Central Ave/Exit 195B - Accident.
2,2018-01-06 00:02:55,33.5496,-112.1123,Phoenix,AZ,,Black Canyon Fwy N,At Northern Ave/Exit 206 - Accident.
2,2020-11-12 00:09:00.000000000,33.3857,-111.8809,Tempe,AZ,,Superstition Fwy E,Incident on US-60 EB near DOBSON RD Left lane blocked.
3,2018-06-10 02:43:05,33.8642,-112.1452,Phoenix,AZ,,Black Canyon Fwy N,At Anthem Way/Exit 229 - Accident.
2,2019-11-15 06:59:59,35.7089,-109.5422,Ganado,AZ,27314,US Highway 191,Accident on US-191 Southbound near Post Office Rd.
4,2020-04-06 13:49:44,33.3791,-111.7885,Mesa,AZ,1998, S Gilbert Rd,Closed between US-60/Superstition Fwy and Guadalupe Rd - Road closed due to accident.
2,2018-11-07 10:30:35,33.8429,-112.1352,Phoenix,AZ,,N Daisy Mountain Dr,Accident on Daisy Mountain Dr at Gavilan Peak Pkwy.
2,2018-05-16 18:54:42,33.4564,-111.9765,Phoenix,AZ,,AZ-202 Loop E,Between 52nd St/Exit 4 and Van Buren St/Exit 4B - Accident.
2,2020-10-25 22:52:00,33.5083,-112.255,Phoenix,AZ,4951, N 91st Ave,Incident on N 91ST AVE near W CAMELBACK RD Expect delays.
3,2017-07-20 19:24:44,33.4621,-112.0307,Phoenix,AZ,,AZ-202 Loop E,Ramp to I-10/Papago Fwy Westbound - Accident.
1,2020-04-08 19:57:16,33.2777,-111.7206,Gilbert,AZ,3206, E Germann Rd,At E Pecos Rd - Accident.
4,2019-07-06 22:45:21,33.411,-112.0057,Phoenix,AZ,,Pearl Harbor Memorial Highway,Closed between University Dr/Exit 151 and 24th St/Exit 150B - Road closed due to accident.
2,2020-11-19 11:06:15,33.6792,-114.0848,Quartzsite,AZ,,I-10 E,Accident on I-10 Westbound at Exit 26 Gold Nugget Rd.
3,2019-06-28 14:46:04,33.3824,-111.9671,Tempe,AZ,,S Arizona Mills Cir,Right lane blocked due to accident on I-10 Westbound at Exits 154 155 US-60.
2,2018-03-23 10:53:28,32.207,-110.918,Tucson,AZ,,S Randolph Way,Accident on 22nd St at Randolph Way.
2,2016-06-27 13:27:58,34.7699,-114.196,Bullhead City,AZ,,I-40 W,At Franconia Rd/Exit 13 - Accident.
2,2018-12-28 08:04:34,35.3355,-109.0706,Ganado,AZ,,I-40 E,At BIA-12/Exit 357 - Accident. Left lane blocked.
3,2019-10-10 13:01:56,33.4288,-112.0996,Phoenix,AZ,,S 19th Ave,Accident on I-17 Southbound at I-17 Exits 197.
2,2020-02-28 13:33:47,33.6874,-112.0999,Phoenix,AZ,22096,N 19th Ave,Accident on 19th Ave at Adobe Dr.
4,2020-02-07 13:35:22,33.6725,-112.3815,Sun City West,AZ,14815, W R.H. Johnson Blvd,Closed at R H Johnson Blvd - Road closed due to accident.
1,2020-05-14 18:36:51,33.509,-112.2205,Phoenix,AZ,4998, N 75th Ave,At 83rd Ave - Accident.
2,2019-08-26 07:20:40,33.4243,-112.0236,Phoenix,AZ,,I-10 E,Right hand shoulder blocked due to accident on I-10 Westbound after Exit 151 32nd St.
2,2019-10-18 17:58:31,33.6384,-112.0209,Phoenix,AZ,2842,E Phelps Rd,Accident on 28th Way at Phelps Rd.
2,2017-10-11 18:41:39,34.399,-112.229,Mayer,AZ,,E Central Ave,Between Central Ave/Copper Rd and Bensch Ranch Blvd - Accident.
2,2018-02-12 12:40:13,33.4482,-112.0789,Phoenix,AZ,399,W Washington St,Accident on 4th Ave at Washington St.
2,2018-02-28 16:54:51,33.4548,-111.9716,Phoenix,AZ,,AZ-202 Loop E,Shoulder blocked due to accident on AZ-202 Loop Eastbound at Exit 4 52nd St.
2,2018-11-03 11:58:55,33.2833,-111.7873,Gilbert,AZ,,AZ-202 Loop W,Accident on exit ramp from AZ-202 Loop Westbound at Exit 44 to Gilbert Rd.
2,2019-02-13 18:42:17,33.6726,-111.9709,Phoenix,AZ,,Pima Fwy W,At Tatum Blvd/Exit 31 - Accident.
2,2018-11-17 14:00:54,33.4615,-112.2883,Avondale,AZ,,Pearl Harbor Memorial Highway,At 107th Ave/Exit 132 - Accident. Right lane blocked.
2,2019-09-11 13:16:43,33.6384,-112.2246,Glendale,AZ,,N 77th Ave,Accident on 77th Ave at Bell Rd.
2,2019-04-09 13:31:04,33.4806,-111.7373,Mesa,AZ,,AZ-202 Loop E,HOV lane blocked due to accident on AZ-202 Westbound at Exit 20 Greenfield Rd.
1,2020-04-22 13:56:57,32.272,-110.9782,Tucson,AZ,400, W Prince Rd,At AZ-77/Oracle Rd - Accident investigation work.
2,2019-01-09 07:25:28,32.6701,-114.5214,Yuma,AZ,,E 32nd St,Accident on I-8-BL 32nd St near AZ-195 Araby Rd.
2,2016-11-30 04:26:42,33.2936,-111.746,Gilbert,AZ,,E Pecos Rd,At S Santan Village Pky/Exit 41 - Accident.
2,2016-11-07 17:25:00,33.654,-111.9079,Scottsdale,AZ,,N Hayden Rd,At AZ-101-LOOP/Pima Fwy - Accident.
2,2018-01-29 12:47:13,32.2112,-110.8923,Tucson,AZ,,E Eastland St,Accident on Eastland St at Swan Rd.
2,2020-11-11 20:23:00,32.2362,-110.944,Tucson,AZ,,E Speedway Blvd,Incident on E SPEEDWAY BL near E SPEEDWAY BLVD Drive with caution.
2,2020-11-17 01:15:00,33.4621,-112.024,Phoenix,AZ,,AZ-202 Loop W,Incident on AZ-202 LOOP WB near 24TH ST Right shoulder closed.
2,2017-07-28 15:04:18,32.1778,-110.9776,Tucson,AZ,3800,S 12th Ave,Accident on 12th Ave at AZ-86 Ajo Way.
2,2018-12-21 06:20:56,33.6547,-112.1345,Phoenix,AZ,3497,W Union Hills Dr,Accident on 35th Ave at Union Hills Dr.
2,2019-08-09 08:17:38,32.3371,-110.9883,Tucson,AZ,7199,N Pampa Pl,Accident on Ina Rd near Pampa Pl.
2,2020-12-03 21:14:00,33.655,-112.0309,Phoenix,AZ,18499, N Cave Creek Rd,Incident on N CAVE CREEK RD near E UNION HILLS DR Expect delays.
3,2017-09-29 11:07:23,33.3074,-111.9728,Phoenix,AZ,15451,S 50th St,Accident on exit ramp from I-10 Eastbound to Chandler Blvd.
2,2020-05-25 14:45:45,32.1338,-111.0031,Tucson,AZ,1802,W Valencia Rd,Accident on Valencia Rd at Valley Indian Agency Connect Rd.
2,2020-12-06 23:11:00,33.4588,-112.3924,Goodyear,AZ,1073, N Estrella Pkwy,Incident on ESTRELLA PW near HOUSE 1100 Expect delays.
2,2019-05-14 07:23:49,33.6941,-112.212,Glendale,AZ,22954,N 71st Ave,Accident on 71st Ave at Planada Ln.
2,2020-05-18 14:43:55,33.4376,-112.6695,Buckeye,AZ,,I-10 W,At Sun Valley/Palo Verde/Exit 109 - Accident.
2,2017-08-14 07:29:07,33.3638,-111.8941,Tempe,AZ,2767,W Guadalupe Rd,HOV lane blocked due to accident on AZ-101 Loop Southbound at Guadalupe Rd.
2,2018-08-29 14:15:03,33.5663,-112.2551,Peoria,AZ,9100,W Olive Ave,Accident on 91st Ave at Olive Ave.
2,2019-11-07 08:25:52,33.6745,-112.255,Peoria,AZ,,N 91st Ave,Accident on 91st Ave at Lake Pleasant Pkwy.
1,2020-05-07 18:15:37,33.5088,-112.255,Phoenix,AZ,4999, N 91st Ave,At 91st Ave - Accident.
3,2017-09-25 13:51:19,32.1147,-110.858,Tucson,AZ,,Pearl Harbor Memorial Highway,Accident on I-10 Eastbound at Wilmot Rd.
2,2020-11-01 01:51:00,33.4937,-112.285,Avondale,AZ,,Westwind Pkwy,Incident on N 104TH DR near W INDIAN SCHOOL RD Expect delays.
2,2020-12-09 00:32:15,32.0863,-110.7728,Tucson,AZ,9130, S Houghton Rd,Incident on S HOUGHTON RD near E OLD VAIL RD Expect delays.
2,2020-05-29 11:46:34,33.4848,-112.0403,Phoenix,AZ,,Piestewa Fwy N,Entry ramp to Az-51 Northbound from N Greenfield Rd closed due to accident.
3,2018-07-18 17:10:06,33.4594,-111.9962,Phoenix,AZ,,AZ-202 Loop W,At 40th St/Exit 2 - Accident.
2,2016-08-02 06:37:05,32.5064,-111.2688,Marana,AZ,,Pearl Harbor Memorial Highway,At Pinal Air Park Rd/Exit 232 - Accident.
1,2020-04-01 19:23:26,33.4228,-112.204,Phoenix,AZ,,S 67th Ave,At S 67th Ave - Accident.
2,2020-08-24 16:44:46,32.1778,-110.9683,Tucson,AZ,3798,S 6th Ave,Accident on 6th Ave at Ajo Way.
3,2018-09-16 05:38:36,33.8414,-112.1438,Phoenix,AZ,,N Daisy Mountain Dr,Right lane blocked due to accident on I-17 Northbound at Exit 227 Daisy Mountain Dr.
2,2020-10-24 10:39:00,33.614,-113.6514,Salome,AZ,,I-10 W,Slow traffic on I-10 from Hovatter Rd/Exit 53 (I-10) to Vicksburg Rd/Exit 45 (I-10) due to accident.
3,2018-05-11 14:19:42,35.1615,-111.2719,Flagstaff,AZ,,Twin Arrows Rd,Right lane blocked due to accident on I-40 Westbound after Exit 219 Twin Arrows Rd.
2,2019-11-12 10:30:39,32.3746,-111.14,Tucson,AZ,,N Silverbell Rd,Accident on Silverbell Rd at Twin Peaks Rd.
2,2016-09-06 10:17:55,33.3856,-111.9532,Tempe,AZ,,US-60 W,At Priest Dr/Exit 172 - Accident.
1,2020-06-10 17:20:39,33.3054,-111.9111,Chandler,AZ,,N McClintock Dr,At AZ-101-LOOP/Price Rd - Accident.
1,2020-05-19 14:52:04,33.4376,-111.9433,Tempe,AZ,757, N Mill Ave,At N Mill Ave - Accident.
2,2020-10-11 06:29:40,32.1714,-111.0715,Tucson,AZ,,S Kinney Rd,Incident on W AJO HWY near S KINNEY RD Expect delays.
2,2020-05-21 16:30:26,32.3088,-110.8752,Tucson,AZ,5497,E Sunrise Dr,Accident on Sunrise Dr at Craycroft Rd.
2,2017-11-20 04:39:25,33.4749,-111.6878,Mesa,AZ,,Red Mountain Fwy S,Shoulder blocked due to accident on AZ-202 Loop Westbound at Exit 23A Power Rd.
2,2020-12-03 07:50:47,33.4473,-112.0346,Phoenix,AZ,84,S 22nd St,Accident on 22nd St at Jefferson St.
2,2020-10-16 15:42:21,33.6493,-112.3638,Surprise,AZ,,Mountain View Blvd,Accident on US-60 Grand Ave Eastbound at Mountain View Blvd.
2,2018-11-01 16:08:43,33.6405,-112.0309,Phoenix,AZ,2398,E Bell Rd,Accident on Bell Rd at Cave Creek Rd.
2,2019-05-16 15:30:41,32.2721,-110.9523,Tucson,AZ,,N Mountain Ave,Accident on Prince Rd at Mountain Ave.
2,2020-02-18 17:18:10,33.5857,-112.0997,Phoenix,AZ,1974,W Desert Cove Ave,Accident on 19th Ave at Desert Cove Ave.
2,2017-07-20 18:35:59,33.6646,-114.2057,Quartzsite,AZ,,Pearl Harbor Memorial Highway,At I-10-BL/Exit 19 - Accident.
1,2020-03-27 16:31:43,32.2214,-110.976,Tucson,AZ,2, N Granada Ave,At W Broadway Blvd - Accident.
1,2020-05-08 09:50:49,33.698,-112.1697,Glendale,AZ,5096, W Pinnacle Peak Rd,At N 59th Ave - Accident.
3,2018-11-14 20:18:38,33.3868,-111.6732,Mesa,AZ,,Superstition Fwy W,At Sossaman Rd/Exit 189 - Accident. Two lanes blocked.
3,2016-09-29 08:32:58,33.4303,-112.1062,Phoenix,AZ,,I-17 N,At Buckeye Rd/Exit 198 - Accident.
2,2019-07-30 07:37:28,33.3777,-112.0647,Phoenix,AZ,,E Baseline Rd,Accident on 7th St at Baseline Rd.
1,2020-03-24 08:46:21,32.2503,-110.9354,Tucson,AZ,2390, N Tucson Blvd,At N Tucson Blvd - Accident.
2,2020-09-18 03:47:00,34.397,-111.4687,Pine,AZ,4572, State Highway 87,Incident on AZ-87 NB near HEALING PINES LN Drive with caution.
2,2018-06-04 08:51:55,33.6545,-112.1681,Glendale,AZ,5095,W Union Hills Dr,Accident on 51st Ave at Union Hills Dr.
2,2020-05-26 09:47:02,33.5663,-112.2551,Peoria,AZ,,W Olive Ave,Accident on 91st Ave near Olive Ave.
1,2020-06-15 13:53:24,32.2506,-110.9012,Tucson,AZ,2399, N Columbus Blvd,At N Columbus Blvd - Accident.
2,2019-12-13 13:58:54,33.6689,-112.0762,Phoenix,AZ,,Pima Fwy W,At 7th Ave/Exit 25 - Accident. Lane blocked.
2,2020-10-05 00:33:00,34.7472,-112.1069,Jerome,AZ,299, Deception Ln,Incident on STATE RTE-89A EB near DECEPTION LN Road closed. Take alternate route.
2,2020-06-17 09:41:06,33.5963,-112.1679,Glendale,AZ,5059, W Cactus Rd,Between N 43rd Ave and N 51st Ave - Accident.
2,2018-07-08 11:34:34,34.3175,-111.1144,Payson,AZ,,E AZ Highway 260,Accident on AZ-260 Eastbound after Control Rd.
2,2020-08-05 09:14:07,33.3367,-111.9979,Phoenix,AZ,3999,E Talowa St,Accident on Appaloosa Dr at Talowa St.
2,2020-12-01 21:05:00.000000000,33.6556,-112.3528,Sun City West,AZ,13564, W Camino del Sol,Incident on W CAMINO DEL SOL near N SPANISH GARDEN DR Expect delays.
2,2017-05-23 00:43:10,33.6373,-112.116,Phoenix,AZ,,Black Canyon Fwy S,At Bell Rd/Exit 212 - Accident.
2,2018-01-12 08:02:54,33.4496,-112.3281,Avondale,AZ,1199,N 127th Ave,Accident on 127th Ave at Van Buren St.
2,2020-06-14 16:01:13,33.5676,-112.0989,Phoenix,AZ,1894, W Dunlap Ave,At N 19th Ave - Accident.
2,2020-09-19 03:52:00,33.4245,-111.9263,Tempe,AZ,1816, E 6th St,Incident on E 6TH ST near S RURAL RD Expect delays.
2,2020-09-12 02:11:00,34.2412,-112.1118,Mayer,AZ,,Arizona Veterans Highway,Incident on I-17 NB near BLOODY BASIN RD Drive with caution.
2,2020-04-01 17:17:57,33.6121,-111.8913,Scottsdale,AZ,,Pima Fwy N,At Raintree Dr/Exit 39 - Accident. Hard shoulder blocked.
2,2017-03-23 18:10:32,33.5207,-111.8877,Scottsdale,AZ,,Pima Fwy N,At McDonald Dr/Exit 45 - Accident.
2,2018-08-07 16:25:25,32.3589,-111.0475,Tucson,AZ,3808,W Cortaro Farms Rd,Accident on Cortaro Farms Rd at Thornydale Rd.
2,2018-04-27 10:23:48,33.5368,-112.0281,Phoenix,AZ,6800,N 26th St,Accident on Squaw Peak Dr at 26th St.
2,2017-12-06 14:33:58,33.5824,-111.8133,Scottsdale,AZ,,N 124th St,Accident on 124th St at Shea Blvd.
2,2018-09-18 13:51:07,32.3374,-111.0295,Tucson,AZ,,N Shannon Rd,Accident on Shannon Rd at Ina Rd.
2,2020-02-17 08:10:07,33.4282,-112.3883,Goodyear,AZ,2159,S Wood Blvd,Accident on Festival Way at Wood Blvd.
3,2018-12-28 14:46:25,33.5242,-112.1123,Phoenix,AZ,,W Bethany Home Rd,HOV lane blocked due to accident on I-17 Black Canyon Hwy Northbound at Exit 204 Bethany Home Rd.
2,2019-09-25 14:20:13,33.466,-112.0382,Phoenix,AZ,,Piestewa Fwy S,HOV lane blocked and left lane blocked due to accident on AZ-51 Southbound from Thomas Rd to Mcdowell Rd.
2,2020-11-05 23:18:00,33.4622,-112.0692,Phoenix,AZ,,Hance Deck Park Tunnel,Incident on I-10 EB near 7TH ST Right shoulder closed.
2,2020-11-24 05:11:00,33.592,-111.8748,Scottsdale,AZ,11699, N 95th Way,Incident on ALTADENA AVE near HOUSE 9600 Expect delays.
2,2020-05-09 17:52:13,33.4612,-111.8892,Scottsdale,AZ,,AZ-101 Loop S,At McDowell Rd/Exit 49 - Accident. Right lane blocked.
2,2020-10-22 17:05:00,33.4134,-112.332,Avondale,AZ,12663, W Elwood St,Incident on W ELWOOD ST near S VERMEERSCH RD Expect delays.
2,2018-05-24 07:15:58,33.3776,-112.1511,Laveen,AZ,6798,S 43rd Ave,Accident on 43rd Ave at Baseline Rd.
2,2017-12-28 15:39:35,32.4244,-110.9612,Tucson,AZ,,N 1st Ave,Accident on 1st Ave at Tangerine Rd.
2,2019-11-01 07:38:51,33.5823,-112.0102,Phoenix,AZ,,E Shea Blvd,Accident on AZ-51 at Exit 9 Shea Blvd.
1,2020-03-19 20:46:06,33.4805,-112.1344,Phoenix,AZ,3498, W Thomas Rd,At N 43rd Ave - Accident.
3,2017-08-08 12:38:04,33.6548,-112.1146,Phoenix,AZ,,Black Canyon Fwy S,Accident on I-17 Black Canyon Fwy Northbound at Exit 214A-B Union Hills Dr.
2,2018-11-15 04:34:19,33.3333,-112.0602,Phoenix,AZ,,S TV Rd,Accident on TV Rd near Rd D.
2,2019-07-15 09:07:44,33.4001,-111.9478,Tempe,AZ,2702,S Roosevelt St,Accident on Alameda Dr near Roosevelt St.
4,2017-06-05 15:32:43,33.3859,-111.8804,Mesa,AZ,,Superstition Fwy W,Closed between Dobson Rd/Exit 177 and AZ-101-LOOP/Exit 176 - Road closed due to accident.
2,2020-07-24 15:08:25,32.2394,-110.9721,Tucson,AZ,1380,N Stone Ave,Accident on Drachman St at Stone Ave.
2,2017-06-22 13:59:52,33.4621,-112.0307,Phoenix,AZ,,AZ-202 Loop E,Ramp to AZ-202 - Accident.
2,2018-08-15 18:02:44,33.4658,-111.8962,Scottsdale,AZ,8613,E McDowell Rd,Accident on 87th St at McDowell Rd.
2,2020-12-18 14:21:00,32.1922,-110.8596,Tucson,AZ,6276, E Golf Links Rd,Stationary traffic from S Craycroft Rd (E Golf Links Rd) to S Wilmot Rd (E Golf Links Rd) due to accident.
1,2020-06-15 15:34:43,32.3519,-110.9956,Tucson,AZ,,W Magee Rd,At W Magee Rd - Accident.
2,2018-10-12 11:37:33,33.6837,-112.1126,Phoenix,AZ,,Black Canyon Fwy S,Accident now on the shoulder on I-17 Northbound at Exit 215B Black Canyon Hwy.
2,2020-12-11 07:12:53,33.379,-111.7717,Mesa,AZ,2778,E Baseline Rd,Accident on Baseline Rd at Lindsay Rd.
2,2020-11-12 11:56:00,34.8093,-111.9081,Cornville,AZ,,W State Route 89A,Incident on STATE RTE-89A NB near FS ROAD 89B Drive with caution.
2,2020-04-09 07:14:18,33.4376,-112.6695,Buckeye,AZ,,I-10 W,At Sun Valley/Palo Verde/Exit 109 - Accident.
4,2016-12-18 01:46:51,33.6687,-112.1665,Glendale,AZ,,Agua Fria Fwy E,Closed at 51st Ave/Exit 20 - Road closed due to accident.
3,2018-09-14 08:08:13,32.4666,-111.2229,Marana,AZ,,I-10 E,Shoulder blocked due to accident on I-10 Eastbound in Marana.
2,2018-09-17 19:58:56,33.3922,-112.0819,Phoenix,AZ,6001,S 7th Ave,Accident on 7th Ave at Southern Ave.
2,2017-09-12 19:24:09,33.3857,-111.9349,Tempe,AZ,,Superstition Fwy W,At Mill Ave/Exit 173 - Accident.
2,2020-07-21 09:28:14,33.5676,-112.1028,Phoenix,AZ,2028,W Dunlap Ave,Accident on C St near Dunlap Ave.
3,2017-09-04 13:19:35,34.6903,-111.7435,Sedona,AZ,,State Route 179,Accident on I-17 Southbound after Exit 298 AZ-179. On the median.
3,2017-12-20 08:02:11,33.4612,-112.0799,Phoenix,AZ,,N 5th Ave,Shoulder blocked due to accident on I-10 Eastbound at 5th ave.
3,2018-10-06 20:02:12,33.4519,-111.8476,Mesa,AZ,,AZ-202 Loop W,Between McKellips Rd/Exit 12 and Alma School Rd/Exit 11 - Accident.
2,2020-08-20 06:07:52,33.6438,-112.1512,Glendale,AZ,4299,W Helena Dr,Accident on 42nd Ln at Helena Dr.
2,2020-02-24 08:55:36,33.4067,-111.8913,Tempe,AZ,,AZ-101 Loop S,Left hand shoulder blocked due to accident on AZ-101-LOOP Northbound near Exit 53 Broadway Rd.
2,2018-07-31 08:30:33,32.1628,-110.7827,Tucson,AZ,9766,E Irvington Rd,Accident on Irvington Rd at Vista.
2,2020-10-13 21:47:00,33.7077,-112.1162,Phoenix,AZ,,Black Canyon Fwy N,Incident on I-17 near W HAPPY VALLEY RD Expect delays.
3,2018-01-29 07:32:21,33.4625,-112.1838,Phoenix,AZ,5740,W Latham St,Accident on entry ramp to I-10 Eastbound from N 59th Ave.
2,2016-09-07 08:47:35,31.4609,-110.9911,Rio Rico,AZ,,I-19 N,At Rio Rico Dr/Exit 17 - Accident.
3,2019-01-22 06:05:23,33.3927,-111.9674,Tempe,AZ,,I-10 W,HOV lane blocked due to accident on I-10 Westbound at Southern Ave.
4,2018-10-04 20:57:40,33.375,-110.742,Globe,AZ,,AZ-77,Closed at US-70 - Road closed due to accident.
3,2018-05-16 21:08:12,33.7331,-112.1219,Phoenix,AZ,,Black Canyon Fwy S,At Happy Valley Rd/Exit 218 - Accident.
2,2018-10-31 08:07:08,33.4358,-111.892,Mesa,AZ,,AZ-101 Loop S,Accident on entry ramp to AZ-101 Loop Southbound at Exit 9 from AZ-202 Loop Eastbound.
2,2019-08-13 07:53:02,33.4587,-112.1345,Phoenix,AZ,998,N 35th Ave,Accident pedestrian involved on 35th Ave at Roosevelt St.
