Severity,Date/Time,Latitude,Longitude,City,State,Number,Street,Description
1,2020-04-23 11:15:27,33.6382,-112.2741,Sun City,AZ,,N 99th Ave,At 99th Ave - Accident.
2,2017-12-19 13:57:03,33.4516,-112.2034,Phoenix,AZ,199,N 67th Ave,Accident on 67th Ave at Van Buren St.
2,2019-09-25 04:27:16,32.1596,-110.9137,Tucson,AZ,,I-10 E,Accident on Palo Verde Blvd near I-10 Exits 264A 264B 265.
2,2020-12-16 08:16:00,34.3699,-112.1822,Mayer,AZ,,Old Sycamore Rd,Incident on AZ-69 SB near BENSCH RANCH BLVD Right lane blocked. Expect delays.
2,2016-08-12 16:25:24,33.6504,-112.0005,Phoenix,AZ,,Piestewa Fwy N,At Union Hills Dr/Exit 14 - Accident.
2,2020-09-16 23:32:00,33.3781,-111.9678,Tempe,AZ,,I-10 W,Incident on I-10 near E ELLIOT RD Expect delays.
2,2020-08-14 06:23:01,32.1377,-110.952,Tucson,AZ,1300,E Ginter Rd,Accident on Ginter Rd at Randall Blvd.
2,2020-10-01 19:30:00,34.5299,-111.9474,Mayer,AZ,,Arizona Veterans Highway,Incident on I-17 NB near AZ-260 Right lane blocked. Expect delays.
2,2019-07-18 16:56:40,32.1997,-110.8751,Tucson,AZ,5499,E 29th St,Accident on 29th St at Craycroft Rd.
3,2018-11-26 14:03:01,32.4618,-111.2167,Marana,AZ,,N Sandario Rd,Left lane closed due to accident on I-10 Westbound at Exit 236 Sandario Rd.
3,2019-01-27 05:32:41,33.4627,-112.1928,Phoenix,AZ,,Pearl Harbor Memorial Highway,Between 59th Ave/Exit 138 and 51st Ave/Exit 139 - Accident.
2,2017-05-18 16:54:24,31.7938,-111.0197,Amado,AZ,,I-19 S,At Canoa Rd/Exit 56 - Accident.
2,2020-12-22 18:49:28,32.2074,-110.9654,Tucson,AZ,1127, S 4th Ave,Incident on S 4TH AVE near E 21ST ST Expect delays.
2,2016-12-06 18:14:04,33.644,-112.1154,Phoenix,AZ,,Black Canyon Fwy S,At Bell Rd/Exit 212 - Accident.
2,2017-09-21 07:45:25,33.551,-112.3244,El Mirage,AZ,,W Northern Ave,Accident on El Mirage Rd at Northern Ave.
2,2020-12-21 01:46:00,35.6178,-111.5225,Flagstaff,AZ,33692, N US Highway 89,Stationary traffic on US-89 N - US-89 S from Black Mesa Pump Station Rd (US-89) to CR-395 (Flagstaff) (North) (US-89) due to accident.
1,2020-04-15 16:00:40,32.236,-110.9595,Tucson,AZ,1083, N Euclid Ave,At N Campbell Ave - Accident.
2,2020-12-03 22:36:00,33.4826,-112.264,Phoenix,AZ,,AZ-101 Loop S,Slow traffic on Agua Fria Fwy S - Loop 101 S - AZ-101 Loop S from Indian School Rd/Exit 4 (Agua Fria Fwy/AZ-101) to McDowell Rd/Exit 2 (Agua Fria Fwy/AZ-101) due to accident.
3,2017-09-22 15:04:30,33.4613,-112.0384,Phoenix,AZ,,Pearl Harbor Memorial Highway,Accident on I-10 Eastbound before AZ-51.
2,2020-11-09 23:59:00,34.7578,-112.4538,Chino Valley,AZ,,Park Pl,Incident on AZ-89 NB near E RD Right lane blocked. Expect delays.
2,2018-08-30 13:21:18,32.2615,-110.8925,Tucson,AZ,4698,E Fort Lowell Rd,Accident on Fort Lowell Rd at Swan Rd.
2,2017-09-08 11:09:21,33.4875,-112.0694,Phoenix,AZ,3399,N 3rd St,Accident on 3rd St at Osborn Rd.
1,2020-03-29 18:36:24,32.2215,-110.8753,Tucson,AZ,,Craycroft Rd,At Craycroft Rd - Accident.
3,2018-07-11 21:14:16,33.5675,-112.1174,Phoenix,AZ,,W Dunlap Ave,Right lane blocked due to accident on I-17 Southbound at Exit 207 Dunlap Ave.
1,2020-05-07 13:05:18,32.1633,-110.9434,Tucson,AZ,1895, E Irvington Rd,At S Campbell Ave - Accident.
4,2019-09-01 04:50:32,35.1313,-111.1895,Flagstaff,AZ,,Purple Heart Trail,Closed between Buffalo Range Rd/Exit 225 and Townsend Winona Rd/Exit 211 - Road closed due to accident.
2,2020-12-18 12:59:30,33.4627,-112.1885,Phoenix,AZ,,I-10 E,Slow traffic on Papago Fwy E - I-10 E - Pearl Harbor Memorial Highway from 67th Ave/Exit 137 (I-10) to 7th St/Exit 145 (I-10) due to accident.
1,2020-05-23 09:56:31,33.4492,-112.1001,Phoenix,AZ,1842, W Adams St,At I-17/US-60/N 23rd Ave - Accident.
2,2016-10-02 10:26:22,33.3263,-111.8936,Chandler,AZ,,Price Fwy S,At Ray Rd/Exit 59 - Accident.
2,2016-08-31 09:04:25,33.4811,-111.7288,Mesa,AZ,,AZ-202 Loop W,Between Greenfield Rd/Exit 20 and Val Vista Dr/Exit 19 - Accident.
2,2019-01-29 14:55:00,33.4399,-112.3468,Avondale,AZ,300,E Ludlow Dr,Accident on 3rd St at Ludlow Dr.
2,2020-12-23 18:55:00.000000000,33.6697,-112.0928,Phoenix,AZ,,AZ-101 Loop W,Incident on AZ-101 near N PIMA Expect delays.
2,2019-04-16 16:22:10,32.2507,-110.8754,Tucson,AZ,,E Grant Rd,Accident on Grant Rd at Craycroft Rd.
2,2019-10-21 16:43:59,33.6251,-112.1511,Phoenix,AZ,15867,N 43rd Ave,Accident on 43rd Ave at Greenway Rd.
2,2017-05-09 09:10:14,33.4359,-111.9444,Tempe,AZ,,AZ-202 Loop W,At Center Pky/Priest Dr/Exit 6 - Accident.
2,2019-06-10 20:27:18,33.6689,-112.0762,Phoenix,AZ,,Pima Fwy W,At 7th Ave/Exit 25 - Accident.
2,2019-09-28 17:38:07,33.4803,-112.2033,Phoenix,AZ,,N 67th Ave,Queueing traffic due to accident on Thomas Rd both ways between 64th Dr and 67th Ave.
2,2019-07-29 09:17:44,33.3861,-111.8492,Mesa,AZ,,Superstition Fwy W,At Alma School Rd/Exit 178 - Accident. Lane blocked.
2,2017-09-15 18:45:54,33.5166,-112.1124,Phoenix,AZ,,Black Canyon Fwy S,At Camelback Rd/Exit 203 - Accident.
2,2019-02-19 14:58:26,33.6107,-112.1859,Glendale,AZ,5898,W Thunderbird Rd,Accident on 59th Ave at Thunderbird Rd.
2,2017-12-01 14:51:25,33.448,-111.9872,Phoenix,AZ,,44th St,At E Washington St - Accident.
2,2019-05-16 16:37:26,33.4067,-112.0646,Phoenix,AZ,701,E Broadway Rd,Accident on Broadway Rd at 7th St.
1,2020-04-15 07:22:59,32.3376,-111.1073,Tucson,AZ,7200, N Cortaro Rd,At W Ina Rd - Accident.
2,2017-10-16 18:26:38,33.4579,-112.3346,Avondale,AZ,,Pearl Harbor Memorial Highway,At Dysart Rd/Exit 129 - Accident. in the right lane.
2,2018-06-06 11:49:15,33.5963,-112.1514,Phoenix,AZ,,W Cactus Rd,Accident on 43rd Ave at Cactus Rd.
2,2017-11-13 14:20:25,33.349,-111.9759,Phoenix,AZ,,S 51st St,Fuel spillage on 51st St at Elliot Rd.
2,2016-12-07 01:26:00,33.6726,-111.9709,Phoenix,AZ,,Pima Fwy W,At Tatum Blvd/Exit 31 - Accident.
2,2018-10-23 08:47:57,33.436,-111.9262,Tempe,AZ,,N Scottsdale Rd,Shoulder blocked due to accident on AZ-202 Loop Westbound at Exit 7 Scottsdale Rd.
1,2020-05-15 18:35:24,32.2722,-110.9268,Tucson,AZ,3598, N Country Club Rd,At N Country Club Rd - Accident.
2,2019-09-15 06:16:03,33.5458,-112.1343,Phoenix,AZ,3500,W Orangewood Ave,Accident on 35th Ave at Orangewood Ave.
1,2020-05-14 19:21:41,33.6403,-112.0829,Phoenix,AZ,698, W Bell Rd,At N 19th Ave - Accident.
4,2019-02-26 14:29:20,32.2723,-112.7406,Ajo,AZ,100, E Sahuaro St,Closed at Ajo Well Rd - Road closed due to accident.
2,2019-03-16 10:36:07,33.6697,-112.097,Phoenix,AZ,,AZ-101 Loop W,Right lane blocked due to accident on AZ-101-LOOP at Exit 24 19th Ave.
2,2020-09-23 21:08:04,32.2199,-110.9655,Tucson,AZ,399, E 12th St,Incident on S 4TH AVE near E BROADWAY BLVD Drive with caution.
1,2020-05-02 21:22:13,33.5379,-112.2205,Glendale,AZ,,N 75th Ave,At N 75th Ave - Accident.
2,2019-07-26 15:15:43,33.4322,-111.891,Mesa,AZ,,AZ-101 Loop N,HOV lane blocked due to accident on AZ-101-LOOP Southbound at Exit 52 Rio Salado Pkwy.
2,2018-08-28 18:40:01,32.1629,-110.8332,Tucson,AZ,7473,E Irvington Rd,Accident on Lantana Pl at Irvington Rd.
3,2019-05-16 17:33:36,32.1874,-110.9705,Tucson,AZ,,I-10 E,Right lane blocked due to accident on I-10 Westbound at Exit 261 6th Ave.
2,2019-05-17 13:32:10,33.6405,-111.9429,Scottsdale,AZ,6360,E Bell Rd,Accident on 64th St at Bell Rd.
2,2018-01-10 07:02:41,33.2475,-111.8467,Chandler,AZ,10985,W Ocotillo Rd,Accident on Nebraska St at Ocotillo Rd.
2,2019-08-14 16:59:11,33.5382,-112.0629,Phoenix,AZ,6995,N 8th Pl,Accident on 8th Pl at Glendale Ave.
2,2017-01-06 19:10:34,33.6692,-112.0901,Phoenix,AZ,,Loop 101 E,At 7th Ave/Exit 25 - Accident.
2,2018-02-15 09:22:10,32.1628,-110.8408,Tucson,AZ,7100,E Irvington Rd,Accident on Kolb Rd at Irvington Rd.
2,2018-01-10 20:38:17,33.434,-111.9263,Tempe,AZ,,N Scottsdale Rd,At AZ-202-loop - Accident.
2,2019-11-26 08:42:49,33.3579,-111.9286,Tempe,AZ,6898,S Rural Rd,Accident on Bell De Mar Dr at Rural Rd.
2,2016-08-01 12:42:38,35.2159,-112.4009,Williams,AZ,,Purple Heart Trail,At Monte Carlo Rd/Exit 149 - Accident.
3,2020-02-01 05:10:30,35.1613,-111.2711,Flagstaff,AZ,,I-40 W,Left lane blocked due to accident on I-40 Westbound at Exit 219 Twin Arrows Rd.
2,2019-03-21 14:38:45,33.3868,-111.9582,Tempe,AZ,,Superstition Fwy W,Accident on exit ramp from US-60 Westbound at Exit 172 to W Baseline Rd Westbound.
2,2019-04-04 04:40:32,33.1466,-112.0071,Maricopa,AZ,,Sacate Rd,Accident on AZ-347 Southbound near Sacate Rd. On the median.
2,2020-09-10 23:01:00,33.5195,-112.0441,Phoenix,AZ,,Piestewa Fwy N,Construction on AZ-51 NB near BETHANY HOME RD Road closed. Take alternate route.
2,2018-10-24 18:47:53,32.2215,-110.9352,Tucson,AZ,2498,E Broadway Blvd,Accident on Broadway Blvd at Tucson Blvd.
2,2020-02-14 15:32:43,33.2183,-111.8585,Sun Lakes,AZ,10398,E Riggs Rd,Accident on Riggs Rd at Alma School Rd.
2,2020-10-12 20:17:30,33.4623,-112.0511,Phoenix,AZ,,I-10 W,Slow traffic on I-10 from AZ-51/AZ-202/Exit 147 (I-10) to 7th St/Exit 145 (I-10) due to accident.
2,2020-07-29 13:32:40,32.2068,-110.9806,Tucson,AZ,,W Starr Pass Blvd,Accident on Starr Pass Blvd at 22nd St.
1,2020-05-28 09:28:16,32.1778,-110.9683,Tucson,AZ,3798, S 6th Ave,At S 12th Ave - Accident.
2,2020-10-24 10:46:00,33.4625,-112.2497,Tolleson,AZ,,I-10 W,Incident on I-10 WB near 91ST AVE Drive with caution.
2,2020-11-03 11:45:42,32.2361,-110.899,Tucson,AZ,4398, E Speedway Blvd,Incident on N CATALINA AVE near E SPEEDWAY BLVD Expect delays.
2,2019-08-15 11:32:37,33.5819,-112.1861,Glendale,AZ,,N 59th Ave,Accident on 59th Ave at Peoria Ave.
3,2017-12-06 18:27:58,32.2942,-111.0299,Tucson,AZ,,W El Camino del Cerro,Accident on I-10 Westbound at Ruthrauff Rd.
2,2018-01-29 16:26:19,33.4728,-111.9696,Phoenix,AZ,2300,N 52nd St,Accident on 52nd St at Oak St.
1,2020-03-27 20:21:15,33.466,-112.1864,Phoenix,AZ,,W McDowell Rd,At N 59th Ave - Serious accident.
2,2019-03-13 18:48:55,33.4592,-112.0366,Phoenix,AZ,1015, N 21st Pl,Between Piestewa Fwy and I-10 - Accident.
2,2020-12-09 15:06:51,33.4183,-111.8915,Tempe,AZ,,AZ-101 Loop S,Lane blocked due to accident on AZ-101-LOOP Southbound at Exit 52 Price Rd.
2,2019-10-30 20:05:04,33.6406,-112.0309,Phoenix,AZ,,N Cave Creek Rd,Accident on Bell Rd at Cave Creek Rd.
2,2019-10-30 15:36:07,33.4084,-111.8913,Tempe,AZ,,AZ-101 Loop S,Accident on AZ-101-LOOP Southbound at Broadway Rd.
1,2020-04-25 08:41:28,32.1778,-111.0034,Tucson,AZ,1801, W Ajo Way,At S Mission Rd - Accident.
2,2018-11-26 18:25:59,33.4396,-111.9664,Phoenix,AZ,,AZ-202 Loop W,Accident on AZ-202 Loop Westbound at Exits 5 6 Sky Harbor Blvd.
3,2018-07-06 16:06:24,32.0796,-110.8022,Tucson,AZ,,Pearl Harbor Memorial Highway,Between Rita Rd/Exit 273 and Kolb Rd/Exit 270 - Accident.
2,2020-11-09 13:51:00,35.2924,-113.0432,Seligman,AZ,,I-40 W,Incident on I-40 WB near ANVIL ROCK RD Left lane blocked.
2,2019-09-12 08:55:04,33.6699,-112.0946,Phoenix,AZ,,AZ-101 Loop W,Accident on exit ramp from AZ-101-LOOP Northbound at Exits 23 23A 23C-B 24 25 to 19th Ave Westbound.
2,2019-04-15 15:30:28,33.3242,-111.8764,Chandler,AZ,1184,N Dobson Rd,Accident on Dobson Rd at Ironwood Dr.
2,2019-06-20 07:54:56,32.2434,-110.8756,Tucson,AZ,5498,E Pima St,Accident on Craycroft Rd at Pima St.
4,2016-10-03 09:11:15,33.4084,-112.2042,Phoenix,AZ,4382, S 67th Ave,Closed at 75th Ave - Road closed due to accident.
2,2019-03-24 18:46:07,33.6697,-112.097,Phoenix,AZ,,AZ-101 Loop W,Two lanes blocked and HOV lane blocked due to accident on AZ-101-LOOP Westbound at Exit 24 19th Ave.
2,2019-07-29 06:58:17,33.462,-112.1462,Phoenix,AZ,,Pearl Harbor Memorial Highway,At 43rd Ave/Exit 140 - Accident. Lane blocked.
2,2019-07-12 20:59:56,33.6252,-112.085,Phoenix,AZ,791,W Coral Gables Dr,Accident on 7th Dr Westbound at Coral Gables Dr.
2,2020-10-24 01:29:00,33.5396,-112.1861,Glendale,AZ,7045, N 59th Ave,Incident on N 59TH AVE near W GLENN DR Expect delays.
1,2020-04-07 18:49:57,32.2972,-110.9782,Tucson,AZ,,N Oracle Rd,At N 1st Ave - Accident.
2,2019-01-30 14:13:48,33.5096,-112.1004,Phoenix,AZ,,W Camelback Rd,Accident on 19th Ave at Camelback Rd.
2,2016-07-28 08:27:36,33.7827,-112.5346,Wittmann,AZ,22036, Grand Ave,At Wickenburg - Accident.
2,2019-11-19 07:29:16,33.4627,-112.1332,Phoenix,AZ,,I-10 E,Left hand shoulder blocked due to accident on I-10 Eastbound after Exit 141 35th Ave.
2,2020-10-20 02:22:00,33.3784,-111.9151,Tempe,AZ,1424, E Baseline Rd,Incident on E BASELINE RD near S DORSEY LN Expect delays.
2,2020-11-25 16:29:00,33.4246,-112.0241,Phoenix,AZ,,I-10 W,Incident on I-10 WB near BUCKEYE RD Drive with caution.
2,2019-05-25 10:09:58,33.3491,-111.9631,Tempe,AZ,,W Elliot Rd,Accident on Elliot Rd at Priest Dr.
2,2019-08-12 13:50:58,33.5825,-111.8827,Scottsdale,AZ,,E Shea Blvd,Accident on 92nd St at Shea Blvd.
4,2017-03-03 08:56:04,34.2404,-111.323,Payson,AZ,,S Beeline Hwy,Closed at AZ-260/W Longhorn Rd - Road closed due to accident.
2,2020-05-18 08:36:09,32.2427,-111.0161,Tucson,AZ,,W Golden Hills Rd,Accident on Golden Hills Rd at Old Ranch Rd.
2,2017-09-21 06:57:49,32.2326,-110.8709,Tucson,AZ,5699,E Rosewood St,Accident on Rosewood St at Van Buren Ave.
1,2020-04-30 11:00:44,33.4949,-112.0835,Phoenix,AZ,4098, N 7th Ave,At N 7th Ave - Serious accident.
2,2019-10-26 20:52:33,33.6587,-112.0656,Phoenix,AZ,18999,N 7th St,Accident on 7th St at Wescott Dr.
2,2019-12-11 13:17:48,32.233,-110.9568,Tucson,AZ,961,E 2nd St,Accident on James E Rogers Way at Park Ave.
2,2020-01-21 09:28:31,33.7127,-112.1524,Phoenix,AZ,25001,N 43rd Ave,Accident on 43rd Ave at Happy Valley Rd.
2,2018-06-19 16:42:03,33.3778,-112.0733,Phoenix,AZ,7601,S Central Ave,Accident on Baseline Rd at Central Ave.
2,2020-01-27 08:16:25,33.5094,-112.2011,Glendale,AZ,4901,N 66th Ave,Accident on 66th Ave at Camelback Rd.
2,2018-04-16 01:49:12,33.4619,-112.0464,Phoenix,AZ,,AZ-202 Loop E,At AZ-51/AZ-202-LOOP/Exit 147 - Accident.
3,2020-05-01 14:59:05,33.614,-112.1165,Phoenix,AZ,,Black Canyon Fwy N,Lane blocked due to accident on I-17 Black Canyon Fwy Southbound at Exit 210.
1,2020-04-10 16:24:02,33.7694,-112.2498,Peoria,AZ,,N Lake Pleasant Pkwy,At AZ-303-LOOP/Bob Stump Memorial Pky - Accident.
2,2020-07-23 07:28:42,33.6475,-112.0656,Phoenix,AZ,17793,N 7th St,Accident on 7th St at Grovers Ave.
3,2018-02-25 14:29:56,33.4949,-112.1129,Phoenix,AZ,,W Indian School Rd,Two lane blocked due to accident on I-17 Black Canyon Fwy Northbound at Exit 202 Indian School Rd.
3,2018-04-07 12:56:48,33.4088,-111.9725,Tempe,AZ,,Pearl Harbor Memorial Highway,1 center lane blocked due to accident on I-10 Eastbound at Exits 153 153A 153B AZ-143.
2,2019-04-17 15:15:55,33.521,-112.0998,Phoenix,AZ,1887,W Montebello Ave,Accident on 19th Ave at Montebello Ave.
2,2019-07-05 16:47:44,33.6388,-112.3998,Surprise,AZ,,W Bell Rd,Accident on Bell Rd at Mountain Vista Blvd.
2,2020-10-01 07:40:00,33.6697,-112.1418,Glendale,AZ,,AZ-101 Loop W,Incident on AZ-101 LOOP WB near 51ST AVE Right shoulder closed.
2,2018-05-04 15:59:38,33.3868,-111.9582,Tempe,AZ,,Superstition Fwy W,At I-10 - Accident.
2,2019-11-10 16:00:58,33.4803,-112.2033,Phoenix,AZ,,N 67th Ave,Accident on 67th Ave at Thomas Rd.
3,2019-01-17 14:21:41,33.5921,-112.1172,Phoenix,AZ,11708,N Black Canyon Hwy,Entry ramp to I-17 Southbound from N Black Canyon Fwy Southbound closed due to accident.
2,2020-12-22 23:45:00,33.5082,-112.3578,Litchfield Park,AZ,13877, W Camelback Rd,Incident on W CAMELBACK RD near N LITCHFIELD RD Expect delays.
2,2019-12-17 09:30:26,33.4395,-111.9668,Phoenix,AZ,,AZ-202 Loop E,At Center Pky/Priest Dr/Exit 6 - Accident. Lane blocked.
2,2016-10-07 08:58:58,33.4593,-111.9951,Phoenix,AZ,,N 40th St,At 40th St/Exit 2 - Accident.
2,2019-11-12 17:27:11,33.6447,-111.8977,Scottsdale,AZ,17598,N Perimeter Dr,Accident on Princess Dr at Perimeter Dr.
2,2020-01-23 07:44:31,33.4947,-112.0629,Phoenix,AZ,4100,N 9th St,Accident on 9th St at Indian School Rd.
3,2019-08-16 07:29:46,33.4622,-112.0651,Phoenix,AZ,,N 7th St,Right hand shoulder blocked and left lane blocked due to accident on 7th St Northbound at I-10 .
3,2018-09-05 20:30:49,32.3226,-110.9747,Tucson,AZ,,W Orange Grove Rd,At Orange Grove Rd - Accident.
2,2020-11-03 01:56:42,32.1918,-110.8339,Tucson,AZ,7458, E Golf Links Rd,Incident on E GOLF LINKS RD near S CALLE CORDOVA Drive with caution.
2,2018-04-26 16:37:54,33.4851,-112.264,Phoenix,AZ,,Agua Fria Fwy S,At Thomas Rd/Exit 3 - Accident.
2,2017-01-13 16:46:35,33.6662,-111.9995,Phoenix,AZ,,Piestewa Fwy S,Ramp to AZ-101-LOOP/Exit 15 - Accident.
1,2020-03-21 10:54:24,32.2356,-110.9845,Tucson,AZ,,W Speedway Blvd,At I-10/N Freeway Rd - Accident.
4,2020-09-06 03:01:29,34.6906,-111.7439,Sedona,AZ,,State Route 179,Two lanes blocked due to accident on I-17 Northbound from Exit 293 / CR-30 Cornville Rd / Mcguireville Rd to Exit 298 / AZ-179 / Nf-618.
2,2018-06-11 10:40:40,33.4943,-112.2377,Phoenix,AZ,8301,W Indian School Rd,Accident on 83rd Ave at Indian School Rd.
2,2017-12-19 13:09:37,33.6986,-111.9189,Scottsdale,AZ,7497,E Pinnacle Peak Rd,Accident on Pinnacle Peak Rd at Los Portones Dr.
2,2020-05-13 16:02:11,32.3232,-111.0374,Tucson,AZ,6373,N Camino de la Tierra,Accident on Orange Grove Rd at Camino De La Tierra.
2,2018-03-02 11:00:18,32.4001,-110.9553,Tucson,AZ,10698,N Oracle Rd,Accident on 1st Ave at AZ-77 Oracle Rd.
2,2019-11-06 14:32:32,33.4107,-112.0013,Phoenix,AZ,,Pearl Harbor Memorial Highway,At 40th St/Exit 152 - Accident.
2,2019-04-05 14:20:45,32.2828,-110.9782,Tucson,AZ,4199,N Oracle Rd,Accident on AZ-77 Oracle Rd at Limberlost Dr.
2,2019-07-03 11:51:21,33.5959,-112.2203,Peoria,AZ,12200,N 75th Ave,Accident on 75th Ave at Cactus Rd.
2,2020-12-22 16:37:38,33.4797,-112.2643,Phoenix,AZ,,W Thomas Rd,Lane blocked due to accident on AZ-101-LOOP Southbound at Exit 3 Thomas Rd.
3,2018-12-18 17:57:22,33.4594,-112.0076,Phoenix,AZ,,AZ-202 Loop W,At 32nd St/Exit 1C - Accident.
4,2018-10-01 13:52:45,32.9395,-110.7383,Winkelman,AZ,7013, N Highway 77,Closed at AZ-77 - Road closed due to accident.
2,2016-10-20 11:44:04,33.6726,-112.0068,Phoenix,AZ,,Loop 101 E,At AZ-51/Exit 29 - Accident.
2,2020-10-27 23:18:00,33.3515,-110.9876,Miami,AZ,53427, E US Highway 60,Construction on US-60 EB near E SUTTON PL Road closed. Take alternate route.
2,2020-06-10 09:22:49,33.466,-112.1778,Phoenix,AZ,5499, W McDowell Rd,At N 59th Ave - Accident.
2,2020-02-18 08:03:49,33.4516,-112.2035,Phoenix,AZ,202,N 67th Ave,Accident on 67th Ave at Van Buren St.
3,2017-12-19 19:20:08,33.4805,-112.1131,Phoenix,AZ,,W Thomas Rd,Right lane blocked due to accident on I-17 Black Canyon Fwy Southbound at Exit 201 US-60 Thomas Rd.
2,2017-11-15 07:50:06,33.669,-112.1346,Phoenix,AZ,,N 35th Ave,Right lane blocked due to accident on AZ-101 Loop Eastbound at Exit 22 Beardsley Rd.
3,2019-01-06 13:32:46,34.4037,-112.0737,Mayer,AZ,,Arizona Veterans Highway,Accident on I-17 Southbound at Exit 268 Dugas Rd.
2,2019-11-07 21:34:36,33.6546,-111.9081,Scottsdale,AZ,,AZ-101 Loop W,Right lane blocked due to accident on AZ-101-LOOP Southbound at Hayden Rd.
2,2019-07-15 11:43:53,33.4368,-112.0347,Phoenix,AZ,,S 24th St,Accident on 24th St at Buckeye Rd.
2,2016-11-06 07:38:14,33.2679,-111.2476,Superior,AZ,29685, E US Highway 60,At NF-231/Uno Trl - Accident.
2,2019-07-06 05:29:44,33.3857,-111.891,Tempe,AZ,,AZ-101 Loop N,Entry ramp to US-60 Westbound at Exits 55 55A-B from AZ-101-LOOP Northbound closed due to accident.
2,2019-07-01 06:38:26,33.4949,-112.117,Phoenix,AZ,4100,N 27th Ave,Accident pedestrian involved on Indian School Rd at 27th Ave.
4,2018-04-18 18:15:15,33.395,-111.6449,Mesa,AZ,,Red Mountain Fwy S,Ramp closed to US-60/Superstition Fwy Eastbound - Road closed due to accident.
2,2017-10-12 19:29:39,33.324,-111.6452,Mesa,AZ,,AZ-24,At AZ-24 - Accident.
3,2019-03-06 21:57:40,33.4627,-112.2035,Phoenix,AZ,,N 67th Ave,Left lane blocked due to accident on I-10 Eastbound at Exit 137 67th Ave.
3,2018-10-02 08:00:30,33.462,-112.0653,Phoenix,AZ,,N 7th St,Accident on I-10 Westbound before 7th St.
1,2020-06-25 12:33:39,33.4512,-111.9953,Phoenix,AZ,,E Van Buren St,At N 40th St - Accident.
1,2020-04-13 11:54:24,32.2068,-110.9685,Tucson,AZ,100, E 22nd St,At S 6th Ave - Accident investigation work.
1,2020-05-29 15:21:15,33.495,-112.1689,Phoenix,AZ,,W Indian School Rd,At N 51st Ave - Accident.
1,2020-05-16 14:18:49,33.3491,-111.9545,Tempe,AZ,7601, S Hardy Dr,At S Kyrene Rd - Accident.
3,2017-10-12 16:46:32,32.3376,-111.0667,Tucson,AZ,,Pearl Harbor Memorial Highway,Accident on I-10 Westbound at Ina Rd.
2,2019-07-10 08:28:58,33.5095,-112.1342,Phoenix,AZ,4902,N 35th Ave,Accident on 35th Ave at Camelback Rd.
2,2019-05-29 06:43:09,33.4858,-112.3626,Goodyear,AZ,,N Litchfield Rd,Accident on Indian School Rd at Litchfield Rd.
2,2020-01-21 07:22:08,33.4757,-111.7016,Mesa,AZ,3248,N Recker Rd,Right hand shoulder blocked due to accident on AZ-202-LOOP Westbound at Exit 22 Recker Rd.
2,2019-12-03 08:35:56,33.4943,-112.2377,Phoenix,AZ,8298,W Indian School Rd,Accident on 83rd Ave at Indian School Rd.
2,2018-03-03 15:33:19,33.5531,-112.1646,Glendale,AZ,4902, W Northern Ave,At 51st Ave - Accident.
1,2020-03-28 11:37:11,32.2828,-110.9781,Tucson,AZ,,W Limberlost Dr,At W Wetmore Rd - Accident.
1,2020-04-16 17:25:47,32.2063,-110.7865,Tucson,AZ,9677, E Old Spanish Trl,At E 22nd St - Accident.
4,2017-08-28 22:26:21,33.3868,-111.6212,Mesa,AZ,,Superstition Fwy W,Closed between Crismon Rd/Exit 192 and Ellsworth Rd/Exit 191 - Road closed due to accident.
4,2018-09-04 22:22:21,34.8888,-111.7335,Sedona,AZ,,N State Route 89A,Closed at Call of the Canyon Day Area Rd - Road closed due to accident.
2,2020-12-07 13:17:00,32.3441,-111.047,Tucson,AZ,7563, N Thornydale Rd,Slow traffic from W Massingale Rd to N Meredith Blvd due to accident.
3,2018-10-02 19:40:43,33.5735,-112.1172,Phoenix,AZ,,Black Canyon Fwy S,At Dunlap Ave/Exit 207 - Accident.
3,2016-07-28 14:55:17,33.4368,-112.1083,Phoenix,AZ,,US-60 E,At Buckeye Rd/Exit 198 - Accident.
2,2020-04-30 13:25:54,33.3857,-111.9316,Tempe,AZ,,Superstition Fwy W,At Mill Ave/Exit 173 - Accident. Right lane blocked.
3,2018-05-24 18:29:22,33.4564,-111.9765,Phoenix,AZ,,AZ-202 Loop E,Between 52nd St/Exit 4 and Van Buren St/Exit 4 - Accident.
2,2020-11-25 13:57:00.000000000,32.1904,-110.9684,Tucson,AZ,2, W 38th St,Stationary traffic from 29th St (S 6th Ave) to I-10/E Benson Hwy (S 6th Ave) due to accident.
1,2020-04-17 11:13:25,32.2354,-110.8069,Tucson,AZ,8698, E Speedway Blvd,At N Camino Seco - Accident.
2,2018-02-26 08:11:19,32.2872,-110.9442,Tucson,AZ,,E River Rd,Accident on River Rd at Campbell Ave.
2,2018-10-09 07:17:20,33.3881,-111.8573,Mesa,AZ,,W Holmes Ave,Accident on Alma School Rd at Holmes Ave.
3,2019-05-21 08:11:19,33.4293,-112.0823,Phoenix,AZ,,I-17 S,Right lane blocked due to accident on I-17 Southbound at 7th Ave.
3,2018-03-29 16:48:16,33.349,-111.9718,Phoenix,AZ,,E Elliot Rd,Left lane blocked due to accident on I-10 Westbound at Exit 157 Elliot Rd.
2,2020-10-27 00:03:17,32.2358,-110.858,Tucson,AZ,,N Wilmot Rd,Incident on N WILMOT RD near E SPEEDWAY BLVD Drive with caution.
4,2019-09-11 12:04:55,33.204,-111.8411,Chandler,AZ,11198, E Hunt Hwy,Closed at AZ-87/S Arizona Ave - Road closed due to accident.
1,2020-06-12 13:47:14,32.2212,-110.8581,Tucson,AZ,,E Broadway Blvd,At Wilmot Rd - Accident.
1,2020-03-27 15:54:06,32.2504,-110.961,Tucson,AZ,,N 1st Ave,At N Stone Ave - Accident.
2,2018-10-05 08:53:20,33.3779,-112.0196,Phoenix,AZ,,S 29th Pl,Fuel spillage on 29th Pl at Baseline Rd.
2,2016-10-13 15:25:53,33.3857,-111.9349,Tempe,AZ,,Superstition Fwy W,At Mill Ave/Exit 173 - Accident.
2,2020-10-02 14:29:38,32.2279,-110.9353,Tucson,AZ,2503,E 6th St,Accident on Tucson Blvd at 6th St.
3,2017-10-25 19:01:04,32.1573,-110.9093,Tucson,AZ,,Pearl Harbor Memorial Highway,Accident on I-10 Eastbound around Exit 265 Alvernon Way.
2,2018-01-04 12:20:18,33.3868,-111.685,Mesa,AZ,,S Power Rd,Accident on US-60 Eastbound at Exit 188 Power Rd. On the median.
1,2020-04-27 09:04:02,33.3782,-111.946,Tempe,AZ,5140, S Kyrene Rd,At S Kyrene Rd - Accident.
3,2019-11-22 14:18:58,33.4613,-112.0823,Phoenix,AZ,,I-10 W,Two lanes blocked due to accident on I-10 Westbound at Exits 144 144A 7th Ave.
2,2018-07-25 05:31:02,33.5455,-112.203,Glendale,AZ,6701,W Orangewood Ave,Accident on 67th Ave at Orangewood Ave.
2,2019-09-30 08:05:37,33.5703,-112.1515,Phoenix,AZ,4283,W Mission Ln,Accident on 43rd Ave at Mission Ln.
2,2019-11-12 16:30:08,33.4694,-112.0129,Phoenix,AZ,1997,N 32nd St,Accident on 32nd St at Palm Ln.
2,2017-03-03 18:07:32,33.5185,-112.0441,Phoenix,AZ,,Piestewa Fwy N,At Bethany Home Rd - Accident.
3,2019-03-08 10:52:27,33.4628,-112.1864,Phoenix,AZ,,N 59th Ave,Left lane blocked due to accident on I-10 Eastbound at Exit 138 59th Ave.
2,2019-10-04 15:08:49,33.538,-112.0414,Phoenix,AZ,,Piestewa Fwy N,Accident on AZ-51 Northbound at Exit 5 Glendale Ave.
1,2020-05-01 19:18:16,32.2721,-110.995,Tucson,AZ,3598, N Flowing Wells Rd,At AZ-77/Oracle Rd - Accident.
2,2020-12-13 09:30:00,34.3062,-110.9506,Payson,AZ,,E AZ Highway 260,Incident on AZ-260 EB near COCONINO GILA COUNTY LINE Drive with caution.
2,2019-04-24 08:47:05,33.3858,-111.8752,Mesa,AZ,,Superstition Fwy E,Right lane blocked due to accident on US-60 Westbound near Exit 177 Dobson Rd.
3,2018-11-30 04:01:29,33.4631,-112.1865,Phoenix,AZ,,N 59th Ave,Accident on I-10 Eastbound at Exit 138 59th Ave.
2,2019-02-08 20:45:01,33.6541,-112.2324,Glendale,AZ,,AZ-101 Loop S,Center lane blocked due to accident on AZ-101-LOOP Northbound at Union Hills Dr.
3,2017-08-03 10:50:56,33.0023,-111.7518,Maricopa,AZ,,Pearl Harbor Memorial Highway,Accident on AZ-187 Northbound at I-10.
3,2018-03-21 15:32:17,33.4108,-111.9784,Phoenix,AZ,,Hohokam Expy S,Shoulder blocked due to accident on I-10 Eastbound at Exits 153 153A 153B AZ-143.
2,2018-05-30 16:59:16,32.3374,-111.0295,Tucson,AZ,,N Shannon Rd,Accident on Ina Rd at Shannon Rd.
2,2019-09-05 08:33:25,32.2289,-110.8755,Tucson,AZ,599,N Craycroft Rd,Accident on Craycroft Rd at 5th St.
2,2017-09-25 16:08:58,33.3862,-111.7882,Mesa,AZ,,S Gilbert Rd,Right lane blocked due to accident on US-60 Westbound at Exit 182 Gilbert Rd.
2,2020-11-27 13:50:44,32.1342,-110.9347,Tucson,AZ,2499,E Valencia Rd,Accident on Valencia Rd at Tucson Blvd.
2,2018-08-30 10:35:04,33.4223,-112.0997,Phoenix,AZ,2778,S 19th Ave,Accident on 19th Ave at Lower Buckeye Rd.
