Severity,Date/Time,Latitude,Longitude,City,State,Number,Street,Description
3,2020-11-01 12:33:48,34.2378,-112.1116,Black Canyon City,AZ,,Arizona Veterans Highway,Left lane blocked due to accident on I-17 Northbound at Exit 256 Badger Springs Rd.
1,2020-05-06 18:05:50,32.1778,-110.9776,Tucson,AZ,3798, S 12th Ave,At I-19 - Accident.
2,2020-01-30 16:23:43,33.5095,-112.1688,Glendale,AZ,,W Camelback Rd,Accident on 51st Ave at Camelback Rd.
4,2016-08-05 12:29:12,33.7267,-111.8906,Scottsdale,AZ,,E Jomax Rd,Closed between Pima Rd and Hayden Rd - Road closed due to accident.
2,2018-05-02 13:16:58,33.4986,-112.113,Phoenix,AZ,,Black Canyon Fwy S,At Indian School Rd/Exit 202 - Accident. in the right lane.
2,2019-06-16 04:52:21,33.5592,-112.3934,Waddell,AZ,,Northern Pkwy,Accident on Northern Pkwy at Exit 2 Reems Rd.
2,2020-03-01 09:34:24,33.4393,-112.6771,Buckeye,AZ,,Sun Valley Pkwy,Accident on I-10 Westbound at Exit 109 Palo Verde Rd.
2,2020-01-28 07:03:52,33.6027,-112.2899,Sun City,AZ,,Grand Ave,Accident on 107th Ave at US-60 Grand Ave.
2,2020-10-20 18:13:00,33.7176,-112.1186,Phoenix,AZ,,Black Canyon Fwy S,Incident on I-17 SB near HAPPY VALLEY RD Right shoulder closed.
1,2020-05-18 14:00:05,32.1484,-111.0131,Tucson,AZ,2101, W Drexel Rd,At W Drexel Rd - Accident.
1,2020-05-30 17:21:50,33.4875,-112.2205,Phoenix,AZ,3399, N 75th Ave,At W Thomas Rd - Accident.
2,2020-10-25 00:06:00,33.5778,-112.1245,Phoenix,AZ,,N Metro Pkwy W,Incident on METRO PW W near HOUSE 10100 Expect delays.
2,2020-12-17 06:00:00,32.2016,-110.9793,Tucson,AZ,,I-10 W,Incident on I-10 WB near I-19 Left shoulder closed.
2,2016-11-03 09:02:46,32.0796,-110.8022,Tucson,AZ,,Pearl Harbor Memorial Highway,At Rita Rd/Exit 273 - Accident.
2,2018-04-10 17:49:34,33.6689,-112.0762,Phoenix,AZ,,Pima Fwy W,At 7th Ave/Exit 25 - Accident. in the right lane.
4,2019-10-22 19:49:39,33.5241,-112.1123,Phoenix,AZ,,W Bethany Home Rd,Right lane blocked due to accident on I-17 Black Canyon Hwy Southbound from Glendale Ave to Bethany Home Rd.
3,2019-08-03 21:33:34,33.6568,-111.9191,Scottsdale,AZ,,Loop 101 E,Between Scottsdale Rd/Exit 34 and Hayden Rd/Exit 35 - Accident.
2,2017-12-28 06:21:13,32.373,-111.4528,Marana,AZ,,W Cocio Wash Rd,Accident on Avra Valley Rd both ways between Silverbell Rd and Cocio Wash Rd.
2,2019-10-16 07:47:46,33.6617,-111.9418,Phoenix,AZ,,AZ-101 Loop W,Right lane blocked due to accident on AZ-101-LOOP Westbound at Exit 33 64th St.
2,2019-04-07 09:05:50,33.713,-112.0891,Phoenix,AZ,25200,N 13th Ave,Accident on 13th Ave at Happy Valley Rd.
4,2018-03-14 14:30:28,33.2752,-111.6861,Gilbert,AZ,19438, S Power Rd,Closed at Germann Rd - Road closed due to accident.
2,2019-09-19 16:40:34,33.5088,-112.2377,Glendale,AZ,8300,W Camelback Rd,Accident on Camelback Rd at 83rd Ave.
2,2020-08-17 11:07:16,32.2279,-110.9439,Tucson,AZ,1899,E 6th St,Accident on 6th St at Campbell Ave.
2,2020-11-17 01:15:00,33.4621,-112.024,Phoenix,AZ,,AZ-202 Loop W,Incident on AZ-202 LOOP WB near 24TH ST Right shoulder closed.
2,2019-06-25 07:47:16,33.3929,-111.952,Tempe,AZ,3263,S Hardy Dr,Accident pedestrian involved on Southern Ave at Hardy Dr.
2,2018-11-30 19:53:33,33.4628,-112.1635,Phoenix,AZ,,Pearl Harbor Memorial Highway,At 51st Ave/Exit 139 - Accident.
2,2019-03-06 05:37:29,33.4616,-112.0144,Phoenix,AZ,,AZ-202 Loop W,Accident on exit ramp from N 32Nd St to AZ-202-LOOP Westbound.
2,2018-05-02 07:55:56,33.3862,-111.7882,Mesa,AZ,,S Gilbert Rd,Shoulder blocked due to accident on US-60 Westbound at Exit 182 Gilbert Rd.
2,2017-03-23 11:31:32,33.4631,-112.1345,Phoenix,AZ,,N 35th Ave,At 35th Ave/Exit 141 - Accident.
3,2017-11-29 07:42:48,33.3881,-111.9676,Tempe,AZ,,US-60 E,Right lane blocked due to accident on I-10 Eastbound at US-60.
2,2019-08-23 14:54:01,33.5747,-112.1689,Glendale,AZ,5101,W Mountain View Rd,Accident on 51st Ave at Mountain View Rd.
1,2020-06-15 18:20:46,33.5661,-112.2636,Peoria,AZ,9492, W Olive Ave,At N 99th Ave - Accident.
2,2020-12-12 00:23:00,32.1628,-110.8409,Tucson,AZ,,S Kolb Rd,Incident on E IRVINGTON RD near S KOLB RD Expect delays.
3,2017-07-20 19:24:44,33.4624,-112.0417,Phoenix,AZ,1833, E Culver St,Ramp to Red Mountain Fwy - Accident.
2,2020-03-04 10:33:02,33.6381,-111.9254,Scottsdale,AZ,,E Frank Lloyd Wright Blvd,Accident on Frank Lloyd Wright Blvd at Scottsdale Rd.
2,2019-10-18 19:18:33,33.4658,-112.0382,Phoenix,AZ,,E McDowell Rd,Right lane blocked due to accident on AZ-51 Southbound at Mcdowell Rd.
3,2020-03-12 17:56:50,33.6112,-112.3152,El Mirage,AZ,,W Grand Ave,Between N A St and 111th Ave - Accident.
2,2017-01-23 07:15:48,33.3031,-111.0896,Superior,AZ,44691, E US Highway 60,At AZ-177/S Ray Rd - Accident.
2,2019-02-25 08:11:20,33.4658,-112.0382,Phoenix,AZ,,E McDowell Rd,Right lane blocked due to accident on AZ-51 Southbound near McDowell Rd.
4,2016-10-24 00:24:18,33.4578,-112.1084,Phoenix,AZ,916, N Black Canyon Hwy,Ramp closed to Exit 143A/Exit 143B - Road closed due to accident.
2,2018-05-11 10:41:23,33.5491,-111.879,Scottsdale,AZ,,Pima Fwy N,At Via De Ventura/Exit 43 - Accident.
2,2018-10-12 07:33:26,33.3857,-111.9266,Tempe,AZ,,Superstition Fwy W,Accident on US-60 Westbound before Exit 174 Rural Rd.
2,2019-04-30 06:15:42,33.5819,-112.1515,Glendale,AZ,4300,W Peoria Ave,Accident on 43rd Ave at Peoria Ave.
2,2016-12-07 12:46:48,33.3985,-111.8913,Tempe,AZ,,Price Fwy S,At Southern Ave/Exit 54 - Accident.
2,2019-06-20 11:06:40,33.4084,-111.7149,Mesa,AZ,400,S Sunnyvale,Accident on Broadway Rd at Sunnyvale.
2,2018-04-17 04:25:38,36.6383,-111.2154,Kaibeto,AZ,,AZ-98,Accident on AZ-98 Eastbound at FS Rd.
4,2017-06-17 16:17:34,36.2177,-111.0435,Tuba City,AZ,,Navajo Trl,Closed at Holbrook - Road closed due to accident.
3,2020-06-01 19:56:40,33.429,-112.0996,Phoenix,AZ,,S 19th Ave,Right lane blocked due to accident on I-17 Northbound at 19th Ave.
2,2018-09-26 09:52:38,33.7312,-111.8412,Scottsdale,AZ,27201,N 111th St,Accident on Bajada Dr at 111th St.
3,2018-09-08 06:17:44,33.4357,-111.8776,Mesa,AZ,,AZ-202 Loop W,Right lane blocked due to accident on AZ-202 Loop Westbound after Exit 10 Dobson Rd.
2,2017-12-19 11:23:48,33.505,-112.0432,Phoenix,AZ,1776,E Coolidge St,Accident on exit ramp from AZ-51 Northbound to Highland Ave.
3,2019-04-18 04:29:47,33.4628,-112.1665,Phoenix,AZ,,I-10 W,Accident on I-10 Westbound at 51st Ave.
3,2018-02-20 09:30:07,33.463,-112.1691,Phoenix,AZ,,Pearl Harbor Memorial Highway,Accident on I-10 Eastbound at Exit 139 51st Ave.
1,2020-04-20 07:32:47,33.4069,-112.0298,Phoenix,AZ,2396, E Broadway Rd,At S 24th St - Accident.
2,2016-11-16 07:02:05,33.4843,-112.1132,Phoenix,AZ,,Black Canyon Fwy S,At Thomas Rd/Exit 201 - Accident.
3,2018-06-18 04:10:35,33.463,-112.1691,Phoenix,AZ,,Pearl Harbor Memorial Highway,Accident on I-10 Eastbound at Exit 139 51st Ave.
2,2020-11-08 07:48:00,33.4402,-111.9257,Tempe,AZ,923, E Curry Rd,Incident on E CURRY RD near N SCOTTSDALE RD Expect delays.
3,2018-08-08 20:25:30,33.5225,-112.2377,Glendale,AZ,5948,N 83rd Ave,Accident on 83rd Ave at Bethany Home Rd.
2,2018-12-11 17:13:35,33.4172,-111.9781,Phoenix,AZ,,Hohokam Expy S,At University Dr/Exit 2 - Accident. Lane blocked.
2,2016-12-18 23:05:31,32.2612,-110.995,Tucson,AZ,1401, W Miracle Mile,At El Burrito Ave - Accident.
2,2018-05-14 10:11:34,32.4146,-112.8717,Ajo,AZ,3198,N Ajo Gila Bend Hwy,Accident on AZ-85 Ajo Gila Bend Hwy at Fees Rd.
2,2020-12-09 10:09:30,35.1919,-114.0702,Kingman,AZ,901, F St,Slow traffic on US-93 S - US-93 N from US-68 (US-93) to I-40 (US-93) due to accident.
3,2017-01-17 08:24:06,33.2858,-111.834,Chandler,AZ,,AZ-202 Loop W,At AZ-87/Arizona Ave/Exit 47 - Accident.
4,2019-12-27 16:48:12,33.4348,-111.8817,Mesa,AZ,,AZ-202 Loop W,Ramp closed to AZ-101-LOOP/Price Fwy/Pima Fwy - Road closed due to accident.
3,2018-12-13 07:12:48,33.3947,-111.8913,Tempe,AZ,,Price Fwy S,At US-60/Exit 55 - Accident. Left lane blocked.
3,2018-12-14 03:47:18,33.4108,-110.8445,Miami,AZ,4196, E Highway 60,At Globe - Accident. Fallen power cables. Danger.
4,2018-09-15 23:04:41,33.6692,-112.1077,Phoenix,AZ,2228, W Beardsley Rd,Ramp closed to Exit 23C/Exit 23B - Road closed due to accident.
2,2017-03-10 19:28:54,33.4885,-112.113,Phoenix,AZ,,Black Canyon Fwy N,Between Thomas Rd/Exit 201 and Camelback Rd/Exit 203 - Accident.
1,2020-06-11 23:25:19,33.4625,-112.0291,Phoenix,AZ,,AZ-202 Loop W,Ramp to N 24th St - Accident.
2,2019-11-08 15:51:49,33.614,-111.9259,Scottsdale,AZ,14122,N Scottsdale Rd,Accident on Redfield Rd at Scottsdale Rd.
2,2017-10-09 11:20:01,33.6926,-112.2031,Glendale,AZ,23001,N 67th Ave,Accident on 67th Ave at Patrick Ln.
2,2020-09-29 20:53:00,33.2474,-111.7894,Chandler,AZ,,S Gilbert Rd,Incident on S GILBERT RD near E OCOTILLO RD Expect delays.
3,2018-05-22 09:01:02,33.4631,-112.1865,Phoenix,AZ,,N 59th Ave,Left lane blocked due to accident on I-10 Eastbound at Exit 138 59th Ave.
2,2020-01-31 16:59:57,33.2187,-111.8239,Chandler,AZ,,S McQueen Rd,Accident on Mcqueen Rd at Riggs Rd.
2,2019-12-31 12:34:18,33.4016,-111.891,Tempe,AZ,,Price Fwy N,At Broadway Rd/Exit 53 - Accident. Lane blocked.
2,2020-11-10 09:24:00,34.3238,-111.0806,Payson,AZ,,S Camp Tontozona Rd,Incident on AZ-260 EB near FS ROAD 64 Road closed. Take alternate route.
2,2017-02-17 10:15:48,33.9704,-112.7214,Wickenburg,AZ,500, E Wickenburg Way,At El Recreo Dr - Accident.
2,2019-05-14 06:11:47,33.4371,-112.221,Phoenix,AZ,1198,S 75th Ave,Accident on CR-85 Buckeye Rd at 75th Ave.
3,2018-04-15 16:30:22,32.187,-110.9683,Tucson,AZ,,S 6th Ave,One lane blocked due to accident on I-10 Eastbound at Exit 261 Benson Hwy.
3,2018-05-02 06:49:21,33.462,-112.1084,Phoenix,AZ,,Pearl Harbor Memorial Highway,Shoulder blocked due to accident on I-10 Westbound at 27th Ave.
2,2018-11-02 15:28:31,33.6104,-112.2157,Peoria,AZ,13701,N 73rd Ave,Accident on 73rd Ave at Thunderbird Rd.
2,2019-10-23 17:28:56,32.1851,-110.9775,Tucson,AZ,596,W 44th St,Accident on 12th Ave at 44th St.
2,2019-08-29 17:03:26,33.244,-111.8413,Chandler,AZ,4302,S Arizona Ave,Accident on AZ-87 Arizona Ave at Home Improvement Way.
2,2016-10-21 08:25:33,33.6688,-112.117,Phoenix,AZ,,Loop 101 W,At 27th Ave - Accident.
2,2020-11-20 13:04:00,33.5964,-112.1201,Phoenix,AZ,12099, N 28th Dr,Stationary traffic from N 35th Ave (W Cactus Rd) to I-17/N Black Canyon Hwy (W Cactus Rd) due to accident.
4,2019-07-03 11:44:58,33.3919,-111.8916,Tempe,AZ,,Price Fwy S,Ramp closed to US-60/Exit 55 - Road closed due to accident.
1,2020-06-25 09:27:10,32.1197,-110.9093,Tucson,AZ,3879, E Los Reales Rd,At E Hughes Access Rd - Accident.
2,2019-08-28 18:13:07,33.5056,-112.0389,Phoenix,AZ,1982,E Highland Ave,Accident on 20th St at Highland Ave.
2,2019-09-20 06:29:02,33.3351,-111.8764,Chandler,AZ,,N Dobson Rd,Accident on Dobson Rd at Warner Rd.
1,2020-04-28 18:09:43,32.2431,-110.8756,Tucson,AZ,1673, N Craycroft Rd,At E Speedway Blvd - Accident.
2,2019-08-06 17:11:00,33.5692,-112.1123,Phoenix,AZ,9200,N 25th Ave,Accident on 25th Ave at Mission Ln.
2,2018-02-06 18:58:27,33.3826,-111.8912,Tempe,AZ,,Price Fwy N,Ramp to AZ-101-LOOP/Exit 176 - Accident. Lane blocked.
3,2017-02-02 15:00:44,33.4624,-112.0653,Phoenix,AZ,,Pearl Harbor Memorial Highway,At 7th St/Exit 145 - Accident.
2,2020-07-24 05:23:39,33.479,-111.8902,Scottsdale,AZ,,AZ-101 Loop S,Gore point obstructed and right hand shoulder blocked due to accident on AZ-101-LOOP Northbound near Exit 48 Thomas Rd.
2,2018-11-23 15:57:24,32.2289,-110.9096,Tucson,AZ,3898,E 5th St,Accident on 5th St at Alvernon Way.
2,2019-04-24 07:05:34,33.3669,-112.0732,Phoenix,AZ,2,E Euclid Ave,Accident on Central Ave at Euclid Ave.
2,2020-11-12 01:50:00.000000000,32.1939,-110.9795,Tucson,AZ,,I-19 S,Incident on I-19 SB near IRVINGTON RD Right shoulder closed.
2,2019-01-17 17:52:10,33.6108,-112.1425,Phoenix,AZ,,N 39th Ave,Accident on 39th Ave at Thunderbird Rd.
3,2019-09-04 21:14:05,33.4124,-112.0106,Phoenix,AZ,,I-10 W,Right lane blocked due to accident on I-10 Westbound from Exit 152 40th St to Exit 151 32nd St.
2,2019-09-30 21:17:08,32.1478,-111.106,Tucson,AZ,,S Camino Verde,Accident on Camino Verde at Drexel Rd.
2,2020-12-01 03:44:30,32.2665,-109.2383,San Simon,AZ,,I-10 E,Stationary traffic on I-10 E - Pearl Harbor Memorial Highway from I-10 Bus/Exit 378 (I-10) to Cavot Rd/Exit 390 (I-10) due to accident.
3,2020-06-19 18:59:32,33.4622,-112.4172,Goodyear,AZ,,I-10 W,At Cotton Lane/Exit 124 - Accident. Two lanes blocked.
1,2020-05-03 10:08:48,32.1631,-110.9175,Tucson,AZ,,E Irvington Rd,At I-10/S Palo Verde Rd - Accident.
2,2019-03-22 13:30:58,33.4658,-111.9089,Scottsdale,AZ,,N Hayden Rd,Accident on Mcdowell Rd at Hayden Rd.
2,2020-12-03 16:56:30,33.4453,-112.0379,Phoenix,AZ,,Frontage Rd,Accident on I-10 Eastbound at Jefferson St.
4,2017-05-17 08:04:20,33.4224,-112.1172,Phoenix,AZ,2574, W Lower Buckeye Rd,Closed between 27th Ave and 43rd Ave - Road closed due to accident.
2,2020-12-02 12:36:00.000000000,33.4322,-112.1874,Phoenix,AZ,,South Mountain Fwy,Incident on AZ-202 LOOP SB near LOWER BUCKEYE RD Drive with caution.
3,2017-03-30 09:54:23,33.4852,-112.0409,Phoenix,AZ,,Piestewa Fwy S,At Thomas Rd/Exit 2 - Accident.
2,2020-12-06 23:56:00,33.5657,-112.2812,Sun City,AZ,10298, W Olive Ave,Incident on N 103RD AVE near W OLIVE AVE Expect delays.
3,2020-09-22 15:19:12,33.4617,-112.1088,Phoenix,AZ,,I-10 E,Lane blocked due to accident on I-17 Northbound at Exits 200A 200B I-10 Exits 143A 143A-B 143B.
4,2017-09-05 12:10:36,34.2653,-111.1952,Payson,AZ,,FS Road 371,Closed at Control Rd/NF-64 - Road closed due to accident.
3,2018-01-17 11:40:35,33.462,-112.0653,Phoenix,AZ,,N 7th St,Shoulder blocked due to accident on I-10 Eastbound at 7th St.
2,2018-11-05 09:00:35,33.669,-112.1346,Phoenix,AZ,,N 35th Ave,Right lane blocked due to accident on AZ-101 Loop Eastbound at Exit 22 35th Ave.
2,2018-03-21 19:58:02,33.4108,-111.9902,Phoenix,AZ,,Pearl Harbor Memorial Highway,Between 40th St/Exit 152 and AZ-143/48th St/Exit 153 - Accident.
3,2020-03-03 14:45:38,33.4619,-112.1515,Phoenix,AZ,,I-10 W,Right hand shoulder blocked due to accident on I-10 Eastbound at Exit 140 43rd Ave.
3,2020-01-24 04:39:39,33.567,-112.1174,Phoenix,AZ,,Black Canyon Fwy N,Right lane blocked due to accident on I-17 Southbound before Exit 207 Dunlap Ave.
2,2018-07-10 18:56:45,33.6109,-112.1338,Phoenix,AZ,,N 35th Ave,Accident on 35th Ave at Thunderbird Rd.
2,2020-10-06 13:41:27,33.1235,-112.0177,Laveen,AZ,24076,Maricopa Rd,Left lane blocked due to accident on AZ-347 Northbound at BIA-1 Casa Blanca Rd.
4,2016-11-23 16:54:04,33.6683,-112.1185,Phoenix,AZ,,Loop 101 E,Ramp closed to I-17/Black Canyon Fwy Northbound - Road closed due to accident.
2,2020-10-16 01:04:00,33.6531,-111.9014,Scottsdale,AZ,,AZ-101 Loop W,Incident on AZ-101 LOOP WB near HAYDEN RD Right shoulder closed.
2,2018-11-19 15:24:17,33.4622,-112.0236,Phoenix,AZ,,AZ-202 Loop W,At 24th St/Exit 1B - Accident.
2,2020-06-24 06:52:50,33.2471,-111.8652,Chandler,AZ,,W Ocotillo Rd,Accident on Alma School Rd at Ocotillo Rd.
2,2020-11-07 16:25:00,33.5735,-112.0202,Phoenix,AZ,,Piestewa Fwy S,Incident on AZ-51 near E NORTHERN AVE Expect delays.
2,2018-11-14 00:47:08,32.7139,-111.4999,Eloy,AZ,,Pearl Harbor Memorial Highway,At Picacho Hwy/Exit 212 - Accident. Left lane blocked.
3,2018-03-11 12:24:19,32.735,-111.5504,Eloy,AZ,,S Sunshine Blvd,Accident on I-10 Westbound at Exit 208 Sunshine Blvd.
2,2020-10-11 19:54:00,36.7049,-111.9468,Marble Canyon,AZ,,Buffalo Ranch Rd,Incident on US-89A NB near NF-D962 Right lane blocked. Expect delays.
2,2020-06-10 01:08:45,34.3179,-112.1236,Mayer,AZ,,Arizona Veterans Highway,At AZ-69/Exit 262 - Accident. Hard shoulder blocked.
2,2020-05-18 15:04:07,32.1779,-110.9913,Tucson,AZ,1281,W Ajo Way,Accident on AZ-86 Ajo Way at Cottonwood Ln.
2,2020-01-15 08:03:39,34.7642,-111.6566,Sedona,AZ,,Stoneman Lake Rd,Accident on I-17 Northbound near Exit 306 Stoneman Lake Rd.
2,2017-12-07 11:45:17,33.6237,-111.9029,Scottsdale,AZ,,N 83rd Pl,Accident on 83rd Pl at Hayden Rd.
2,2020-09-26 19:13:00,33.4752,-111.889,Scottsdale,AZ,,AZ-101 Loop N,Incident on AZ-101 LOOP NB near THOMAS RD Right shoulder closed.
2,2017-07-05 16:30:16,33.4622,-112.2568,Tolleson,AZ,,Pearl Harbor Memorial Highway,At 91st Ave/Exit 134 - Accident.
2,2018-02-27 07:59:55,33.3785,-111.8932,Tempe,AZ,2186,E Baseline Rd,Left lane blocked due to accident on AZ-101 Loop Southbound at Exit 55C Baseline Rd.
3,2018-06-11 07:57:47,33.5963,-112.1168,Phoenix,AZ,,W Cactus Rd,Accident on I-17 Southbound at Exit 209 Black Canyon Hwy.
3,2019-01-24 16:57:48,33.3866,-111.7486,Mesa,AZ,,Superstition Fwy W,At Val Vista Dr/Exit 184 - Accident. 4 lanes blocked.
2,2019-12-05 18:13:33,33.3859,-111.8463,Mesa,AZ,,US-60 E,At AZ-87/Country Club Dr/Exit 179 - Accident.
2,2016-10-03 08:09:40,33.644,-112.1154,Phoenix,AZ,,Black Canyon Fwy S,At Bell Rd/Exit 212 - Accident.
3,2016-07-31 05:24:00,33.4843,-112.1132,Phoenix,AZ,,Black Canyon Fwy S,At Thomas Rd/Exit 201 - Accident.
2,2020-01-10 06:48:54,32.2212,-110.858,Tucson,AZ,,Wilmot Rd,Accident on Broadway Blvd at Wilmot Rd.
2,2018-02-02 05:57:59,33.5312,-112.1515,Phoenix,AZ,4298,W Maryland Ave,Accident on 43rd Ave at Maryland Ave.
2,2020-12-10 23:48:00,32.2356,-110.8239,Tucson,AZ,7899, E Speedway Blvd,Incident on E SPEEDWAY BL near E SPEEDWAY BLVD Expect delays.
4,2017-06-14 06:04:12,32.0796,-110.8022,Tucson,AZ,,Pearl Harbor Memorial Highway,Closed between Rita Rd/Exit 273 and Kolb Rd/Exit 270 - Road closed due to accident.
3,2017-08-06 13:47:58,33.9145,-112.1456,New River,AZ,,I-17 S,1 left lane blocked due to accident on I-17 Southbound at Exit 232 New River Rd.
4,2020-02-07 19:44:18,34.4561,-114.3285,Lake Havasu City,AZ,,AZ-95,Closed between S Acoma Blvd and Swanson Ave - Road closed due to accident.
2,2020-06-03 14:30:44,33.5825,-111.8911,Scottsdale,AZ,,AZ-101 Loop N,Two lane blocked due to accident on AZ-101-LOOP Southbound at Exit 41 Shea Blvd.
3,2016-09-15 07:18:39,33.5938,-112.2597,Peoria,AZ,9496, W Grand Ave,At AZ-101-loop - Accident.
2,2017-11-07 18:23:43,33.3857,-111.8575,Mesa,AZ,,US-60 E,Left lane blocked due to accident on US-60 Eastbound at Exit 178 Alma School Rd.
4,2017-04-11 08:17:41,33.3919,-112.2028,Laveen,AZ,6101, S 67th Ave,Closed at W Baseline Rd - Road closed due to accident.
1,2020-04-01 15:05:29,33.3929,-111.9396,Tempe,AZ,3302, S Mill Ave,At S Mill Ave - Accident.
2,2016-08-22 08:39:20,33.4626,-112.2033,Phoenix,AZ,,Pearl Harbor Memorial Highway,At 67th Ave/Exit 137 - Accident.
1,2020-04-14 13:41:44,32.1632,-110.9357,Tucson,AZ,4900, S Tucson Blvd,At S Campbell Ave - Accident.
2,2019-09-12 07:28:44,33.4067,-112.0646,Phoenix,AZ,701,E Broadway Rd,Accident on 7th St at Broadway Rd.
2,2017-09-20 07:05:31,33.6242,-112.3993,Surprise,AZ,15400,Vista Ranch Rd,Right lane closed due to accident on Greenway Rd Eastbound at 157th Ave.
2,2019-06-11 07:20:46,33.5639,-112.0996,Phoenix,AZ,,W Alice Ave,Accident on 19th Ave at Alice Ave.
2,2019-05-10 14:34:07,33.639,-112.1691,Glendale,AZ,,N 51st Ave,Accident on 51st Ave at Bell Rd.
2,2017-08-04 17:31:06,33.5675,-112.1863,Glendale,AZ,5901,W Olive Ave,Accident on 59th Ave at Olive Ave.
2,2018-03-19 11:51:12,33.7108,-112.2723,Peoria,AZ,,W Happy Valley Pkwy,Accident on Happy Valley Pkwy at Lake Pleasant Pkwy.
2,2018-12-01 11:29:48,33.6108,-112.1442,Phoenix,AZ,13499,W Thunderbird Rd,Accident on Thunderbird Rd at 39th Ln.
2,2017-12-11 11:55:51,34.6655,-112.2251,Prescott Valley,AZ,10426,Prescott Jerome Hwy,Shoulder blocked due to accident on AZ-89A Prescott Jerome Hwy Southbound between Legend Hills Rd and Old Fain Rd.
2,2020-09-16 17:11:00,33.0002,-112.0479,Maricopa,AZ,,W Peters and Nall Rd,Construction on AZ-347 NB near W FARRELL RD Road closed. Take alternate route.
2,2017-11-28 18:34:08,33.459,-112.0007,Phoenix,AZ,,AZ-202 Loop E,At 40th St/Exit 2 - Accident.
2,2020-12-17 04:30:00,34.5583,-111.9075,Mayer,AZ,,Arizona Veterans Highway,Incident on I-17 SB near GEN CROOK TR Drive with caution.
2,2019-09-11 06:01:24,33.4322,-111.891,Mesa,AZ,,AZ-101 Loop N,Right hand shoulder blocked due to accident on AZ-101-LOOP Northbound near Exit 52 Rio Salado Pkwy.
2,2019-07-17 19:19:28,33.9853,-114.2169,Bouse,AZ,24953, State Highway 95,Between AZ-72 and CR-1/Mohave Dr/Mohave Rd - Accident.
2,2019-09-23 19:12:27,33.6546,-111.9081,Scottsdale,AZ,,AZ-101 Loop W,Right lane blocked due to accident on AZ-101-LOOP Westbound at Exit 35 Hayden Rd.
2,2020-11-13 00:23:00,33.495,-112.0957,Phoenix,AZ,1698, W Indian School Rd,Incident on N 17TH ST near E INDIAN SCHOOL RD Expect delays.
2,2020-02-12 06:20:46,33.4552,-111.9718,Phoenix,AZ,,AZ-202 Loop W,Accident on AZ-202-LOOP Westbound at Exit 4 52nd St.
2,2019-07-01 06:59:11,32.6967,-114.6181,Yuma,AZ,1699,S Maple Ave,Accident on Maple Ave at 17th St.
1,2020-04-15 13:37:02,32.1197,-110.9093,Tucson,AZ,3879, E Los Reales Rd,At E Hughes Access Rd - Accident.
2,2019-12-06 22:37:25,33.5531,-112.1256,Phoenix,AZ,8001,N 31st Ave,Accident on 31st Ave at Northern Ave.
2,2020-11-16 04:08:00,34.2085,-113.065,Congress,AZ,33799, Joshua Forest Scenic Rd,Incident on US-93 SB near DATE CREEK RANCH RD Drive with caution.
2,2019-06-25 07:37:20,33.2829,-111.7906,Chandler,AZ,,AZ-202 Loop E,Accident on AZ-202-LOOP Westbound near Exit 44 Gilbert Rd.
2,2020-03-19 15:23:15,33.3866,-111.6349,Mesa,AZ,,Superstition Fwy W,Right lane blocked due to accident on US-60 Eastbound at Exit 191 Ellsworth Rd.
2,2018-04-20 04:55:18,33.5095,-112.1688,Glendale,AZ,,N 51st Ave,Accident on 51st Ave at Camelback Rd.
1,2020-06-12 05:48:30,33.5676,-112.0825,Phoenix,AZ,601, W Dunlap Ave,At N 7th Ave - Accident.
2,2020-12-29 01:53:00,33.4744,-112.113,Phoenix,AZ,,Black Canyon Fwy N,Incident on I-17 near W GRAND AVE Expect delays.
3,2018-02-07 18:37:16,33.4659,-111.8886,Scottsdale,AZ,,E McDowell Rd,Hov lane blocked and 2 left lane blocked due to accident on AZ-101 Loop Southbound at McDowell Rd.
2,2017-08-17 14:56:29,32.1779,-110.9817,Tucson,AZ,802,W Ajo Way,Accident on AZ-86 Ajo Way at 16th Ave.
3,2018-04-24 05:50:43,32.3376,-111.0667,Tucson,AZ,,Pearl Harbor Memorial Highway,Shoulder blocked due to accident on I-10 Westbound at Exit 248 Casa Grande Hwy.
3,2017-08-30 12:42:06,33.4577,-112.3463,Goodyear,AZ,,Pearl Harbor Memorial Highway,At Dysart Rd/Exit 129 - Accident.
2,2020-06-08 14:57:50,33.3861,-111.8451,Mesa,AZ,,Superstition Fwy W,At Alma School Rd/Exit 178 - Accident. Hard shoulder blocked. on the right.
2,2016-11-28 16:06:05,32.1387,-110.8901,Tucson,AZ,,Pearl Harbor Memorial Highway,At I-10-BL/Valencia Rd/Exit 267 - Accident.
2,2019-01-02 16:35:04,33.3856,-111.9261,Tempe,AZ,,Superstition Fwy E,Left lane blocked due to accident on US-60 Eastbound at Exit 174 Rural Rd.
2,2020-11-09 22:33:00,33.7605,-112.2169,Peoria,AZ,,Sonoran Mountain Ranch Rd,Incident on W PALO BREA LN near N SONORAN MTN RANCH RD Expect delays.
2,2016-11-06 10:45:10,32.3411,-111.0704,Tucson,AZ,,Pearl Harbor Memorial Highway,At Ina Rd/Exit 248 - Accident.
3,2020-05-16 12:58:35,33.4626,-112.4269,Goodyear,AZ,,Frontage Rd,HOV lane blocked due to accident on I-10 Westbound at Exits 124A 124B AZ-303-LOOP Exits 104A 104B.
1,2020-04-06 14:32:24,32.2498,-110.961,Tucson,AZ,2344, N 1st Ave,At N Euclid Ave/E North St - Accident.
2,2020-11-16 13:59:30,32.2069,-110.9136,Tucson,AZ,1201, S Dodge Blvd,Stationary traffic from E Aviation Pkwy (E 22nd St) to S Swan Rd (E 22nd St) due to accident.
2,2017-10-20 16:08:40,33.4614,-112.4416,Goodyear,AZ,,Pearl Harbor Memorial Highway,Between AZ-303-LOOP/Cotton Lane/Exit 124 and Sarival Ave - Accident.
2,2019-04-15 15:21:29,33.4659,-112.0826,Phoenix,AZ,678,W McDowell Rd,Accident on 7th Ave at Mcdowell Rd.
2,2020-09-16 09:20:18,33.0291,-112.0478,Maricopa,AZ,,W Farrell Rd,Left lane blocked due to accident on AZ-347 Maricopa Rd Southbound from AZ-347 John Wayne Pkwy to BIA-14 Farrell Rd.
2,2019-09-06 13:19:32,33.5527,-112.0652,Phoenix,AZ,7898,N 7th St,Accident on 7th St at Northern Ave.
2,2020-06-25 11:47:14,35.2264,-114.3068,Golden Valley,AZ,,N Egar Rd,Left lane blocked due to accident on AZ-68 Westbound between Emery Park Rd and Egar Rd.
2,2018-02-03 14:01:13,33.3857,-111.9394,Tempe,AZ,,S Mill Ave,1 left lane blocked due to accident on US-60 Westbound at Exit 173 Mill Ave.
2,2019-08-23 16:53:24,33.567,-111.9027,Scottsdale,AZ,,N Hayden Rd,Accident on Hayden Rd at Via Linda.
2,2020-01-06 16:49:46,33.4396,-112.0373,Phoenix,AZ,,I-10 W,Accident on I-10 Eastbound at Exit 149 Sky Harbor Blvd.
2,2019-05-25 09:30:13,36.1729,-111.3995,Kaibeto,AZ,,Indian Route 6133,Accident on US-89 Northbound at BIA-6133.
2,2020-06-26 09:52:08,33.6372,-112.0568,Phoenix,AZ,1163,E Greenway Pkwy,Accident on 12th St near Greenway Pkwy.
4,2020-02-16 01:19:51,35.2016,-111.4724,Flagstaff,AZ,,US-180 E,Closed between Cosnino Rd/Exit 207 and Townsend Winona Rd/Exit 211 - Road closed due to accident.
2,2020-10-15 05:29:17,32.2649,-110.9374,Tucson,AZ,3201,N Jackson Ave,Lane blocked due to accident on Fort Lowell Rd at Jackson Ave.
2,2020-05-25 10:59:40,33.6946,-112.0291,Phoenix,AZ,2499,E Cielo Grande Ave,Accident on Cave Creek Rd at Memorial Dr.
2,2020-06-22 15:49:09,33.4622,-112.0244,Phoenix,AZ,,AZ-202 Loop W,Between 32nd St/Exit 1C and I-10/AZ-51 - Accident. Hard shoulder blocked. on the right.
3,2019-01-27 05:38:41,33.4627,-112.1928,Phoenix,AZ,,Pearl Harbor Memorial Highway,Between 59th Ave/Exit 138 and 51st Ave/Exit 139 - Accident.
4,2018-08-27 11:31:53,33.5752,-111.9061,Scottsdale,AZ,8089, E Mountain View Rd,Closed at Mountain View Rd - Road closed due to accident.
2,2020-09-30 00:38:00,33.6723,-112.0313,Phoenix,AZ,,AZ-101 Loop W,Incident on AZ-101 LOOP WB near CAVE CREEK RD Right lane blocked. Expect delays.
2,2020-10-25 06:31:04,32.1678,-110.9775,Tucson,AZ,584, W Ohio St,Incident on S 12TH AVE near W OHIO ST Drive with caution.
2,2019-10-29 08:15:14,33.5971,-111.9958,Phoenix,AZ,,E Cactus Rd,Accident on 40th St at Cactus Rd.
2,2020-10-16 10:17:00,35.1614,-113.655,Kingman,AZ,,I-40 E,Incident on I-40 EB near WILLOWS RANCH RD Right shoulder closed.
2,2016-10-07 15:31:09,33.4984,-112.942,Tonopah,AZ,,Pearl Harbor Memorial Highway,At 411th Ave/Exit 94 - Accident.
2,2019-06-17 15:17:49,33.2341,-111.6945,Gilbert,AZ,18002,E Chandler Heights Rd,Accident on Chandler Heights Rd at Seville Blvd.
