Severity,Date/Time,Latitude,Longitude,City,State,Number,Street,Description
2,2017-11-28 15:44:54,39.6714,-75.7691,Newark,DE,801,Elkton Rd,Accident on Elkton Rd at Chrysler Ave.
3,2016-09-16 05:53:07,39.2236,-75.5766,Dover,DE,5449, N Dupont Hwy,At SR-42 - Accident.
2,2019-10-31 13:51:11,39.7452,-75.5496,Wilmington,DE,902,N Orange St,Accident on Orange St at 9th St.
2,2019-02-06 19:34:02,39.7532,-75.5386,Wilmington,DE,2300,N Market St,Accident on 23rd St at US-13-BR Market St.
2,2017-09-25 21:43:56,39.6995,-75.5525,New Castle,DE,,Memorial Dr,Accident on West Ave at DE-9 New Castle Ave.
3,2019-01-08 08:57:46,39.7391,-75.5623,Wilmington,DE,249,Maryland Ave,Accident on I-95 Southbound near Martin Luther King Jr Blvd.
2,2018-08-06 08:52:56,39.749,-75.5724,Wilmington,DE,1950,W 4th St,Accident on 4th St at DE-2 Lincoln St.
2,2020-11-12 05:37:00,39.6983,-75.6134,New Castle,DE,,Delaware Tpke S,Incident on I-95 SB near CHURCHMANS Expect long delays.
2,2019-11-15 11:39:48,39.6727,-75.6761,Newark,DE,1281,Christiana Rd,Accident on I-95 Southbound at Exits 3 3A 3B DE-273 Christiana Rd.
3,2020-03-27 15:31:20,39.4066,-75.6615,Townsend,DE,,Dupont Pkwy,At Old State Rd - Accident.
2,2020-03-11 19:10:03,39.7488,-75.5374,Wilmington,DE,507,E 17th St,Accident on Pine St at 17th St.
2,2018-01-04 09:58:07,39.6695,-75.6797,Newark,DE,,Delaware Tpke,At SR-273/Exit 3 - Accident.
4,2020-05-27 15:13:51,38.5173,-75.2396,Frankford,DE,34201, Dupont Blvd,Closed between Delaware Ave and SR-26/Clayton St/Nine Foot Rd - Road closed due to accident.
2,2017-07-06 18:39:18,39.673,-75.6739,Newark,DE,,Delaware Tpke,At SR-273/Exit 3 - Accident.
2,2019-10-31 06:45:54,39.8151,-75.4534,Claymont,DE,,I-495 N,Accident on I-95 Southbound around Exit 11 I-495.
2,2020-01-16 10:12:16,39.7477,-75.5502,Wilmington,DE,1101,N West St,Accident on West St at DE-52 11th St.
2,2020-10-26 20:16:30.000000000,39.7689,-75.5359,Wilmington,DE,,I-95 S,Stationary traffic on I-95 from DE-3/Marsh Rd/Exit 9 (I-95) to DE-52/Delaware Ave/W 7th St/Exit 7 (I-95) due to accident.
4,2017-09-10 05:03:55,39.6457,-75.7798,Newark,DE,,Otts Chapel Rd,Closed at Old Baltimore Pike - Road closed due to accident.
2,2020-11-30 16:31:00,39.7075,-75.5878,New Castle,DE,,I-95 N,Slow traffic on I-95 N - US-202 N from I-495/I-295/Exit 5 (I-95) to DE-4/Maryland Ave/6th Ave/Exit 6 (I-95) due to accident.
2,2019-03-04 06:08:21,39.7394,-75.5485,Wilmington,DE,299,E 4th St,Accident on DE-9 4th St at US-13-BR Walnut St.
2,2018-08-31 21:22:27,39.7076,-75.5975,New Castle,DE,,US-202 S,At I-295/US-202/SR-141/Exit 5 - Accident. Lane blocked.
2,2020-09-29 08:13:22,39.7159,-75.6354,Wilmington,DE,2008,W Newport Pike,Accident on DE-4 Newport Pike at Redmont Rd.
2,2016-11-24 11:04:29,39.7781,-75.5106,Wilmington,DE,,I-95 N,At SR-3/Marsh Rd/Exit 9 - Accident.
2,2020-10-08 13:54:00,39.6052,-75.7742,Newark,DE,2994, Pulaski Hwy,Stationary traffic on US-40 from Frazer Rd (Pulaski Hwy/US-40) to US-301/DE-896/Summit Bridge Rd (US-301/Pulaski Hwy/US-40) due to accident.
2,2017-11-22 17:02:28,39.7245,-75.605,Wilmington,DE,,W Keystone Ave,Accident on DE-62 Boxwood Rd at Keystone Ave.
2,2020-11-30 16:31:00,39.7075,-75.5878,New Castle,DE,,I-95 N,Slow traffic on I-95 N - US-202 N from I-495/I-295/Exit 5 (I-95) to DE-4/Maryland Ave/6th Ave/Exit 6 (I-95) due to accident.
2,2018-06-29 11:51:15,39.7423,-75.5465,Wilmington,DE,299,E 8th St,Accident on 8th St Westbound from Lombard St to US-13 Bus Walnut St.
2,2018-10-03 08:00:11,39.7467,-75.5718,Wilmington,DE,201,N Scott St,Accident on DE-48 2nd St at Scott St.
4,2019-07-28 17:33:22,39.8051,-75.4532,Claymont,DE,3740, Philadelphia Pike,Closed between US-13/Philadelphia Pike/Exit 5 and US-13/Philadelphia Pike - Road closed due to accident.
2,2020-01-15 06:53:15,39.775,-75.6907,Hockessin,DE,1800,Brackenville Rd,Accident on Brackenville Rd at Mill Creek Rd.
4,2019-06-04 05:54:54,38.5987,-75.2892,Millsboro,DE,29906, John J Williams Hwy,Closed at SR-30/Gravel Hill Rd - Road closed due to accident.
2,2020-09-29 19:37:00.000000000,39.7786,-75.4878,Wilmington,DE,1022, Philadelphia Pike,Incident on PHILADELPHIA PIKE SB near SILVERSIDE RD Road closed. Take alternate route.
2,2020-12-19 07:30:00.000000000,39.8082,-75.4627,Claymont,DE,,I-95 S,Incident on I-95 SB near HARVEY RD Right lane blocked. Expect delays.
2,2018-10-30 07:32:48,39.7668,-75.5431,Wilmington,DE,,I-95 N,Accident on I-95 Northbound at Exits 8 8B US-202.
2,2018-03-19 15:20:40,39.6977,-75.5826,New Castle,DE,,Delaware Tpke,At US-13/US-40/US-301/Dupont Hwy - Accident.
2,2020-09-04 07:39:20,39.7968,-75.4648,Claymont,DE,2989,Philadelphia Pike,Accident on US-13-BR Philadelphia Pike at Princeton Ave.
4,2017-12-02 08:18:22,39.5226,-75.7174,Middletown,DE,4228, Summit Bridge Rd,Closed at Newark - Road closed due to accident.
2,2019-07-07 15:53:37,39.7009,-75.5976,New Castle,DE,,I-295 N,Ramp to I-295 Northbound - Accident.
4,2020-05-25 20:00:56,39.6705,-75.7106,Newark,DE,2, Pearson Dr,Closed at SR-2/SR-72/S Chapel St - Road closed due to accident.
4,2016-09-30 07:51:25,39.5295,-75.737,Middletown,DE,,Bethel Church Rd,Closed between Summit Bridge Rd and Choptank Rd - Road closed due to accident.
4,2016-08-05 14:00:00,38.5829,-75.2926,Millsboro,DE,,Dupont Blvd,Closed at Dupont Blvd - Road closed due to accident.
2,2018-04-12 20:04:38,39.7969,-75.4669,Claymont,DE,98,Pennsylvania Ave,Accident on Mansion Ave at Pennsylvania Ave.
2,2018-03-29 17:05:56,39.4526,-75.6864,Middletown,DE,,Brick Mill Rd,Accident on DE-299 Middletown Odessa Rd at Brick Mill Rd.
4,2016-05-30 16:34:00,39.6855,-75.7327,Newark,DE,710, Ogletown Rd,Closed at SR-2/SR-72/Kirkwood Hwy/Library Ave - Road closed due to accident.
2,2019-01-30 06:48:00,39.5051,-75.7507,Middletown,DE,,Choptank Rd,Accident on DE-15 Choptank Rd at Clayton Manor Dr.
2,2018-12-03 11:12:49,39.8017,-75.4507,Claymont,DE,,I-495 N,Between US-13/Exit 4 and I-95 - Accident.
4,2019-05-05 13:06:30,39.6321,-75.6528,New Castle,DE,,DE-1 N,Closed between US-40/Exit 160 and SR-273/Exit 162 - Road closed due to accident.
3,2020-06-17 10:21:09,39.6544,-75.6165,New Castle,DE,234, S Dupont Hwy,At US-301/US-40/Pulaski Hwy - Accident. Three lanes blocked.
4,2018-03-21 06:05:39,39.5427,-75.6503,Middletown,DE,,Korean War Veterans Memorial Hwy S,Closed between Lorewood Grove Rd/Exit 148 and Pole Bridge Rd/Exit 142 - Road closed due to accident.
4,2020-03-27 07:22:25,39.4627,-75.7214,Middletown,DE,,N Broad St,Closed between SR-299/W Main St and SR-896/Boyds Corner Rd - Road closed due to accident.
2,2017-05-24 07:57:27,39.7785,-75.5101,Wilmington,DE,,I-95 S,Between SR-3/Marsh Rd/Exit 9 and SR-202/Concord Pike/Exit 8 - Accident.
2,2016-10-14 16:07:01,39.7214,-75.5387,Wilmington,DE,,I-495 S,At Terminal Ave/Exit 2 - Accident.
2,2019-03-14 07:17:20,39.6596,-75.7422,Newark,DE,172, E Chestnut Hill Rd,At SR-72/SR-4/S Chapel St - Accident. Lane blocked.
2,2020-09-18 23:28:00,38.8188,-75.345,Ellendale,DE,12271, Isaacs Rd,Incident on DE-30 EB near HUMMINGBIRD RD Drive with caution.
2,2020-06-19 19:50:03,39.7532,-75.5477,Wilmington,DE,1454, N Washington St,At SR-52/W 11th St/W 12th St - Accident.
2,2020-05-01 18:29:24,39.6545,-75.6168,New Castle,DE,,S Dupont Hwy,At US-301/US-40/Pulaski Hwy - Accident.
2,2016-06-26 16:34:55,39.695,-75.6207,New Castle,DE,,Delaware Tpke,Accident on I-95 Northbound at Exit 5A Airport Rd.
2,2019-10-28 16:37:53,39.7561,-75.5605,Wilmington,DE,1500,N Rodney St,Accident on Delaware Ave at Rodney St.
2,2019-07-15 10:17:10,39.7495,-75.5713,Wilmington,DE,1899,W 5th St,Accident on DE-2 Lincoln St both ways at 5th St.
2,2020-10-21 22:54:00,39.7182,-75.5437,New Castle,DE,,I-495 N,Incident on I-495 NB near CHRISTINA RIVER BRG Road closed. Take alternate route.
2,2019-11-14 13:14:03,39.7553,-75.5955,Wilmington,DE,3637,Lancaster Pike,Accident on DE-100 Lancaster Pike Northbound at Court Dr.
2,2020-10-21 22:49:00,39.729,-75.5289,Wilmington,DE,,I-495 S,Incident on I-495 SB near CHRISTINA RIVER BRG Expect delays.
2,2019-09-17 08:14:50,39.4999,-75.6494,Middletown,DE,,Pole Bridge Rd,Accident on US-13 Dupont Pkwy at DE-896 Boyds Corner Rd.
2,2019-01-08 06:03:43,39.7607,-75.6245,Wilmington,DE,2977,Centerville Rd,Accident on Centerville Rd at Red Clay Dr.
2,2019-11-04 16:05:32,39.7424,-75.6226,Wilmington,DE,496,Ohio Ave,Accident on Ohio Ave at Rhode Island Ave.
2,2019-08-19 07:58:20,39.7439,-75.5674,Wilmington,DE,1,S Broom St,Accident on Broom St at DE-48 Lancaster Ave.
2,2018-05-21 19:37:06,39.459,-75.729,Middletown,DE,,S Rammuno Dr,Accident on Ash Blvd at Rammuno Dr.
4,2020-04-28 00:37:56,39.6704,-75.7104,Newark,DE,557, E Chestnut Hill Rd,Closed at SR-273/Newark Christiana Rd - Road closed due to accident.
3,2017-03-28 13:21:17,39.7143,-75.5842,New Castle,DE,,I-95 N,Right lane closed due to accident on I-495 Northbound at I-95.
2,2020-09-20 18:19:00,39.8165,-75.4521,Claymont,DE,,I-95 N,Slow traffic on I-95 from Harvey Rd/Exit 10 (I-95) to Chichester Ave/Exit 1 (I-95) due to accident.
3,2018-02-05 17:32:30,39.7385,-75.5192,Wilmington,DE,,I-495 S,At 12th St/Exit 3 - Accident. Left lane blocked. Right lane blocked.
2,2020-11-25 07:31:00,39.6887,-75.6418,New Castle,DE,,Delaware Tpke S,Incident on I-95 SB near CHURCHMANS RD Road closed. Take alternate route.
4,2019-04-30 10:32:42,38.9845,-75.5672,Felton,DE,,S Dupont Hwy,Closed at SR-12/Main St/Midstate Rd - Road closed due to accident.
2,2020-11-02 11:17:39,39.6655,-75.727,Newark,DE,198,Marrows Rd,Accident on Marrows Rd at Kensington Ln.
2,2020-12-20 08:51:00,39.0814,-75.6012,Camden Wyoming,DE,8998, Willow Grove Rd,Incident on WILLOW GROVE RD near MORGANS CHOICE RD Road closed. Take alternate route.
2,2020-12-01 07:06:00,39.7554,-75.4956,Wilmington,DE,,I-495 N,Construction on I-495 NB near MYRTLE AVE Right lane blocked. Expect delays.
4,2018-06-12 17:30:43,38.8874,-75.5725,Harrington,DE,19747, S Dupont Hwy,Closed at Harrington - Road closed due to accident.
2,2018-10-02 17:43:04,38.5615,-75.2741,Dagsboro,DE,30703, Dupont Blvd,At Dupont Blvd - Accident. Right lane blocked.
2,2020-05-26 06:43:37,39.745,-75.5601,Wilmington,DE,502,N Jackson St,Accident on exit ramp from I-95 Westbound at Exits 6 7B to W 4th St Westbound.
2,2020-11-04 07:52:02,39.6014,-75.7137,Bear,DE,2701,Wrangle Hill Rd,Accident on DE-72 Wrangle Hill Rd at Del Laws Rd.
2,2018-12-21 05:26:54,39.6561,-75.5805,New Castle,DE,772,W 7th St,Accident on Clymer St at DE-9 7th St.
2,2019-04-09 05:54:26,39.7037,-75.5888,New Castle,DE,,Delaware Tpke,Ramp to I-95 Southbound and SR-141 NB - Accident.
2,2018-03-14 17:56:36,39.6358,-75.6608,Bear,DE,100,Governors Pl,Accident on Governors Pl at Songsmith Dr.
3,2020-04-24 08:25:30,39.812,-75.4542,Claymont,DE,,I-495 N,At I-95 - Accident. Right lane blocked.
2,2016-06-10 18:57:56,39.7775,-75.5128,Wilmington,DE,,I-95 N,Between SR-3/Marsh Rd/Exit 9 and Harvey Rd/Exit 10 - Accident.
2,2020-12-30 09:50:42,39.7519,-75.583,Wilmington,DE,214,N Gray Ave,Accident on Gray Ave at Conrad St.
2,2018-12-28 08:40:43,39.7388,-75.6271,Wilmington,DE,,Albertson Blvd,Accident on Albertson Blvd at Greenbank Rd.
2,2020-11-13 22:04:00,39.6174,-75.6444,New Castle,DE,,S Dupont Hwy,Incident on RED LION RD near RAMP Drive with caution.
2,2019-05-31 08:28:00,39.7525,-75.5885,Wilmington,DE,,N Dupont Rd,Accident on Dupont Rd at DE-100 Lancaster Ave.
2,2020-12-17 11:59:01,39.7195,-75.6761,Wilmington,DE,2611,Longfellow Dr,Accident on Carl Rd at Longfellow Dr.
2,2017-09-20 22:11:18,39.5741,-75.7642,Bear,DE,99,Rose Hill Dr,Accident on Frazer Rd near Rose Hill Dr.
2,2020-05-01 16:57:27,39.7555,-75.5313,Wilmington,DE,,Jessup St,Accident on 30th St at US-13-BR Market St. No recent updates.
2,2020-05-09 15:13:06,39.7181,-75.5443,New Castle,DE,,I-495 S,At US-13/Dupont Pky/Exit 1 - Accident. Two lanes blocked.
2,2020-02-14 08:53:33,39.744,-75.5652,Wilmington,DE,199,N Franklin St,Accident on Franklin St at DE-48 2nd St.
4,2019-06-21 06:16:25,39.1,-75.4547,Dover AFB,DE,,Bay Rd,Closed at Trap Shooters Rd - Road closed due to accident.
3,2019-05-20 08:47:08,39.7719,-75.544,Wilmington,DE,1406,Concord Pike,Accident on I-95 Northbound at Exits 8 8A-8B Concord Pike.
2,2020-01-02 10:04:29,39.7473,-75.7006,Wilmington,DE,,Limestone Rd,Accident on DE-7 Limestone Rd at Ocheltree Ln.
4,2016-11-10 15:57:37,39.7858,-75.6862,Hockessin,DE,7231, Lancaster Pike,Closed at Schoolhouse Rd - Road closed due to accident.
2,2020-10-08 07:38:41,39.742,-75.5437,Wilmington,DE,826,N Lombard St,Accident on Taylor St at Lombard St.
3,2020-03-28 08:22:13,39.0713,-75.5535,Felton,DE,,S Dupont Hwy,At US-13-ALT/SR-15/Canterbury Rd/Uppr King Rd - Accident traffic being directed around accident area.
2,2020-11-02 19:58:00,39.7491,-75.5566,Wilmington,DE,898, W 10th St,Incident on I-95 NB near DELAWARE AVE Expect long delays.
2,2018-07-05 07:56:54,39.7824,-75.5553,Wilmington,DE,198,Childrens Dr,Accident on Rockland Rd at Childrens Dr.
2,2020-07-31 04:11:54,39.7575,-75.5523,Wilmington,DE,1529,N Park Dr,Accident on I-95 Southbound before Exit 11 Adams St.
2,2020-06-06 23:51:40,39.1306,-75.4926,Dover,DE,,DE-1 S,Between SR-1/SR-10/E Lebanon Rd and SR-12/Frederica Rd - Accident. Right lane blocked.
2,2019-09-16 07:46:53,39.7398,-75.5954,Wilmington,DE,804,New Rd,Accident on New Rd at Gamble Ave.
2,2019-03-29 06:50:16,39.7666,-75.7067,Hockessin,DE,,Brackenville Rd,Accident on Brackenville Rd at Little Baltimore Rd.
2,2020-05-09 10:04:48,38.9327,-75.4304,Milford,DE,985, N Dupont Blvd,At SR-14/NW Front St/Harrington Hwy - Accident traffic being directed around accident area.
2,2020-04-01 17:30:39,39.7712,-75.4839,Wilmington,DE,5930, Governor Printz Blvd,At Bellevue Rd - Accident. Left lane blocked.
2,2020-05-08 03:02:21,39.6689,-75.6707,Newark,DE,1388, Christiana Rd,Between Old Baltimore Pike and SR-4/Christiana Rd/Salem Church Rd - Accident. Right lane blocked.
2,2020-09-29 04:05:06,39.7428,-75.5355,Wilmington,DE,1069,Thatcher St,Accident on 12th St at Thatcher St.
4,2017-11-26 18:22:06,39.7161,-75.5723,New Castle,DE,,I-495 S,Closed at I-95/I-295 - Road closed due to accident.
2,2019-01-10 12:44:43,39.7434,-75.5493,Wilmington,DE,800,N Market St,Accident on Market St near 8th St.
3,2020-01-04 09:07:24,39.7795,-75.5068,Wilmington,DE,,I-95 S,Accident on I-95 Southbound at Exit 9 Carr Rd.
2,2020-04-02 14:16:37,39.6403,-75.6474,Bear,DE,831,Pulaski Hwy,Accident on Buckley Blvd at US-40 Pulaski Hwy.
2,2020-04-28 18:39:40,39.5172,-75.5792,Port Penn,DE,1, W Market St,At Bayview Rd - Accident.
2,2019-01-25 08:32:33,39.7603,-75.4986,Wilmington,DE,1004,Lore Ave,Accident on River Rd at Lore Ave.
2,2017-09-28 16:00:33,39.4201,-75.6345,Townsend,DE,1,Dundee,Accident on Aberdeen both ways in Odessa.
2,2020-10-27 11:13:53,39.7495,-75.5713,Wilmington,DE,1899,W 5th St,Accident on 5th St at DE-2 Lincoln St.
2,2020-11-09 01:20:00,39.6834,-75.6581,Newark,DE,,Delaware Tpke S,Incident on I-95 SB near DE-273 Road closed. Take alternate route.
2,2018-04-18 05:39:41,38.5541,-75.182,Frankford,DE,30801,West Rd,Accident on DE-26 Vines Creek Rd at West Rd.
2,2020-11-11 10:10:00,39.7498,-75.5059,Wilmington,DE,,I-495 N,Slow traffic on I-495 from 12th St/Exit 3 (I-495) to US-13/Exit 4 (I-495) due to accident.
4,2018-12-13 10:22:46,39.6084,-75.714,Bear,DE,1989, Pulaski Hwy,Closed at Pulaski Hwy - Road closed due to accident.
2,2020-11-10 10:31:56,39.744,-75.5704,Wilmington,DE,1597,Chestnut St,Accident on Chestnut St at Clayton St.
2,2019-10-17 14:45:08,39.5114,-75.6641,Middletown,DE,700,Stanford White Way,Accident on Stanford White Way Northbound at Bayberry Pkwy.
2,2020-09-04 06:08:28,39.6442,-75.6433,Bear,DE,51,Oriole Ave,Accident on Seymour Rd at Oriole Ave.
3,2018-02-11 00:50:27,39.7504,-75.5048,Wilmington,DE,,I-495 S,At SR-3/Edgemoor Rd/Exit 4 - Accident.
4,2017-03-20 16:43:33,39.5142,-75.7119,Middletown,DE,4423, Summit Bridge Rd,Closed at SR-896/Boyds Corner Rd - Road closed due to accident.
2,2020-12-26 14:26:30,39.6197,-75.6918,Newark,DE,1610, Pulaski Hwy,Stationary traffic on US-40 E from DE-72/Sunset Lake Rd/Wrangle Hill Rd (Pulaski Hwy/US-40) to Walther Rd/Glendale Blvd (Pulaski Hwy/US-40) due to accident.
2,2017-12-08 17:14:33,39.7434,-75.5586,Wilmington,DE,798,W 4th St,Accident on DE-9 4th St at Monroe St.
4,2019-04-19 15:20:40,38.6982,-75.1716,Lewes,DE,,Harts Rd,Closed at Milton - Road closed due to accident.
4,2020-06-22 19:15:12,39.663,-75.6391,New Castle,DE,,Christiana Rd,Closed at SR-1 - Road closed due to accident.
4,2018-02-21 13:33:30,39.1354,-75.5271,Dover,DE,1418, S Dupont Hwy,Closed at Dover - Road closed due to accident.
4,2019-01-04 17:46:00,38.9268,-75.5391,Harrington,DE,2, Old Airport Rd,Closed at Doctor Smith Rd - Road closed due to accident.
2,2019-01-04 18:11:10,39.8123,-75.522,Wilmington,DE,2718,Silverside Rd,Accident on Silverside Rd at Meadow Glen Ln.
2,2020-11-12 01:26:00,39.6887,-75.6418,New Castle,DE,,Delaware Tpke S,Incident on I-95 SB near CHURCHMANS RD Expect delays.
2,2018-09-30 09:43:43,39.6695,-75.6797,Newark,DE,,Delaware Tpke,At SR-273/Exit 3 - Accident. Left lane blocked.
2,2019-06-14 17:03:34,39.4525,-75.7176,Middletown,DE,310,N Broad St,Accident on DE-71 Broad St at DE-71 Broad St.
3,2018-12-31 13:29:56,39.8018,-75.4507,Claymont,DE,,I-495 N,Accident and fuel spillage on I-495 Northbound at Exit 5 US-13 Philadelphia Pike.
2,2020-12-23 18:50:30,39.6528,-75.7114,Newark,DE,,Delaware Tpke N,Slow traffic on I-95 N - Delaware Tpke N from DE-896/Exit 1 (I-95) to DE-273/Exit 3 (I-95) due to accident.
2,2020-09-25 19:27:30,39.8153,-75.4531,Claymont,DE,,I-95 N,Queuing traffic on I-95 from Harvey Rd/Exit 10 (I-95) to PA-452/Market St/Exit 2 (I-95) due to accident.
2,2020-09-19 17:12:00,39.8153,-75.4531,Claymont,DE,,I-95 N,Stationary traffic on I-95 from Harvey Rd/Exit 10 (I-95) to Chichester Ave/Exit 1 (I-95) due to accident.
2,2017-12-01 19:12:17,39.7437,-75.5367,Wilmington,DE,901,E 12th St,Accident on 12th St at US-13 Northeast Blvd.
4,2019-02-22 19:58:29,39.8022,-75.5051,Wilmington,DE,2198, Silverside Rd,Closed at Marsh Rd - Road closed due to accident.
2,2019-11-15 19:34:21,39.6334,-75.6589,Bear,DE,,Pulaski Hwy,Accident on US-40 Pulaski Hwy at Eden Cir.
2,2017-08-23 16:44:58,39.4435,-75.7391,Middletown,DE,,Middletown Warwick Rd,Accident on US-301 Middletown Warwick Rd at Merrimac Ave.
2,2019-09-23 18:17:57,39.7476,-75.534,Wilmington,DE,2085,N Locust St,Accident on Locust St at Vandever Ave.
2,2016-11-28 18:29:31,39.6481,-75.736,Newark,DE,,Delaware Tpke,At SR-896/Exit 1 - Accident.
2,2019-06-19 17:08:04,39.7561,-75.5605,Wilmington,DE,1500,N Rodney St,Accident on Delaware Ave at Rodney St.
2,2020-11-03 13:35:00,39.7068,-75.5971,New Castle,DE,,Delaware Tpke S,Incident on I-295 SB near I-95 Left lane blocked.
4,2020-05-31 23:13:22,39.332,-75.6287,Smyrna,DE,,DE-1 S,Closed between SR-299/Exit 136 and Kent/New Castle County Line - Road closed due to accident.
3,2019-12-17 08:25:14,39.721,-75.5773,Wilmington,DE,,I-95 S,At I-295/I-495/Exit 5 - Accident.
4,2018-03-01 20:26:49,39.1514,-75.5049,Dover,DE,637, Bay Rd,Closed at Little Creek Rd - Road closed due to accident.
2,2020-06-16 11:48:39,39.7524,-75.5694,Wilmington,DE,1875,Howland St,Accident on DE-2 Lincoln St at Howland St.
3,2018-03-18 12:46:07,39.7513,-75.5034,Wilmington,DE,,I-495 S,Accident on I-495 Southbound at Exits 4 4B DE-3 Edgemoor Rd.
2,2017-12-07 11:42:47,39.7392,-75.555,Wilmington,DE,301,Martin Luther King Blvd,Accident on Tatnall St at Martin Luther King Blvd.
2,2020-05-22 12:53:56,39.7201,-75.614,Wilmington,DE,,Burnside Blvd,At SR-4/Exit 4 - Accident. Left lane blocked.
2,2020-12-02 14:52:00,39.6976,-75.6123,New Castle,DE,,Delaware Tpke N,Construction on I-95 NB near I-295 Drive with caution.
2,2019-09-23 18:18:26,39.7375,-75.5593,Wilmington,DE,792,S West St,Accident on West St at Justison St.
2,2019-11-22 13:24:05,39.7284,-75.5845,Wilmington,DE,37,S Dupont Rd,Accident on Dupont Rd at Hillside Rd.
2,2020-10-09 08:01:37,39.6882,-75.6532,Newark,DE,,Churchmans Rd,Accident on Geoffrey Dr Southbound at Churchmans Rd.
2,2018-12-12 13:05:25,38.4512,-75.142,Selbyville,DE,34485,W Line Rd,Accident on Line Rd at Selby Rd.
2,2016-07-04 08:20:37,39.7494,-75.5068,Wilmington,DE,,I-495 N,At SR-3/Edgemoor Rd/Exit 4 - Accident.
3,2020-03-20 16:55:39,39.5302,-75.737,Middletown,DE,,Summit Bridge Rd,At Bethel Church Rd - Accident traffic being directed around accident area.
4,2019-02-12 07:42:43,38.7237,-75.2904,Georgetown,DE,26294, Lewes Georgetown Hwy,Closed at SR-30/Gravel Hill Rd - Road closed due to accident.
2,2018-06-04 19:48:26,39.7257,-75.6171,Wilmington,DE,,Boxwood Rd,Accident on DE-141 at Exit 5 DE-62 Boxwood Rd.
2,2020-07-13 08:06:39,39.7996,-75.534,Wilmington,DE,3395,Coachman Rd,Accident on Shipley Rd at Windley Rd.
2,2020-11-25 06:55:00,39.6983,-75.6134,New Castle,DE,,Delaware Tpke S,Slow traffic on I-95 S - Delaware Tpke S from Exit 5A (I-95) to DE-58/Exit 4 (I-95) due to accident.
2,2020-09-07 09:55:23,39.6627,-75.5881,New Castle,DE,101,Centerpoint Blvd,Accident on Johnson Way at Centerpoint Blvd.
2,2018-10-24 07:12:40,39.4381,-75.7136,Middletown,DE,999,S Broad St,Accident on DE-71 Broad St at Lakeside Dr.
2,2020-05-01 17:00:58,39.7522,-75.5409,Wilmington,DE,1, Vandever Ave,At Lea Blvd - Accident.
2,2019-07-08 07:44:27,39.6787,-75.7359,Newark,DE,,Library Ave,Accident on DE-2 Library Ave at Wyoming Rd.
2,2020-04-14 17:14:12,39.6325,-75.6604,Bear,DE,1062, Pulaski Hwy,Between Walther Rd/Glendale Blvd and SR-1 - Accident.
4,2016-11-03 19:37:59,38.6844,-75.6182,Seaford,DE,7198, Hearns Pond Rd,Closed between Conrail Rd and Wesley Church Rd - Road closed due to accident.
4,2017-11-12 15:41:23,39.2197,-75.5745,Dover,DE,5148, N Dupont Hwy,Closed at Dover - Road closed due to accident.
2,2018-04-05 17:44:16,39.7459,-75.5588,Wilmington,DE,623, N Adams St,Between SR-52/Delaware Ave/Exit 7 and SR-202/Concord Pike/Exit 8 - Accident. Left lane blocked.
2,2020-04-02 12:30:23,39.4496,-75.7278,Middletown,DE,,Middletown Warwick Rd,Accident on DE-299 Main St at Middletown Warwick Rd.
2,2019-07-01 11:00:22,38.6343,-75.3502,Georgetown,DE,25192, Dupont Blvd,At Millsboro - Accident.
2,2020-11-22 05:39:00,39.8229,-75.4875,Wilmington,DE,,Naamans Rd,Incident on NAAMANS RD WB near MARSH RD Road closed. Take alternate route.
4,2017-10-07 11:49:53,38.8695,-75.3486,Lincoln,DE,8510, Coastal Hwy,Closed between Pine Haven Rd/Slaughter Beach Rd and Dewey Beach - Road closed due to accident.
4,2020-12-03 02:48:00,38.9107,-75.4718,Milford,DE,5898, Williamsville Rd,Incident on WILLIAMSVILLE RD near HOLLY HILL RD Road closed. Take alternate route.
2,2018-12-03 08:24:49,38.8066,-75.277,Milton,DE,13216, Coastal Hwy,Between Milton and Milford - Accident. Left lane blocked.
3,2016-08-13 09:43:51,39.6982,-75.6103,New Castle,DE,,Delaware Tpke,Accident on I-95 Northbound at Exit 5A-5B I-295.
4,2017-02-03 18:37:54,39.1276,-75.7103,Hartly,DE,2602, Halltown Rd,Closed at Proctors Purchase Rd - Road closed due to accident.
4,2016-04-25 12:57:48,39.564,-75.7578,Bear,DE,3, Pencader Ln,Closed between Pencader Ln and Frazer Rd - Road closed due to accident.
3,2016-07-30 03:01:18,38.5886,-75.5738,Laurel,DE,28639, Sussex Hwy,At Blades - Accident.
2,2020-08-27 14:57:05,39.6551,-75.6349,New Castle,DE,,Appleby Rd,Accident on Appleby Rd at Wilton Blvd.
2,2018-10-10 08:49:40,39.7581,-75.5362,Wilmington,DE,2798,N Washington St,Accident on 28th St at Washington St.
2,2020-05-09 12:35:56,39.6892,-75.6542,Newark,DE,,DE-7 N,At SR-58/Churchmans Rd - Accident.
2,2019-04-02 12:02:30,39.4525,-75.7176,Middletown,DE,310,N Broad St,Accident on DE-71 Broad St Northbound at DE-71 Broad St.
2,2018-05-14 06:04:08,39.8051,-75.4703,Claymont,DE,,Glenrock Dr,Accident on Glenrock Dr at Compass Dr.
4,2018-11-19 20:03:51,39.6071,-75.6522,New Castle,DE,,DE-1 S,Closed at US-13/SR-72/Exit 152 - Road closed due to accident.
2,2018-03-01 12:18:46,39.7695,-75.5877,Wilmington,DE,,Kennett Pike,Accident on Montchanin Rd at DE-52 Kennett Pike.
4,2016-07-18 09:10:35,39.1323,-75.5286,Dover,DE,1588, S Dupont Hwy,Closed at US-13-ALT/Lakeview Ave/Governrs Ave - Road closed due to accident.
2,2018-02-01 20:53:30,39.7113,-75.7111,Newark,DE,79,Polly Drummond Hill Rd,Accident on Polly Drummond Hill Rd at Old Coach Rd.
2,2018-05-14 05:50:56,39.7983,-75.4747,Claymont,DE,2699,Garfield Ave,Accident on Harvey Rd at Garfield Ave.
2,2019-04-18 08:33:09,39.7383,-75.6902,Wilmington,DE,4521,New Linden Hill Rd,Accident on New Linden Hill Rd at Riding Blvd.
4,2018-10-22 21:41:13,39.6379,-75.6517,Bear,DE,907, Pulaski Hwy,Closed at SR-1 - Road closed due to accident.
4,2019-07-28 03:23:35,39.7386,-75.5188,Wilmington,DE,,I-495 N,Closed at SR-3/Edgemoor Rd/Exit 4 - Road closed due to accident.
2,2018-07-09 19:05:13,39.7379,-75.5658,Wilmington,DE,699,Maryland Ave,Accident on DE-4 Maryland Ave at DE-4 Maryland Ave / Beech St.
2,2017-08-30 07:14:25,39.6483,-75.7349,Newark,DE,,Delaware Tpke,At SR-896/Exit 1 - Accident.
3,2019-02-09 22:45:41,39.6349,-75.6563,Bear,DE,1000, Pulaski Hwy,At SR-1 - Accident. Right lane blocked.
2,2020-01-14 06:52:01,39.5628,-75.7501,Bear,DE,140,Clear Creek Dr,Accident on Clear Creek Dr at Bohemia Rd.
2,2018-04-18 19:39:50,39.7226,-75.5917,Wilmington,DE,97,Middleboro Rd,Accident on Boxwood Rd at Middleboro Rd.
2,2019-01-10 08:47:18,39.7766,-75.5282,Wilmington,DE,4601,Talley Hill Ln,Accident on Talley Rd near Talley Hill Ln.
2,2020-12-15 23:04:00,39.66,-75.6549,Bear,DE,103, Bear Christiana Rd,Construction on DE-273 EB near DE-1 Right lane blocked. Expect delays.
2,2018-07-05 20:53:21,39.4435,-75.7391,Middletown,DE,,Middletown Warwick Rd,Accident on US-301 Middletown Warwick Rd at Merrimac Ave.
2,2019-04-01 07:04:35,39.6533,-75.7507,Newark,DE,981,S College Ave,Accident on DE-896 College Ave at Plymouth Dr.
2,2020-10-29 18:48:00,39.6471,-75.7397,Newark,DE,,Delaware Tpke N,Incident on I-95 NB near DE-896 Right lane blocked. Expect delays.
4,2020-05-11 20:50:59,39.7197,-75.5555,Wilmington,DE,,Rogers Rd,Closed between US-13-BR/S Market St and SR-9/New Castle Ave - Road closed due to accident.
2,2020-03-27 16:35:31,39.7468,-75.5576,Wilmington,DE,800,N Adams St,Accident on Adams St at 8th St. No recent updates.
