Severity,Date/Time,Latitude,Longitude,City,State,Number,Street,Description
2,2020-02-17 16:33:33,39.6504,-75.6236,New Castle,DE,321,Pulaski Hwy,Accident on Wilton Blvd at US-40 Pulaski Hwy.
2,2017-11-24 11:48:24,39.7569,-75.5176,Wilmington,DE,298,E Lea Blvd,Accident on Colony Blvd at Lea Blvd.
3,2020-02-15 00:17:26,38.7519,-75.5937,Bridgeville,DE,16654, Sussex Hwy,At US-13/US-13-BR/Sussex Hwy/S Main St - Accident.
2,2018-08-21 20:50:00,39.7485,-75.5509,Wilmington,DE,1100,N Washington St,Accident on DE-52 12th St at Washington St.
4,2018-10-29 01:55:09,39.6965,-75.5656,New Castle,DE,,Delaware Tpke,Closed at US-13/US-40/US-301/Dupont Hwy - Road closed due to accident.
2,2020-04-02 21:39:06,39.6347,-75.6572,Bear,DE,1113, Pulaski Hwy,At SR-7/Bear Christiana Rd - Accident traffic being directed around accident area.
3,2020-04-26 20:49:27,39.6615,-75.6515,New Castle,DE,493, Christiana Rd,At SR-37/Airport Rd - Accident. Two lanes blocked.
2,2019-01-04 07:23:15,39.7418,-75.5652,Wilmington,DE,1197,Chestnut St,Accident on Chestnut St at Harrison St.
4,2017-06-10 18:00:19,39.8088,-75.4535,Claymont,DE,,I-495 S,Closed at US-13/Philadelphia Pike/Exit 5 - Road closed due to accident.
4,2020-05-02 19:58:56,39.4627,-75.7214,Middletown,DE,,N Broad St,Closed between SR-299/W Main St and SR-896/Boyds Corner Rd - Road closed due to accident.
2,2018-02-06 06:38:51,39.7464,-75.5735,Wilmington,DE,1900,Lancaster Ave,Accident on DE-48 Lancaster Ave Eastbound at DE-2 Lincoln St.
2,2017-01-31 17:51:00,39.6668,-75.7743,Newark,DE,971,Elkton Rd,Accident on DE-896 Suburban Dr Northbound at DE-279 Elkton Rd.
2,2020-11-02 22:05:30,39.5849,-75.6616,Bear,DE,,DE-1 N,Slow traffic on US-13 from DE-1 (Bear) (US-13) to DE-1/Exit 96 (US-13) due to accident.
2,2018-05-08 19:10:21,39.4435,-75.7391,Middletown,DE,,Middletown Warwick Rd,Accident on Merrimac Ave at US-301 Middletown Warwick Rd.
3,2016-10-10 17:09:59,39.7172,-75.5517,Wilmington,DE,,I-495 S,Accident on I-495 Westbound at Exit 1 US-13 Heald St.
2,2019-07-11 12:39:50,39.7594,-75.559,Wilmington,DE,1612,Lovering Ave,Accident on Dupont St Southbound at Kentmere Dr.
2,2020-05-28 07:22:00,39.7511,-75.5375,Wilmington,DE,2199,Carter St,Accident on Carter St at 22nd St.
2,2017-08-24 13:18:06,39.7222,-75.6199,Wilmington,DE,199,Livingston Ave,Accident on Kiamensi Rd both ways from Stanley Ave to Livingston Ave.
2,2019-12-17 06:12:41,39.3712,-75.6599,Townsend,DE,4448,Dupont Pkwy,Accident on Blackbird Forest Rd near US-13 Dupont Pkwy.
2,2017-11-23 16:44:36,39.7434,-75.5586,Wilmington,DE,798,W 4th St,Accident on DE-9 4th St at Monroe St.
2,2020-06-12 13:42:33,38.6972,-75.0754,Dewey Beach,DE,98, Clayton St,At SR-1-ALT/Houston St/Clayton St - Accident. Left lane blocked.
4,2018-03-07 03:53:45,39.5035,-75.7126,Middletown,DE,4596, Summit Bridge Rd,Closed at SR-71/Broad St - Road closed due to accident.
2,2020-05-25 18:12:11,39.6483,-75.6309,New Castle,DE,,Pulaski Hwy,Between US-301/US-40/Pulaski Hwy and SR-273/Christiana Rd - Accident.
2,2020-09-17 08:09:43,39.747,-75.6837,Wilmington,DE,401,Woodstock Ln,Accident on Middleton Dr at Northpointe Blvd.
2,2020-01-31 08:49:06,39.682,-75.5887,New Castle,DE,,N Dupont Hwy,Accident on Dupont Hwy at DE-141 Basin Rd Exit 1A.
3,2018-11-23 04:20:07,39.8054,-75.4509,Claymont,DE,,I-495 N,Accident on I-495 Northbound before Exit 5 US-13 Philadelphia Pike.
3,2017-10-20 13:58:52,39.6699,-75.655,Newark,DE,,DE-1 N,At SR-273/Exit 162 - Accident. Left lane blocked. Right lane blocked.
2,2019-09-29 08:08:12,39.8003,-75.4838,Claymont,DE,,I-95 N,Between Harvey Rd/Exit 10 and I-495/SR-92/Naamans Rd/Exit 11 - Accident.
3,2020-04-01 12:30:30,39.6612,-75.7359,Newark,DE,834, S Chapel St,At SR-2/SR-4/E Chestnut Hill Rd - Overturned vehicle. Two lanes blocked.
4,2019-02-08 01:06:41,39.8196,-75.5478,Wilmington,DE,4808, Concord Pike,Closed at US-202/Concord Pike - Road closed due to accident.
2,2020-09-30 00:53:00,39.7362,-75.5633,Wilmington,DE,,I-95 S,Incident on I-95 SB near CHRISTINA RIVER BRG Road closed. Take alternate route.
3,2018-06-14 17:48:00,39.7076,-75.5975,New Castle,DE,,US-202 S,At I-295/US-202/SR-141/Exit 5 - Accident. Lane blocked.
4,2020-04-28 16:39:18,39.6468,-75.7495,Newark,DE,,Delaware Tpke,Between I-95 Newark Toll Plaza and SR-273/Exit 3 - Accident. Three lanes blocked.
4,2016-10-21 16:33:48,39.8009,-75.5028,Wilmington,DE,1396, Veale Rd,Closed at Veale Rd - Road closed due to accident.
4,2019-10-29 09:57:03,39.7051,-75.5504,New Castle,DE,3064, New Castle Ave,Closed at Rogers Rd/Sutton Ln - Road closed due to accident.
3,2018-06-13 13:11:06,39.8189,-75.45,Claymont,DE,,I-95 S,Two lanes blocked due to accident on I-95 Southbound between Exit 1 Chichester Ave and Exit 11 I-495.
2,2017-06-23 12:45:33,39.6471,-75.7397,Newark,DE,,Delaware Tpke,At Delaware House Service Area - Accident.
4,2016-08-02 01:41:04,38.7173,-75.149,Lewes,DE,19302, John J Williams Hwy,Closed between Mulberry Knoll Rd and Camp Arrowhead Rd - Road closed due to accident.
2,2020-05-13 10:08:02,39.7473,-75.5587,Wilmington,DE,726,N Jackson St,Accident on 8th St near Jackson St.
2,2018-02-15 21:37:32,39.751,-75.5848,Wilmington,DE,2,N Cleveland Ave,Accident on DE-48 Lancaster Ave near Cleveland Ave.
2,2020-11-26 02:51:00,39.2189,-75.5605,Dover,DE,,DE-1 N,Incident on DE-1 NB near DE-42 Right lane blocked. Expect delays.
3,2018-12-21 07:11:31,39.639,-75.7877,Newark,DE,,Delaware Tpke S,At Maryland/Delaware State Line - Accident. Right lane blocked.
2,2020-08-11 17:31:21,39.7523,-75.5372,Wilmington,DE,99,E 23rd St,Accident on 23rd St at Lamotte St.
4,2017-08-22 11:51:00,39.6638,-75.6278,New Castle,DE,205, Christiana Rd,Closed at Pleasant Pl - Road closed due to accident.
2,2020-12-12 01:42:00,38.7676,-75.2147,Milton,DE,15698, Coastal Hwy,Incident on DE-1 SB near CAVE NECK RD Drive with caution.
2,2019-11-13 07:23:23,39.5034,-75.6832,Middletown,DE,1199,Jamison Corner Rd,Accident on DE-896 Boyds Corner Rd at Jamison Corner Rd.
2,2018-12-24 08:15:18,39.4473,-75.7311,Middletown,DE,,S Ridge Ave,Accident on Ridge Ave at US-301 Middletown Warwick Rd.
2,2016-12-22 12:34:13,38.9318,-75.4914,Milford,DE,1899,Blairs Pond Rd,Accident on DE-14 Milford Harrington Hwy at Blairs Pond Rd.
2,2017-08-04 17:56:51,39.7059,-75.5877,New Castle,DE,,I-95 N,Between I-295/I-495/Exit 5 and SR-4/Maryland Ave/Exit 6 - Accident.
3,2017-01-09 17:23:05,39.6961,-75.5635,New Castle,DE,,US-40 E,Accident on I-295 Eastbound at US-40.
4,2016-04-21 17:20:43,39.7837,-75.6221,Wilmington,DE,4007, Centerville Rd,Closed at Barley Mill Rd - Road closed due to accident.
4,2020-05-31 23:14:12,39.2785,-75.5865,Smyrna,DE,,DE-1 N,Closed between SR-42/Fast Landing Rd and Kent/New Castle County Line - Road closed due to accident.
3,2020-04-25 14:10:17,39.7333,-75.5238,Wilmington,DE,,I-495 S,At Terminal Ave/Exit 2 - Accident.
2,2019-07-09 07:54:40,39.7443,-75.5475,Wilmington,DE,901,N King St,Accident on 9th St at US-13-BR King St.
2,2020-06-25 16:07:22,39.6327,-75.6606,Bear,DE,1139, Pulaski Hwy,At Walther Rd/Glendale Blvd - Accident.
4,2018-12-08 14:02:31,39.1557,-75.5931,Dover,DE,2856, Forrest Ave,Closed at Sharon Hill Rd - Road closed due to accident.
2,2020-02-10 07:40:21,39.7419,-75.5624,Wilmington,DE,4,S Jackson St,Accident on DE-48 Lancaster Ave Southbound at Jackson St.
2,2018-03-01 18:10:51,39.715,-75.6251,Wilmington,DE,1496,W Newport Pike,Accident on MacArthur Dr at DE-4 Newport Pike.
2,2018-10-25 08:45:16,39.7057,-75.6008,New Castle,DE,,I-95 S,Accident on I-95 Northbound at I-295 Exit 5.
4,2020-11-30 23:24:00,39.8182,-75.4514,Claymont,DE,,I-495 S,Incident on I-495 SB near NAAMANS RD Road closed. Take alternate route.
2,2020-12-12 02:37:00,38.7678,-75.2145,Lewes,DE,,Cave Neck Rd,Incident on DE-1 NB near CAVE NECK RD Drive with caution.
2,2019-07-29 07:44:14,39.7255,-75.6167,Wilmington,DE,1046,Boxwood Rd,Accident on Centerville Rd at DE-141 Exit 5.
2,2018-07-02 19:25:30,39.7478,-75.5452,Wilmington,DE,1298,N King St,Accident on 13th St at US-13 Bus King St.
3,2018-07-18 05:44:21,39.7002,-75.6517,Newark,DE,,DE-4,At SR-7/Stanton Christiana Rd - Accident.
4,2020-06-10 13:52:59,39.6587,-75.7516,Newark,DE,,Abbey Hall,Closed between SR-72/SR-4/S Chapel St and SR-2-BR/Elkton Rd - Road closed due to accident.
4,2019-08-10 15:06:20,38.6489,-75.0685,Rehoboth Beach,DE,22301, Coastal Hwy,Closed at Bethany Beach - Road closed due to accident.
2,2018-11-05 07:32:19,39.7694,-75.5031,Wilmington,DE,607,Philadelphia Pike,Accident on US-13 Bus Philadelphia Pike at DE-3 Washington Blvd.
3,2019-10-25 21:28:01,39.6954,-75.62,New Castle,DE,,Delaware Tpke S,Between SR-141/Exit 5 and SR-273/Exit 3 - Accident. Left lane blocked.
4,2018-07-23 22:54:01,39.7445,-75.6973,Wilmington,DE,5360, Limestone Rd,Closed at New Linden Hill Rd - Road closed due to accident.
4,2018-06-13 14:57:43,39.6471,-75.7515,Newark,DE,,Delaware Tpke,Between SR-896/Exit 1 and Delaware/Maryland State Line - Accident. Two lanes blocked.
4,2020-10-21 22:49:00,39.7327,-75.5244,Wilmington,DE,,I-495 S,Incident on I-495 SB near CHRISTINA RIVER BRG Road closed. Take alternate route.
2,2017-12-11 16:48:49,39.7392,-75.5895,Wilmington,DE,458,S Dupont Rd,Accident on DE-100 Dupont Rd at DE-2 Wilmington Ave.
2,2020-02-24 06:04:48,39.7388,-75.5659,Wilmington,DE,1100,Sycamore St,Accident on Sycamore St near Van Buren St.
4,2019-02-14 05:26:11,39.7663,-75.6236,Wilmington,DE,3204, Centerville Rd,Closed at Hillside Rd - Road closed due to accident.
2,2020-02-13 16:50:06,39.6811,-75.5533,New Castle,DE,65,Buttonwood Ave,Accident on Buttonwood Ave at Railroad Ave.
3,2020-05-22 21:45:44,38.7123,-75.1012,Rehoboth Beach,DE,,Coastal Hwy,Between SR-1-ALT/Houston St/Clayton St and SR-24/John J Williams Hwy - Accident.
1,2020-06-11 06:25:52,38.9334,-75.5657,Harrington,DE,,S Dupont Hwy,At Winkler Rd/Hopkins Cemetery Rd - Accident. Right lane blocked.
2,2020-10-16 17:21:30,39.7393,-75.5627,Wilmington,DE,,I-95 S,Stationary traffic on I-95 from DE-9/W 6th St/4th St/Exit 6 (I-95) to Exit 5A (I-95) due to accident.
2,2020-10-02 11:49:07,39.4435,-75.7391,Middletown,DE,,Middletown Warwick Rd,Accident on DE-15 Middletown Warwick Rd at Merrimac Ave.
2,2020-11-27 18:20:00,39.7283,-75.6493,Wilmington,DE,,Kirkwood Hwy,Incident on KIRKWOOD RD EB near FARRAND DR Drive with caution.
2,2017-01-12 10:28:49,39.7642,-75.5477,Wilmington,DE,,I-95 N,Between SR-202/Concord Pike/Exit 8 and SR-52/Delaware Ave/Exit 7 - Accident.
2,2017-10-06 22:39:32,39.7379,-75.5658,Wilmington,DE,699,Maryland Ave,Accident on DE-4 Maryland Ave at Beech St.
2,2018-03-27 15:40:46,39.789,-75.4736,Claymont,DE,1994,Philadelphia Pike,Accident on US-13 Bus Philadelphia Pike at Winding Ln.
2,2019-09-27 07:37:00,39.7303,-75.6677,Wilmington,DE,2602,Old Limestone Rd,Accident on Milltown Rd at Old Limestone Rd.
2,2018-03-28 14:46:51,39.6875,-75.692,Newark,DE,1,Trombone Ct,Accident on Harmony Crest Dr near Trombone Dr.
2,2018-11-21 23:14:19,39.7823,-75.5025,Wilmington,DE,,I-95 S,At SR-3/Marsh Rd/Exit 9 - Accident. Right lane blocked.
2,2017-12-01 16:01:55,39.738,-75.6228,Wilmington,DE,2,Greenbank Rd,Accident on Centerville Rd at Greenbank Rd.
4,2017-07-08 13:30:59,39.5004,-75.6493,Middletown,DE,2398, Dupont Pkwy,Closed at Port Penn Rd - Road closed due to accident. Accident.
2,2019-08-12 10:17:26,39.7391,-75.5482,Wilmington,DE,335,E 4th St,Accident on DE-9 4th St both ways at Poplar St.
4,2019-08-10 15:10:05,38.553,-75.0595,Bethany Beach,DE,30909, Coastal Hwy,Closed at Ocean View - Road closed due to accident.
2,2016-09-09 05:50:24,39.812,-75.457,Claymont,DE,,I-95 N,At I-495/SR-92/Naamans Rd/Exit 11 - Accident.
3,2019-02-15 12:51:43,39.677,-75.6695,Newark,DE,,Delaware Tpke S,Between SR-1/SR-7/Exit 4 and Delaware House Service Area - Accident. Left lane blocked.
2,2020-05-09 11:44:25,39.6892,-75.6542,Newark,DE,,DE-7 N,At SR-58/Churchmans Rd - Accident.
2,2019-04-24 07:53:43,39.3036,-75.6046,Smyrna,DE,201, E Mount Vernon St,Between SR-6/E Commerce St and Kent/New Castle County Line - Accident. Lane blocked.
2,2019-07-11 08:20:25,39.7278,-75.6563,Wilmington,DE,2111,Dombey Rd,Accident on Nicholby Dr at Dombey Rd.
4,2019-05-07 06:43:59,39.45,-75.6733,Middletown,DE,,Korean War Veterans Memorial Hwy N,Closed between SR-299/Exit 136 and Pole Bridge Rd/Exit 142 - Road closed due to accident.
2,2020-05-13 16:17:43,39.6261,-75.7729,Newark,DE,,Otts Chapel Rd,At Old Baltimore Pike - Accident.
2,2020-11-25 02:08:00,39.7179,-75.581,New Castle,DE,,I-95 S,Incident on I-95 SB near I-495 Expect delays.
4,2017-11-27 09:37:52,39.6085,-75.7154,Bear,DE,2498, Sunset Lake Rd,Closed at SR-72/S Chapel St/Sunset Lake Rd - Road closed due to accident.
2,2019-07-07 15:53:37,39.6991,-75.5845,New Castle,DE,,I-295 N,Between I-95 and I-295/I-495/Exit 5 - Accident.
2,2017-11-24 11:02:31,39.8217,-75.6542,Wilmington,DE,2201,Old Kennett Rd,Accident on Center Mill Rd at Old Kennett Rd.
3,2020-03-20 08:40:51,39.6705,-75.7106,Newark,DE,1, Pearson Dr,At SR-2/SR-72/S Chapel St - Accident traffic being directed around accident area.
4,2017-07-22 06:13:31,39.6081,-75.7153,Bear,DE,,Pulaski Hwy,Closed at Pulaski Hwy - Road closed due to accident.
2,2020-02-17 16:48:23,39.7541,-75.5766,Wilmington,DE,705,Blackshire Rd,Accident on Coverdale Rd at Blackshire Rd.
2,2019-05-11 15:59:01,39.6831,-75.5879,New Castle,DE,,N Dupont Hwy,Between SR-141/W Basin Rd and New Castle - Accident. Right lane blocked.
2,2019-11-25 06:41:54,39.7375,-75.5593,Wilmington,DE,792,S West St,Accident on West St at Justison St.
4,2018-05-07 05:05:00,39.7404,-75.5894,Wilmington,DE,,N Dupont Rd,Closed at SR-48/Lancaster Ave - Road closed due to accident. Roadwork.
2,2018-12-14 15:46:51,39.5623,-75.6636,Bear,DE,,DE-1 S,At Senator William V Roth Jr Brg - Accident.
2,2017-11-27 10:50:33,39.7463,-75.5658,Wilmington,DE,399,N Broom St,Accident on 4th St at Broom St.
2,2018-02-05 07:44:01,39.6266,-75.6845,Newark,DE,34,Auckland Dr,Accident on Laxford Dr at Auckland Dr.
2,2017-12-22 06:40:28,39.6646,-75.5875,New Castle,DE,,Centerpoint Blvd,Accident on DE-273 Frenchtown Rd at Centerpoint Blvd.
2,2018-08-16 05:53:05,39.4526,-75.6864,Middletown,DE,,Brick Mill Rd,Accident on DE-299 Middletown Odessa Rd at Brick Mill Rd.
2,2019-11-13 17:29:33,39.7508,-75.5494,Wilmington,DE,,N Washington St,Accident on 14th St at Washington St.
2,2019-04-04 08:14:06,39.7441,-75.5357,Wilmington,DE,999,E 13th St,Accident on US-13 Northeast Blvd at 13th St.
2,2019-10-14 12:49:22,39.6743,-75.7505,Newark,DE,2,E Park Pl,Accident on Park Pl Southbound at Academy St.
2,2019-07-19 08:27:07,39.8054,-75.5542,Wilmington,DE,590,Mount Lebanon Rd,Accident on Severn Rd at Mt Lebanon Rd.
2,2017-12-11 19:29:33,39.5876,-75.7405,Bear,DE,,Summit Bridge Rd,Accident on Porter Rd at US-301 Summit Bridge Rd.
2,2018-05-26 13:56:36,39.7693,-75.7213,Newark,DE,1298,Little Baltimore Rd,Accident on Star Rd at Little Baltimore Rd.
2,2020-03-11 19:49:35,39.7517,-75.6602,Wilmington,DE,,Millcreek Rd,Accident on Mill Creek Rd at Mckennans Church Rd.
2,2020-09-25 11:15:33,39.7384,-75.5516,Wilmington,DE,199,N King St,Accident on DE-48 2nd St at King St.
2,2019-08-13 07:40:35,39.7439,-75.5505,Wilmington,DE,124,W 8th St,Accident on 8th St at Orange St.
2,2019-04-24 08:10:05,39.748,-75.5426,Wilmington,DE,1402,N Walnut St,Accident on 14th St at US-13-BR Walnut St.
2,2019-06-28 07:14:57,39.7356,-75.5716,Wilmington,DE,1,7th Ave,Accident on DE-4 Maryland Ave at 7th Ave.
3,2019-01-30 07:40:55,39.6724,-75.6747,Newark,DE,,Delaware Tpke N,Accident on I-95 Northbound near Exits 3 3A 3B DE-273 Christiana Rd.
2,2020-01-15 10:25:59,39.643,-75.7012,Newark,DE,1,Joseph Dr,Accident on Joseph Dr between Salem Church Rd and Jaymar Blvd.
2,2018-01-31 18:02:14,39.796,-75.4658,Claymont,DE,2898,Philadelphia Pike,Accident on US-13 Bus Philadelphia Pike at Princeton Ave.
2,2020-05-15 07:28:26,39.7401,-75.5504,Wilmington,DE,99,E 4th St,Accident on DE-9 4th St at US-13-BR King St.
4,2017-12-06 21:49:07,39.7121,-75.6085,Wilmington,DE,,DE-141 S,Closed at SR-4/Exit 4 - Road closed due to accident.
2,2017-09-26 16:47:28,39.7106,-75.563,New Castle,DE,,N Dupont Hwy,Accident on US-13 Dupont Hwy Northbound at Hessler Blvd.
2,2017-08-25 18:16:37,39.7429,-75.5895,Wilmington,DE,106,N Dupont Rd,Accident on DE-100 Dupont Rd both ways between Cleveland Ave and Boulevard Rd.
2,2017-11-22 17:50:39,39.7216,-75.5767,Wilmington,DE,,US-202 S,At I-295/I-495/Exit 5 - Accident. Right lane blocked.
3,2020-06-12 10:09:48,39.812,-75.457,Claymont,DE,,I-95 N,Between Harvey Rd/Exit 10 and Chichester Ave/Exit 1 - Accident. Right lane blocked. Roadwork.
2,2020-02-03 22:56:40,39.7447,-75.5669,Wilmington,DE,200,N Broom St,Accident on DE-48 2nd St at Broom St.
3,2019-04-09 08:27:20,39.7505,-75.5044,Wilmington,DE,,I-495 N,Accident on I-495 Northbound at Exits 4 4B DE-3 Edgemoor Rd.
2,2017-10-24 21:20:22,39.7283,-75.633,Wilmington,DE,1800,Newport Rd,Accident on Newport Rd at Kiamensi Ave.
4,2018-10-22 21:41:13,39.6365,-75.6536,Bear,DE,996, Pulaski Hwy,Closed at SR-1 - Road closed due to accident.
3,2017-05-26 18:13:18,39.6952,-75.6201,New Castle,DE,,Delaware Tpke,At SR-141/Exit 5 - Accident.
2,2017-05-11 09:06:57,39.663,-75.6391,New Castle,DE,,Christiana Rd,Accident on Airport Rd at DE-273 Christiana Rd.
2,2018-10-09 08:36:12,39.7588,-75.6043,Wilmington,DE,,Lancaster Pike,Accident on Lancaster Pike at DE-141 Centre Rd.
2,2019-11-22 13:11:28,39.7927,-75.4695,Claymont,DE,2498,Philadelphia Pike,Accident on US-13-BR Philadelphia Pike Northbound at Riverview Ave.
2,2016-12-02 08:51:45,39.2197,-75.5745,Dover,DE,5148, N Dupont Hwy,At Dover - Accident.
2,2020-11-25 02:08:00,39.7179,-75.581,New Castle,DE,,I-95 S,Incident on I-95 SB near I-495 Expect delays.
4,2020-05-11 18:49:42,39.7114,-75.5483,New Castle,DE,2, Sutton Ln,Closed between SR-9/New Castle Ave and US-13-BR/S Market St - Road closed due to accident.
4,2019-02-22 19:58:29,39.8022,-75.5051,Wilmington,DE,2198, Silverside Rd,Closed at Marsh Rd - Road closed due to accident.
4,2020-03-20 09:10:40,39.6814,-75.6623,Newark,DE,,Delaware Tpke,Closed between SR-273/Exit 3 and SR-141/Exit 5 - Road closed due to accident.
2,2020-10-08 02:51:00,39.53,-75.65,Middletown,DE,,DE-1 S,Incident on DE-1 SB near BIDDLES TOLL PLAZA Expect long delays.
2,2019-09-17 18:10:09,39.4435,-75.7391,Middletown,DE,,Middletown Warwick Rd,Lane blocked due to accident on US-301 Middletown Warwick Rd at Merrimac Ave.
2,2018-08-23 07:46:37,39.744,-75.5652,Wilmington,DE,1300,W 2nd St,Accident on Franklin St at DE-48 2nd St.
4,2020-06-13 12:50:20,39.7172,-75.5574,Wilmington,DE,,I-495 S,Closed between Terminal Ave/Exit 2 and I-95/I-295 - Road closed due to accident.
2,2020-05-26 15:13:27,39.3245,-75.6214,Smyrna,DE,5436, Dupont Pkwy,At SR-1 (Exit 119) - Accident. Left lane blocked.
2,2018-03-27 14:08:40,39.6082,-75.7154,Bear,DE,,Pulaski Hwy,Queueing traffic due to accident on US-40 Pulaski Hwy at Sunset Lake Rd.
2,2018-06-22 07:08:30,39.7384,-75.5492,Wilmington,DE,183,E Front St,Accident on US-13 Bus Walnut St at Front St.
2,2019-07-11 07:22:24,39.7464,-75.5312,Wilmington,DE,,Northeast Blvd,Accident on US-13 Northeast Blvd at 22nd St.
2,2020-03-04 16:47:02,39.7056,-75.5676,New Castle,DE,2362,N Dupont Hwy,Accident on US-13 Dupont Hwy Northbound at US-13 Dupont Hwy.
2,2019-10-21 19:34:36,39.7252,-75.683,Wilmington,DE,2873,Skyline Dr,Accident on Skyline Dr at Barnsley Rd.
4,2018-02-14 09:09:18,39.8068,-75.5875,Wilmington,DE,2213, Montchanin Rd,Closed at SR-100/Montchanin Rd/Adams Dam Rd - Road closed due to accident.
2,2020-09-25 18:35:00,39.2042,-75.5421,Dover,DE,,DE-1 S,Incident on DE-1 SB near EXIT 104 Right lane blocked. Expect delays.
2,2019-12-04 05:55:46,39.7047,-75.5892,New Castle,DE,,Delaware Tpke S,Accident on entry ramp to I-95 Eastbound from I-295 Westbound.
2,2017-09-27 22:10:55,39.7388,-75.5931,Wilmington,DE,100,Ohio Ave,Accident on Ohio Ave at DE-2 Kirkwood Hwy.
2,2020-07-07 11:30:44,39.7511,-75.5375,Wilmington,DE,2199,Carter St,Accident on Carter St at 22nd St.
2,2020-08-24 07:22:03,39.6431,-75.6235,New Castle,DE,102,Schaffer Blvd,Accident on Schafer Blvd at Hodgkins Pl. No recent updates.
2,2020-10-22 13:52:00,38.6015,-75.2563,Millsboro,DE,28899, John J Williams Hwy,Stationary traffic on DE-24 from Gull Point Rd (John J Williams Hwy/DE-24) to DE-30/Gravel Hill Rd (John J Williams Hwy/DE-24) due to accident.
2,2020-09-30 06:08:00,39.6654,-75.6045,New Castle,DE,,S Dupont Hwy,Incident on US-13 SB near DE-273 Road closed. Take alternate route.
2,2018-12-12 10:16:38,39.2066,-75.565,Dover,DE,1,Dyke Branch Rd,Accident on US-13 Dupont Hwy both ways at Fork Branch Rd.
2,2020-10-01 12:39:00.000000000,39.727,-75.6517,Wilmington,DE,4388, Kirkwood Hwy,Stationary traffic on DE-2 from DE-7/Limestone Rd (Kirkwood Hwy/DE-2) to Duncan Rd (Kirkwood Hwy/DE-2) due to accident.
2,2018-05-04 20:46:51,39.7506,-75.5839,Wilmington,DE,1,S Gray Ave,Accident on Gray Ave at DE-48 Lancaster Ave.
3,2018-12-24 08:50:50,39.7507,-75.5557,Wilmington,DE,,I-95 S,Accident on I-95 Southbound from Exits 8 8A-8B US-202 Concord Pike to Exits 7 7A 7B Adams St.
4,2016-06-30 05:13:02,38.6034,-75.2306,Millsboro,DE,28170, John J Williams Hwy,Closed between Millsboro and William St Rd - Road closed due to accident.
4,2020-03-30 10:56:04,39.7308,-75.6668,Wilmington,DE,,Milltown Rd,Closed between SR-41/Newport Gap Pike and SR-2/Robert W Kirkwood Hwy - Road closed due to accident.
2,2017-11-23 11:04:53,39.6541,-75.6529,Bear,DE,900,Christiana Mdws,Accident on Christiana Mdws near Bear Christiana Rd.
2,2020-12-09 01:34:00,39.7621,-75.5501,Wilmington,DE,,I-95 N,Incident on I-95 SB near BRANDYWINE RIVER BRG Right lane blocked. Expect delays.
2,2020-04-21 10:51:25,39.7432,-75.551,Wilmington,DE,704,N Orange St,Accident on Orange St near 7th St.
2,2019-01-17 07:07:52,39.7478,-75.6355,Wilmington,DE,101,Spice Mill Ln,Accident on DE-34 Faulkland Rd at Spice Mill Ln.
2,2020-08-13 06:58:56,39.6756,-75.7232,Newark,DE,20,Greenbridge Dr,Accident on Greenbridge Dr at Erskine Ct.
2,2018-08-22 17:39:59,39.74,-75.5504,Wilmington,DE,100,E 4th St,Accident on DE-9 4th St at US-13 Bus King St.
2,2020-11-25 10:42:56,39.7458,-75.5484,Wilmington,DE,101,W 10th St,Accident on 10th St at Shipley St.
2,2019-12-09 08:48:00,39.7044,-75.5883,New Castle,DE,,I-95 N,Between I-295/US-202/SR-141/Exit 5 and SR-4/Maryland Ave/Exit 6 - Accident. Two lanes blocked.
2,2019-11-13 19:10:22,39.7144,-75.6655,Wilmington,DE,5234,Old Capitol Trl,Accident on Old Capitol Trl at Telegraph Rd.
2,2018-03-22 15:53:18,39.7455,-75.5478,Wilmington,DE,1000,N Market St,Accident on 10th St at Market St.
2,2018-02-07 20:57:52,39.7941,-75.4679,Claymont,DE,2698,Philadelphia Pike,Accident on US-13 Bus Philadelphia Pike at Harvey Rd.
2,2017-05-01 17:49:49,39.68,-75.6572,Newark,DE,,DE-7 S,At Exit 165A - Accident.
2,2020-12-08 16:45:00,39.7543,-75.5532,Wilmington,DE,,I-95 S,Incident on I-95 SB near DELAWARE AVE SOUTH Right lane blocked. Expect delays.
3,2020-04-06 13:27:31,39.1131,-75.5376,Camden Wyoming,DE,,S Dupont Hwy,At Walnut Shade Rd - Accident traffic being directed around accident area.
2,2020-10-10 18:49:00,39.4177,-75.7052,Townsend,DE,101, Green Giant Rd,Incident on DE-71 SB near KARINS BLVD Road closed. Take alternate route.
2,2020-12-24 12:49:00,39.0859,-75.5503,Dover,DE,4982, S Dupont Hwy,Incident on US-13 SB near LONGACRE DR Right lane blocked. Expect delays.
3,2017-07-14 16:33:08,39.8026,-75.4505,Claymont,DE,,I-495 N,Accident on I-495 Northbound at Exit 5 US-13 Philadelphia Pike.
2,2020-12-16 21:09:30,39.7865,-75.4698,Claymont,DE,,I-495 N,Slow traffic on I-495 N from US-13/Exit 4 (I-495) to I-95 (I-495) due to accident.
2,2020-10-18 19:43:00,39.4096,-75.6619,Townsend,DE,,DE-1 N,Incident on DE-1 NB near FIELDSBORO RD Expect delays.
4,2018-12-07 20:22:00,38.9276,-75.5122,Harrington,DE,4204, Milford Harrington Hwy,Closed between Houston and US-13/S Dupont Hwy - Road closed due to accident.
2,2020-12-14 15:47:00,39.5255,-75.6506,Middletown,DE,,DE-1 N,Stationary traffic on Korean War Veterans Memorial Hwy N - DE-1 N from Biddles Corner Toll Plaza (DE-1) to US-13/DE-72/Exit 152 (DE-1) due to accident.
2,2020-03-05 08:37:46,39.7416,-75.5543,Wilmington,DE,398,N West St,Accident on DE-9 4th St near West St.
4,2020-04-25 12:05:39,39.636,-75.7436,Newark,DE,1017, Old Baltimore Pike,Closed between I-95/Delaware Tpke/J F K Meml Hwy and US-301/US-40/Pulaski Hwy - Road closed due to accident.
4,2019-03-22 21:30:12,38.8377,-75.3174,Milton,DE,10801, Coastal Hwy,Closed at Truitt Rd - Road closed due to accident.
2,2020-02-20 11:36:03,39.7398,-75.5954,Wilmington,DE,804,New Rd,Accident on New Rd near Gamble Ave.
4,2020-11-22 05:39:00,39.8227,-75.4876,Wilmington,DE,1700, Naamans Rd,Incident on NAAMANS RD EB near MARSH RD Road closed. Take alternate route.
4,2016-10-29 20:49:06,38.6862,-75.6374,Seaford,DE,21098, Wesley Church Rd,Closed between Hearns Pond Rd and Atlanta Rd - Road closed due to accident.
2,2017-09-12 17:17:25,39.7527,-75.6245,Wilmington,DE,2701,Centerville Rd,Accident on Centerville Rd at Turnstone Dr.
4,2020-11-06 07:12:00,39.332,-75.6287,Smyrna,DE,,DE-1 S,Incident on DE-1 SB near EXIT 119 Road closed. Take alternate route.
4,2020-06-24 05:13:12,39.6545,-75.6168,New Castle,DE,27, Pulaski Hwy,Closed between SR-273/Frenchtown Rd/Christiana Rd and SR-1 Northern Split/Exit 96 - Road closed due to accident.
4,2017-04-24 17:05:08,38.7079,-75.5473,Bridgeville,DE,10716, Seashore Hwy,Closed between Ellendale and Milford - Road closed due to accident.
2,2020-02-27 07:39:09,39.4431,-75.715,Middletown,DE,701,S Broad St,Accident on DE-71 Broad St at Berkman St.
4,2016-06-12 02:57:01,39.718,-75.6118,Wilmington,DE,,DE-141 S,Closed at SR-4/Exit 4 - Road closed due to accident.
4,2020-04-22 20:19:36,39.812,-75.457,Claymont,DE,,I-95 N,Closed between Harvey Rd/Exit 10 and Chichester Ave/Exit 1 - Road closed due to accident.
2,2017-09-28 15:44:22,39.7238,-75.6582,Wilmington,DE,,Limestone Rd,Accident on DE-2 Kirkwood Hwy at DE-7 Limestone Rd.
4,2020-06-09 23:57:02,39.1316,-75.4935,Dover,DE,,DE-1 S,Closed at Lebanon Rd/13th St - Road closed due to accident.
