Severity,Date/Time,Latitude,Longitude,City,State,Number,Street,Description
2,2016-06-24 14:47:04,39.6654,-75.6034,New Castle,DE,,Frenchtown Rd,At Centerpoint Blvd - Accident.
2,2017-07-17 10:35:09,39.7338,-75.5519,Wilmington,DE,,A St,Accident on US-13 Bus Walnut St at A St.
3,2020-03-29 21:01:21,39.665,-75.6044,New Castle,DE,102, S Dupont Hwy,At SR-273/Frenchtown Rd/Christiana Rd - Accident traffic being directed around accident area.
2,2019-01-29 08:15:55,39.7459,-75.5554,Wilmington,DE,701,W 8th St,Accident on Madison St at 8th St.
2,2018-06-15 17:07:26,39.7232,-75.5963,Wilmington,DE,798,Overland Ave,Accident on DE-62 Boxwood Rd at Overland Ave.
2,2017-08-25 07:07:27,39.6709,-75.6388,New Castle,DE,38,Dunsinane Dr,Accident on Dunsinane Dr at Charring Ln.
4,2020-05-25 22:20:26,39.6814,-75.6623,Newark,DE,,Delaware Tpke,Between SR-273/Exit 3 and SR-58/Exit 4 - Accident.
2,2018-02-08 12:45:16,39.4526,-75.6864,Middletown,DE,,Brick Mill Rd,Accident on DE-299 Middletown Odessa Rd near Brick Mill Rd.
2,2017-11-28 21:33:22,39.6878,-75.5834,New Castle,DE,94, E Franklin Ave,At New Castle - Accident. Right lane blocked.
3,2019-10-10 12:39:16,39.6958,-75.5413,New Castle,DE,,I-295 S,Right lane blocked due to accident on I-295 Northbound near DE-9 New Castle Ave / Cherry Ln.
4,2020-11-19 15:21:00,39.4835,-75.7194,Middletown,DE,4951, Summit Bridge Rd,Incident on DE-71 NB near CONNECTOR RD Road closed. Take alternate route.
2,2020-11-24 16:43:00,39.742,-75.6927,Wilmington,DE,4800, Limestone Rd,Incident on LIMESTONE RD SB near STONEY BATTER RD Drive with caution.
4,2020-05-11 05:04:31,39.7332,-75.5237,Wilmington,DE,,I-495 N,Closed between Terminal Ave/Exit 2 and SR-3/Edgemoor Rd/Exit 4 - Road closed due to accident.
4,2018-07-11 16:34:36,39.086,-75.4572,Dover AFB,DE,,Bay Rd,Closed between SR-9/Kitts Hummock Rd and Harrington - Road closed due to accident.
3,2018-12-10 17:34:03,39.6471,-75.7423,Newark,DE,,Delaware Tpke,At SR-896/Exit 1 - Accident. Right lane blocked.
2,2018-12-11 07:16:57,39.6332,-75.6595,Bear,DE,,Pulaski Hwy,Accident on US-40 Pulaski Hwy at DE-7 Bear Corbitt Rd.
2,2017-12-01 15:46:09,39.8029,-75.4572,Claymont,DE,3534,Philadelphia Pike,Accident on US-13 Philadelphia Pike at Manor Ave.
2,2017-09-18 18:09:12,39.749,-75.5724,Wilmington,DE,1950,W 4th St,Accident on 4th St at DE-2 Lincoln St.
2,2018-12-19 07:34:47,39.701,-75.6997,Newark,DE,,Capitol Trl,Accident on DE-2 Capitol Trl at Harmony Rd.
2,2018-11-07 13:47:14,39.6878,-75.5834,New Castle,DE,,E Franklin Ave,At I-295 - Accident. Right lane blocked.
3,2017-04-12 17:13:59,39.6952,-75.6201,New Castle,DE,,Delaware Tpke,At SR-141/Exit 5 - Accident.
2,2017-09-19 14:09:49,39.7592,-75.5255,Wilmington,DE,3700,N Market St,Accident on 37th St both ways from Pine St to US-13 Bus Market St.
2,2019-07-09 09:19:33,39.5663,-75.6544,New Castle,DE,,S Dupont Hwy,Accident on Highpointe Dr both ways at US-13 Dupont Hwy.
4,2018-12-20 12:37:49,39.7686,-75.5364,Wilmington,DE,,I-95 S,Closed between SR-3/Marsh Rd/Exit 9 and I-295/I-495/Exit 5 - Road closed due to accident. Two lanes blocked. Police activity ongoing.
2,2019-11-27 08:56:41,39.7455,-75.5613,Wilmington,DE,1089,W 5th St,Accident on Van Buren St near 5th St.
2,2018-12-21 08:39:35,39.7487,-75.5555,Wilmington,DE,808,W 10th St,Accident on 10th St at Trenton Pl.
3,2018-11-15 07:43:19,39.6979,-75.5732,New Castle,DE,,N Dupont Hwy,Between I-295 and New Castle - Accident. Right lane blocked.
2,2020-06-19 19:50:03,39.7532,-75.5477,Wilmington,DE,1454, N Washington St,At SR-202/Concord Ave - Accident.
2,2018-04-21 13:08:32,39.7521,-75.5409,Wilmington,DE,2106,N Market St,Accident on US-13 Bus Market St at Vandever Ave.
2,2019-10-18 08:24:21,39.6839,-75.5702,New Castle,DE,1,S Lunenburg Dr,Accident on Lunenburg Dr in Jefferson Farms.
2,2019-08-19 08:29:18,39.7529,-75.5577,Wilmington,DE,1201,Pennsylvania Ave,Accident on DE-52 Pennsylvania Ave near Harrison St.
2,2018-10-15 07:48:55,39.6951,-75.694,Newark,DE,499,N Harmony Rd,Accident on Harmony Rd at Greenridge Rd.
2,2020-08-07 10:48:56,39.7406,-75.5591,Wilmington,DE,1,Maryland Ave,Accident on Madison St at DE-48 Martin Luther King Blvd.
2,2020-09-12 17:40:00,39.6887,-75.6418,New Castle,DE,,Delaware Tpke S,Incident on I-95 SB near CHURCHMANS XING Road closed. Take alternate route.
2,2016-07-07 11:38:02,39.7183,-75.6052,Wilmington,DE,400,1st Ave,Accident on 1st Ave at Cedar St.
2,2018-12-27 12:26:28,39.7391,-75.5487,Wilmington,DE,302,N Walnut St,Accident on US-13-BR Walnut St both ways at DE-9 4th St.
2,2020-02-18 08:43:08,39.7359,-75.6942,Wilmington,DE,4000,Skyline Dr,Accident on Skyline Dr at Pike Creek Blvd.
2,2019-10-15 18:30:37,39.6894,-75.6385,New Castle,DE,,Delaware Tpke N,At SR-141/Exit 5 - Accident.
2,2020-04-28 18:39:40,39.5172,-75.5792,Port Penn,DE,1, W Market St,At Bayview Rd - Accident.
2,2016-11-22 13:02:54,39.7076,-75.5975,New Castle,DE,,US-202 S,Between I-295/I-495/Exit 5 and SR-58/Exit 4 - Accident.
2,2020-07-20 07:46:11,39.7621,-75.6401,Wilmington,DE,402,Hercules Rd,Accident on Hercules Rd at DE-48 Lancaster Pike.
3,2020-06-09 18:24:42,39.6814,-75.6623,Newark,DE,,Delaware Tpke,At SR-1/SR-7/Exit 4 - Accident. Two lanes blocked.
4,2016-04-10 19:24:56,39.7234,-75.6579,Wilmington,DE,2098, Limestone Rd,Closed between SR-2/Robert W Kirkwood Hwy and SR-4/Main St/Mitch Rd - Road closed due to accident.
2,2018-11-09 08:24:06,39.7561,-75.5678,Wilmington,DE,1915,Pennsylvania Ave,Accident on Union St at DE-52 Pennsylvania Ave.
2,2019-11-11 13:13:31,39.7539,-75.5683,Wilmington,DE,1001,N Lincoln St,Accident on DE-2 Lincoln St Northbound at 10th St.
2,2019-07-15 09:51:32,39.7554,-75.5596,Wilmington,DE,1398,Delaware Ave,Accident on Delaware Ave at Broom St.
2,2020-07-13 05:06:17,39.809,-75.4578,Claymont,DE,116,Darley Rd,Accident on Darley Rd at Lenape Way.
3,2020-04-29 17:20:34,39.3322,-75.6286,Smyrna,DE,,DE-1 N,Between Kent/New Castle County Line and SR-299/Exit 136 - Accident traffic being directed around accident area.
2,2020-10-06 22:46:00,39.6983,-75.6134,New Castle,DE,,Delaware Tpke S,Construction on I-95 SB near AIRPORT RD Drive with caution.
2,2019-09-16 08:05:27,39.7855,-75.5463,Wilmington,DE,,Powder Mill Rd,Accident on US-202 Concord Pike at DE-141 Powder Mill Rd.
4,2020-05-19 08:07:17,39.7059,-75.5877,New Castle,DE,,I-95 N,Closed between I-295/US-202/SR-141/Exit 5 and SR-4/Maryland Ave/Exit 6 - Road closed due to accident.
3,2020-04-18 20:37:39,39.8009,-75.4599,Claymont,DE,3409, Philadelphia Pike,At Bellevue Rd - Accident traffic being directed around accident area.
2,2018-12-16 20:19:00,39.6641,-75.6541,Newark,DE,,DE-1 S,At SR-1 - Accident. Left lane blocked.
2,2018-01-16 18:22:08,39.7544,-75.6494,Wilmington,DE,801, Hercules Rd,At Hayes Ct - Accident.
2,2018-05-17 16:34:24,39.4517,-75.6916,Middletown,DE,560,Middletown Odessa Rd,Accident on Dove Run Blvd at DE-299 Middletown Odessa Rd.
3,2018-12-02 11:22:34,39.8033,-75.4799,Claymont,DE,1065, Harvey Rd,At Harvey Rd/Exit 10 - Accident. Right lane blocked.
2,2016-11-03 09:04:58,39.3137,-75.6133,Smyrna,DE,5738, Dupont Pkwy,At Paddock Rd - Accident.
2,2018-10-29 00:58:09,39.6984,-75.6008,New Castle,DE,,Airport Rd,Between SR-37/Commons Blvd and I-295/I-495/Exit 5 - Accident. Right lane blocked.
2,2020-09-11 11:23:22,39.7536,-75.5377,Wilmington,DE,1,W 24th St,Accident on 24th St at US-13-BR Market St.
2,2020-05-06 11:54:18,39.6187,-75.6946,Bear,DE,,Porter Rd,At Walther Rd/Glendale Blvd - Accident.
4,2019-09-16 11:34:26,39.7229,-75.594,Wilmington,DE,,S Maryland Ave,Closed between SR-62/Boxwood Rd/Middleboro Rd and Hayden Ave - Road closed due to accident.
4,2020-09-11 02:21:00,38.5131,-75.1538,Frankford,DE,34379, Roxana Rd,Incident on ROXANA RD near POWELL FARM RD Road closed. Take alternate route.
2,2019-08-12 08:46:54,39.742,-75.5361,Wilmington,DE,983,E 11th St,Accident on Thatcher St at 11th St.
2,2020-06-04 08:57:56,39.6544,-75.6165,New Castle,DE,234, S Dupont Hwy,At US-13/S Dupont Pky - Accident. Right lane blocked.
2,2018-11-26 06:01:13,39.739,-75.603,Wilmington,DE,,Beech Ave,Accident on DE-2 Kirkwood Hwy at Beech Ave.
4,2018-01-10 05:01:06,39.5489,-75.7303,Bear,DE,3627, Red Lion Rd,Closed at Summit Pointe Cir - Road closed due to accident.
4,2019-02-27 10:00:43,39.6845,-75.6528,Newark,DE,,Delaware Tpke,Ramp closed to Stanton Christiana Rd - Road closed due to accident.
3,2020-03-25 08:35:31,39.7358,-75.5636,Wilmington,DE,,I-95 S,Between SR-9/4th St/Exit 6 and I-295/I-495/Exit 5 - Accident. Two lanes blocked.
3,2019-08-11 23:05:25,38.7326,-75.1351,Rehoboth Beach,DE,18846, Coastal Hwy,Between SR-1/Coastal Hwy and Milford - Accident. Roadway reduced to 1 lane.
4,2019-04-03 05:49:31,39.6931,-75.6528,Newark,DE,,DE-7 N,Between SR-7 and Stanton Christiana Rd - Accident. Lane blocked.
4,2016-10-18 15:00:49,39.3092,-75.5967,Smyrna,DE,,DE-1 S,Closed between US-13/Exit 119 and US-13/S Dupont Blvd/Exit 114 - Road closed due to accident.
2,2018-08-29 08:38:45,39.7712,-75.4839,Wilmington,DE,5973,Governor Printz Blvd,Accident on US-13 Governor Printz Blvd at Bellevue Rd.
3,2018-10-03 03:01:43,39.7463,-75.5588,Wilmington,DE,,US-202 S,At SR-9/4th St/Exit 6 - Accident.
3,2020-06-16 19:46:10,39.6415,-75.6034,New Castle,DE,591, Llangollen Blvd,At SR-72/Wrangle Hill Rd - Accident traffic being directed around accident area.
2,2020-10-11 04:51:30.000000000,39.4958,-75.6463,Middletown,DE,,DE-1 N,Stationary traffic on DE-1 from DE-299/Exit 136 (DE-1) to Pole Bridge Rd/Exit 142 (DE-1) due to accident.
3,2020-04-24 08:02:24,39.812,-75.4542,Claymont,DE,,I-495 N,At I-95 - Accident. Right lane blocked.
4,2019-04-18 14:42:51,39.8194,-75.5478,Wilmington,DE,4715, Concord Pike,Closed at SR-92/Naamans Rd - Road closed due to accident.
2,2018-02-23 16:31:24,39.7651,-75.5385,Wilmington,DE,998,W 30th St,Accident on Miller Rd at Broom St.
3,2018-07-03 21:12:56,39.7172,-75.5545,Wilmington,DE,,I-495 S,At US-13/Dupont Pky/Exit 1 - Accident. Left lane blocked.
2,2019-06-06 08:33:05,39.701,-75.6997,Newark,DE,,Capitol Trl,Accident on Harmony Rd at DE-2 Capitol Trl.
4,2020-03-18 22:09:31,39.6049,-75.7449,Newark,DE,2400, Pulaski Hwy,Closed at US-301/SR-896/Summit Bridge Rd - Road closed due to accident.
2,2020-10-17 00:53:00,39.7003,-75.5522,New Castle,DE,,New Castle Ave,Incident on NEW CASTLE AVE SB near MEMORIAL DR Road closed. Take alternate route.
2,2020-05-09 12:08:22,39.6892,-75.6542,Newark,DE,,DE-7 N,At SR-58/Churchmans Rd - Accident.
3,2016-12-28 11:55:35,39.6511,-75.7201,Newark,DE,,Delaware Tpke,Accident on I-95 Northbound at Exits 1 1A 1B DE-896 College Ave.
2,2018-08-16 10:49:30,39.6059,-75.7413,Newark,DE,,Pulaski Hwy,Accident on DE-896 College Ave Northbound at US-40 Pulaski Hwy.
2,2018-05-14 20:44:51,39.6438,-75.6252,New Castle,DE,,Schaffer Blvd,Accident on US-13 Dupont Hwy at Schaffer Blvd.
2,2020-05-21 14:51:08,39.6081,-75.7153,Bear,DE,,Pulaski Hwy,At SR-72/Wrangle Hill Rd/Sunset Lke Rd - Accident. Right lane blocked.
3,2018-12-10 16:22:02,39.5856,-75.6844,Bear,DE,,Red Lion Rd,At Delaware City - Accident. Blocked ahead.
4,2019-01-04 17:46:00,38.9229,-75.5521,Harrington,DE,6413, Milford Harrington Hwy,Closed at Butler Rd - Road closed due to accident.
2,2020-10-21 22:49:00,39.7272,-75.5312,Wilmington,DE,,I-495 S,Incident on I-495 SB near CHRISTINA RIVER BRG Road closed. Take alternate route.
2,2018-01-15 06:01:08,39.7628,-75.5729,Wilmington,DE,2499,W 17th St,Accident on Greenhill Ave at 17th St.
2,2020-11-30 23:17:00.000000000,39.8121,-75.4554,Claymont,DE,,I-495 S,Incident on I-495 SB near I-95 Right lane blocked. Expect delays.
3,2017-12-18 17:14:09,39.7139,-75.5839,New Castle,DE,,I-495 S,At I-95/I-295 - Accident.
3,2016-07-30 06:38:48,38.5886,-75.5738,Laurel,DE,28639, Sussex Hwy,At Blades - Accident.
2,2020-07-15 10:00:49,39.7498,-75.5696,Wilmington,DE,604,N Scott St,Accident on 6th St at Scott St.
2,2019-07-10 07:07:10,39.7784,-75.7023,Hockessin,DE,89,Nathalie Dr,Accident on Nathalie Ct at Robin Ct.
2,2019-10-17 18:30:51,39.4805,-75.7202,Middletown,DE,5044,Summit Bridge Rd,Accident on DE-71 Summit Bridge Rd at Marl Pit Rd.
2,2020-09-28 11:39:39,39.7476,-75.534,Wilmington,DE,2085,N Locust St,Accident on Vandever Ave at Locust St.
2,2020-05-25 18:12:11,39.6624,-75.6419,New Castle,DE,4, Appleby Rd,At US-301/US-40/Pulaski Hwy - Accident.
4,2020-04-19 00:25:53,39.802,-75.4509,Claymont,DE,,I-495 S,Closed between I-95 and US-13/Exit 4 - Road closed due to accident.
2,2020-08-03 10:29:22,39.6872,-75.584,New Castle,DE,101,E Van Buren Ave,Accident on Van Buren Ave at US-13 Dupont Hwy.
2,2017-11-21 19:50:53,39.7432,-75.5657,Wilmington,DE,1298,Lancaster Ave,Accident on Franklin St at DE-48 Lancaster Ave.
2,2019-01-11 07:24:45,39.7034,-75.5599,New Castle,DE,11,Karlyn Dr,Accident on Karlyn Dr at Halcyon Dr.
3,2019-05-27 07:28:32,39.7642,-75.5477,Wilmington,DE,,I-95 N,Between SR-202/Concord Pike/Exit 8 and SR-52/Delaware Ave/Exit 7 - Accident.
2,2020-07-21 06:20:47,39.8088,-75.5566,Wilmington,DE,798,Severn Rd,Accident on Severn Rd at Taunton Rd.
3,2019-12-03 20:56:19,39.3087,-75.6092,Smyrna,DE,487, N Dupont Blvd,Between Smyrna and SR-6/SR-300/E Glenwood Ave - Accident.
4,2020-05-25 22:20:26,39.6814,-75.6623,Newark,DE,,Delaware Tpke,Between SR-273/Exit 3 and SR-58/Exit 4 - Accident.
4,2019-03-18 18:18:59,39.5827,-75.6736,Bear,DE,3900, Wrangle Hill Rd,Closed at Middletown - Road closed due to accident.
2,2016-11-22 13:50:15,39.7024,-75.6064,New Castle,DE,,Delaware Tpke,Between I-295/US-202/SR-141/Exit 5 and SR-58/Exit 4 - Accident.
3,2017-09-08 09:02:25,39.6886,-75.642,New Castle,DE,,Delaware Tpke,At SR-58/Exit 4 - Accident.
2,2020-09-22 11:33:36,39.7444,-75.5451,Wilmington,DE,301,E 10th St,Accident on US-13-BR Walnut St near 10th St.
2,2019-05-06 08:38:14,39.7354,-75.6548,Wilmington,DE,798,Milltown Rd,Accident on Calf Run Dr at Milltown Rd.
3,2020-03-18 15:53:44,39.0944,-75.5808,Camden Wyoming,DE,,DE-10,At SR-15/Dundee Rd/Moose Lodge Rd - Accident traffic being directed around accident area.
4,2017-03-30 06:34:55,39.6945,-75.72,Newark,DE,699, Capitol Trl,Closed between SR-72/Possum Park Rd and Anna Way - Road closed due to accident.
2,2018-02-16 08:22:19,39.7786,-75.543,Wilmington,DE,,Foulk Rd,At SR-261/Foulk Rd - Accident. Right lane blocked.
2,2019-11-26 07:09:17,39.4545,-75.7233,Middletown,DE,5451,Peterson Rd,Accident on Middletown Warwick Rd at Doc Levinson Dr.
4,2020-10-21 22:49:00,39.7327,-75.5244,Wilmington,DE,,I-495 S,Incident on I-495 SB near CHRISTINA RIVER BRG Road closed. Take alternate route.
2,2018-07-20 06:48:22,39.7538,-75.7175,Newark,DE,199,Sun Ct,Accident on Sun Ct at Jupiter Rd.
2,2019-05-15 08:52:09,39.7531,-75.6526,Wilmington,DE,3211,Newport Gap Pike,Accident on DE-41 Newport Gap Pike at Mill Creek Rd.
2,2020-01-27 10:29:27,39.7188,-75.5546,Wilmington,DE,,Rogers Rd,Accident on Rogers Rd near US-13 Dupont Hwy.
4,2017-10-24 09:51:23,38.7888,-75.5908,Greenwood,DE,14277, Sussex Hwy,Closed at SR-16/SR-36/Market St - Road closed due to accident.
3,2020-05-07 17:54:27,39.6954,-75.6202,New Castle,DE,,Delaware Tpke S,Between I-295/US-202/SR-141/Exit 5 and SR-58/Exit 4 - Accident. Right lane blocked.
4,2020-04-09 15:12:44,39.6084,-75.6644,Bear,DE,1100, Red Lion Rd,Closed at US-13/SR-1/S Dupont Hwy - Road closed due to accident.
2,2016-06-10 18:22:13,39.0467,-75.4578,Frederica,DE,7938, Bay Rd,At US-113-ALT/Clapham Rd - Accident.
2,2018-04-04 10:33:09,39.6911,-75.581,New Castle,DE,1509, N Dupont Hwy,At Wilmington - Accident. Left lane blocked.
4,2016-06-07 14:36:37,39.0822,-75.4582,Magnolia,DE,9759, Bay Rd,Closed at Dover - Road closed due to accident.
4,2018-03-20 03:04:08,39.1651,-75.6818,Hartly,DE,2041, Judith Rd,Closed at SR-8/Halltown Rd - Road closed due to accident.
2,2020-12-08 00:48:00,39.7837,-75.5535,Wilmington,DE,,Powder Mill Rd,Incident on DE-141 SB near US-202 Road closed. Take alternate route.
3,2019-12-03 20:56:19,39.3063,-75.6069,Smyrna,DE,308, N Dupont Blvd,At Smyrna - Accident.
2,2020-02-28 08:00:01,39.6477,-75.6225,New Castle,DE,401,S Dupont Hwy,Accident on US-13 Dupont Pkwy near Langollen Blvd.
2,2020-12-07 08:42:13,39.7424,-75.5685,Wilmington,DE,1699,Elm St,Accident on Broom St at Elm St.
2,2018-08-23 11:27:19,39.7394,-75.5441,Wilmington,DE,600,E 6th St,Accident on 6th St at Pine St.
4,2016-11-29 22:58:48,39.7492,-75.508,Wilmington,DE,,I-495 S,Closed between SR-3/Edgemoor Rd/Exit 4 and 12th St/Exit 3 - Road closed due to accident.
2,2020-12-16 06:56:06,39.6454,-75.7847,Newark,DE,1,Laurel Ln,Accident on Maple Dr at Laurel Ln.
3,2020-04-25 17:02:07,39.6953,-75.5458,New Castle,DE,,US-40 E,Between SR-9/New Castle Ave and Delaware Memorial Brg (North) - Accident.
2,2020-09-26 00:20:00,39.4495,-75.6733,Middletown,DE,,DE-1 S,Incident on DE-1 SB near APPOQUNIMIK BRG Left lane blocked.
4,2020-05-07 04:42:33,39.7856,-75.5459,Wilmington,DE,,Concord Pike,Closed at Mt Lebanon Rd - Road closed due to accident.
2,2019-07-29 08:03:41,39.7505,-75.5812,Wilmington,DE,201,Greenhill Ave,Accident on Greenhill Ave at 2nd St.
2,2020-12-08 00:48:00,39.7844,-75.5544,Wilmington,DE,849, Powder Mill Rd,Incident on DE-141 SB near US-202 Road closed. Take alternate route.
2,2018-03-14 19:33:54,39.7407,-75.554,Wilmington,DE,300,W 3rd St,Accident on 3rd St at Tatnall St.
2,2019-01-07 18:18:20,39.7661,-75.5104,Wilmington,DE,245, Philadelphia Pike,At US-13-BR/Philadelphia Pike - Accident. Left lane blocked.
2,2020-04-02 12:20:41,39.0455,-75.5577,Felton,DE,,Canterbury Rd,Between Walnut Shade Rd and SR-12/Main St/Midstate Rd - Accident. Left lane blocked.
2,2017-10-11 13:24:51,39.7755,-75.5874,Wilmington,DE,,Ponds Ln,Accident on DE-100 Montchanin Rd at Ponds Ln.
2,2020-12-02 06:44:38,39.6963,-75.6167,New Castle,DE,,Delaware Tpke N,Accident on I-95 Northbound at Exit 5A Airport Rd.
2,2020-04-01 17:50:49,39.7712,-75.4839,Wilmington,DE,5930, Governor Printz Blvd,At Bellevue Rd - Accident. Left lane blocked. Hard shoulder blocked.
2,2020-11-19 03:57:00,39.4804,-75.7201,Middletown,DE,500, Marl Pit Rd,Incident on SUMMIT BRIDGE RD NB near MARL PIT RD Road closed. Take alternate route.
2,2019-10-03 10:17:34,39.7963,-75.5726,Rockland,DE,,Mount Lebanon Rd,Accident on Rockland Rd at Mt Lebanon Rd.
2,2020-12-22 13:54:00,39.1786,-75.5271,Dover,DE,656, N Dupont Hwy,Incident on US-13 SB near LEPORE DR Road closed. Take alternate route.
4,2017-09-07 12:32:25,39.7289,-75.6912,Wilmington,DE,5226, New Linden Hill Rd,Closed at Pike Creek Blvd - Road closed due to accident.
2,2018-08-20 10:01:27,39.7478,-75.574,Wilmington,DE,204,N Union St,Accident on 2nd St Westbound at DE-48 Lancaster Ave.
3,2017-05-19 08:42:06,39.6065,-75.7362,Newark,DE,2251, Pulaski Hwy,At US-301/SR-896/Summit Bridge Rd - Accident.
2,2018-10-26 05:41:30,39.662,-75.693,Newark,DE,,Delaware Tpke S,Accident on I-95 Northbound at Chapman Rd.
2,2017-12-14 17:51:09,39.7573,-75.5416,Wilmington,DE,399,Concord Ave,Accident on 23rd St at DE-202 Concord Ave.
4,2018-07-06 16:47:30,39.3322,-75.6286,Smyrna,DE,,DE-1 N,Closed between US-13/Exit 119 and SR-299/Exit 136 - Road closed due to accident.
2,2018-01-31 19:44:21,39.7794,-75.5065,Wilmington,DE,,Marsh Rd,Accident on DE-3 Marsh Rd at I-95.
4,2018-11-11 15:00:26,38.5374,-75.254,Dagsboro,DE,32567, Dupont Blvd,Closed between Frankford and Dagsboro - Road closed due to accident.
2,2019-07-15 09:44:13,39.7373,-75.5534,Wilmington,DE,23,S Market St,Accident on US-13-BR Market St both ways at Shipley St.
2,2020-08-14 07:37:30,39.784,-75.6716,Hockessin,DE,1101,Old Wilmington Rd,Accident on Old Wilmington Rd at Brackenville Rd.
2,2020-11-22 05:39:00,39.8229,-75.4875,Wilmington,DE,,Naamans Rd,Incident on NAAMANS RD WB near MARSH RD Road closed. Take alternate route.
2,2020-10-01 13:32:30,39.7321,-75.6424,Wilmington,DE,,Kirkwood Hwy,Stationary traffic on DE-2 from Duncan Rd (Kirkwood Hwy/DE-2) to DE-7/Limestone Rd (Kirkwood Hwy/DE-2) due to accident.
3,2018-06-16 13:39:01,39.7143,-75.5842,New Castle,DE,,I-95 N,Accident on I-95 Northbound at I-295.
4,2017-01-12 04:38:25,39.6479,-75.7023,Newark,DE,549, Old Baltimore Pike,Closed at Salem Church Rd/Salem Woods Dr - Road closed due to accident.
2,2017-05-05 06:44:43,39.2016,-75.5389,Dover,DE,,DE-1 N,At Scarborough Rd/Exit 104 - Accident.
4,2020-04-18 23:52:02,39.802,-75.4509,Claymont,DE,,I-495 S,Closed between I-95 and US-13/Exit 4 - Road closed due to accident.
2,2018-07-06 07:10:22,39.7494,-75.5573,Wilmington,DE,931,W 10th St,Accident on 10th St at Jackson St.
3,2020-03-20 07:32:04,39.6705,-75.7106,Newark,DE,1, Pearson Dr,At SR-2/SR-72/S Chapel St - Accident traffic being directed around accident area.
2,2019-05-31 07:44:39,39.7464,-75.5321,Wilmington,DE,1699,N Heald St,Accident on Vandever Ave at Heald St.
2,2019-11-25 10:20:51,39.7498,-75.5744,Wilmington,DE,2050,W 4th St,Accident on Servan Ct near 4th St.
2,2020-03-11 17:10:21,39.6553,-75.6272,New Castle,DE,12,Coachlight Ct,Accident on Coachlight Ct in Rambleton Acres.
2,2018-08-23 09:54:57,39.6958,-75.5537,New Castle,DE,,New Castle Ave,Accident on DE-9 New Castle Ave Northbound near I-295.
4,2018-12-02 21:21:49,39.0677,-75.5541,Felton,DE,7130, S Dupont Hwy,Closed at Woodside - Road closed due to accident.
2,2017-08-24 18:46:40,39.8226,-75.4869,Wilmington,DE,,Naamans Rd,Accident on DE-92 Naamans Rd at DE-3 Marsh Rd.
2,2019-04-08 09:31:47,39.689,-75.6585,Newark,DE,,Churchmans Rd,Accident on Continental Dr near DE-58 Churchmans Rd.
2,2018-08-31 19:06:00,39.8107,-75.4541,Claymont,DE,,I-495 N,At I-95 - Accident. Right lane blocked.
2,2017-06-09 08:05:48,39.748,-75.6114,Wilmington,DE,,Faulkland Rd,At Centre Rd - Accident.
2,2020-09-30 00:53:00,39.7362,-75.5633,Wilmington,DE,,I-95 S,Incident on I-95 SB near CHRISTINA RIVER BRG Left lane blocked.
2,2018-11-21 10:33:05,39.7404,-75.5623,Wilmington,DE,,I-95 N,At SR-9/4th St/Exit 6 - Accident. Left lane blocked.
4,2017-11-03 22:13:15,39.6716,-75.5983,New Castle,DE,140, N Dupont Hwy,Closed at New Castle - Road closed due to accident.
2,2018-05-18 07:18:12,39.74,-75.5574,Wilmington,DE,105,N Washington St,Accident on Martin Luther King Blvd at DE-48 Martin Luther King Blvd.
2,2019-09-17 07:09:42,39.7008,-75.5454,New Castle,DE,601,Central Ave,Accident on Central Ave at 6th St.
2,2020-05-27 08:16:37,39.7376,-75.6999,Wilmington,DE,4761,Hogan Dr,Accident on Ault Ct at Ryder Ct.
2,2020-02-14 08:10:07,39.6639,-75.5736,New Castle,DE,1089,Delaware St,Accident on DE-273 Delaware St at Jack Markell Trl.
2,2020-02-11 19:23:23,39.7193,-75.5389,New Castle,DE,512, Terminal Ave,At I-495 - Accident. Right lane blocked.
2,2020-07-23 08:06:35,39.7607,-75.5306,Wilmington,DE,3318,N Washington St,Accident on 34th St at Washington St.
2,2020-08-02 20:55:59,39.6035,-75.7623,Newark,DE,,Pulaski Hwy,Accident on US-40 Pulaski Hwy at Perch Creek Dr.
3,2020-05-13 16:30:36,39.7494,-75.5068,Wilmington,DE,,I-495 N,Between 12th St/Exit 3 and US-13/Philadelphia Pike/Exit 5 - Accident.
2,2019-10-23 17:40:06,39.749,-75.5562,Wilmington,DE,1000,N Adams St,Accident on 11th St at Adams St.
2,2019-05-15 07:20:10,39.7114,-75.65,Wilmington,DE,532,Main St,Accident on Honeysuckle Ln at DE-4 Mitch Rd.
2,2020-09-17 13:34:00,39.1869,-75.5179,Dover,DE,,DE-1 S,Construction on DE-1 SB near DOVER TOLL PLAZA Drive with caution.
2,2019-07-15 09:44:57,39.7528,-75.5301,Wilmington,DE,2994,N Church St,Accident on 28th St at Church St.
3,2019-04-24 16:39:26,39.7083,-75.5874,New Castle,DE,,I-495 N,Between I-95/I-295 and US-13/Dupont Pky/Exit 1 - Accident. Lane blocked.
2,2020-12-02 15:46:00,39.8082,-75.4627,Claymont,DE,,I-95 S,Incident on I-95 SB near HARVEY RD Left lane blocked.
3,2018-03-06 06:37:19,39.6885,-75.6415,New Castle,DE,,Delaware Tpke,Between SR-58/Exit 4 and SR-141/Exit 5 - Accident.
4,2017-09-03 13:25:40,39.7697,-75.5435,Wilmington,DE,,US-202 S,Closed at I-95/US-202 - Road closed due to accident.
2,2020-05-01 16:38:39,39.7606,-75.538,Wilmington,DE,590,W 28th St,Accident on 28th St at Monroe St. No recent updates.
3,2018-07-03 18:56:28,39.5032,-75.6494,Middletown,DE,,Dupont Pkwy,At SR-896/Boyds Corner Rd - Accident. Lane blocked.
2,2017-09-08 13:53:55,39.6856,-75.6341,Newark,DE,629,Churchmans Rd,Accident on DE-58 Churchmans Rd at Iroquois Ct.
2,2018-11-15 08:29:37,39.7969,-75.5256,Wilmington,DE,,Windsor Hills Dr,Accident on DE-261 Foulk Rd at Windsor Hills Dr.
2,2019-03-22 12:29:58,39.7321,-75.6262,Wilmington,DE,3390,Old Capitol Trl,Accident on Old Capitol Trl Northbound at DE-62 Newport Gap Pike.
2,2018-10-29 08:35:06,39.7172,-75.5325,Wilmington,DE,801,Christiana Ave,Accident on DE-9A Christiana Ave near Old Ferry Rd.
4,2017-02-15 14:48:51,39.7202,-75.6139,Wilmington,DE,,Burnside Blvd,Closed at Newport Gap Pike/Exit 5 - Road closed due to accident.
4,2020-05-07 00:31:35,39.7856,-75.5459,Wilmington,DE,,Concord Pike,Closed at Mt Lebanon Rd - Road closed due to accident.
4,2020-12-20 08:51:00,39.0814,-75.6012,Camden Wyoming,DE,8998, Willow Grove Rd,Incident on WILLOW GROVE RD near MORGANS CHOICE RD Road closed. Take alternate route.
2,2017-10-27 22:21:04,39.7234,-75.5973,Wilmington,DE,111,Boxwood Rd,Accident on Essex Ave at DE-62 Boxwood Rd.
2,2018-10-25 10:09:44,39.7114,-75.6503,Wilmington,DE,587, Main St,At Newport - Accident. Lane blocked.
4,2018-11-30 06:27:04,39.6205,-75.6456,New Castle,DE,,DE-1 N,Ramp closed to US-13/Dupont Hwy - Road closed due to accident.
2,2020-01-09 06:31:56,39.7519,-75.5633,Wilmington,DE,1457,W 10th St,Accident on 10th St at Rodney St.
4,2019-05-15 09:17:47,38.8034,-75.5391,Greenwood,DE,12146, Beach Hwy,Closed between SR-16/Beach Hwy/Ellendale-Greenwood Hwy and Milford - Road closed due to accident.
2,2020-11-04 12:30:30,39.8363,-75.5415,Wilmington,DE,5749, Concord Pike,Stationary traffic on US-202 from DE-92/Naamans Rd (US-202) to Smithbridge Rd (US-202) due to accident.
3,2020-10-18 20:43:58,39.6946,-75.5542,New Castle,DE,,New Castle Ave,Accident on entry ramp to I-295 Southbound from New Castle Ave.
2,2020-12-13 02:40:00,39.6062,-75.7396,Newark,DE,,Pulaski Hwy,Incident on US-40 WB near DE-896 Expect long delays.
4,2020-03-26 11:39:21,39.7382,-75.5518,Wilmington,DE,5, Martin Luther King Blvd,Closed between E 9th St and I-495 - Road closed due to accident.
