Severity,Date/Time,Latitude,Longitude,City,State,Number,Street,Description
2,2019-06-20 07:08:50,38.8958,-76.9523,Washington,DC,,Benning Rd NE,Right lane blocked due to accident on DC-295 Southbound from Kenilworth Ave to Benning Rd.
2,2020-12-06 23:30:21,38.866,-76.9916,Washington,DC,,I-695 N,Incident on I-695 near I-695 Drive with caution.
2,2020-12-06 22:25:30,38.866,-76.9916,Washington,DC,,I-695 N,Stationary traffic on I-695 N from Howard Rd/Exit 3B (I-695/I-295) to I-695/DC-295 (I-695/I-295) due to accident.
2,2018-03-01 19:35:49,38.9488,-77.0662,Washington,DC,4547, Connecticut Ave NW,Between Appleton St NW and Chesapeake St NW - Accident. Rescue and recovery work in progress.
2,2020-04-10 11:32:11,38.8708,-76.9889,Washington,DC,,I-695 S,At 11th St Bridge - Accident. Left lane blocked.
3,2018-02-14 16:02:51,38.8702,-76.9878,Washington,DC,,I-695 N,Entry ramp to DC-295 Northbound at Exits 2A 2B from I-695 Eastbound shoulder blocked due to accident.
3,2016-11-29 10:42:38,38.8688,-77.0054,Washington,DC,,S Capitol St SE,At M St - Accident.
2,2020-10-20 19:58:05,38.8822,-77.0258,Washington,DC,,I-395 N,Incident on I-395 NB near I-395 Drive with caution.
2,2018-11-21 07:53:50,38.8753,-76.9748,Washington,DC,,Anacostia Fwy S,Two lanes blocked due to accident on DC-295 Anacostia Fwy Northbound near Exit 1A Pennsylvania Ave.
2,2020-06-15 11:19:35,38.8984,-76.9466,Washington,DC,4121, Minnesota Ave NE,At Benning Rd NE - Accident.
2,2020-10-11 16:59:56,38.8549,-76.9581,Washington,DC,2999, Branch Ave SE,Incident on SOUTHERN AVE NB near BRANCH AVE Drive with caution.
2,2016-10-13 13:22:02,38.886,-77.0179,Washington,DC,428,C St SW,Accident on C St Northbound at 4th St.
4,2020-05-11 17:47:30,38.9002,-77.0152,Washington,DC,299, H St NW,Closed at Massachusetts Ave NW/3rd St NW - Road closed due to accident.
2,2020-04-08 17:07:59,38.8778,-76.962,Washington,DC,3135, Minnesota Ave SE,At Randle Cir SE/Minnesota Ave SE - Accident.
3,2019-02-21 14:34:13,38.8469,-77.007,Washington,DC,,I-295 N,Heavy traffic and 2 left lane blocked due to accident on I-295 Southbound before Exit 2 Malcolm X Ave.
2,2017-10-02 18:13:42,38.8764,-77.0417,Washington,DC,,I-395 S,At George Mason Memorial Bridge - Accident.
2,2020-06-01 13:14:52,38.8975,-77.0091,Washington,DC,612, N Capitol St NW,At N Capitol St - Accident.
2,2016-10-18 09:20:35,38.8896,-76.9551,Washington,DC,3535,E Capitol St SE,Accident on Capitol St Westbound in Washington.
2,2020-12-30 19:01:01.000000000,38.8384,-77.009,Washington,DC,,I-295 N,Incident on S CAPITOL ST near S CAPITOL ST Drive with caution.
2,2018-02-22 16:28:28,38.8753,-76.9748,Washington,DC,,Anacostia Fwy S,Left lane blocked due to accident on DC-295 Anacostia Fwy Southbound before Exit 1A Pennsylvania Ave.
2,2020-09-16 07:46:21,38.917,-77.0281,Washington,DC,1198,U St NW,Accident on 12th St at U St.
4,2020-05-10 19:59:15,38.8511,-76.9733,Washington,DC,2299, Alabama Ave SE,Closed at Suitland Pky SE - Road closed due to accident.
4,2020-04-26 07:24:36,38.8918,-77.0627,Washington,DC,,I-66 W,Closed at Theodore Roosevelt Memorial Brg - Road closed due to accident.
2,2020-12-08 14:42:10,38.866,-76.9918,Washington,DC,,I-695 S,Incident on I-295 SB near I-295 Drive with caution.
2,2020-08-10 04:51:29,38.9001,-76.9834,Washington,DC,,Maryland Ave NE,Accident on Benning Rd both ways at Bladensburg Rd.
2,2020-12-17 06:23:27,38.9025,-76.9437,Washington,DC,,Nannie Helen Burroughs Ave NE,Two lanes blocked due to accident on DC-295 Southbound at Kenilworth Ave.
4,2019-07-23 19:17:32,38.9025,-76.999,Washington,DC,549, K St NE,Closed at 6th St NE - Road closed due to accident.
2,2017-12-14 07:25:28,38.882,-77.0283,Washington,DC,,I-395 N,At 12th St - Accident. Right lane blocked.
2,2019-04-09 08:52:52,38.8957,-76.9522,Washington,DC,,Kenilworth Ave S,Left lane blocked due to accident on DC-295 Northbound before Benning Rd.
2,2020-12-18 01:22:23,38.9242,-76.9864,Washington,DC,,Brentwood Rd NE,Incident on RHODE ISLAND AVE near RHODE ISLAND AVE Drive with caution.
2,2020-10-21 22:08:33,38.8722,-76.9817,Washington,DC,,Anacostia Fwy S,Incident on DC-295 SB near 11TH ST Drive with caution.
2,2019-07-19 08:29:16,38.8493,-76.9742,Washington,DC,3321,22nd St SE,Accident on 22nd St at Savannah Ter.
2,2019-06-10 16:00:00,38.893,-77.056,Washington,DC,,US-50 W,Between US-50/Potomac River Fwy and US-50/Arlington Blvd/GW Pky - Accident. Right lane blocked.
2,2020-10-24 23:32:07,38.8826,-77.0221,Washington,DC,,I-395 S,Incident on I-395 SB near I-395 Drive with caution.
2,2017-10-11 17:28:57,38.8928,-77.0573,Washington,DC,,US-50 W,At Theodore Roosevelt Memorial Brg - Accident. Left lane blocked.
2,2019-03-28 08:30:50,38.853,-76.9839,Washington,DC,,Suitland Pkwy E,Lane blocked due to accident on Suitland Pkwy Westbound near Stanton Rd.
3,2020-06-07 15:26:54,38.8821,-77.0288,Washington,DC,1300, Maine Ave SW,At I-395/Southwest Fwy/12th St SW - Accident. Three lanes blocked.
2,2020-10-13 12:38:00,38.8876,-76.9619,Washington,DC,,Anacostia Fwy S,Slow traffic on DC-295 from Capitol St (DC-295) to Pennsylvania Ave (DC-295) due to accident.
3,2019-09-16 09:36:46,38.9245,-76.9856,Washington,DC,1300, Montana Ave NE,At Montana Ave NE - Accident.
2,2020-12-12 04:35:46,38.9047,-77.0165,Washington,DC,408, New York Ave NW,Incident on NEW YORK AVE near NEW YORK AVE Drive with caution.
2,2019-07-02 07:37:10,38.9102,-77.0281,Washington,DC,,12th St NW,Accident on Rhode Island Ave at 12th St.
3,2016-08-16 17:45:11,38.8957,-76.9517,Washington,DC,,Kenilworth Ave S,Delays expected due to accident on Benning Rd Westbound at Minnesota Ave.
3,2018-05-15 17:49:00,38.8266,-77.0169,Washington,DC,,I-295 S,Accident on I-295 Southbound at Exit 1 Overlook Ave.
2,2020-04-09 06:59:33,38.8721,-76.9897,Washington,DC,,I-695 N,Lane blocked due to accident on I-695 clockwise at Exits 1C 2 2A 2B I-295 Exits 5A 5B.
1,2020-06-23 12:21:31,38.8519,-76.962,Temple Hills,DC,3249, Southern Ave,At Southern Ave SE - Accident.
2,2017-09-29 15:28:03,38.8898,-76.963,Washington,DC,,E Capitol St NE,At DC-295/Anacostia Fwy - Accident.
2,2018-03-19 17:48:23,38.8609,-77.0026,Washington,DC,,I-295 N,At Suitland Pky/Exit 3 - Accident.
2,2020-12-29 00:24:56,38.8782,-77.0373,Washington,DC,,US-1 N,Incident on US-1 near US-1 Drive with caution.
2,2020-12-01 22:37:31,38.9066,-76.9392,Washington,DC,,Kenilworth Ave S,Incident on DC-295 near DC-295 Drive with caution.
2,2016-12-13 06:38:45,38.9032,-76.943,Washington,DC,,Kenilworth Ave N,At Burroughs Ave - Accident.
2,2018-03-19 17:55:19,38.8896,-76.959,Washington,DC,,E Capitol St SE,Lane blocked due to accident on DC-295 Anacostia Fwy Southbound at Capitol St.
2,2019-11-14 18:15:21,38.9333,-77.0365,Washington,DC,3361,16th St NW,Accident on 16th St at Newton St.
3,2019-06-25 08:18:42,38.8892,-77.0622,Washington,DC,,George Washington Memorial Pkwy N,Between Memorial Dr and US-29 - Accident. Lane blocked.
2,2020-12-03 21:57:53,38.8983,-77.0142,Washington,DC,,I-395 S,Incident on I-395 SB near I-395 Drive with caution.
2,2020-05-20 10:32:17,38.9,-76.9828,Washington,DC,1511, Benning Rd NE,At Oklahoma Ave NE - Accident. Right lane blocked.
2,2017-10-19 18:09:26,38.8664,-76.9915,Washington,DC,,I-695 S,At Anacostia Fwy - Accident. Left lane blocked.
2,2020-09-14 21:04:30,38.8824,-77.0158,Washington,DC,,Southwest Fwy N,Slow traffic on I-295 from I-395 (I-695/I-295) to 8th St (I-695/I-295) due to accident.
2,2020-09-23 12:21:00,38.9264,-77.0114,Washington,DC,58, Michigan Ave NW,Queuing traffic from Washington Hospital Center Rd / 1st St NW to Girard St NE due to accident.
2,2020-11-12 21:53:25,38.8822,-77.0285,Washington,DC,,I-395 S,Incident on I-395 SB near I-395 Drive with caution.
2,2018-05-16 06:35:24,38.8711,-76.9889,Washington,DC,,I-695 N,Between I-695 and 8th St - Accident. Left lane blocked.
4,2019-04-10 05:47:41,38.9037,-76.9251,Washington,DC,5201, Sheriff Rd NE,Closed at 50th St NE - Road closed due to accident.
2,2020-04-15 18:47:40,38.9624,-77.0364,Washington,DC,1599, Missouri Ave NW,At 16th St NW/Military Rd NW - Accident.
3,2020-06-07 23:44:30,38.9369,-77.1167,Washington,DC,,Clara Barton Pkwy,At Maryland/District of Columbia - Serious accident.
2,2020-10-14 10:39:00,38.9068,-77.0108,Washington,DC,51, New York Ave NW,Queuing traffic on I-395 S - US-50 W from New York Ave NE / N Capitol St NW to exit [8] due to accident.
4,2020-04-09 17:18:27,38.9397,-77.0297,Washington,DC,3954, 13th St NW,Closed at Upshur St NW - Road closed due to accident.
2,2020-10-14 04:53:49,38.8757,-77.0208,Washington,DC,600,Water St SW,Accident on 6th St at Water St.
2,2020-12-24 01:41:43,38.8823,-77.0192,Washington,DC,,Southwest Fwy N,Incident on I-395 NB near 3RD ST Drive with caution.
2,2020-10-30 12:03:30,38.9308,-76.971,Washington,DC,3122, South Dakota Ave NE,Slow traffic from US-1/Rhode Island Ave (South Dakota Ave) to Bladensburg Rd (South Dakota Ave) due to accident.
4,2020-04-11 19:54:26,38.8693,-76.9885,Washington,DC,,I-695 N,Closed at I-295/I-695/11th St Brg/N St SE - Road closed due to accident.
2,2017-11-27 08:54:22,38.8823,-77.0236,Washington,DC,,I-395 N,Between 12th St/Maine Ave and 6th St - Accident.
2,2020-02-05 06:36:18,38.9173,-76.9725,Washington,DC,,New York Ave NE,Right lane blocked due to accident on US-50 New York Ave Westbound at Bladensburg Rd.
4,2020-03-22 21:06:09,38.8774,-76.9629,Washington,DC,3111, Minnesota Ave SE,Closed between 31st St SE and G St SE - Road closed due to accident.
4,2019-05-03 04:13:14,38.8804,-76.9598,Washington,DC,3267, Minnesota Ave SE,Closed at Randle Cir SE/Minnesota Ave SE - Road closed due to accident.
2,2020-11-18 01:14:06,38.8808,-77.0304,Washington,DC,,I-395 N,Incident on I-395 NB near MAINE AVE Drive with caution.
2,2020-11-06 03:31:45,38.9007,-77.0567,Washington,DC,,I St NW,Incident on I ST near I ST Drive with caution.
3,2018-04-27 18:34:13,38.8917,-77.0644,Washington,DC,,Theodore Roosevelt Memorial Brg E,Right lane closed and right hand shoulder closed due to accident on I-66 Eastbound at George Washington Memorial Pkwy.
2,2020-12-20 04:17:07,38.8535,-77.0056,Washington,DC,,I-295 N,Incident on I-295 NB near I-295 Drive with caution.
2,2020-10-03 03:17:00,38.8718,-76.9821,Washington,DC,,Anacostia Fwy N,Stationary traffic on DC-295 from I-295/Exit 4 (DC-295) to Pennsylvania Ave (DC-295) due to accident.
4,2019-06-19 05:23:54,38.8518,-77.0069,Washington,DC,,I-295 S,Closed between Malcolm X Ave/Exit 2 and Capitol St - Road closed due to accident.
2,2020-12-29 08:54:55,38.8785,-76.93,Washington,DC,752,51st St SE,Accident on 51st St at H St.
2,2020-12-17 13:44:30,38.9186,-76.947,Washington,DC,,New York Ave W,Stationary traffic on US-50 W - New York Ave W from MD-295/Kenilworth Ave (US-50) to Bladensburg Rd (US-50) due to accident.
2,2020-10-30 08:54:35,38.9002,-77.0102,Washington,DC,46,H St NW,Accident on H St at North Capitol St.
3,2020-04-27 07:43:43,38.8782,-77.0373,Washington,DC,,US-1 N,At I-395 - Accident.
2,2020-10-05 20:29:01.000000000,38.9276,-77.0297,Washington,DC,2918, 13th St NW,Incident on 13TH ST near 13TH ST Drive with caution.
2,2017-08-01 08:09:46,38.9073,-77.0091,Washington,DC,1300,N Capitol St NW,Right lane closed due to accident on US-50 New York Ave Westbound at Capitol St.
2,2019-01-10 15:16:05,38.91,-76.936,Washington,DC,,Kenilworth Ave N,At Eastern Ave - Accident. Right lane blocked.
2,2020-11-30 09:55:24,38.8384,-77.009,Washington,DC,,I-295 N,Incident on I-295 EB near CAPITOL ST Drive with caution.
2,2018-12-10 20:35:29,38.912,-76.9342,Washington,DC,1699, Kenilworth Ave NE,At Eastern Ave - Accident. Center lane blocked.
2,2018-04-03 18:17:47,38.8721,-77.0091,Washington,DC,,P St SW,At Frederick Douglas Memorial Brg - Accident. Left lane blocked.
4,2020-05-05 19:51:59,38.8978,-76.9695,Washington,DC,,Oklahoma Ave NE,Closed at Maryland Ave NE/Bladensburg Rd NE - Road closed due to accident.
3,2017-02-28 08:59:59,38.8824,-77.028,Washington,DC,,I-395 S,Left lane blocked due to accident on I-395 Northbound at 12th st.
3,2017-09-29 07:30:28,38.8826,-77.0216,Washington,DC,,7th St SW,Left lane closed due to accident on I-695 Southwest Fwy Westbound at 7th St.
3,2016-12-13 07:15:01,38.8974,-76.95,Washington,DC,,Kenilworth Ave S,At Benning Rd - Accident.
2,2019-12-12 20:48:00,38.9063,-77.0122,Washington,DC,100,New York Ave NW,Slow traffic due to accident on 1st St at US-50 New York Ave.
2,2019-04-18 06:20:31,38.8952,-77.0035,Washington,DC,407,2nd St NE,Lane blocked due to accident on 2nd St Northbound at Massachusetts Ave.
2,2020-11-25 06:17:00.000000000,38.9062,-77.0126,Washington,DC,,New York Ave NW,Slow traffic on I-395 S - US-50 W from New York Ave NE / N Capitol St NW to exit [8] due to accident.
2,2020-11-17 21:52:30,38.8829,-77.0239,Washington,DC,,Frontage Rd,Slow traffic on Southwest Fwy N - I-395 N from 9th St SW to C St SW exit [6] due to accident.
2,2020-09-19 16:40:30,38.8982,-76.949,Washington,DC,,Kenilworth Ave S,Slow traffic on DC-295 from Nannie Helen Burroughs Ave (DC-295) to Pennsylvania Ave (DC-295) due to accident.
3,2017-08-29 07:32:01,38.8788,-77.0385,Washington,DC,,I-395 N,Right lane closed due to accident on I-395 Express Lanes Inbound between Exits 10B 10C George Washington Memorial Pkwy and Exits 1 2 US-1.
2,2020-04-13 06:19:20,38.8225,-77.0166,Washington,DC,,Laboratory Rd SE,At Lab Rd/Shepherd Pky/EB Exit 1 - Accident. Hard shoulder blocked.
2,2019-10-11 17:10:08,38.9156,-76.9852,Washington,DC,1298, New York Ave NE,At Fenwick St NE - Accident.
2,2020-06-01 07:35:35,38.9111,-76.9984,Washington,DC,400,New York Ave NE,Accident on US-1-ALT New York Ave Eastbound at 4th St.
2,2020-04-06 06:56:17,38.8992,-77.0152,Washington,DC,728, 3rd St NW,At Constitution Ave NW - Accident.
2,2019-03-25 19:08:28,38.929,-76.9762,Washington,DC,3099, 20th St NE,At 20th St NE - Accident.
2,2019-01-16 08:12:06,38.9173,-76.9735,Washington,DC,,New York Ave NE,Lane blocked due to accident on US-50 New York Ave at New York Ave.
1,2020-05-19 18:48:54,38.9794,-77.0264,Washington,DC,7401, Georgia Ave NW,At Butternut St NW/Main Dr - Accident.
2,2020-02-07 07:09:30,38.906,-77.0792,Washington,DC,1203,Foxhall Rd NW,Two lanes blocked due to accident on Canal Rd inbound at Foxhall Rd.
2,2020-12-20 15:54:32,38.8915,-77.0151,Washington,DC,,3rd St NW,Incident on PENNSYLVANIA AVE near 3RD ST Drive with caution.
2,2020-04-09 09:19:44,38.9193,-76.9914,Washington,DC,1056, Brentwood Rd NE,At 9th St NE - Earlier accident.
2,2019-10-19 09:57:35,38.9173,-76.9725,Washington,DC,,New York Ave NE,Center lane blocked due to accident on US-50 New York Ave Westbound at Bladensburg Rd.
2,2020-09-26 18:22:30,38.8847,-77.0127,Washington,DC,,I-395 S,Slow traffic on I-395 from D St (I-395) to Ohio Dr (I-395) due to accident.
4,2019-01-03 06:46:00,38.8962,-77.0074,Washington,DC,52, Columbus Cir NE,Closed between Columbus Cir NE and Louisiana Ave NW - Road closed due to accident.
2,2020-06-22 18:20:44,38.92,-77.0219,Washington,DC,2296, Georgia Ave NW,At Columbia Rd NW - Accident.
3,2020-06-28 09:36:08,38.8946,-76.953,Washington,DC,,Anacostia Fwy N,Between Baker St and Burroughs Ave - Accident.
3,2016-11-30 07:52:27,38.8636,-76.9968,Washington,DC,899,Howard Rd SE,Accident on I-295 Southbound at Exit 3B Howard Rd.
2,2017-11-30 06:02:08,38.9024,-76.9437,Washington,DC,4073,Nannie Helen Burroughs Ave NE,Accident on DC-295 Kenilworth Ave Southbound at Nannie Helen Burroughs Ave.
2,2017-11-16 18:36:12,38.9034,-77.0153,Washington,DC,,I-395 S,Between K St NW and Massachusetts Ave - Accident. Lane blocked.
2,2017-04-28 10:46:34,38.8897,-76.9575,Washington,DC,,E Capitol St NE,Accident on DC-295 Anacostia Fwy Eastbound at Capitol St.
4,2016-07-07 05:01:00,38.8621,-76.9973,Washington,DC,,Suitland Pkwy E,Closed between Firth Sterling Ave SE and Stanton Rd SE - Road closed due to accident.
2,2018-04-03 17:58:38,38.8739,-77.0091,Washington,DC,1323, S Capitol St SW,At P St SW - Accident. Left lane blocked.
1,2020-05-06 19:29:25,38.8992,-77.0152,Washington,DC,728, 3rd St NW,At Constitution Ave NW - Accident.
2,2018-04-09 06:09:32,38.8755,-76.974,Washington,DC,,Anacostia Fwy S,Shoulder blocked due to accident on DC-295 Anacostia Fwy Southbound at Exit 1A Pennsylvania Ave.
2,2020-04-24 10:25:16,38.8921,-77.0281,Washington,DC,,Constitution Ave NW,At Pennsylvania Ave NW - Accident. Two lanes blocked.
2,2020-09-28 01:47:17,38.8575,-76.9938,Washington,DC,,Suitland Pkwy E,Incident on SUITLAND PKY near SUITLAND PKY Drive with caution.
2,2017-11-20 16:55:54,38.8908,-77.0142,Washington,DC,,I-395 S,At 2nd St - Accident.
2,2020-11-12 22:52:40,38.8828,-76.9581,Washington,DC,3355, Minnesota Ave SE,Accident from E Capitol St NE/Ridge Rd (Minnesota Ave) to Randle Cir/Branch Ave (Minnesota Ave).
2,2020-12-11 13:26:00,38.9907,-77.0363,Washington,DC,8101, 16th St NW,Slow traffic on MD-390 from Kalmia Rd (16th St) to MD-410/East West Hwy/E West Hwy (16th St) due to accident.
4,2020-04-10 14:49:23,38.9265,-77.0364,Washington,DC,,Columbia Rd NW,Closed at Park Rd NW - Road closed due to accident. Construction work.
2,2020-06-23 20:29:56,38.8823,-77.0236,Washington,DC,,I-395 N,Ramp to I-395 Northbound - Accident.
2,2020-05-26 13:50:02,38.8732,-77.0422,Washington,DC,,I-395 N,At Memorial Bridge - Accident. Hard shoulder blocked.
2,2018-07-13 06:39:37,38.9173,-76.9772,Washington,DC,1911,New York Ave NE,#1 #2 &#3 lane blocked due to accident on US-50 New York Ave at US-50 New York Ave.
2,2019-05-13 05:50:44,38.8657,-77.0027,Washington,DC,,S Capitol St SW,Between Suitland Pkwy/Anacostia Dr SE and Firth Sterling Ave SE/Defense Blvd - Accident. Lane blocked.
2,2020-03-25 11:46:06,38.8709,-76.9888,Washington,DC,,I-695 N,At 11th St Bridge - Accident. Hard shoulder blocked.
2,2020-12-12 00:00:12,38.928,-77.0439,Washington,DC,1898, Harvard St NW,Incident on BEACH DR near BEACH DR Drive with caution.
2,2020-10-21 02:47:22,38.8764,-76.991,Washington,DC,,I-695 S,Incident on I-695 WB near I-695 Drive with caution.
4,2018-01-23 17:28:00,38.949,-77.027,Washington,DC,4812, Georgia Ave NW,Closed at Farragut St NW - Road closed due to accident.
3,2020-04-25 13:24:41,38.8876,-76.9615,Washington,DC,,Anacostia Fwy N,Between Pennsylvania Ave and Benning Rd - Accident.
2,2017-06-14 06:23:04,38.9052,-77.0152,Washington,DC,,Bibleway Bnd,Right lane closed due to accident on 3rd St Northbound at US-50 New York Ave.
3,2019-09-16 08:45:05,38.8821,-77.0279,Washington,DC,,12th St SW,Center lane blocked due to accident on I-395 Hov Lane Southbound at Maine Ave SW.
2,2020-05-29 09:13:30,38.9524,-77.009,Washington,DC,1,Gallatin St NE,Two lane blocked due to accident on North Capitol St Northbound between Crittenden St and Gallatin St.
3,2018-05-15 06:59:01,38.8793,-77.0361,Washington,DC,,US-1 N,Two lanes blocked due to accident on I-395 Southbound at 14th St.
2,2020-08-10 07:45:55,38.8935,-77.0435,Washington,DC,378,19th St NW,Accident on 19th St both ways at Virginia Ave.
4,2020-01-02 11:57:34,38.9111,-76.9983,Washington,DC,300, Penn St NE,Closed between 4th St NE/Brentwood Park and Fairview Ave NE - Road closed due to accident.
2,2020-12-14 21:26:30,38.8575,-76.9938,Washington,DC,,Suitland Pkwy E,Slow traffic from Firth Sterling Ave (Suitland Pkwy) to Stanton Rd (Suitland Pkwy) due to accident.
2,2019-10-25 18:19:55,38.9752,-77.036,Washington,DC,7034, Alaska Ave NW,At 16th St NW - Accident.
4,2019-05-08 19:47:44,38.9419,-77.0297,Washington,DC,1299, Upshur St NW,Closed at 14th St NW - Road closed due to accident.
4,2018-06-08 22:21:30,38.8982,-76.9883,Washington,DC,1298, Maryland Ave NE,Closed at H St NE - Road closed due to accident.
2,2020-12-12 19:43:13,38.8865,-77.0135,Washington,DC,,I-395 S,Incident on I-395 SB near I-395 Drive with caution.
4,2020-04-21 10:48:18,38.9141,-76.9751,Washington,DC,1999, Montana Ave NE,Closed between Bladensburg Rd Ne and US-50/US-1-ALT/New York Ave NE - Road closed due to accident.
2,2020-11-27 21:10:27,38.8784,-76.993,Washington,DC,,I-695 N,Incident on I-695 WB near I-695 Drive with caution.
2,2019-07-16 20:19:40,38.8619,-76.959,Washington,DC,3321,Alabama Ave SE,Accident on Branch Ave at Alabama Ave.
4,2020-03-05 09:59:17,38.9308,-76.971,Washington,DC,3120, South Dakota Ave NE,Closed between 26th St NE and Lawrence St NE - Road closed due to accident. Police activity ongoing.
2,2018-09-27 17:35:38,38.8627,-77.0002,Washington,DC,,I-295 N,At Suitland Pky/Exit 3 - Accident.
2,2020-11-25 22:39:32,38.8788,-76.961,Washington,DC,3209, Minnesota Ave SE,Incident on MINNESOTA AVE near MINNESOTA AVE Drive with caution.
2,2020-10-19 23:41:54,38.8825,-77.0156,Washington,DC,,I-395 S,Incident on I-395 SB near I-395 Drive with caution.
2,2017-08-25 15:43:30,38.905,-77.0706,Washington,DC,3571, M St NW,At MacArthur Blvd - Accident.
2,2020-09-23 16:26:49,38.881,-77.006,Washington,DC,,I-695 N,Incident on I-395 NB near I-395 Drive with caution.
4,2019-01-18 03:36:43,38.9887,-77.0363,Washington,DC,7929, 16th St NW,Closed at 16th St - Road closed due to accident.
2,2016-09-15 09:02:36,38.9363,-77.0243,Washington,DC,,Rock Creek Church Rd NW,At Kenyon St NW - Accident.
2,2020-04-20 20:10:33,38.9048,-77.0159,Washington,DC,398, New York Ave NW,At US-50/New York Ave NW - Accident. Left lane blocked.
4,2017-11-07 05:55:15,38.9026,-77.0371,Washington,DC,,K St NW,Closed at 17th St NW - Road closed due to accident.
2,2020-06-25 12:04:25,38.9163,-77.0219,Washington,DC,700, Florida Ave NW,At US-1/Rhode Island Ave NW - Accident.
2,2018-12-27 08:50:45,38.8764,-76.978,Washington,DC,,Pennsylvania Ave SE,Accident on DC-295 Southbound after Exits 1A 1B 1D Pennsylvania Ave.
2,2018-01-16 16:28:08,38.876,-76.931,Washington,DC,5098, Benning Rd SE,At Benning Rd SE - Accident.
3,2020-04-20 16:42:25,38.9048,-77.0159,Washington,DC,398, New York Ave NW,At US-50/New York Ave NW - Accident.
2,2020-10-31 02:20:17,38.879,-77.0334,Washington,DC,,I-395 N,Incident on I-395 NB near I-395 Drive with caution.
2,2020-10-06 13:38:00,38.9141,-77.0167,Washington,DC,,Florida Ave NW,Stationary traffic on US-1 from US-29/7th St (Rhode Island Ave/US-1) to N Capitol St NW (Rhode Island Ave/US-1) due to accident.
2,2016-06-23 19:02:12,38.9067,-76.9389,Washington,DC,1203, Kenilworth Ave NE,Between Polk St and Eastern Ave - Accident.
3,2020-06-06 21:12:38,38.8732,-77.0422,Washington,DC,,I-395 N,Between GW Pky/Exit 11 and US-1 - Accident.
3,2017-01-25 06:50:16,38.8825,-77.0253,Washington,DC,,I-395 S,Lane blocked due to accident on I-395 Westbound at Exits 3 4 G St.
2,2019-06-12 09:50:29,38.8702,-76.9506,Washington,DC,3817,Carpenter St SE,Accident on 38th St between St and Carpenter St.
2,2017-12-21 18:20:30,38.8765,-76.991,Washington,DC,,I-695 S,At 8th St - Accident.
2,2020-09-17 12:49:30,38.8822,-77.0286,Washington,DC,,I-395 S,Queuing traffic on Southwest Fwy N - I-395 N - I-695 S from I-395 S to C St SW exit [6] due to accident.
2,2020-12-11 16:50:49,38.8453,-77.0072,Washington,DC,,I-295 N,Incident on I-295 NB near I-295 Drive with caution.
2,2020-10-30 23:50:02,38.9174,-77.0072,Washington,DC,53, Rhode Island Ave NE,Accident on N Capitol St NW (Rhode Island Ave/US-1) from 13th St/Brentwood Rd (Rhode Island Ave/US-1) to US-1.
2,2020-09-15 00:25:14,38.8533,-76.9833,Washington,DC,3033, Stanton Rd SE,Incident on SUITLAND PKY near SUITLAND PKY Drive with caution.
4,2019-12-28 13:15:34,38.9286,-77.0732,Washington,DC,2964, Wisconsin Ave NW,Closed at Observatory Cir NW - Road closed due to accident.
2,2018-06-20 09:13:43,38.9431,-77.0629,Washington,DC,3100, Van Ness St NW,At Van Ness St NW - Accident. Police directing traffic.
2,2020-11-11 08:50:10,38.8615,-76.9938,Washington,DC,2403,Sheridan Rd SE,Accident on Howard Rd at Sheridan Rd.
2,2019-06-25 07:49:26,38.9126,-77.009,Washington,DC,1700,N Capitol St NW,Accident on R St at North Capitol St.
2,2018-11-06 05:44:12,38.8823,-77.0219,Washington,DC,544, 7th St SW,At 6th St - Accident. Left lane blocked.
2,2020-12-03 20:04:15,38.8742,-76.9772,Washington,DC,,Anacostia Fwy N,Incident on DC-295 NB near EXIT 1A Drive with caution.
2,2018-02-05 17:08:36,38.941,-77.0617,Washington,DC,2994,Tilden St NW,Right lane blocked due to accident on Connecticut Ave Northbound at Tilden St.
2,2019-05-30 11:42:49,38.9172,-76.9772,Washington,DC,1867, New York Ave NE,At Montana Ave - Accident.
2,2016-12-01 05:29:50,38.9025,-77.009,Washington,DC,999,N Capitol St NE,Right lane blocked due to accident on Capitol St Southbound at N Capitol St.
2,2020-10-27 11:04:30,38.8607,-76.9943,Washington,DC,2530, Martin Luther King Jr Ave SE,Queuing traffic from Martin Luther King Jr Ave SE to Firth Sterling Ave SE due to accident.
2,2020-11-06 21:43:35,38.8718,-76.9821,Washington,DC,,Anacostia Fwy N,Incident on DC-295 near DC-295 Drive with caution.
2,2020-09-20 04:57:00,38.9025,-77.026,Washington,DC,1000, K St NW,Incident on 10TH ST near 10TH ST Drive with caution.
2,2019-08-07 14:26:46,38.9099,-76.9361,Washington,DC,,Kenilworth Ave N,At Eastern Ave - Accident. Lane blocked.
2,2020-11-24 22:12:16,38.866,-76.9918,Washington,DC,,I-695 S,Incident on I-295 SB near I-295 Drive with caution.
2,2020-12-15 22:46:40,38.9256,-76.9944,Washington,DC,,Franklin St NE,Incident on FRANKLIN ST near FRANKLIN ST Drive with caution.
2,2020-10-25 22:42:00,38.8918,-77.0628,Washington,DC,,I-66 W,Incident on I-66 WB near MM 75 Expect delays.
2,2017-01-31 10:03:46,38.8885,-77.0523,Washington,DC,,Ohio Dr SW,Center lane blocked due to accident on Arlington Memorial Brg Inbound at Lincoln Memorial Cir.
3,2020-06-24 16:13:29,38.8512,-76.9729,Washington,DC,2298, Alabama Ave SE,At MD-5/Branch Ave - Accident.
2,2020-11-30 22:45:56,38.866,-76.9916,Washington,DC,,I-695 N,Incident on I-695 WB near I-695 Drive with caution.
4,2018-02-05 08:01:03,38.8898,-76.9279,Washington,DC,,Division Ave NE,Closed between 52nd St SE and Central Ave - Road closed due to accident.
2,2020-11-23 09:36:00.000000000,38.8522,-76.9738,Washington,DC,,Suitland Pkwy W,Stationary traffic from Alabama Ave (Suitland Pkwy) to Firth Sterling Ave (Suitland Pkwy) due to accident.
2,2020-04-20 16:04:55,38.9049,-77.0159,Washington,DC,394, New York Ave NW,At US-50/New York Ave NW - Accident.
