Severity,Date/Time,Latitude,Longitude,City,State,Number,Street,Description
4,2018-06-06 07:44:45,38.9131,-77.0199,Washington,DC,,6th St NW,Closed between 6th St NW and R St NW - Road closed due to accident.
2,2019-02-13 10:21:34,38.9173,-76.9735,Washington,DC,,New York Ave NE,Lane blocked due to accident on US-50 New York Ave inbound at New York Ave.
3,2016-10-24 08:27:49,38.8792,-77.0359,Washington,DC,,US-1 N,Accident on I-395 Eastbound at Exits 1 2 US-1 14th St.
3,2020-04-12 18:23:20,38.9004,-76.9462,Washington,DC,,Kenilworth Ave S,At Burroughs Ave - Accident.
2,2018-07-27 06:26:28,38.9199,-76.9572,Washington,DC,2150,South Dakota Ave NE,Accident on South Dakota Ave at 33rd Pl.
3,2019-09-12 08:22:32,38.8641,-76.9949,Washington,DC,,I-295 S,Lane blocked due to accident on I-295 Northbound near Exit 4B Howard Rd.
2,2020-04-20 16:04:55,38.9049,-77.0159,Washington,DC,394, New York Ave NW,At US-50/New York Ave NW - Accident.
2,2017-04-04 07:13:50,38.8998,-76.9486,Washington,DC,716,Kenilworth Ter NE,Accident on Burnham Pl Westbound at Kenilworth Ter.
3,2017-07-24 07:57:46,38.9074,-77.0089,Washington,DC,,N Capitol St NE,Between N Capitol St and N St NW - Accident.
2,2020-12-31 05:00:30.000000000,38.8759,-76.9709,Washington,DC,,Anacostia Fwy S,Slow traffic on DC-295 S from Capitol St (DC-295) to Pennsylvania Ave (DC-295) due to accident.
3,2017-08-02 13:20:41,38.8694,-76.9884,Washington,DC,,I-695 N,Entry ramp to I-695 Westbound at Exits 5A 5B from I-295 Northbound closed due to rolled over tractor-trailor and spillage.
2,2020-09-24 11:06:30,38.9041,-77.0184,Washington,DC,,New York Ave NW,Stationary traffic on US-50 from US-1 Alt/US-50/6th St (New York Ave/US-50) to N Capitol St NE (New York Ave/US-50) due to accident.
3,2017-09-27 14:03:21,38.8826,-77.0218,Washington,DC,,7th St SW,Two lanes blocked and slow traffic due to accident on I-395 Southbound at 7th St.
2,2017-12-15 08:25:49,38.9568,-77.0582,Washington,DC,5101,27th St NW,Accident on Broad Branch Rd Northbound at 27th St.
2,2018-07-22 19:48:46,38.91,-76.936,Washington,DC,,Kenilworth Ave N,At Eastern Ave - Accident. Right lane blocked.
2,2020-09-17 03:27:00,38.7924,-77.0374,Washington,DC,,Capital Beltway E,I-95 OUTER LOOP AT MP 0 (WOODROW WILSON BRIDGE)
2,2018-05-02 08:35:37,38.9675,-77.0275,Washington,DC,,Georgia Ave NW,Left lane blocked due to accident on US-29 Georgia Ave Southbound at Piney Branch Rd.
2,2016-09-22 21:13:49,38.9048,-77.0687,Washington,DC,,Francis Scott Key Brg,At M St NW - Accident.
2,2017-07-24 08:46:07,38.9089,-77.0046,Washington,DC,,Florida Ave NE,2 right lane blocked due to accident on US-50 New York Ave Westbound at Florida Ave.
2,2020-05-07 10:49:34,38.8615,-76.9938,Washington,DC,2403, Sheridan Rd SE,Between Martin Luther King Jr Ave SE and I-295/Firth Sterling Ave SE - Accident.
2,2020-10-31 21:45:00,38.8708,-76.9855,Washington,DC,,Anacostia Fwy S,Stationary traffic on I-695 N from exit [1C] to M St SE exit [2] due to accident.
2,2018-01-18 06:51:16,38.853,-76.9842,Washington,DC,,Suitland Pkwy E,Left lane blocked due to accident on Suitland Pkwy Inbound at Stanton Rd.
4,2018-01-23 17:26:30,38.9,-76.982,Washington,DC,,Benning Rd NE,Closed at Maryland Ave NE/Bladensburg Rd NE - Road closed due to accident.
2,2020-11-27 14:10:13,38.8932,-77.0136,Washington,DC,229, 2nd St NW,Incident on 2ND ST near C ST Drive with caution.
2,2020-03-27 16:47:05,38.8741,-76.9774,Washington,DC,,Anacostia Fwy N,Between I-295/Exit 4 and Capitol St - Accident. Left lane blocked.
3,2019-08-07 10:17:37,38.8871,-77.0219,Washington,DC,202, 7th St SW,Between Maryland Ave SW and 7th St NW - Accident. Two lanes blocked.
3,2016-11-11 04:18:14,38.8824,-77.0139,Washington,DC,,I-395 N,Left lane closed due to multi-vehicle accident on I-695 Southwest Fwy Northbound at I-395. Use right lane.
2,2017-12-11 07:58:08,38.8768,-76.9778,Washington,DC,,Pennsylvania Ave SE,Between DC-295 and Southeast Fwy - Accident.
2,2017-08-09 08:10:56,38.8957,-76.9517,Washington,DC,,Kenilworth Ave S,Left lane closed due to accident on DC-295 Kenilworth Ave Northbound at Benning Rd.
4,2018-05-15 17:24:09,38.957,-77.071,Washington,DC,5180, Connecticut Ave NW,Closed at Chevy Chase Pkwy NW - Road closed due to accident.
2,2020-06-22 20:15:40,38.961,-77.0662,Washington,DC,5396, Nebraska Ave NW,At Nebraska Ave NW/Broad Branch Rd NW - Accident.
2,2020-11-14 02:05:03.000000000,38.9006,-76.946,Washington,DC,,Kenilworth Ave S,Incident on DC-295 near DC-295 Drive with caution.
3,2020-06-24 20:10:18,38.8785,-76.995,Washington,DC,,8th St SE,Entry ramp to I-695 Southbound from 8th St Se Southbound closed due to demonstration.
3,2020-05-11 15:10:21,38.8946,-76.953,Washington,DC,,Anacostia Fwy N,At Benning Rd - Accident.
2,2017-12-26 11:32:50,38.9004,-76.9461,Washington,DC,,Kenilworth Ave N,At Burroughs Ave - Accident. Right lane blocked.
4,2020-03-22 20:45:53,38.8778,-76.962,Washington,DC,3135, Minnesota Ave SE,Closed between Pennsylvania Ave SE and E Capitol St NE/Ridge Rd SE - Road closed due to accident.
2,2020-11-11 17:29:30,38.8188,-77.0178,Washington,DC,,I-295 S,Stationary traffic on I-295 S from Shepherd Pkwy/1st St (I-695/I-295) to DC--MD State Border (I-695/I-295) due to accident.
2,2020-06-15 13:03:42,38.8897,-76.914,Washington,DC,5993, E Capitol St SE,At Southern Ave - Accident.
4,2020-04-10 18:06:06,38.9258,-77.009,Washington,DC,,Girard St NE,Closed at Irving St - Road closed due to accident.
2,2020-10-30 17:45:13,38.8795,-77.0322,Washington,DC,,I-395 N,Incident on I-395 NB near I-395 Drive with caution.
2,2020-10-20 13:34:30,38.8825,-77.0261,Washington,DC,,Lenfant Plz SW,Slow traffic on I-395 from 7th St SW (I-395) to Ohio Dr (I-395) due to accident.
3,2017-02-22 10:03:00,38.8451,-77.0072,Washington,DC,,I-295 N,Left lane blocked due to accident on I-295 Northbound at Exit 2 Malcolm X Ave.
2,2020-09-22 19:41:30,38.8741,-77.0414,Washington,DC,,Arland D Williams Jr Memorial Bridge,Queuing traffic on I-395 from 11th St/Exit 11 (I-395) to 12th St (I-395) due to accident.
2,2020-11-18 21:01:26,38.8795,-77.0325,Washington,DC,,I-395 S,Incident on I-395 SB near I-395 Drive with caution.
2,2017-07-13 08:57:43,38.8897,-76.9446,Washington,DC,4109,E Capitol St SE,Left and center lane closed due to accident on Capitol St Inbound near 41st St.
2,2019-09-09 08:20:51,38.9037,-77.0142,Washington,DC,1101,New Jersey Ave NW,Accident on L St at New Jersey Ave.
2,2019-11-14 17:43:29,38.8507,-76.9752,Washington,DC,2098,Bruce Pl SE,Accident on Alabama Ave near 21st St.
2,2018-07-02 06:57:56,38.9053,-76.9404,Washington,DC,,Kenilworth Ave S,At Burroughs Ave - Accident. Left lane blocked.
2,2020-10-16 14:31:00,38.8469,-77.0081,Washington,DC,3150, S Capitol St SE,Stationary traffic from Malcolm X Ave/Macdill Blvd (S Capitol St SE) to Firth Sterling Ave/Defense Blvd (S Capitol St SW) due to accident.
2,2019-01-16 08:14:16,38.9256,-76.9762,Washington,DC,2773,20th St NE,Accident on 20th St at Franklin St.
2,2020-06-24 07:27:39,38.9108,-77.009,Washington,DC,,Florida Ave NE,At US-1/Rhode Island Ave NE - Accident.
4,2016-10-26 01:21:48,38.913,-76.9927,Washington,DC,1198, 9th St NE,Closed at Brentwood Pky NE - Road closed due to accident.
2,2020-09-10 12:06:30,38.8941,-77.014,Washington,DC,,I-395 N,Stationary traffic on I-395 from 2nd St/Washington Ave SW (I-395) to Massachusetts Ave (I-395) due to accident.
2,2019-07-02 06:51:03,38.8984,-76.9205,Washington,DC,623,56th St NE,Accident on Nannie Helen Burroughs Ave at Hayes St.
4,2020-04-10 17:00:59,38.9258,-77.009,Washington,DC,,Girard St NE,Closed at Irving St - Road closed due to accident.
4,2018-10-05 10:33:19,38.8508,-76.9747,Washington,DC,2145, Alabama Ave SE,Closed at 21st St SE - Road closed due to accident.
2,2018-10-16 07:05:58,38.8753,-76.9748,Washington,DC,,Anacostia Fwy S,Lane blocked due to accident on DC-295 Anacostia Fwy Southbound at Exit 1A Pennsylvania Ave.
2,2017-01-11 11:48:09,38.9024,-77.0285,Washington,DC,1198,K St NW,Accident on K St in Washington.
2,2017-02-03 16:40:59,38.8741,-76.9774,Washington,DC,,Anacostia Fwy N,At Pennsylvania Ave - Accident.
4,2018-02-12 16:10:42,38.9054,-77.0148,Washington,DC,,New Jersey Ave NW,Closed at New Jersey Ave NW - Road closed due to accident.
4,2020-05-10 21:16:56,38.8511,-76.9733,Washington,DC,2299, Alabama Ave SE,Closed at Suitland Pky SE - Road closed due to accident.
2,2020-12-22 01:57:23,38.9661,-77.0364,Washington,DC,,Sheridan St NW,Incident on 16TH ST near 16TH ST Drive with caution.
3,2020-06-01 09:57:58,38.9096,-77.024,Washington,DC,867, P St NW,At Mt Vernon Pl NW/Massachusetts Ave - Accident. Left lane blocked.
4,2020-05-12 19:46:26,38.9316,-77.108,Washington,DC,5227, Macomb St NW,Closed at Arizona Ave NW - Road closed due to accident.
2,2017-09-21 08:40:01,38.9119,-77.0091,Washington,DC,,Quincy Pl,At Florida Ave NW - Accident.
2,2020-12-25 12:11:07,38.9096,-77.009,Washington,DC,1501, N Capitol St NE,Incident on NORTH CAPITOL ST NB near P ST Drive with caution.
2,2020-11-18 01:34:27,38.8594,-76.959,Washington,DC,3303, Camden St SE,Incident on CAMDEN ST near BRANCH AVE Drive with caution.
2,2020-11-02 20:43:00,38.8718,-76.9821,Washington,DC,,Anacostia Fwy N,Slow traffic on DC-295 from I-295/Exit 4 (DC-295) to Capitol St (DC-295) due to accident.
4,2020-06-08 13:37:18,38.9238,-77.0297,Washington,DC,2605, 13th St NW,Closed at U St NW - Road closed due to accident.
2,2018-02-07 06:26:27,38.9321,-76.9724,Washington,DC,3394, South Dakota Ave NE,Between 24th St NE and Myrtle Ave NE - Accident. Lane blocked.
4,2018-01-24 09:54:58,38.9049,-77.0162,Washington,DC,,4th St NW,Closed between US-50/New York Ave NW and I-695 - Road closed due to accident. Construction work. Lane blocked.
3,2019-06-19 18:15:42,38.8922,-77.0602,Washington,DC,,I-66 E,Two lanes blocked due to accident on I-66 outbound at Roosevelt Bridge.
4,2018-06-08 22:21:30,38.9007,-76.9883,Washington,DC,813, 13th St NE,Closed at G St NE - Road closed due to accident.
2,2018-03-29 14:39:00,38.8921,-77.0266,Washington,DC,1055, Constitution Ave NW,Between 10th St NW and US-1/US-50/Constitution Ave NW - Accident. Left lane blocked. Center lane blocked.
2,2020-11-24 00:47:27,38.8787,-76.995,Washington,DC,,8th St SE,Incident on I-695 EB near I-695 Drive with caution.
2,2020-09-29 05:55:00,38.9187,-76.948,Washington,DC,,New York Ave E,Stationary traffic on US-50 from South Dakota Ave (New York Ave/US-50) to MD-295/Baltimore Washington Pkwy (New York Ave/US-50) due to accident.
2,2019-07-16 22:17:45,38.8825,-76.9911,Washington,DC,1107,Pennsylvania Ave SE,Accident on Pennsylvania Ave Northbound at 11th St.
2,2019-07-25 09:47:47,38.9126,-77.009,Washington,DC,1700,N Capitol St NW,Accident on North Capitol St at R St.
2,2020-06-03 15:59:51,38.9002,-77.0129,Washington,DC,800, New Jersey Ave NW,At Massachusetts Ave NW - Accident.
2,2019-05-07 17:38:07,38.9061,-77.0804,Washington,DC,1309, Foxhall Rd NW,At Canal Rd NW - Accident. Lane blocked.
3,2018-02-20 07:34:18,38.8225,-77.0166,Washington,DC,,Laboratory Rd SE,Right lane blocked due to accident on I-295 Northbound after Laboratory Rd.
2,2019-07-10 10:00:23,38.8798,-76.9656,Washington,DC,,Anacostia Fwy S,At Pennsylvania Ave - Accident. Lane blocked.
3,2018-09-28 06:32:28,38.8784,-76.962,Washington,DC,10, Randle Cir SE,At Randle Cir SE - Accident. Blocked ahead.
2,2017-01-06 06:24:05,38.9172,-76.9782,Washington,DC,,New York Ave NE,Delays due to accident on US-50 New York Ave at Montana Ave.
2,2020-06-01 07:31:26,38.9049,-77.0162,Washington,DC,,4th St NW,At I-395 - Accident.
2,2020-01-23 09:12:34,38.9307,-76.9578,Washington,DC,3288,Bladensburg Rd NE,Accident on Bladensburg Rd at Eastern Ave.
2,2018-05-29 15:51:33,38.904,-76.9809,Washington,DC,,Levis St NE,At Lyman Pl NE - Accident.
2,2020-09-26 18:31:04,38.8987,-77.0531,Washington,DC,,New Hampshire Ave NW,Incident on VIRGINIA AVE near VIRGINIA AVE Drive with caution.
2,2020-10-11 00:17:43,38.8512,-76.9731,Washington,DC,2288, Alabama Ave SE,Incident on ALABAMA AVE near ALABAMA AVE Drive with caution.
2,2020-12-10 02:39:00,38.8934,-76.9544,Washington,DC,,Anacostia Fwy N,Slow traffic on DC-295 N from Baker St (DC-295) to Nannie Helen Burroughs Ave (DC-295) due to accident.
2,2020-01-17 17:11:05,38.9363,-77.0297,Washington,DC,1131,Spring Rd NW,Accident on 13th St at Spring Rd.
3,2019-06-05 16:17:23,38.881,-77.0301,Washington,DC,,I-395 N,Right lane blocked due to accident on I-395 Northbound at Case Bridge.
2,2020-10-21 19:40:37,38.9126,-77.045,Washington,DC,1697, Connecticut Ave NW,Incident on CONNECTICUT AVE near CONNECTICUT AVE Drive with caution.
2,2019-03-27 10:15:10,38.8666,-77.0017,Washington,DC,1718,S Capitol St SE,Two lanes blocked due to accident on Capitol St inbound after Suitland Pkwy.
2,2018-04-03 18:36:56,38.873,-77.009,Washington,DC,,O St SW,At M St - Accident.
2,2019-04-09 08:47:12,38.9193,-76.9708,Washington,DC,,24th Pl NE,Accident on 24th Pl at Bladensburg Rd.
2,2020-10-23 11:01:30,38.9039,-77.0189,Washington,DC,,New York Ave NW,Stationary traffic on US-50 from US-1 Alt/US-50/6th St (New York Ave/US-50) to N Capitol St NE (New York Ave/US-50) due to accident.
2,2020-12-20 09:48:00,38.7926,-77.0386,Washington,DC,,Capital Beltway E,I-95 OUTER LOOP AT MP 0 (WOODROW WILSON BRIDGE)
2,2020-11-26 00:26:47,38.9048,-77.0162,Washington,DC,,I-395 S,Incident on I-395 SB near 3RD ST Drive with caution.
3,2018-10-29 08:50:42,38.9313,-77.056,Washington,DC,3138, Connecticut Ave NW,At Macomb St NW - Accident. Three lanes blocked.
4,2018-01-17 07:30:22,38.8366,-77.008,Washington,DC,3601, S Capitol St SE,Closed between I-295/Anacostia Fwy/Shepard Pky and Malcolm X Ave SE/MacDill Blvd SW - Road closed due to accident.
2,2018-04-27 16:20:02,38.9037,-77.009,Washington,DC,,L St NW,Accident on Capitol St at L St.
2,2020-09-22 21:28:55,38.8918,-76.956,Washington,DC,,Anacostia Fwy S,Incident on DC-295 near DC-295 Drive with caution.
2,2020-12-15 04:30:27.000000000,38.9044,-76.9415,Washington,DC,,Kenilworth Ave S,Incident on DC-295 near DC-295 Drive with caution.
2,2019-10-21 05:58:01,38.9007,-76.9458,Washington,DC,,Kenilworth Ave S,Left lane closed due to accident on DC-295 Southbound after Nannie Helen Burroughs Ave.
4,2019-06-04 07:36:57,38.8973,-76.95,Washington,DC,,Kenilworth Ave S,Closed between Benning Rd and Burroughs Ave - Road closed due to accident.
2,2020-05-20 04:05:28,38.8897,-76.9375,Washington,DC,,Benning Rd NE,At Benning Rd - Accident. Right lane blocked.
2,2020-12-06 22:41:15,38.9287,-77.0346,Washington,DC,1501, Irving St NW,Incident on IRVING ST near IRVING ST Drive with caution.
2,2019-04-22 19:29:48,38.8335,-77.0134,Washington,DC,,I-295 S,Between Chesapeake St/WB Exit 1 and Lab Rd/Shepherd Pky/EB Exit 1 - Accident. Right lane blocked.
2,2020-01-10 21:32:49,38.9089,-77.0046,Washington,DC,,New York Ave NE,Accident on US-50 New York Ave at Florida Ave.
2,2020-10-14 02:05:00,38.8824,-77.0259,Washington,DC,,I-395 N,Queuing traffic on Southwest Fwy N - I-395 N - I-695 S from I-395 S to C St SW exit [6] due to accident.
2,2020-09-26 18:22:30,38.8821,-77.0102,Washington,DC,,Southwest Fwy S,Stationary traffic on I-395 S - Southwest Fwy S - I-695 N from Southwest Fwy N / S Capitol St SE to 6th St SW exit [5] due to accident.
2,2018-05-27 16:10:39,38.9029,-77.0219,Washington,DC,701, Mount Vernon Pl NW,At US-1/US-50/6th St NW - Accident. Lane blocked.
2,2020-11-22 02:24:32,38.9213,-77.0091,Washington,DC,,Bryant St NW,Incident on N CAPITOL ST near N CAPITOL ST Drive with caution.
2,2017-12-22 06:13:00,38.867,-76.9909,Washington,DC,,Anacostia Fwy N,At 11th St Bridge - Accident. Right lane blocked.
2,2018-07-02 06:53:19,38.8957,-76.9517,Washington,DC,,Kenilworth Ave S,Heavy traffic and 1 left lane blocked due to accident on DC-295 Anacostia Fwy Southbound after 36th St.
2,2020-11-15 21:53:41,38.8941,-77.014,Washington,DC,,I-395 N,Incident on I-395 NB near I-395 Drive with caution.
2,2020-10-30 15:26:55,38.879,-77.0348,Washington,DC,,I-395 N,Incident on I-395 NB near EXIT 2 Drive with caution.
2,2020-10-21 02:47:19,38.8946,-76.9533,Washington,DC,,Kenilworth Ave S,Incident on DC-295 near DC-295 Drive with caution.
2,2019-02-07 05:25:26,38.8629,-76.9989,Washington,DC,,Suitland Pkwy W,Between I-295/Anacostia Fwy/Anacostia Park and S Capitol St SW - Accident. Right lane blocked.
2,2020-11-03 04:41:30.000000000,38.8652,-76.9925,Washington,DC,,I-295 S,Slow traffic on I-295 from I-695/DC-295 (I-695/I-295) to Suitland Pkwy/Exit 3 (I-695/I-295) due to accident.
2,2019-02-11 10:53:57,38.9088,-77.032,Washington,DC,1396,14th St NW,Accident on 14th St at Rhode Island Ave.
2,2019-06-04 19:44:36,38.8656,-76.9922,Washington,DC,,I-295 S,At Howard Rd/Exit 4B - Accident. Lane blocked.
2,2017-01-17 05:00:25,38.8893,-76.9597,Washington,DC,,Anacostia Fwy S,Left lane blocked due to accident on DC-295 Anacostia Fwy Southbound at Capitol St.
4,2020-10-14 00:07:59,38.833,-76.9918,Washington,DC,899, Xenia St SE,Closed road from 9th St SE to Washington due to accident.
4,2019-12-26 00:47:47,38.8732,-76.9496,Washington,DC,3800, Massachusetts Ave SE,Closed at Alabama Ave SE - Road closed due to accident.
2,2020-12-14 23:04:23,38.866,-76.9916,Washington,DC,,I-695 N,Incident on I-695 near I-695 Drive with caution.
4,2017-08-21 09:15:55,38.9015,-77.0199,Washington,DC,601, Massachusetts Ave NW,Closed at I St NW - Road closed due to accident.
3,2018-03-06 10:26:49,38.8642,-76.9944,Washington,DC,,I-295 S,Between Howard Rd/Exit 3B and Suitland Pky/Exit 3 - Accident.
2,2020-12-11 23:59:46,38.8722,-76.9817,Washington,DC,,Anacostia Fwy S,Incident on DC-295 SB near I-695 Drive with caution.
2,2020-12-01 02:30:30,38.8918,-76.956,Washington,DC,,Anacostia Fwy N,Incident on DC-295 near DC-295 Drive with caution.
3,2017-12-21 18:51:06,38.8822,-77.0286,Washington,DC,,I-395 S,Left lane blocked due to accident on I-395 Northbound at Exits 3 4 9th St.
3,2018-07-05 10:33:12,38.8387,-77.0088,Washington,DC,,I-295 N,Between Capitol St and Malcolm X Ave/Exit 2 - Accident. Left lane blocked.
2,2020-11-03 15:23:24,38.8921,-77.024,Washington,DC,182, 9th St NW,Incident on 9TH ST near 9TH ST Drive with caution.
2,2017-09-26 06:07:42,38.9373,-77.0065,Washington,DC,,N Capitol St,At Harewood Rd NW - Accident.
2,2019-01-16 09:55:28,38.9174,-76.9699,Washington,DC,,New York Ave NE,At Bladensburg Rd - Accident. Lane blocked.
2,2020-10-12 13:42:13,38.917,-76.9611,Washington,DC,,New York Ave NE,Incident on NEW YORK AVE near NEW YORK AVE Drive with caution.
4,2020-05-29 03:47:28,38.9136,-76.9911,Washington,DC,,Mount Olivet Rd NE,Closed at Bladensburg Rd NE - Road closed due to accident.
2,2020-05-01 08:04:47,38.8823,-77.0158,Washington,DC,,I-395 N,At I-695 - Accident.
2,2019-01-25 07:16:52,38.9379,-76.9669,Washington,DC,3848,Eastern Ave,Accident on Randolph St at Eastern Ave.
3,2017-03-06 09:13:35,38.8822,-77.0286,Washington,DC,,I-395 S,Accident on I-395 Northbound at Exits 3 4 G St.
2,2020-10-20 19:58:05,38.8823,-77.019,Washington,DC,,Southwest Fwy N,Incident on I-395 NB near I-395 Drive with caution.
4,2020-04-24 19:05:36,38.8631,-76.9728,Washington,DC,2402, Good Hope Rd SE,Closed at Minnesota Ave SE - Road closed due to accident.
2,2017-11-29 19:41:38,38.8651,-76.9927,Washington,DC,,I-295 S,At Howard Rd/Exit 3B - Accident.
3,2019-05-03 20:05:01,38.9006,-77.057,Washington,DC,,Rock Creek and Potomac Pkwy NW,At Virginia Ave NW - Accident. Right lane blocked.
2,2018-09-04 07:56:55,38.9075,-77.0366,Washington,DC,,Scott Cir NW,Accident on Massachusetts Ave Westbound between 15th St and Scott Cir. Police directing traffic.
2,2020-07-21 20:14:05,38.8984,-76.9742,Washington,DC,2099, Benning Rd NE,At Oklahoma Ave NE - Accident.
2,2020-11-18 07:18:40,38.9066,-77.0346,Washington,DC,,15th St NW,Accident on 15th St at Massachusetts Ave.
4,2018-02-12 16:10:42,38.9045,-77.0144,Washington,DC,1127, New Jersey Ave NW,Closed at New York Ave NW - Road closed due to accident.
2,2020-03-21 18:06:38,38.8869,-77.0353,Washington,DC,1599, Maine Ave SW,At Independence Ave SW - Accident.
2,2020-12-11 14:58:19,38.9046,-76.9412,Washington,DC,,Kenilworth Ave NE,Incident on DC-295 near DC-295 Drive with caution.
2,2020-10-14 02:05:00,38.8824,-77.0261,Washington,DC,,Lenfant Plz SW,Queuing traffic on Southwest Fwy N - I-395 N - I-695 S from I-395 S to C St SW exit [6] due to accident.
1,2020-03-27 15:36:28,38.8448,-77.0072,Washington,DC,,I-295 N,At Malcolm X Ave/Exit 2 - Accident. Right lane blocked.
3,2017-01-31 07:41:43,38.9045,-77.009,Washington,DC,1113, N Capitol St NE,At US-50/New York Ave NE - Accident.
2,2020-03-23 06:18:39,38.8951,-76.9492,Washington,DC,3727, Benning Rd NE,At 44th St NE - Accident.
2,2020-12-29 13:26:30,38.8234,-77.0051,Washington,DC,4565, S Capitol St SE,Slow traffic on MD-210 from Galveston St SW / 1st St SE to Oxon Run Dr due to accident.
4,2019-06-20 19:52:26,38.8749,-76.9678,Washington,DC,2721, Minnesota Ave SE,Closed at 27th St SE - Road closed due to accident.
2,2020-06-18 07:37:17,38.8965,-76.9575,Washington,DC,599, 34th St NE,At DC-295/Kenilworth Ave NE - Accident.
3,2016-12-30 07:57:24,38.8825,-77.0198,Washington,DC,,Frontage Rd,Delays and right lane blocked due to accident on I-395 Northbound at 6th St.
3,2017-05-03 17:10:19,38.8631,-76.9996,Washington,DC,,Suitland Pkwy E,Delays expected and Right lane blocked due to accident on I-295 Southbound at Exits 3A 3B Suitland Pkwy.
2,2018-12-17 06:30:30,38.8764,-76.978,Washington,DC,,Pennsylvania Ave SE,Lane blocked due to accident on DC-295 Southbound at Exits 1A 1B 1D Pennsylvania Ave.
2,2020-10-17 19:41:57,38.8825,-77.0208,Washington,DC,,I-395 S,Incident on I-395 SB near I-395 Drive with caution.
3,2017-02-08 08:14:28,38.8824,-77.0139,Washington,DC,,I-395 N,Right lane blocked due to accident on I-395 Northbound at Exits 5 6 I-695 Southwest Fwy.
2,2020-11-06 21:09:57.000000000,38.8735,-77.042,Washington,DC,,Arland D Williams Jr Memorial Bridge,Incident on I-395 NB near I-395 Drive with caution.
4,2020-05-08 08:24:44,38.8357,-77.0078,Washington,DC,3733, S Capitol St SE,Closed at Atlantic St SE - Road closed due to accident.
2,2020-09-25 07:35:00,38.9099,-77.0019,Washington,DC,,New York Ave NE,Stationary traffic on US-50 from Brentwood Pkwy/Mount Olivet Rd (US-50) to Capitol St (US-50) due to accident.
3,2016-09-06 18:07:48,38.8626,-76.9971,Washington,DC,2549, Firth Sterling Ave SE,At Suitland Pky SE - Accident.
3,2018-02-27 13:49:20,38.8951,-76.9492,Washington,DC,3727, Benning Rd NE,At Minnesota Ave NE - Accident.
2,2020-10-14 02:05:00,38.883,-77.0313,Washington,DC,1348, Maine Ave SW,Stationary traffic on Southwest Fwy N - I-395 N from Maine Ave SW to C St SW exit [6] due to accident.
2,2020-12-04 03:58:00,38.8823,-77.0192,Washington,DC,,Southwest Fwy N,Stationary traffic on I-695 S from I-395 (I-695/I-295) to 6th St (I-695/I-295) due to accident.
2,2020-12-17 15:49:17,38.9606,-77.0454,Washington,DC,,Military Rd NW,Incident on MILITARY RD near MILITARY RD Drive with caution.
2,2020-09-10 21:40:45.000000000,38.8869,-77.0386,Washington,DC,,Independence Ave SW,Incident on INDEPENDENCE AVE near INDEPENDENCE AVE Drive with caution.
2,2020-11-30 04:22:00,38.8927,-76.9552,Washington,DC,,Anacostia Fwy S,Slow traffic on DC-295 S from Baker St (DC-295) to Pennsylvania Ave (DC-295) due to accident.
3,2020-07-31 12:47:00,38.876,-77.0421,Washington,DC,,George Mason Memorial Bridge,Two lanes blocked due to accident on I-395 Southbound on 14th St Bridge.
2,2020-11-02 07:24:58,38.8977,-76.9497,Washington,DC,,Kenilworth Ave S,Incident on DC-295 near DC-295 Drive with caution.
2,2019-02-22 19:20:58,38.8881,-76.9156,,DC,5909, Southern Ave,At 57th Pl SE - Accident.
4,2017-10-26 16:14:02,38.9432,-77.0693,Washington,DC,3521, Van Ness St NW,Closed at Reno Rd NW - Road closed due to accident.
2,2016-11-30 07:25:32,38.9304,-77.1118,Washington,DC,,Chain Brg,Accident on Canal Rd Inbound at Chain Brg.
2,2020-11-02 00:11:37,38.916,-76.9839,Washington,DC,1461, New York Ave NE,Incident on NEW YORK AVE near NEW YORK AVE Drive with caution.
2,2020-11-22 01:22:26.000000000,38.9037,-77.0319,Washington,DC,1076, 14th St NW,Incident on 14TH ST near 14TH ST Drive with caution.
2,2016-12-06 07:32:53,38.9173,-76.9726,Washington,DC,,New York Ave NE,Right lane closed due to accident on Bladensburg Rd Southbound at New York Ave.
2,2017-03-10 18:43:55,38.8974,-76.95,Washington,DC,,Kenilworth Ave S,At Benning Rd - Accident.
4,2020-05-05 16:40:34,38.9531,-77.0276,Washington,DC,1171, Hamilton St NW,Closed at Arkansas Ave NW - Road closed due to accident.
2,2019-04-23 08:13:17,38.8822,-77.0259,Washington,DC,,I-395 N,At 12th St SW/Maine Ave SW - Accident. Lane blocked.
2,2016-12-06 16:44:51,38.8899,-76.9376,Washington,DC,,Benning Rd NE,At Capitol St - Accident.
2,2020-11-09 18:38:47,38.8835,-76.9635,Washington,DC,,Anacostia Fwy N,Incident on DC-295 near DC-295 Drive with caution.
2,2020-10-12 16:58:00,38.9135,-77.0975,Washington,DC,4694, Canal Rd NW,Stationary traffic from MacArthur Blvd (Canal Rd) to Arizona Ave (Canal Rd) due to accident.
3,2020-04-22 15:22:01,38.8846,-77.0126,Washington,DC,,I-395 S,At I-695 - Accident. Right lane blocked.
3,2018-12-18 07:37:38,38.8825,-77.024,Washington,DC,,I-395 S,Center lane blocked due to accident on I-395 Westbound at Exits 3 4 5 6 7 I-695.
2,2020-12-10 23:00:49,38.8918,-76.956,Washington,DC,,Anacostia Fwy S,Incident on DC-295 near DC-295 Drive with caution.
2,2020-10-28 00:25:49,38.9526,-77.0363,Washington,DC,,Colorado Ave NW,Incident on 16TH ST near 16TH ST Drive with caution.
2,2020-09-10 21:56:00,38.8825,-77.0179,Washington,DC,,I-395 S,Slow traffic on I-395 from I-695 (I-395) to Ohio Dr (I-395) due to accident.
3,2020-06-07 15:26:54,38.8821,-77.0288,Washington,DC,1300, Maine Ave SW,At I-395/Southwest Fwy/12th St SW - Accident. Three lanes blocked.
2,2019-07-08 11:35:49,38.9155,-77.0943,Washington,DC,4786,MacArthur Blvd NW,Accident on Macarthur Blvd at Reservoir Rd.
2,2019-09-07 12:58:22,38.9231,-76.9902,Washington,DC,1116,Rhode Island Ave NE,Accident on US-1 Rhode Island Ave both ways at 12th St.
3,2020-05-24 12:04:28,38.8921,-77.0417,Washington,DC,1768, Constitution Ave NW,At 17th St NW - Accident.
