Severity,Date/Time,Latitude,Longitude,City,State,Number,Street,Description
2,2020-09-23 10:39:00,38.9263,-77.0121,Washington,DC,2699, 1st St NW,Queuing traffic from Washington Hospital Center Rd / 1st St NW to Girard St NE due to accident.
2,2019-07-12 11:27:24,38.939,-77.0364,Washington,DC,3884,16th St NW,Accident on 16th St at Arkansas Ave.
3,2019-01-09 10:20:31,38.9013,-77.0296,Washington,DC,898, 13th St NW,At I St NW - Accident investigation work. Blocked ahead.
2,2019-12-08 14:02:22,38.9172,-76.9781,Washington,DC,,New York Ave NE,Left lane blocked due to accident on US-1-ALT New York Ave both ways at West Virginia Ave.
2,2018-10-26 20:31:29,38.8661,-76.9916,Washington,DC,,I-295 N,At I-695 - Accident. Left lane blocked.
2,2018-06-14 14:18:24,38.9021,-77.024,Washington,DC,,9th St NW,Left lane blocked due to accident on New York Ave at 9th St.
2,2018-03-29 18:15:48,38.909,-77.0516,Washington,DC,,Rock Creek Pkwy,At P St NW - Accident. Left lane blocked.
2,2020-05-28 14:34:10,38.9101,-76.9361,Washington,DC,,Kenilworth Ave N,At Polk St - Accident.
3,2020-06-11 10:41:17,38.8662,-76.9917,Washington,DC,,I-695 N,At Howard Rd/Exit 4B - Accident.
2,2017-09-25 11:39:57,38.8732,-77.0422,Washington,DC,,I-395 N,At Memorial Bridge - Accident. Left lane blocked.
3,2018-03-26 16:43:18,38.8792,-77.0359,Washington,DC,,US-1 N,Lane blocked due to accident on I-395 Northbound at Exits 1 2 US-1 14th St.
2,2020-06-24 18:23:25,38.8935,-77.0435,Washington,DC,378, 19th St NW,At E St NW - Accident.
3,2018-01-11 14:29:39,38.8835,-77.0124,Washington,DC,,I-395 N,Left lane blocked due to accident on I-395 Northbound before 3rd St Tunnel.
3,2018-02-26 20:02:05,38.8733,-77.042,Washington,DC,,I-395 N,Between Arland D Williams Jr Memorial Brg and US-1 - Accident. Right lane blocked.
2,2019-09-16 09:22:51,38.9303,-77.1118,Washington,DC,5348,Canal Rd NW,Right lane blocked due to accident on Clara Barton Pkwy inbound at Chain Bridge.
2,2019-03-25 08:00:57,38.9506,-77.0089,Washington,DC,4962, N Capitol St,At Crittenden St NE - Accident. Lane blocked.
2,2020-11-11 14:59:30,38.9248,-77.1071,Washington,DC,5132, Canal Rd NW,Stationary traffic from Arizona Ave (Canal Rd) to Chain Bridge (Canal Rd) due to accident.
2,2020-11-28 18:56:00,38.9017,-76.9448,Washington,DC,,Kenilworth Ave S,Stationary traffic on DC-295 S from Polk St (DC-295) to Capitol St (DC-295) due to accident.
2,2020-06-29 14:15:25,38.9299,-76.9701,Washington,DC,2500, Myrtle Ave NE,At Bladensburg Rd NE - Accident.
2,2020-10-24 21:39:45,38.9058,-77.0133,Washington,DC,,New York Ave NW,Incident on NEW YORK AVE near NEW YORK AVE Drive with caution.
2,2019-04-23 08:21:59,38.9126,-77.0452,Washington,DC,,R St NW,Accident on Connecticut Ave at R St.
3,2018-12-12 19:41:37,38.8795,-77.0367,Washington,DC,,I-395 S,Accident on I-395 Northbound at Exit 2 I-395 Hov Ln.
4,2018-06-11 06:19:24,38.8998,-77.0204,Washington,DC,608, H St NW,Closed at 7th St NW - Road closed due to accident.
2,2020-09-13 02:23:22,38.9072,-77.0501,Washington,DC,2229, N St NW,Incident on N ST near N ST Drive with caution.
3,2018-05-29 09:21:09,38.8941,-77.0532,Washington,DC,,I-66 E,Left lane blocked due to accident on I-66 Eastbound at US-50.
2,2020-04-09 07:43:14,38.9183,-76.9549,Washington,DC,,New York Ave E,At US-50/New York Ave NE - Accident. Left lane blocked.
2,2020-05-11 17:37:10,38.8992,-77.0142,Washington,DC,,I-395 S,Ramp to I-395 Southbound - Accident.
4,2020-04-17 18:36:50,38.913,-77.0199,Washington,DC,1710, 6th St NW,Closed at L St NW - Road closed due to accident.
4,2018-02-05 08:43:50,38.8898,-76.9239,Washington,DC,,54th St SE,Closed between 57th Pl NE and 50th St NE - Road closed due to accident.
2,2019-03-18 07:37:57,38.8747,-77.0433,Washington,DC,,George Mason Memorial Bridge,Left hand shoulder blocked due to accident on I-395 Northbound at Exit 10C George Washington Memorial Pkwy.
2,2019-09-27 09:09:46,38.8823,-77.0106,Washington,DC,,Southwest Fwy S,Ramp to I-395 Northbound - Accident.
2,2020-11-18 04:01:43,38.866,-76.9918,Washington,DC,,I-695 S,Incident on I-295 SB near I-295 Drive with caution.
4,2020-11-17 03:52:15,38.8554,-76.9625,Washington,DC,2800, 31st St SE,Closed road from Gainesville St SE / Merini St SE to Erie St SE due to accident.
2,2019-02-28 08:22:21,38.8898,-76.938,Washington,DC,,Texas Ave SE,Accident on Capitol St at Texas Ave.
2,2019-12-15 08:22:32,38.8958,-76.9523,Washington,DC,,Benning Rd NE,Accident on DC-295 Northbound at DC-295 / Benning Rd.
2,2020-10-26 14:13:44,38.8829,-77.0128,Washington,DC,,I-395 N,Incident on I-395 NB near I-395 Drive with caution.
4,2020-05-14 03:43:56,38.9068,-76.979,Washington,DC,,Bladensburg Rd NE,Closed at Maryland Ave NE/Benning Rd NE/H St NE - Road closed due to accident.
2,2020-04-20 17:01:17,38.9049,-77.0162,Washington,DC,,4th St NW,At I-395 - Accident. Right lane blocked.
2,2019-12-04 06:13:21,38.8292,-77.0077,Washington,DC,,S Capitol St SE,Accident on Capitol St both ways between Mississippi Ave and Chesapeake St.
2,2020-09-15 13:28:03,38.9056,-77.009,Washington,DC,,M St NE,Stationary traffic from H St (N Capitol St NE) to US-1/Rhode Island Ave (N Capitol St NE) due to accident.
3,2018-11-16 14:57:42,38.8792,-77.0359,Washington,DC,,US-1 N,Right lane blocked due to accident on I-395 Northbound at Exits 1 2 US-1 14th St.
3,2019-10-04 10:54:55,38.8746,-76.973,Washington,DC,,Pennsylvania Ave SE,At DC-295 - Accident.
2,2018-03-29 07:56:16,38.8956,-77.0142,Washington,DC,,I-395 S,Between Massachusetts Ave and D St - Accident.
2,2018-10-22 03:04:27,38.8873,-76.9621,Washington,DC,,Anacostia Fwy S,Between Capitol St and 11th St Bridge - Accident.
2,2020-10-21 21:42:47,38.8876,-77.028,Washington,DC,,12th St NW,Incident on INDEPENDENCE AVE near INDEPENDENCE AVE Drive with caution.
2,2019-03-28 08:15:01,38.9547,-77.0696,Washington,DC,4999,Connecticut Ave NW,Accident on Connecticut Ave at Fessenden St.
2,2019-08-05 16:15:27,38.9002,-76.9855,Washington,DC,800,14th St NE,Right lane blocked due to accident on H St Eastbound from 13th St to 14th St.
2,2020-04-24 08:12:18,38.8709,-76.9888,Washington,DC,,I-695 N,At 11th St Bridge - Accident.
4,2020-05-13 16:56:47,38.8733,-76.9709,Washington,DC,2451, Minnesota Ave SE,Closed at Pennsylvania Ave SE - Road closed due to accident.
2,2019-07-24 09:45:04,38.8751,-76.9675,Washington,DC,2727,Minnesota Ave SE,Accident on Minnesota Ave at Anacostia Rd.
2,2019-07-11 08:17:32,38.8987,-77.053,Washington,DC,,New Hampshire Ave NW,Accident on Virginia Ave at New Hampshire Ave.
4,2019-09-11 08:36:22,38.9191,-77.1006,Washington,DC,4885, Canal Rd NW,Closed at Arizona Ave - Road closed due to accident.
2,2020-05-29 08:12:24,38.885,-77.0199,Washington,DC,395,6th St SW,Accident on 6th St at Virginia Ave.
2,2018-03-06 17:48:37,38.8921,-77.0502,Washington,DC,,23rd St NW,Between Potomac River Fwy/23rd St and 17th St - Accident.
2,2019-01-23 11:33:15,38.9621,-77.0803,Washington,DC,4050,Legation St NW,Accident on 41st St at Military Rd.
3,2017-01-21 21:32:16,38.8638,-76.947,Washington,DC,4040, Pennsylvania Ave SE,At Southern Ave - Accident.
2,2020-12-03 22:06:49,38.917,-76.9611,Washington,DC,,New York Ave NE,Incident on NEW YORK AVE near NEW YORK AVE Drive with caution.
2,2020-10-27 11:04:30,38.8588,-76.9936,Washington,DC,,Suitland Pkwy W,Slow traffic from Stanton Rd SE to Firth Sterling Ave SE due to accident.
2,2018-01-30 19:22:03,38.8827,-76.9911,Washington,DC,1104, Pennsylvania Ave SE,At 12th St SE - Accident.
4,2020-04-21 10:15:26,38.9141,-76.9751,Washington,DC,1999, Montana Ave NE,Closed between Bladensburg Rd Ne and US-50/US-1-ALT/New York Ave NE - Road closed due to accident.
3,2018-11-14 09:50:06,38.8792,-77.0359,Washington,DC,,US-1 N,Lane blocked due to accident on I-395 Northbound before Exits 1 2 US-1 14th St.
2,2020-12-31 05:06:11,38.8735,-77.042,Washington,DC,,Arland D Williams Jr Memorial Bridge,Incident on I-395 NB near I-395 Drive with caution.
2,2020-11-14 02:21:35,38.8791,-76.9967,Washington,DC,,I-695 S,Incident on I-695 EB near I-695 Drive with caution.
2,2020-04-15 18:32:10,38.9624,-77.0364,Washington,DC,1599, Missouri Ave NW,At 16th St NW/Military Rd NW - Accident.
2,2020-10-28 19:35:30,38.9123,-76.9342,,DC,,Eastern Ave,Stationary traffic on DC-295 from Eastern Ave (DC-295) to Nannie Helen Burroughs Ave (DC-295) due to accident.
4,2020-03-20 15:07:22,38.8656,-76.9513,Washington,DC,3799, Alabama Ave SE,Closed at Branch Ave - Road closed due to accident.
3,2020-05-15 17:28:19,38.8878,-76.9618,Washington,DC,,Anacostia Fwy S,Between Baker St and Pennsylvania Ave - Accident.
2,2016-11-09 08:03:02,38.9424,-77.008,Washington,DC,,Harewood Rd NW,Accident on Capitol St Southbound at Clermont Dr.
4,2020-05-08 16:33:45,38.8978,-76.9695,Washington,DC,,Oklahoma Ave NE,Closed at Maryland Ave NE/Bladensburg Rd NE - Road closed due to accident.
2,2020-05-28 06:01:16,38.8672,-76.96,Washington,DC,1898, Branch Ave SE,At Pennsylvania Ave SE - Accident.
2,2020-12-30 18:25:24,38.8527,-77.0063,Washington,DC,,I-295 S,Incident on I-295 SB near I-295 Drive with caution.
3,2019-09-26 08:54:42,38.8876,-77.0035,Washington,DC,204, Independence Ave SE,Between Independence Av SE and Minnesota Ave - Accident.
3,2018-07-13 09:48:39,38.8469,-76.9803,Washington,DC,1598, Alabama Ave SE,At Stanton Rd SE - Accident. Blocked ahead.
2,2016-10-04 09:03:17,38.9248,-77.0365,Washington,DC,1611,Fuller St NW,Accident on 16th St at Fuller St.
2,2020-10-30 12:03:30,38.9264,-76.9665,Washington,DC,2707, South Dakota Ave NE,Slow traffic from US-1/Rhode Island Ave (South Dakota Ave) to US-50/New York Ave (South Dakota Ave) due to accident.
2,2020-05-20 10:59:51,38.9,-76.9828,Washington,DC,1511, Benning Rd NE,At Oklahoma Ave NE - Accident. Right lane blocked.
2,2020-11-11 22:23:46,38.8825,-77.0172,Washington,DC,,I-395 S,Incident on I-395 SB near I-395 Drive with caution.
2,2020-04-28 18:01:36,38.8548,-76.9657,Washington,DC,2999, Naylor Rd SE,At Southern Ave SE - Accident.
3,2017-06-25 10:03:23,38.8792,-77.0359,Washington,DC,,US-1 N,Right lane blocked due to accident on I-395 Northbound at Exits 1 2 US-1.
4,2017-10-13 06:58:52,38.902,-77.0561,Washington,DC,,27th St NW,Closed at US-29/Whitehurst Fwy/K St NW - Road closed due to accident.
2,2020-12-07 14:38:30,38.9096,-77.0303,Washington,DC,,Logan Cir NW,Stationary traffic from Vermont Ave/13th St (Rhode Island Ave/US-1) to Massachusetts Ave/16th St (Rhode Island Ave/US-1) due to accident.
2,2020-10-12 20:51:56,38.8674,-76.9905,Washington,DC,,Anacostia Fwy N,Incident on DC-295 NB near I-695 Drive with caution.
3,2018-11-21 05:35:26,38.8451,-77.0072,Washington,DC,,I-295 N,Left hand shoulder blocked due to accident on I-295 Northbound at Exit 2 Malcolm X Ave.
3,2020-05-15 18:09:13,38.8878,-76.9618,Washington,DC,,Anacostia Fwy S,Between Baker St and Pennsylvania Ave - Accident. Hard shoulder blocked.
3,2019-06-26 09:12:23,38.8957,-76.9519,Washington,DC,,Benning Rd NE,Between DC-295/Kenilworth Ave NE and 34th St NE - Accident. Two lanes blocked.
2,2020-12-18 06:06:04,38.8823,-77.019,Washington,DC,,Southwest Fwy N,Incident on I-695 EB near I-695 Drive with caution.
4,2020-06-08 21:33:39,38.8997,-76.9815,Washington,DC,799, 16th St NE,Closed at Oklahoma Ave NE - Road closed due to accident.
3,2018-05-23 08:51:11,38.8825,-77.0179,Washington,DC,,I-395 S,Between 6th St and 12th St/Maine Ave - Accident.
3,2020-05-11 15:46:41,38.8946,-76.953,Washington,DC,,Anacostia Fwy N,At Benning Rd - Accident.
2,2020-11-24 14:40:39,38.9172,-76.9772,Washington,DC,1911, New York Ave NE,Incident on NEW YORK AVE near NEW YORK AVE Drive with caution.
2,2020-10-02 12:31:30,38.883,-77.0313,Washington,DC,1348, Maine Ave SW,Stationary traffic on Southwest Fwy N - I-395 N - I-695 S from Maine Ave SW to C St SW exit [6] due to accident.
2,2018-06-14 08:19:28,38.8897,-76.9178,Washington,DC,5801,E Capitol St SE,Left lane blocked due to accident on Capitol St Westbound at 58th St.
3,2017-11-29 19:38:15,38.8948,-77.0141,Washington,DC,,I-395 N,Right lane blocked due to accident on I-395 Southbound before Exits 9 10 D St.
4,2019-10-24 13:01:50,38.8895,-76.9758,Washington,DC,1990, E Capitol St SE,Closed at 22nd St SE - Road closed due to accident. Police activity ongoing.
2,2020-12-01 18:37:10.000000000,38.8738,-76.9338,Washington,DC,4600, Southern Ave,Incident on SOUTHERN AVE near SOUTHERN AVE Drive with caution.
4,2018-02-25 06:17:04,38.863,-76.996,Washington,DC,901, Howard Rd SE,Closed at Anacostia Fwy/Howard Rd SE - Road closed due to accident.
2,2020-11-19 08:00:22,38.8308,-77.0077,Washington,DC,4009,S Capitol St SE,Accident on Atlantic St at Capitol St.
2,2016-08-15 06:09:17,38.9096,-77.0504,Washington,DC,,P St NW,Lane blocked due to accident on Rock Creek Pkwy Northbound at P St.
2,2020-11-11 17:30:04,38.8188,-77.0178,Washington,DC,,I-295 S,Incident on I-295 SB near I-295 Drive with caution.
2,2018-01-31 12:23:33,38.8709,-76.9888,Washington,DC,,I-695 N,Between Southeast Fwy and 11th St Bridge - Accident. Vehicle fire.
2,2020-12-18 05:08:30,38.8823,-77.0192,Washington,DC,,Southwest Fwy N,Stationary traffic on I-695 S from I-395 (I-695/I-295) to 6th St (I-695/I-295) due to accident.
2,2018-11-27 05:41:39,38.8893,-76.9597,Washington,DC,,Anacostia Fwy S,Accident on DC-295 Anacostia Fwy Southbound at Capitol St.
2,2018-01-09 06:39:57,38.9058,-77.0135,Washington,DC,,New York Ave NW,Right lane blocked due to accident on US-50 New York Ave Westbound at Kirby St.
2,2018-10-10 11:36:10,38.8732,-77.0422,Washington,DC,,I-395 N,At Memorial Bridge - Accident. Left lane blocked.
2,2018-10-19 06:15:56,38.9054,-77.0148,Washington,DC,,New York Ave NW,Left hand shoulder blocked due to accident on US-50 New York Ave both ways at New Jersey Ave.
3,2017-03-11 04:02:40,38.8538,-76.9817,Washington,DC,,Suitland Pkwy E,At Alabama Ave SE - Accident.
2,2020-05-05 16:55:45,38.9351,-77.0252,Washington,DC,838, Princeton Pl NW,At Park Rd NW/Monroe St NW - Accident.
2,2020-04-15 06:10:24,38.8704,-76.9866,Washington,DC,,Anacostia Fwy S,Exit ramp from DC-295 Southbound at Exits 1A 1B-C to I-695 Westbound lane blocked due to accident.
2,2020-09-29 19:00:35,38.8718,-76.9821,Washington,DC,,Anacostia Fwy N,Incident on DC-295 near DC-295 Drive with caution.
4,2020-06-20 06:35:52,38.8991,-76.978,Washington,DC,1753, Benning Rd NE,Closed at Oklahoma Ave NE - Road closed due to accident.
2,2018-05-15 17:42:30,38.8897,-76.9476,Washington,DC,3995,E Capitol St SE,Accident on Capitol St Eastbound at Stoddert Pl.
2,2020-11-10 19:06:30,38.8894,-77.0628,Washington,DC,,George Washington Memorial Pkwy N,Slow traffic from Memorial Ave (George Washington Pkwy) to I-66/US-50 (George Washington Pkwy) due to accident.
2,2020-05-28 14:13:01,38.9382,-77.06,Washington,DC,3701, Connecticut Ave NW,At Calvert St NW - Accident.
2,2020-04-07 07:00:12,38.8584,-76.993,Washington,DC,2620, Sheridan Rd SE,At Sheridan Rd SE - Accident.
2,2020-09-18 12:44:30,38.8823,-77.0222,Washington,DC,,I-395 N,Queuing traffic on I-395 from 9th St SW/Maine Ave (I-395) to 2nd St/Washington Ave SW (I-395) due to accident.
4,2020-01-15 06:25:39,38.8533,-76.9833,Washington,DC,,Stanton Rd SE,Closed at Firth Sterling Ave SE - Road closed due to accident.
2,2019-01-08 05:24:16,38.8918,-77.0647,Washington,DC,,I-66 E,Between US-50/Arlington Blvd/GW Pky and Theodore Roosevelt Memorial Brg - Accident. Hard shoulder blocked.
2,2017-07-07 07:58:16,38.8292,-77.0077,Washington,DC,,S Capitol St SE,Right lane closed due to accident on Capitol St Northbound at Chesapeake St.
2,2020-11-12 01:01:48,38.8677,-76.9904,Washington,DC,,I-695 N,Incident on I-695 near I-695 Drive with caution.
2,2020-09-25 19:21:06,38.8622,-76.9974,Washington,DC,,Suitland Pkwy E,Incident on SUITLAND PKWY EB near NULL Drive with caution.
2,2020-11-05 13:48:00,38.9089,-76.9372,Washington,DC,,Kenilworth Ave S,Slow traffic on DC-295 from Eastern Ave (DC-295) to Benning Rd (DC-295) due to accident.
2,2020-10-12 20:51:56,38.8674,-76.9905,Washington,DC,,Anacostia Fwy N,Incident on DC-295 NB near I-695 Drive with caution.
4,2019-09-11 08:36:22,38.9158,-77.0953,Washington,DC,4805, Reservoir Rd NW,Closed between MacArthur Blvd NW and Canal Rd NW - Road closed due to accident.
2,2016-09-27 19:14:49,38.9034,-77.0153,Washington,DC,,I-395 S,At K St NW - Accident.
2,2018-04-15 17:42:57,38.9053,-76.9404,Washington,DC,,Kenilworth Ave S,At Burroughs Ave - Accident.
3,2019-02-05 08:34:31,38.8709,-76.9842,Washington,DC,,Anacostia Fwy N,Between Anacostia Fwy and I-695 - Accident. Two lanes blocked.
2,2020-09-29 02:47:00,38.8771,-77.0385,Washington,DC,,Arland D Williams Jr Memorial Bridge,Queuing traffic on I-395 from 11th St/Exit 11 (I-395) to 12th St (I-395) due to accident.
2,2019-07-22 08:13:59,38.8312,-77.0059,Washington,DC,99,Atlantic St SE,Accident on Atlantic St at 1st St.
2,2020-10-24 10:13:47,38.8823,-77.0129,Washington,DC,,Southwest Fwy N,Incident on I-695 EB near EXIT 1A Drive with caution.
2,2019-01-07 08:30:17,38.9174,-76.9731,Washington,DC,,New York Ave NE,At Bladensburg Rd - Accident. Center lane blocked.
3,2020-04-22 17:35:23,38.8823,-77.0219,Washington,DC,,7th St SW,Between 12th St SW/Maine Ave SW and I-695 - Accident. Two lanes blocked.
2,2020-04-30 18:45:12,38.8935,-77.0501,Washington,DC,,23rd St NW,At I-66/US-50/Constitution Ave NW - Accident.
2,2020-12-11 01:21:59,38.8825,-77.0193,Washington,DC,,I-395 S,Incident on I-395 SB near I-395 Drive with caution.
3,2018-11-14 08:26:42,38.8822,-77.0286,Washington,DC,,I-395 S,Lane blocked and right hand shoulder blocked due to accident on I-395 Westbound near Exits 3 4 Frontage Rd.
2,2020-11-09 01:37:48,38.9269,-77.0068,Washington,DC,60, Michigan Ave NE,Incident on MICHIGAN AVE near MICHIGAN AVE Drive with caution.
2,2019-03-20 08:09:59,38.9105,-77.0049,Washington,DC,1,Harry Thomas Way NE,Accident on Eckington Pl between US-50 New York Ave and Harry Thomas Way.
2,2020-10-25 07:34:30,38.8753,-76.9745,Washington,DC,,Pennsylvania Ave SE,Incident on PENNSYLVANIA AVE near PENNSYLVANIA AVE Drive with caution.
4,2020-01-24 19:20:37,38.9186,-76.947,Washington,DC,,New York Ave W,Between South Dakota Ave/V St and Bladensburg Rd - Accident.
4,2019-06-07 17:40:30,38.9016,-76.9874,Washington,DC,1326, Florida Ave NE,Closed at Trinidad Ave NE - Road closed due to accident.
2,2020-12-14 22:54:28,38.8711,-76.9889,Washington,DC,,I-695 N,Incident on I-695 WB near I-695 Drive with caution.
2,2020-02-13 15:00:30,38.9002,-76.9949,Washington,DC,765,8th St NE,Accident on H St both ways at 8th St.
2,2020-09-20 18:37:30,38.8829,-77.0134,Washington,DC,,I-395 S,Queuing traffic on I-395 from 2nd St/Washington Ave SW (I-395) to Ohio Dr (I-395) due to accident.
2,2020-05-12 19:08:42,38.93,-77.1068,Washington,DC,5441, MacArthur Blvd NW,At DC/Maryland State Line - Accident.
2,2020-11-08 18:16:00,38.9024,-76.944,Washington,DC,,Kenilworth Ave S,Slow traffic on DC-295 from Polk St (DC-295) to Pennsylvania Ave (DC-295) due to accident.
2,2020-10-21 21:30:00,38.8812,-77.0071,Washington,DC,,Southwest Fwy S,Stationary traffic on I-295 from 6th St (I-695/I-295) to I-395 (I-695/I-295) due to accident.
2,2018-01-24 19:21:43,38.8447,-76.9885,Washington,DC,1299, Alabama Ave SE,At Stanton Rd SE - Accident.
2,2020-10-31 21:45:00,38.871,-76.9888,Washington,DC,,I-695 N,Slow traffic on I-295 from Howard Rd/Exit 3B (I-695/I-295) to 8th St (I-695/I-295) due to accident.
2,2020-11-23 04:43:43,38.9445,-77.0037,Washington,DC,4599,2nd St NE,Accident on Hawaii Ave at Fort Totten Dr.
2,2020-11-02 19:22:00,38.9056,-76.9401,Washington,DC,,Kenilworth Ave S,Slow traffic on DC-295 from Polk St (DC-295) to Pennsylvania Ave (DC-295) due to accident.
2,2020-12-07 04:07:34,38.9013,-77.0319,Washington,DC,1401, I St NW,Incident on 14TH ST near 14TH ST Drive with caution.
2,2020-10-09 03:12:19,38.883,-77.031,Washington,DC,1219, Maine Ave SW,Incident on MAINE AVE near MAINE AVE Drive with caution.
3,2020-06-24 20:17:31,38.8704,-76.9866,Washington,DC,,Anacostia Fwy S,Entry ramp to I-695 Westbound at Exits 1A 1B-C from DC-295 Southbound closed due to demonstration.
1,2020-05-06 18:22:43,38.8528,-76.9845,Washington,DC,,Suitland Pkwy E,At Stanton Rd SE - Accident.
2,2017-11-09 06:09:29,38.8983,-76.949,Washington,DC,,Kenilworth Ave S,Between Burroughs Ave and Benning Rd - Accident. Center lane blocked.
2,2020-10-26 13:53:30,38.8609,-77.0026,Washington,DC,,I-295 N,Stationary traffic on I-295 from Malcolm X Ave/2nd St/Exit 2 (I-695/I-295) to I-395 (I-695/I-295) due to accident.
2,2020-12-21 22:04:24,38.9214,-77.0508,Washington,DC,2501, Shoreham Dr NW,Incident on BEACH DR near BEACH DR Drive with caution.
2,2020-06-29 13:42:15,38.8662,-76.9819,Washington,DC,1933, 16th St SE,At 25th St SE/Naylor Rd SE - Accident.
3,2018-01-11 17:02:30,38.8695,-76.9886,Washington,DC,,11th St SE,Accident Motorcycle involved on DC-295 Anacostia Fwy Northbound at Exits 1A 1B-C 5C I-695. Police directing traffic.
2,2020-03-11 08:25:28,38.9019,-76.9426,Washington,DC,4171,Nannie Helen Burroughs Ave NE,Slow traffic due to accident on Nannie Helen Burroughs Ave at Minnesota Ave.
2,2020-04-07 06:07:24,38.8584,-76.9933,Washington,DC,2621,Sheridan Rd SE,Accident on Sheridan Rd both ways at Stanton Rd.
4,2019-04-30 18:08:49,38.9421,-77.0186,Washington,DC,445, Upshur St NW,Closed at New Hampshire Ave - Road closed due to accident.
2,2017-08-10 07:28:30,38.8709,-76.9888,Washington,DC,,I-695 N,Between Southeast Fwy and 11th St Bridge - Accident.
2,2019-12-17 08:53:45,38.8759,-76.9761,Washington,DC,1958, Pennsylvania Ave SE,At DC-295 - Accident.
2,2018-02-28 10:29:49,38.8645,-76.9932,Washington,DC,,I-295 N,Between Howard Rd/Exit 3B and DC-295 - Accident. Left lane blocked.
4,2020-12-11 05:02:04,38.8873,-76.9302,Washington,DC,126, 50th St SE,Closed road from 50th St SE to 49th St SE / 47th St SE due to accident.
2,2019-05-06 08:00:01,38.8876,-77.0219,Washington,DC,,7th St SW,Lane blocked due to accident on 7th St Northbound after Independence Ave.
2,2020-11-12 01:19:30,38.8769,-76.9907,Washington,DC,,I-695 N,Incident on I-695 WB near M ST Drive with caution.
2,2020-02-14 17:10:46,38.875,-76.9745,Washington,DC,,Pennsylvania Ave SE,Left lane blocked due to accident on DC-295 Northbound at Pennsylvania Ave.
2,2017-10-23 06:49:52,38.8518,-77.0069,Washington,DC,,I-295 S,At Malcolm X Ave/Exit 2 - Accident.
2,2020-09-19 17:13:00,38.8826,-77.0218,Washington,DC,,7th St SW,Slow traffic on I-395 from I-695 (I-395) to Ohio Dr (I-395) due to accident.
2,2020-12-11 21:40:02,38.8718,-76.9821,Washington,DC,,Anacostia Fwy N,Incident on DC-295 near DC-295 Drive with caution.
4,2018-02-14 02:08:33,38.9096,-76.9958,Washington,DC,597, Penn St NE,Closed between 6th St NE/Penn St NE and T St NE - Road closed due to accident.
2,2016-07-27 17:14:12,38.8778,-77.0091,Washington,DC,,S Capitol St SW,Accident on Capitol St Southbound at St.
2,2020-12-19 02:00:16,38.8723,-76.9901,Washington,DC,,I-695 S,Incident on DC-295 near DC-295 Drive with caution.
2,2020-06-19 17:53:25,38.9002,-77.032,Washington,DC,1399, H St NW,At New York Ave NW - Accident.
4,2017-08-18 06:17:25,38.9624,-77.0364,Washington,DC,1600, Missouri Ave NW,Closed at Manchester Pl NW - Road closed due to accident.
3,2019-06-26 08:22:29,38.8798,-77.032,Washington,DC,,I-395 S,Lane blocked due to accident on I-395 Eastbound after Exit 2 Ohio Dr.
2,2020-10-28 21:31:41,38.9024,-76.944,Washington,DC,,Kenilworth Ave S,Incident on DC-295 near DC-295 Drive with caution.
3,2017-02-13 06:06:30,38.8225,-77.0166,Washington,DC,,Laboratory Rd SE,At Lab Rd/Shepherd Pky/EB Exit 1 - Accident.
2,2020-11-06 19:30:32,38.8631,-76.9957,Washington,DC,,Howard Rd SE,Accident from Howard Rd SE / Firth Sterling Ave SE to I-295 N.
2,2020-06-22 13:05:01,38.9133,-77.009,Washington,DC,1721, N Capitol St NE,At US-1/Rhode Island Ave NE - Accident.
2,2020-11-23 06:09:35,38.875,-76.9744,Washington,DC,,Pennsylvania Ave SE,Accident on Pennsylvania Ave at DC-295 Exits 1A 1B 1D.
3,2020-06-19 12:09:15,38.8741,-76.9774,Washington,DC,,Anacostia Fwy N,Between I-295/Exit 4 and Capitol St - Accident.
2,2020-12-08 02:48:41,38.9333,-77.0365,Washington,DC,1580, Newton St NW,Accident from Park Rd (16th St) to Kennedy St/Morrow Dr (16th St).
2,2020-11-20 02:17:44,38.8754,-76.9736,Washington,DC,,Anacostia Fwy N,Incident on DC-295 near DC-295 Drive with caution.
2,2020-11-19 01:37:28,38.8718,-76.9821,Washington,DC,,Anacostia Fwy N,Incident on DC-295 near DC-295 Drive with caution.
3,2020-06-21 12:58:11,38.8741,-76.9774,Washington,DC,,Anacostia Fwy N,Between I-295/Exit 4 and Capitol St - Accident. Left lane blocked.
2,2020-12-28 21:19:52,38.8823,-77.023,Washington,DC,,I-395 N,Incident on I-395 NB near I-395 Drive with caution.
2,2020-11-02 23:15:53,38.8225,-77.0166,Washington,DC,,Laboratory Rd SE,Incident on LABORATORY RD near I-295 Drive with caution.
2,2017-09-29 15:28:03,38.8898,-76.963,Washington,DC,,E Capitol St NE,At DC-295/Anacostia Fwy - Accident.
2,2018-10-04 07:47:41,38.8448,-77.0072,Washington,DC,,I-295 N,At Malcolm X Ave/Exit 2 - Accident. Left lane blocked.
2,2017-10-26 08:09:31,38.8917,-76.9562,Washington,DC,,Anacostia Fwy S,At Capitol St - Accident.
2,2020-12-23 00:32:37,38.8823,-77.0129,Washington,DC,,Southwest Fwy N,Incident on I-695 near I-695 Drive with caution.
2,2018-02-28 10:42:35,38.9169,-77.0089,Washington,DC,,N Capitol St NE,At N Capitol St - Accident. Left lane blocked.
2,2020-12-10 20:33:30,38.8718,-76.9821,Washington,DC,,Anacostia Fwy N,Stationary traffic on DC-295 N from I-295/Exit 4 (DC-295) to Capitol St (DC-295) due to accident.
2,2020-11-16 18:58:57,38.9235,-76.9754,Washington,DC,2597, Queens Chapel Rd NE,Accident from Queens Chapel Rd NE to 22nd St NE.
2,2020-10-14 02:05:00,38.8823,-77.027,Washington,DC,,I-395 N,Stationary traffic on Southwest Fwy N - I-395 N from I-395 S to C St SW exit [6] due to accident.
4,2020-04-20 18:01:45,38.9335,-77.0858,Washington,DC,3315, New Mexico Ave NW,Closed at Tunlaw Rd NW - Road closed due to accident.
2,2020-11-21 20:49:31,38.8826,-77.0221,Washington,DC,,I-395 S,Incident on I-395 SB near I-395 Drive with caution.
