Severity,Date/Time,Latitude,Longitude,City,State,Number,Street,Description
2,2020-12-12 00:26:02,45.6964,-111.1855,Bozeman,MT,1752, Jackrabbit Ln,Incident on JACKRABBIT LN near BAXTER LN Drive with caution.
2,2020-12-11 15:26:02.000000000,48.1143,-114.601,Kila,MT,7399, US Highway 2 W,Incident on IDAHO HILL RD near US-2 Drive with caution.
2,2020-12-24 21:55:40,48.2404,-114.3203,Kalispell,MT,748, W Reserve Dr,Incident on RESERVE DR near COUNTRY WAY Drive with caution.
2,2020-10-22 15:17:30,45.6557,-110.8494,Bozeman,MT,,I-90 E,Stationary traffic on I-90 from Trail Creek Rd/Exit 316 (I-90) to Jackson Creek Rd/Exit 319 (I-90) due to accident.
2,2020-10-25 01:31:30,45.7705,-108.4869,Billings,MT,,I-90 E,Slow traffic on I-90 from MT-3/S 27th St/Exit 450 (I-90) to I-90 Bus/US-87/Exit 452 (I-90) due to accident.
2,2020-10-25 03:58:07,46.8328,-113.8239,Missoula,MT,,I-90 E,Incident on I-90 EB near MULLAN RD Drive with caution.
2,2020-10-23 17:22:05.000000000,47.7473,-114.2299,Polson,MT,2, Ranch Rd,Incident on US-93 near RANCH RD Drive with caution.
2,2020-11-13 22:42:18,47.1729,-114.8632,Superior,MT,,I-90 E,Incident on I-90 EB near RIVER BEND RD Drive with caution.
2,2020-10-26 15:09:50,45.7148,-111.1032,Bozeman,MT,2849, Harper Puckett Rd,Incident on HARPER PUCKET RD near HIDDEN VALLEY RD Drive with caution.
2,2018-08-21 13:56:52,46.2674,-106.4285,Rosebud,MT,,I-94 E,At Butte CR Rd/Exit 105 - Accident.
2,2020-12-16 08:32:03,47.3508,-115.2913,Saint Regis,MT,,I-90 E,Incident on I-90 EB near MM 18 Drive with caution.
2,2020-10-26 13:57:51,46.5471,-111.9477,Clancy,MT,,I-15 N,Incident on I-15 NB near MM 187 Drive with caution.
2,2020-12-30 16:10:45,48.2731,-114.2642,Kalispell,MT,3305, US Highway 2 E,Incident on US-2 near BOBCAT LN Drive with caution.
2,2020-11-18 01:43:13,46.7094,-112.1763,Helena,MT,6175, Birdseye Rd,Incident on BIRDSEYE RD near HICKORY RD Drive with caution.
2,2020-12-01 02:35:18,48.3257,-114.3358,Whitefish,MT,4567, Highway 93 S,Incident on US-93 near MEADOW LN Drive with caution.
2,2019-02-06 07:43:27,47.8335,-114.3472,Elmo,MT,31525, US Highway 93,At MT-28 - Accident. Roadway reduced to 1 lane. Lane blocked. Police activity ongoing.
2,2020-10-22 16:37:04,45.6855,-109.4618,Reed Point,MT,,I-90 W,Incident on I-90 WB near MM 400 Drive with caution.
2,2020-10-18 22:52:00,45.6653,-108.7577,Laurel,MT,,US-212 E,Incident on I-90 EB near LAUREL Expect long delays.
3,2017-03-02 03:07:11,45.4002,-105.3621,Broadus,MT,,US Highway 212,Between MT-59 (East) and MT-39 - Accident. Roadway reduced to 1 lane.
2,2020-12-18 09:45:13.000000000,48.3635,-114.1428,Columbia Falls,MT,598, Mabel St,Incident on BERNE RD near COLUMBIA MOUNTAIN RD Expect delays.
2,2017-02-05 09:15:32,47.0172,-114.6414,Alberton,MT,,I-90 W,At Fish CR Rd/Exit 66 - Accident.
2,2020-12-11 04:56:02,47.5229,-111.2816,Black Eagle,MT,1500, N River Rd,Incident on RIVER RD near 15TH ST Drive with caution.
2,2020-10-14 13:03:03,48.6793,-106.4793,Richland,MT,3677, MT Highway 24 N,Incident on MT-24 near ASLESON RD Drive with caution.
2,2020-09-25 04:37:04,47.2502,-112.1249,Wolf Creek,MT,,US Highway 287,Incident on MT-434 near MT-200 Drive with caution.
2,2020-11-07 12:38:31.000000000,47.8098,-112.1864,Choteau,MT,1, 3rd Ave NW,Incident on US-287 near 3RD ST Drive with caution.
2,2020-11-15 05:58:11,47.5042,-114.0969,Ronan,MT,35201, Bouchard Rd,Incident on US-93 near BOUCHARD RD Drive with caution.
2,2020-11-06 17:05:18,46.0235,-112.5415,Butte,MT,,Idaho St,Incident on IDAHO ST near MISSOULA AVE Drive with caution.
4,2017-07-13 13:42:16,46.2184,-107.2505,Forsyth,MT,,I-94 E,Closed at US-10/US-312/MT-311/Exit 67 - Road closed due to accident.
2,2016-12-14 07:22:10,47.5595,-111.5304,Power,MT,,MT-200,At US-89/MT-200/Exit 290 - Accident.
2,2020-11-18 20:50:47.000000000,46.9923,-114.4402,Alberton,MT,,I-90 W,Incident on I-90 WB near MM 77 Drive with caution.
2,2020-10-28 00:45:51,45.6297,-110.5805,Livingston,MT,15, Shamrock Ln,Incident on MILLER DR near SHAMROCK LN Drive with caution.
2,2017-09-08 13:54:06,47.4349,-111.5039,Great Falls,MT,,I-15 S,At Center St/Exit 270 - Accident.
2,2020-11-11 00:20:54,44.5614,-112.325,Lima,MT,,I-15 S,Incident on I-15 SB near MM 0 Drive with caution.
2,2020-10-12 22:00:43,48.2337,-106.5665,Glasgow,MT,,MT Highway 24 N,Incident on MT-24 near JOHNSON RD Expect delays.
2,2020-12-20 18:35:01,48.4216,-114.4635,Whitefish,MT,,Beaver Lake Rd,Incident on BEAVER LAKE RD near US-93 Drive with caution.
2,2020-12-28 20:46:43,46.5128,-114.0901,Stevensville,MT,3885, Eastside Hwy,Incident on EASTSIDE HWY near MT-203 Drive with caution.
2,2020-11-11 20:04:08,48.2687,-114.2665,Kalispell,MT,3154, US Highway 2 E,Incident on ROUND BOY CT near US-2 Drive with caution.
2,2020-12-16 16:28:26,48.2692,-114.4173,Kalispell,MT,3197, Farm To Market Rd,Incident on FARM TO MARKET RD near CLARK DR Drive with caution.
2,2020-11-23 04:27:26.000000000,46.3081,-111.6363,Winston,MT,,NFD Road 360,Incident on INDIAN CREEK RD near NFD ROAD 360 Expect delays.
2,2018-04-02 05:52:54,46.2021,-112.3404,Boulder,MT,,I-15 N,At Nez Perce Rd/Exit 138 - Accident involving heavy truck. Right lane blocked.
2,2020-10-27 21:32:57,48.1822,-114.3587,Kalispell,MT,104, Buckboard Ln,Incident on BUCKBOARD LN near FOYS LAKE RD Drive with caution.
2,2020-11-23 23:52:06.000000000,47.5151,-114.0397,Ronan,MT,33401, Timberlane Rd,Incident on TIMBERLANE RD near MOUNTAIN ESTATES DR Drive with caution.
2,2020-11-06 18:59:23,45.4956,-111.2746,Gallatin Gateway,MT,,Spanish Creek Rd,Incident on SPANISH CREEK RD near GALLATIN RD Drive with caution.
2,2020-11-08 15:25:42,45.6582,-109.3058,Columbus,MT,,I-90 W,Incident on I-90 WB near MM 426 Drive with caution.
2,2020-11-26 00:43:27,45.7226,-111.0764,Bozeman,MT,,I-90 W,Incident on I-90 WB near BOZEMAN Drive with caution.
2,2020-11-29 03:09:05,47.6884,-114.0918,Polson,MT,9287, Haack Rd,Incident on HAACK RD near MT-35 Drive with caution.
2,2020-10-18 19:06:57,44.7819,-111.1133,West Yellowstone,MT,22698, Hebgen Lake Rd,Incident on US-287 near US-191 Drive with caution.
2,2020-10-27 13:24:50,45.8677,-111.0911,Belgrade,MT,3801, Reese Creek Rd,Incident on REESE CREEK RD near SPRINGHILL RD Drive with caution.
2,2020-12-29 11:49:44,46.8204,-114.0003,Missoula,MT,203, Dean Stone Dr,Incident on RIMEL RD near WHITAKER DR Drive with caution.
2,2020-11-30 21:10:28,47.2963,-115.1693,Saint Regis,MT,,I-90 W,Incident on I-90 WB near MM 30 Drive with caution.
2,2020-11-20 15:49:05,45.5669,-110.5591,Livingston,MT,3001, E River Rd,Incident on RIVER RD near SUCE CREEK RD Drive with caution.
2,2020-10-19 13:18:38,45.6362,-108.9047,Park City,MT,,I-90 E,Incident on I-90 EB near POPE RD Drive with caution.
3,2018-02-05 22:28:27,45.4742,-108.9999,Joliet,MT,9459, US Highway 212,At Columbus - Accident. Single alternate lane traffic.
2,2020-12-12 06:29:05,45.6628,-108.7691,Laurel,MT,,I-90 W,Incident on I-90 WB near US-212 Drive with caution.
2,2020-10-11 04:44:58.000000000,48.079,-114.222,Somers,MT,25, Kraft Ave,Incident on KRAFT AVE near BURNELL AVE Drive with caution.
2,2017-01-31 09:52:59,45.8822,-108.3129,Huntley,MT,,I-94 E,Between MT-522/Exit 6 and Arrow Creek Rd/Exit 14 - Accident.
2,2020-11-01 20:56:41,46.9652,-114.145,Missoula,MT,10597, Waldo Rd,Incident on WALDO RD near TOOKIE TREK Drive with caution.
2,2020-11-30 04:28:28,46.6116,-111.9146,East Helena,MT,3399, Grandview Rd,Incident on GRANDVIEW RD near VALLEY DR Drive with caution.
2,2020-10-18 23:30:57,45.6647,-110.8371,Bozeman,MT,,I-90 W,Incident on I-90 WB near MM 319 Drive with caution.
2,2020-12-03 15:25:29,46.7149,-112.0633,Helena,MT,7749, Green Meadow Dr,Incident on GREEN MEADOW DR near BROOKINGS RD Drive with caution.
2,2020-11-11 17:07:08,46.5017,-111.9627,Clancy,MT,26, Whitetail Ln,Incident on WHITETAIL LN near GREENWOOD TRL Drive with caution.
2,2020-12-11 21:45:33.000000000,45.6578,-110.7671,Livingston,MT,,I-90 W,Slow traffic on I-90 W - US-191 S from Flynn Creek Rd/Exit 327 (I-90) to Jackson Creek Rd/Exit 319 (I-90) due to accident.
2,2020-10-20 15:45:29,46.733,-113.9189,Clinton,MT,14810, Miller Creek Rd,Incident on MILLER CREEK RD near SPOONER CREEK RD Expect delays.
2,2020-12-07 14:04:00,45.7966,-108.4707,Billings,MT,,US Highway 87 E,Slow traffic on US-87 N - I-90 Bus W - US-87 S - I-90 Bus E from Montana Rail Link to N 9th St due to accident.
2,2020-10-11 18:07:25,47.0305,-114.3218,Huson,MT,23113, Huson Rd,Incident on MELLIE CT near HUSON RD Drive with caution.
4,2017-10-13 17:28:09,48.2589,-114.2715,Kalispell,MT,2924, US Highway 2 E,Closed at Whitefish - Road closed due to accident.
2,2020-12-14 16:55:54,46.8832,-113.9941,Missoula,MT,,I-90 W,Incident on I-90 WB near MM 104 Expect delays.
2,2020-11-30 06:07:28,46.1488,-107.4506,Bighorn,MT,,I-94 E,Incident on I-94 EB near MM 53 Drive with caution.
2,2020-10-29 02:47:52,44.9037,-112.8219,Dillon,MT,,I-15 S,Incident on I-15 SB near MM 37 Drive with caution.
2,2020-10-18 13:00:57,45.6625,-108.7696,Laurel,MT,,I-90 E,Incident on I-90 EB near US-212 Drive with caution.
2,2020-11-26 04:34:27,45.7021,-110.838,Bozeman,MT,3368, Jackson Creek Rd,Incident on JACKSON CREEK RD near RIDGE RD Drive with caution.
2,2019-02-06 10:37:27,47.0318,-114.319,Huson,MT,,I-90 W,At Frenchtown Frontage Rd/Exit 85 - Accident. Roadway reduced to 1 lane.
2,2020-11-24 01:14:41,46.2672,-106.4778,Forsyth,MT,,I-94 W,Incident on I-94 WB near MM 103 Expect delays.
2,2020-11-19 01:49:04,45.6443,-110.5725,Livingston,MT,,I-90 E,Incident on I-90 EB near MM 333 Drive with caution.
2,2020-11-09 10:40:27,46.0088,-112.625,Butte,MT,,I-15 S,Incident on I-15 NB near MM 122 Drive with caution.
2,2020-11-08 16:38:27,46.2674,-106.3514,Rosebud,MT,,I-94 E,Incident on I-94 EB near US-12 Expect delays.
2,2017-10-18 09:30:24,46.8366,-114.0395,Missoula,MT,3735, Reserve St,At Brooks St - Accident.
2,2017-02-23 08:28:48,47.5109,-111.3475,Great Falls,MT,,US-89 S,At I-15-BR/Central Ave/Exit 280 - Accident.
2,2020-12-30 02:13:45,47.4101,-114.0756,Saint Ignatius,MT,8698, Delaney Way,Incident on DELANEY WAY near MCDONALD LAKE RD Drive with caution.
2,2020-12-06 01:06:34.000000000,45.2781,-113.1209,Dillon,MT,31241, MT Highway 278,Incident on POLARIS RD near MT-278 Drive with caution.
2,2020-12-29 06:31:12,46.5216,-114.1097,Stevensville,MT,3899, Almost Home Dr,Incident on ALMOST HOME DR near STEVENSVILLE CUTOFF RD Drive with caution.
2,2020-12-11 15:31:00,47.5472,-111.4582,Great Falls,MT,,I-15 N,Incident on I-15 NB near VAUGHN Expect delays.
2,2019-02-06 13:37:28,47.0149,-114.4072,Alberton,MT,,I-90 E,At Nine Mile Rd/Exit 82 - Accident. Lane blocked.
2,2020-12-14 15:07:16,45.5838,-111.1952,Bozeman,MT,17296, Cottonwood Rd,Incident on COTTONWOOD RD near GALLATIN RD Drive with caution.
2,2020-11-02 15:32:20.000000000,45.9386,-112.4928,Butte,MT,490, Shoe String Annie,Incident on SHOESTRING ANNIE RD near ALBANY AVE Expect delays.
2,2020-12-19 01:21:48,48.1969,-114.3406,Kalispell,MT,1385, US Highway 2 W,Incident on US-2 near US-93 Drive with caution.
2,2020-12-12 06:20:02,46.9176,-112.12,Wolf Creek,MT,,I-15 N,Incident on I-15 NB near US-287 Expect delays.
2,2019-11-08 08:15:35,45.9023,-112.2223,Whitehall,MT,,I-90 W,At Delmoe Lake Rd/Exit 241 - Accident. Roadway reduced to 1 lane.
2,2020-10-31 13:20:20,45.6383,-111.1819,Bozeman,MT,701, Blackwood Rd,Incident on BLACKWOOD RD near LEHRKIND WAY Expect delays.
2,2020-10-10 15:55:30,45.7064,-110.9983,Bozeman,MT,3826, Bridger Canyon Rd,Queuing traffic on MT-86 from Boylan Rd to Brass Lantern Ct due to accident.
2,2020-11-19 22:56:58,47.257,-111.7089,Cascade,MT,,I-15 N,Incident on I-15 NB near MM 254 Drive with caution.
2,2020-11-09 01:52:27,48.0593,-114.2426,Somers,MT,175, Spring Creek Rd,Incident on SPRING CREEK RD near US-93 Drive with caution.
2,2020-12-11 22:53:02,45.8177,-108.41,Billings,MT,,I-90 W,Incident on I-90 WB near MM 455 Drive with caution.
3,2016-12-14 14:54:55,45.1352,-107.3691,Lodge Grass,MT,,I-90 E,Between MT-457/Exit 544 and CR-382/Exit 549 - Accident.
2,2020-09-26 14:04:05,48.321,-106.7928,Glasgow,MT,798, Riverside Dr,Incident on BORESON RD near RIVERSIDE DR Expect delays.
2,2019-03-07 10:19:49,47.1272,-114.7948,Superior,MT,,I-90 E,At Lozeau Rd/Exit 55 - Accident. Roadway reduced to 1 lane. Lane blocked.
2,2020-10-23 22:55:05,48.2393,-114.3305,Kalispell,MT,2466, US Highway 93 N,Incident on US-93 near RESERVE DR Drive with caution.
2,2020-12-31 04:19:46,48.5018,-115.9215,Troy,MT,1, Forest Dr,Incident on RIVER RD near US-2 Drive with caution.
2,2020-10-25 00:16:00,45.6306,-108.9303,Park City,MT,,I-90 W,Slow traffic on I-90 from US-10/Exit 426 (I-90) to MT-78/Exit 408 (I-90) due to accident.
2,2020-10-20 14:23:02,45.809,-111.2532,Belgrade,MT,934, Thorpe Rd,Incident on THORPE RD near ISAIAH TRL Drive with caution.
2,2020-11-11 16:07:08,46.2762,-114.0714,Corvallis,MT,548, Wilcox Ln,Incident on WILCOX LN near HAMILTON HEIGHTS RD Drive with caution.
2,2020-11-26 00:43:27,45.7342,-111.0987,Bozeman,MT,,I-90 W,Incident on I-90 WB near BOZEMAN Drive with caution.
2,2020-11-20 07:42:48,45.6793,-111.0462,Bozeman,MT,632, W Main St,Incident on I-90 WB near US-191 Expect delays.
2,2020-11-01 19:38:20,45.5659,-111.7539,Norris,MT,1, Swayback Rd,Incident on STERLING RD near SWAYBACK RD Expect delays.
2,2020-10-17 04:46:50,48.3202,-114.3322,Whitefish,MT,837, Bowdish Rd,Incident on BOWDISH RD near BEAR TRL Drive with caution.
2,2020-12-08 16:58:30,46.6367,-114.5817,Lolo,MT,44847, Lolo Creek Rd,Incident on US-12 near LOLO CREEK RD Drive with caution.
2,2020-12-07 16:37:59,46.9212,-114.0641,Missoula,MT,,I-90 E,Incident on US-93 near MM 101 Drive with caution.
3,2016-10-26 10:49:46,48.1254,-104.4744,Culbertson,MT,,MT-16,At Culbertson Brg - Accident.
2,2020-12-29 02:25:44,45.0303,-109.0568,Belfry,MT,223, Highway 72,Incident on MT-72 near HIGHWAY 72 Drive with caution.
2,2020-09-17 17:23:32,45.7657,-111.1458,Belgrade,MT,1, Aviation Ln,Incident on AVIATION LN near AIRPORT RD Expect delays.
2,2020-12-14 22:19:36,46.882,-113.8867,Missoula,MT,8000, Flagler Rd,Incident on SUNSET PINES CT near FLAGLER RD Drive with caution.
4,2020-10-22 11:20:00,46.6089,-113.0246,Gold Creek,MT,,I-90 W,Incident on I-90 WB near MM 160 Road closed. Take alternate route.
2,2020-10-13 02:00:56,45.6478,-108.7566,Laurel,MT,1661, US Highway 212 S,Incident on US-310 near THIEL RD Drive with caution.
2,2020-10-25 03:58:07,46.8328,-113.8239,Missoula,MT,,I-90 E,Incident on I-90 EB near MULLAN RD Drive with caution.
2,2020-12-14 17:35:03,48.3634,-114.2192,Columbia Falls,MT,2598, Talbot Rd,Incident on HILLTOP RD near TALBOT RD Drive with caution.
2,2016-10-23 02:42:20,45.6465,-110.8817,Bozeman,MT,,US-191 S,At Trail Crk Road/Exit 316 - Accident.
2,2020-10-25 17:49:07,46.4981,-113.9983,Stevensville,MT,1054, Middle Burnt Fork Rd,Incident on IRON CAP DR near MIDDLE BURNT FORK RD Expect delays.
2,2020-11-10 15:34:32,48.1969,-114.1157,Kalispell,MT,298, Kauffman Ln,Incident on CRESTON HATCHERY RD near KAUFFMAN LN Drive with caution.
2,2020-12-24 03:46:17.000000000,45.5591,-108.8582,Joliet,MT,,Farewell Rd,Incident on US-310 near US-212 Drive with caution.
2,2020-11-06 12:02:23,47.5695,-114.8717,Plains,MT,,Upper Lynch Creek Rd,Incident on UPPER LYNCH CREEK RD near CEDAR CREEK RD Expect delays.
2,2020-10-18 18:18:25,47.1599,-114.0826,Arlee,MT,92663, US Highway 93,Incident on POW WOW RD near US-93 Drive with caution.
2,2020-10-25 05:34:07,46.0482,-112.7477,Butte,MT,,I-90 W,Incident on I-90 WB near MM 211 Drive with caution.
2,2020-11-10 18:33:58,46.5048,-111.9019,Clancy,MT,377, McClellan Creek Rd,Incident on MCCLELLAN CREEK RD near STRAWBERRY LOOKOUT RD Drive with caution.
2,2020-12-25 07:13:40,45.7942,-108.4816,Billings,MT,,US Highway 87 E,Incident on I-90 WB near US-87 Expect delays.
2,2020-09-30 13:12:28,47.5443,-114.0703,Ronan,MT,45998, N Foothills Dr,Incident on FOOTHILLS DR near SPRING CREEK RD Expect delays.
2,2020-10-20 22:54:33,45.7407,-108.5792,Billings,MT,6420, Elysian Rd,Incident on ELYSIAN RD near FRONTAGE RD Drive with caution.
2,2020-11-25 14:31:06,46.3,-112.7471,Deer Lodge,MT,122, S Frontage Rd,Incident on FRONTAGE RD near DEMPSEY RD Drive with caution.
2,2020-11-17 08:58:13.000000000,48.3563,-114.1582,Columbia Falls,MT,3699, Highway 206,Incident on HIGHWAY 206 near MT-206 Expect delays.
2,2020-10-26 13:57:51,46.5369,-111.9431,Clancy,MT,,I-15 N,Incident on I-15 NB near MM 187 Drive with caution.
2,2020-10-24 19:55:08,47.1238,-114.0465,Arlee,MT,,US Highway 93 N,Incident on MOUNTAIN HOME LN near US-93 Expect delays.
2,2020-12-08 15:46:00,47.4932,-111.2156,Great Falls,MT,8998, US Highway 89,Incident on US-89 SB near 57TH ST Right lane blocked. Expect delays.
2,2019-06-26 12:58:08,45.5365,-112.6994,Twin Bridges,MT,,I-15 N,At Frontage Rd/Exit 93 - Accident. Roadway reduced to 1 lane. Lane blocked. emergency vehicles at scene.
2,2020-10-18 15:14:45,45.9319,-108.1676,Huntley,MT,,I-94 E,Incident on I-94 EB near MM 14 Expect delays.
2,2020-11-02 02:56:20,45.8459,-108.4662,Billings,MT,2580, US Highway 87 N,Incident on US-87 near PINE RIDGE LN Drive with caution.
2,2020-10-25 16:46:07,47.0995,-104.7086,Glendive,MT,,E Power St,Incident on TAYLOR AVE near VALENTINE ST Drive with caution.
2,2020-12-16 15:27:01.000000000,46.0087,-108.2934,Shepherd,MT,11619, C A Rd,Incident on C A RD near PEACEFUL PLATEAU TRL Drive with caution.
2,2020-10-09 03:09:11.000000000,45.6576,-109.3058,Columbus,MT,,I-90 E,Incident on I-90 EB near MT-306 Drive with caution.
2,2020-12-14 01:01:08,46.5227,-114.1123,Stevensville,MT,,Houk Way,Incident on STEVENSVILLE CUTOFF near HOUK WAY Drive with caution.
2,2020-11-25 06:52:06,46.8749,-113.8908,Missoula,MT,,I-90 W,Incident on I-90 WB near MM 109 Drive with caution.
2,2020-10-28 18:05:52,47.5298,-114.0528,Ronan,MT,33083, Terrace Lake Rd,Incident on TERRACE LAKE RD near TIMBER MEADOW RD Expect delays.
2,2020-12-28 18:27:55,45.6376,-110.9244,Bozeman,MT,5800, Bearclaw Ln,Incident on BEARCLAW LN near MOOSE HOLLOW RD Drive with caution.
2,2020-10-21 08:42:23,48.3217,-114.3347,Whitefish,MT,471, Antelope Trl,Incident on ANTELOPE TRL near MEADOW LN Expect delays.
2,2020-11-24 13:10:06,46.6323,-114.0417,Florence,MT,6012, Eastside Hwy,Incident on MT-203 near EIGHT MILE CREEK RD Drive with caution.
2,2020-09-14 04:22:16,46.157,-112.8915,Anaconda,MT,,Galen Rd,Incident on LOST CREEK RD near GALEN RD Expect delays.
4,2019-01-29 17:25:12,45.679,-111.0121,Bozeman,MT,,I-90 E,At I-90-BL/US-191/Main St/Exit 309 - Overturned heavy truck.
2,2020-11-16 04:28:12,45.3853,-109.1694,Roberts,MT,,Cooney Rd,Incident on COONEY RD near COTTONWOOD RD Expect delays.
2,2020-12-26 03:47:37,45.6129,-111.1963,Bozeman,MT,2, Zachariah Ln,Incident on GALLATIN RD near ZACHARIAH LN Drive with caution.
2,2020-11-02 02:20:20,48.3621,-115.5488,Libby,MT,99, Snowshoe Rd,Incident on SNOWSHOE RD near SHAUGNESSY RD Expect delays.
2,2020-11-11 23:57:23,45.7521,-108.5192,Billings,MT,,I-90 E,Incident on I-90 EB near US-212 Drive with caution.
2,2020-12-12 07:49:12,48.1503,-114.0082,Kalispell,MT,4299, Foothill Rd,Incident on FOOTHILL RD near NOISY CREEK RD Expect delays.
2,2018-01-14 18:22:25,45.9308,-114.1182,Conner,MT,4966,US Highway 93 S,Accident on US-93 Southbound at Conner Cutoff Rd.
2,2020-12-30 00:39:19,46.9811,-114.124,Missoula,MT,11468, US Highway 93 N,Incident on US-93 near INDRELAND RD Expect delays.
2,2020-10-23 02:22:05,46.849,-108.876,Grass Range,MT,201, Tyler Cutoff,Incident on TYLER CUTOFF near UPPER FLATWILLOW RD Drive with caution.
2,2020-09-25 00:27:47,48.2549,-114.2931,Kalispell,MT,100, Rose Bud Ln,Incident on ROSE BUD LN near ROSE CROSSING RD Expect delays.
2,2020-11-13 00:33:00,48.5394,-108.8085,Harlem,MT,,US Highway 2,Slow traffic on US-2 W - US-2 E from Old Savoy Rd/Watkins Ln (US-2) to 14th Ave (US-2) due to accident.
2,2020-10-10 00:50:49,45.6578,-110.7671,Livingston,MT,,I-90 W,Incident on I-90 WB near QUINN CREEK RD Expect delays.
3,2019-02-03 22:04:04,47.3024,-112.1238,Wolf Creek,MT,9428, MT Highway 200,At MT-21 - Accident.
2,2020-12-03 01:38:15.000000000,45.7294,-111.1239,Bozeman,MT,1198, Harper Puckett Rd,Incident on VALLEY CENTER RD near HARPER PUCKET RD Expect delays.
2,2020-11-19 06:28:04,46.2627,-112.3314,Clancy,MT,,I-15 S,Incident on I-15 SB near MM 151 Drive with caution.
2,2020-11-05 01:46:10,46.3475,-108.6791,Roundup,MT,15967, US Highway 12 W,Incident on US-12 near HOUGARDY LN Drive with caution.
2,2020-12-14 15:58:03,45.7521,-108.5307,Billings,MT,,I-90 E,Incident on I-90 EB near US-212 Drive with caution.
2,2020-12-26 12:40:41,46.2571,-108.4315,Roundup,MT,9, PM Coal Rd,Incident on PM COAL RD near OLD DIVIDE RD Expect delays.
2,2020-12-18 02:44:38,47.3557,-114.0967,Saint Ignatius,MT,75099, US Highway 93,Incident on LEMERY LN near US-93 Drive with caution.
2,2020-12-22 23:40:40,47.421,-115.6119,Saint Regis,MT,,I-90 E,Incident on I-90 EB near MM 5 Expect delays.
2,2020-10-25 00:32:23,48.8052,-115.1347,Rexford,MT,,Pinkham Creek Rd,Incident on PINKHAM RD near STACY HOLLOW DR Drive with caution.
2,2020-11-20 07:42:48,45.6798,-111.0462,Bozeman,MT,21, N 7th Ave,Incident on I-90 EB near US-191 Expect delays.
2,2017-01-31 08:29:05,46.6029,-112.0056,Helena,MT,,I-15 N,Between I-15-BL/Cedar St/Exit 193 and MT-279/MT-453/Lincoln Rd/Exit 200 - Accident.
2,2020-10-19 22:34:03,46.9495,-104.9066,Glendive,MT,,I-94 W,Incident on I-94 WB near MM 198 Drive with caution.
2,2020-12-17 19:56:38,46.962,-112.6123,Lincoln,MT,2200, Smiley Rd,Incident on MT-200 near SMILEY RD Drive with caution.
2,2020-12-23 00:37:40,46.9241,-112.1237,Wolf Creek,MT,,I-15 N,Incident on I-15 NB near MM 209 Drive with caution.
2,2020-10-25 00:31:07,46.6401,-111.7241,Helena,MT,6999, Sail View Rd,Incident on CANYON FERRY RD near SAIL VIEW RD Drive with caution.
2,2020-12-17 05:08:04,45.2141,-109.2425,Red Lodge,MT,2, Two Mile Bridge Rd,Incident on US-212 near TWO MILE BRIDGE RD Drive with caution.
2,2020-10-26 01:31:36,47.8678,-104.3091,Fairview,MT,34309, Highway 201,Incident on HIGHWAY 201 near MT-16 Drive with caution.
2,2020-11-11 15:52:08,45.9926,-112.5447,Butte,MT,,I-15 S,Incident on I-15 NB near MM 124 Drive with caution.
2,2020-10-20 13:16:04,46.3598,-112.741,Deer Lodge,MT,,I-90 W,Incident on I-90 WB near MM 187 Drive with caution.
2,2020-11-06 04:59:23.000000000,48.3003,-113.38,Essex,MT,,US Highway 2 E,Incident on US-2 near SKYLAND RD Expect delays.
2,2020-12-12 11:14:02,48.1067,-114.4417,Kila,MT,2698, Smith Lake Rd,Incident on SMITH LAKE RD near SPRING HILL RD Drive with caution.
2,2020-10-20 06:31:58,48.3656,-109.6758,Havre,MT,,Beaver Creek Rd,Incident on BEAVER CREEK RD near MOUNTAIN VIEW RD Drive with caution.
2,2020-10-29 02:02:52,48.3127,-114.1593,Columbia Falls,MT,100, Trap Rd,Incident on HIGHWAY 206 near TRAP LN Drive with caution.
2,2020-11-09 03:07:27,45.6628,-108.7691,Laurel,MT,,I-90 W,Incident on I-90 WB near US-212 Drive with caution.
2,2020-10-17 14:25:41,48.3071,-111.9376,Conrad,MT,1469, Valier Hwy,Incident on MT-44 near MT-91 Drive with caution.
2,2020-12-19 03:17:38,47.9512,-110.5052,Loma,MT,53090, US Highway 87,Incident on US-87 near LEWIS AND CLARK TRL Drive with caution.
2,2020-12-23 19:46:40,48.4361,-114.3412,Whitefish,MT,1799, Wisconsin Ave,Incident on LAKESHORE DR near WISCONSIN AVE Drive with caution.
2,2020-12-31 15:54:14,48.327,-114.2407,Columbia Falls,MT,4895, US Highway 2 E,Incident on US-2 near JELLISON LN Drive with caution.
2,2020-10-28 16:12:20,48.079,-114.2294,Somers,MT,5368, Highway 93 S,Incident on US-93 near SOMERS RD Drive with caution.
2,2020-11-20 07:42:48,45.6793,-111.0462,Bozeman,MT,632, W Main St,Incident on I-90 WB near US-191 Expect delays.
2,2020-11-09 19:19:08,47.3257,-115.2501,Saint Regis,MT,,I-90 E,Incident on I-90 EB near MM 25 Expect delays.
2,2020-11-02 00:05:20,45.8746,-110.6447,Livingston,MT,,Canyon Creek Rd,Incident on BRACKETT CREEK RD near CANYON CREEK RD Drive with caution.
2,2020-12-24 23:37:40,45.2039,-110.8974,Emigrant,MT,87, Tom Miner Creek Rd,Incident on TOM MINER CREEK RD near US-89 Drive with caution.
2,2020-11-19 01:49:04,45.6443,-110.5725,Livingston,MT,,I-90 E,Incident on I-90 EB near MM 333 Drive with caution.
2,2019-02-12 08:50:31,46.8218,-114.0796,Missoula,MT,5158, US Highway 93 S,At US-93/Lewis and Clark Hwy - Accident. Lane blocked.
2,2020-11-27 19:19:33,46.9297,-114.2144,Missoula,MT,,Deep Creek Rd,Incident on BIG FLAT RD near DEEP CREEK RD Drive with caution.
2,2020-10-29 12:39:54,47.5178,-114.9818,Plains,MT,2, Buffalo Bill Rd,Incident on BUFFALO BILL RD near DRAGONFLY LN Drive with caution.
2,2017-07-12 11:16:01,48.495,-113.9811,Kalispell,MT,,Going To the Sun Rd,At Glacier RT One/Going to the Sun Hwy - Accident.
2,2020-09-21 18:27:34,46.5886,-114.0497,Stevensville,MT,5401, Eastside Hwy,Incident on EASTSIDE HWY near DRY GULCH RD Drive with caution.
2,2020-09-15 03:43:23,46.2294,-114.1902,Hamilton,MT,401, Westside Rd,Incident on WESTSIDE RD near OWINGS CREEK RD Expect delays.
2,2020-12-13 02:14:02,47.6311,-114.0938,Polson,MT,35201, Mud Lake Trl,Incident on MUD LAKE TRL near FARM RD Drive with caution.
2,2020-10-25 00:38:22,45.8274,-110.8837,Bozeman,MT,11995, Bridger Canyon Rd,Incident on BRIDGER CANYON RD near HENRYS DR Drive with caution.
2,2020-11-02 23:41:21,46.6539,-111.7009,Helena,MT,8028, Canyon Ferry Rd,Incident on CANYON FERRY RD near CAVE GULCH RD Drive with caution.
2,2020-12-12 22:59:02,47.6024,-111.2284,Floweree,MT,100, Black Horse Lake Rd,Incident on US-87 near BLACK HORSE LAKE RD Drive with caution.
2,2020-11-01 00:18:21,45.9812,-112.4887,Butte,MT,,I-15 N,Incident on I-15 NB near MM 129 Expect delays.
2,2020-12-14 18:18:55.000000000,47.7173,-114.1992,Polson,MT,47077, US Highway 93,Incident on FOX RD near US-93 Drive with caution.
2,2020-12-30 03:23:01,47.6311,-114.1136,Polson,MT,55798, US Highway 93,Incident on MUD LAKE TRL near US-93 Expect delays.
2,2020-11-30 18:18:32,48.021,-115.8255,Noxon,MT,98, Hereford Ln,Incident on MT-200 near HEREFORD LN Drive with caution.
2,2019-02-17 18:44:00,47.0783,-112.3703,Wolf Creek,MT,124, MT Highway 200,At MT-434/Stearns-Augusta Rd - Accident. Lane blocked.
