Severity,Date/Time,Latitude,Longitude,City,State,Number,Street,Description
2,2020-12-14 18:30:27,45.6627,-108.7695,Laurel,MT,,I-90 W,Incident on I-90 WB near US-212 Drive with caution.
2,2020-12-13 01:06:26,46.1983,-107.2619,Forsyth,MT,,I-94 W,Incident on I-94 WB near MM 63 Expect delays.
2,2020-12-14 04:27:21,48.2201,-114.3077,Kalispell,MT,1177, Whitefish Stage,Incident on WHITEFISH STAGE near WINCHESTER ST Drive with caution.
2,2020-12-12 01:05:48,45.8817,-111.4291,Manhattan,MT,,I-90 E,Incident on I-90 EB near MM 283 Drive with caution.
2,2020-12-23 15:22:40,46.6132,-105.5427,Ismay,MT,,I-94 W,Incident on I-94 WB near MM 148 Drive with caution.
2,2020-12-23 02:13:40,46.9547,-114.1372,Missoula,MT,,I-90 E,Incident on I-90 EB near MM 96 Drive with caution.
2,2020-09-29 21:50:22,46.5914,-111.9844,Helena,MT,3108, Prospect Ave,Incident on PROSPECT AVE near 20TH ST Drive with caution.
2,2020-12-31 04:25:46,48.3437,-115.5177,Libby,MT,36470, US Highway 2,Incident on US-2 near WARDS RD Drive with caution.
2,2020-09-30 16:42:23,47.6022,-114.1127,Ronan,MT,57862, US Highway 93,Incident on US-93 near CLAIRMONT RD Expect delays.
3,2017-09-21 00:09:56,46.7278,-113.6731,Clinton,MT,,US-12 W,Between Rock Creek Rd/Exit 126 and MT-200/Exit 109 - Accident.
2,2020-10-24 17:46:08.000000000,45.9065,-108.3256,Shepherd,MT,5901, Frey Rd,Incident on FREY RD near CHICAGO RD Drive with caution.
4,2017-10-19 12:07:53,45.7239,-110.2449,Livingston,MT,,I-90 E,Closed at Felton Ln/Exit 352 - Road closed due to accident. Roadway reduced to 1 lane.
2,2020-10-30 00:53:52,45.7974,-108.4605,Billings,MT,999, US Highway 87 E,Incident on FRONTAGE RD near US-87 Drive with caution.
2,2020-10-10 03:37:54,45.9368,-114.1424,Darby,MT,4479, W Fork Rd,Incident on CROW CREEK RD near FORK RD Drive with caution.
4,2017-12-16 21:15:16,45.6957,-109.4879,Reed Point,MT,,I-90 E,Closed between Division St/Exit 392 and Springtime Road/Exit 400 - Road closed due to accident. Jackknifed articulated truck.
2,2020-12-01 03:04:28,47.2507,-115.0533,Saint Regis,MT,,I-90 W,Incident on I-90 WB near MM 37 Drive with caution.
2,2020-12-12 18:44:02,45.6726,-111.0064,Bozeman,MT,,I-90 E,Incident on I-90 EB near MM 306 Drive with caution.
2,2020-12-12 17:53:02,47.541,-111.6999,Vaughn,MT,,MT Highway 200,Incident on MT-200 near US-89 Expect delays.
2,2020-10-21 01:16:04,46.2903,-107.0193,Sanders,MT,,Old Highway 10,Incident on OLD HIGHWAY 10 near HAINES RANCH RD Drive with caution.
3,2019-02-04 16:31:04,47.2567,-110.6295,Raynesford,MT,,US Highway 87,At Belt - Accident. Roadway reduced to 1 lane.
2,2020-12-17 03:43:00,46.9133,-112.1166,Wolf Creek,MT,,I-15 N,Slow traffic on I-15 N - US-287 N from Sieben Canyon Rd/Exit 216 (I-15) to Exit 226 (I-15) due to accident.
2,2020-10-27 13:39:51,48.2911,-114.3025,Kalispell,MT,1196, Birch Grove Rd,Incident on BIRCH GROVE RD near WHITEFISH STAGE Drive with caution.
2,2020-10-24 19:05:41,48.0845,-115.1378,Libby,MT,,NFD Road 257,Incident on CRYSTAL LAKE LANDFILL RD near CAMP RD Drive with caution.
4,2019-01-07 13:00:53,44.808,-111.0974,West Yellowstone,MT,,US-191 N,Closed at US-287/Hebgen Lake Rd - Road closed due to accident.
2,2020-12-27 08:40:43,45.6798,-111.0462,Bozeman,MT,21, N 7th Ave,Incident on I-90 EB near US-191 Drive with caution.
2,2020-11-12 03:15:50,45.9619,-108.077,Ballantine,MT,,I-94 E,Incident on I-94 EB near LOWER CANAL RD Expect delays.
2,2020-10-30 04:56:48,45.6417,-110.6863,Livingston,MT,1, Pony Rd,Incident on COKEDALE RD near PONY RD Drive with caution.
2,2020-10-12 03:50:04,45.9843,-112.4785,Butte,MT,,I-15 S,Incident on I-15 SB near US-287 Drive with caution.
2,2020-11-09 03:28:27,48.2149,-114.2232,Kalispell,MT,201, Fairmont Rd,Incident on FAIRMONT RD near MT-35 Drive with caution.
2,2020-11-08 13:59:27,45.7199,-110.2542,Livingston,MT,,I-90 W,Incident on I-90 WB near MM 352 Drive with caution.
2,2020-10-24 17:22:07,45.9319,-108.1676,Huntley,MT,,I-94 E,Incident on I-94 EB near MM 14 Drive with caution.
2,2020-12-22 19:37:40,48.2319,-114.2762,Kalispell,MT,2400, US Highway 2 E,Incident on US-2 near SUNSET DR Drive with caution.
2,2020-09-13 14:58:28.000000000,45.361,-110.7028,Pray,MT,1182, E River Rd,Incident on RIVER RD near CHICO RD Drive with caution.
3,2019-05-03 22:40:27,47.3139,-115.2271,Saint Regis,MT,,I-90 W,Between Two Mile Road/Exit 30 and Drexel Rd/Exit 25 - Oil spillage accident. Left lane blocked.
2,2020-12-24 23:04:02,46.9332,-112.1266,Wolf Creek,MT,,I-15 N,Incident on I-15 NB near US-287 Expect delays.
3,2017-12-30 14:51:15,45.6557,-109.2715,Columbus,MT,,I-90 E,Between Springtime Road/Exit 400 and Old US-10/Exit 426 - Accident. Roadway reduced to 1 lane.
2,2020-12-01 00:40:30,46.0045,-112.5736,Butte,MT,,I-15 N,Slow traffic on I-15 N - I-90 E from Exit 122 (I-90/I-15) to I-15/Exit 227 (I-90/I-15) due to accident.
2,2020-11-12 03:15:50,45.9619,-108.077,Ballantine,MT,,I-94 E,Incident on I-94 EB near LOWER CANAL RD Expect delays.
2,2020-12-11 22:30:00,46.3341,-111.5312,Townsend,MT,7628, US Highway 287,Incident on US-12 WB near TOWNSEND Expect long delays.
2,2019-02-03 16:28:05,44.8328,-111.4883,Cameron,MT,1, US Highway 287 S,At Mt Highway 87 - Accident. Roadway reduced to 1 lane.
2,2020-11-25 02:58:26,45.7974,-108.4596,Billings,MT,1031, US Highway 87 E,Incident on US-87 near LOCKWOOD FRONTAGE RD Expect delays.
2,2020-11-15 19:58:49,45.7679,-111.1843,Belgrade,MT,,I-90 E,Incident on I-90 EB near MM 298 Drive with caution.
3,2016-12-19 01:53:56,44.8467,-111.069,West Yellowstone,MT,,US-191 S,At Black Butte Ranch - Overturned vehicle.
2,2018-01-10 08:30:15,46.2524,-107.2328,Forsyth,MT,,I-94 W,At Hysham Rest Area - Accident.
2,2020-10-25 19:21:50,45.8866,-111.8649,Cardwell,MT,,I-90 W,Incident on I-90 WB near COTTONWOOD CANYON RD Drive with caution.
2,2020-10-25 20:15:38,48.2259,-114.2927,Kalispell,MT,127, W Evergreen Dr,Incident on EVERGREEN DR near NICKLAUS Drive with caution.
2,2020-12-14 21:35:03,45.3755,-113.4095,Jackson,MT,32601, Highway 278,Incident on MT-278 near JARDINE AVE Drive with caution.
2,2020-12-18 01:52:49,48.0591,-114.0774,Bigfork,MT,8528, MT Highway 35,Incident on BRIDGE ST near MT-35 Expect delays.
2,2020-09-23 07:06:01,46.4764,-111.9787,Clancy,MT,,I-15 S,Incident on I-15 SB near MM 182 Drive with caution.
2,2020-11-12 02:01:08,45.6397,-110.7303,Livingston,MT,464, Cokedale Rd,Incident on COKEDALE RD near ELDRIDGE CREEK TRL Drive with caution.
2,2020-12-04 05:28:29,47.9846,-115.7548,Noxon,MT,101, Klakken Rd,Incident on STEVENS CREEK RD near KLAKKEN RD Expect delays.
2,2020-12-03 23:35:57,48.359,-114.1811,Columbia Falls,MT,4199, Columbia Falls Stage,Incident on COLUMBIA FALLS STAGE near RIVER RD Drive with caution.
2,2020-11-08 22:38:27,45.7133,-110.4008,Livingston,MT,,US-191 N,Incident on I-90 EB near MM 340 Drive with caution.
2,2020-12-16 00:11:03,47.5298,-114.0637,Ronan,MT,33657, Terrace Lake Rd,Incident on VICTOR LN near TERRACE LAKE RD Drive with caution.
2,2020-11-24 00:16:54,46.9176,-112.12,Wolf Creek,MT,,I-15 N,Incident on I-15 NB near US-287 Drive with caution.
2,2020-10-16 01:41:12,45.5912,-111.1981,Bozeman,MT,4, Mill St,Incident on MILL ST near US-191 Drive with caution.
2,2020-12-24 02:01:40,46.7282,-113.6584,Clinton,MT,,Interstate 90,Incident on I-90 WB near INTERSTATE 90 Expect delays.
2,2020-10-22 19:15:38,48.3514,-107.6389,Malta,MT,,Harb Rd,Incident on HARB RD near BOWDOIN RD Expect delays.
2,2020-10-22 13:30:00,45.671,-111.1713,Bozeman,MT,8258, Huffine Ln,Slow traffic on US-191 from MT-84/MT-85/Norris Rd/Jackrabbit Ln (US-191) to N 7th Ave (US-191) due to accident.
2,2020-12-30 19:28:07,45.6033,-109.1526,Columbus,MT,1539, Highway 10,Incident on HIGHWAY 10 near HENSLEY CREEK RD Expect delays.
2,2020-10-30 15:39:15,45.6711,-111.1834,Bozeman,MT,8127, Huffine Ln,Incident on HUFFINE LN near SHEDHORN DR Expect delays.
2,2020-12-23 19:33:40,46.27,-112.7481,Deer Lodge,MT,2, Race Track Rd,Incident on I-90 WB near RACE TRACK RD Drive with caution.
2,2020-12-02 04:57:59,47.019,-114.2787,Frenchtown,MT,15399, Erskine Fishing Access Rd,Incident on ERSKINE FISHING ACCESS RD near MICASA LN Drive with caution.
2,2020-12-16 00:11:03,47.5418,-111.7006,Vaughn,MT,842, US Highway 89,Incident on US-89 near MT-200 Expect delays.
2,2020-11-06 02:02:23,46.7272,-113.6742,Clinton,MT,,Interstate 90,Incident on I-90 EB near INTERSTATE 90 Drive with caution.
2,2019-07-29 13:49:31,46.728,-113.6622,Clinton,MT,,Interstate 90,Between Rock Creek Rd/Exit 126 and Rock Creek Rest Area - Accident. Roadway reduced to 1 lane.
4,2020-11-25 17:38:31,45.6536,-110.945,Bozeman,MT,,I-90 E,One lane blocked due to accident on I-90 Eastbound from Exit 309 I-90-BL Main St to Exit 313 Moffit Gulch Rd.
2,2020-10-20 17:30:25,46.5591,-114.0468,Stevensville,MT,486, Ambrose Creek Rd,Incident on AMBROSE CREEK RD near EASTSIDE HWY Expect delays.
2,2020-11-02 22:47:21,45.6707,-111.1542,Bozeman,MT,6798, Tawny Brown Ln,Incident on TAWNY BROWN LN near US-191 Drive with caution.
2,2020-09-17 20:17:27,45.671,-111.1516,Bozeman,MT,8356, Huffine Ln,Incident on BAXTER LN near LOVE LN Expect delays.
3,2017-05-17 09:21:31,45.9212,-112.4159,Whitehall,MT,,I-90 W,At Homestake Pass/Exit 233 - Accident.
2,2020-12-30 22:11:08,45.6462,-110.5508,Livingston,MT,,I-90 W,Stationary traffic on I-90 W - US-191 S from I-90/Exit 337 (I-90) to US-89/Exit 333 (I-90) due to accident.
2,2020-12-12 18:34:57,45.8129,-108.6322,Billings,MT,3842, Apache Trl,Incident on APACHE TRL near SHOSHONI TRL Drive with caution.
2,2020-12-11 16:48:30,47.8454,-111.7026,Dutton,MT,,I-15 N,Incident on I-15 NB near MM 313 Expect delays.
4,2017-07-13 13:42:16,46.255,-107.2301,Forsyth,MT,,I-94 W,Closed between US-10/US-312/MT-311/Exit 67 and Hysham Rest Area - Road closed due to accident.
3,2017-12-05 23:37:53,46.8403,-105.1312,Fallon,MT,,I-94 E,Between MT-340/Exit 185 and Bad Route Road/Exit 192 - Accident.
2,2020-11-18 15:31:01,46.3914,-114.1439,Victor,MT,2015, US Highway 93 N,Incident on US-93 near SILVERBOW DR Drive with caution.
2,2020-11-15 06:05:25,45.8156,-111.3258,Manhattan,MT,2612, Churchill Rd,Incident on CHURCHILL RD near MEADOW VIEW RD Drive with caution.
2,2020-11-08 23:04:14,47.6756,-104.1603,Sidney,MT,35130, County 122,Incident on MT-23 near COUNTY 122 Drive with caution.
3,2018-02-06 09:34:02,46.6162,-105.54,Ismay,MT,,I-94 W,Accident on I-94 Westbound near Exit 159 Diamond Ring Rd.
2,2018-01-09 13:58:25,48.2404,-114.3305,Kalispell,MT,2498, US Highway 93 N,At Reserve Loop - Accident.
2,2020-12-12 18:14:02,45.9563,-111.0978,Belgrade,MT,20182, Rocky Mountain Rd,Incident on ROCKY MOUNTAIN RD near JOHNSON CANYON RD Drive with caution.
2,2020-12-17 14:32:04,46.7293,-112.0206,Helena,MT,8123, N Montana Ave,Incident on MONTANA AVE near SEAGULL RD Drive with caution.
2,2019-01-03 14:42:06,48.4193,-113.2171,East Glacier Park,MT,20752, US Highway 2,At Glacier RT One/Going to the Sun Hwy - Accident. Lane blocked.
2,2020-11-11 00:52:08,48.3562,-114.143,Columbia Falls,MT,1001, Jensen Rd,Incident on JENSEN RD near WILDFLOWER LN Drive with caution.
2,2020-10-11 04:29:39,47.0185,-114.2518,Frenchtown,MT,18098, Mullan Rd,Incident on BECKWITH ST near MULLAN RD Expect delays.
2,2020-10-21 14:44:00.000000000,45.9434,-108.2017,Worden,MT,2200, Sunrise Rd,Incident on HIGHWAY 312 near 12TH RD Expect delays.
3,2020-01-13 15:36:11,47.1354,-114.8013,Superior,MT,,I-90 W,At Lozeau Rd/Exit 55 - Accident. Right lane blocked.
2,2020-11-18 02:22:13,45.8979,-111.5179,Three Forks,MT,,I-90 W,Incident on I-90 WB near MM 278 Drive with caution.
2,2020-11-12 20:55:08,45.6711,-111.1357,Bozeman,MT,,Willow Peak Dr,Incident on HUFFINE LN near WILLOW PEAK DR Expect delays.
3,2017-06-05 04:38:39,48.2404,-114.2763,Kalispell,MT,2, W Reserve Dr,At MT-548/Reserve Dr - Accident.
2,2020-10-15 22:23:24,48.2911,-113.7981,Kalispell,MT,,NFD Road 5317,Incident on NFD ROAD 38 near NFD ROAD 5317 Expect delays.
2,2020-11-08 23:52:36,48.477,-114.3944,Whitefish,MT,,Pointe of View Ranch Dr,Incident on LAKESHORE DR near POINTE OF VIEW RANCH DR Drive with caution.
2,2020-11-24 15:40:06,46.6754,-114.0752,Florence,MT,20415, US Highway 93 N,Incident on CARLTON CREEK RD near US-93 Drive with caution.
2,2020-11-12 20:11:31,47.689,-114.0867,Polson,MT,39051, MT Highway 35,Incident on MT-35 near HAACK RD Drive with caution.
2,2020-12-12 01:59:02,46.5879,-111.8598,East Helena,MT,2988, Spokane Ranch Rd,Incident on SPOKANE RANCH RD near DIEHL DR Drive with caution.
2,2020-12-11 19:22:11,47.5647,-111.5376,Vaughn,MT,,I-15 S,Incident on I-15 SB near MT-200 Drive with caution.
2,2020-10-23 21:31:05.000000000,48.4801,-114.3955,Whitefish,MT,,Pointe of View Ranch Dr,Incident on POINTE OF VIEW RANCH DR near LAKESHORE DR Drive with caution.
2,2016-12-15 16:02:24,47.4533,-115.6942,Saint Regis,MT,,I-90 W,At Lookout Pass/Exit 0 - Accident.
2,2020-12-21 05:22:57,45.6627,-108.7695,Laurel,MT,,I-90 W,Incident on I-90 WB near US-212 Expect delays.
3,2018-02-09 09:53:08,45.8699,-111.9546,Whitehall,MT,,I-90 W,Accident on I-90 Westbound near Exit 256 MT-2.
2,2020-10-27 15:12:51,45.8021,-111.1702,Belgrade,MT,2, Penwell Bridge Rd,Incident on PENWELL BRIDGE RD near DRY CREEK RD Drive with caution.
4,2016-07-12 09:00:00,47.4339,-111.5073,Sun River,MT,,I-15 S,Closed at Center St/Exit 270 - Road closed due to accident.
2,2020-12-29 04:22:18,47.1551,-111.8456,Cascade,MT,,I-15 N,Incident on I-15 NB near NOVAK CREEK LN Drive with caution.
2,2020-12-29 15:29:53,47.1232,-104.7313,Glendive,MT,127, Highway 16,Incident on MT-16 near LEWIS AND CLARK TRL Drive with caution.
2,2020-12-16 16:23:57,47.3508,-115.2913,Saint Regis,MT,,I-90 E,Incident on I-90 EB near MM 22 Drive with caution.
2,2020-12-12 03:26:02,46.6041,-112.0066,Helena,MT,,I-15 S,Incident on I-15 SB near MM 192 Expect delays.
2,2020-12-03 17:55:28,46.632,-112.0212,Helena,MT,4066, N Montana Ave,Incident on BEAVERHEAD RD near MONTANA AVE Drive with caution.
2,2020-10-23 23:49:05,48.2547,-114.4172,Kalispell,MT,2700, Farm To Market Rd,Incident on FARM TO MARKET RD near RHODES DRAW Drive with caution.
2,2020-12-14 17:50:41,47.4143,-115.5221,Saint Regis,MT,,I-90 W,Incident on I-90 WB near MM 10 Drive with caution.
2,2018-04-03 10:21:24,46.1412,-107.476,Custer,MT,,I-94 E,At Tullock Rd/Exit 53 - Accident. Broken down vehicle.
3,2016-07-14 09:00:00,46.7548,-112.0157,Helena,MT,,US-287 S,At MT-279/MT-453/Lincoln Rd/Exit 200 - Accident.
2,2020-11-25 23:37:27,46.7164,-113.6682,Clinton,MT,1, Bucking Horse Ln,Incident on ROCK CREEK RD near STAGE STATION RD Expect delays.
2,2020-11-12 00:01:08,45.7521,-108.5419,Billings,MT,,I-90 E,Incident on I-90 EB near MM 447 Expect delays.
2,2020-11-09 19:22:08,45.4621,-109.2206,Roberts,MT,896, Boyd Cooney Dam Rd,Incident on BOYD COONEY DAM RD near COONEY DAM RD Drive with caution.
2,2020-11-27 07:26:18,45.2646,-111.2533,Gallatin Gateway,MT,47911, Gallatin Rd,Incident on MT-64 near US-191 Drive with caution.
2,2020-12-22 20:46:40,48.2126,-114.2813,Kalispell,MT,,Sager Ln,Incident on SAGER LN near US-2 Drive with caution.
2,2019-09-05 11:22:10,45.8225,-108.3583,Billings,MT,,I-90 W,At I-94/Exit 456 - Accident. Overturned vehicle. Roadway reduced to 1 lane. Lane blocked.
4,2019-11-08 15:41:49,48.3185,-114.2417,Kalispell,MT,4797, Airport Frontage Rd,Closed at Whitefish - Road closed due to accident. Overturned heavy truck.
2,2020-11-19 19:58:05,46.979,-112.5514,Lincoln,MT,3401, Copper Creek Rd,Incident on COPPER CREEK RD near MT-200 Drive with caution.
4,2018-06-19 15:37:24,47.29,-112.1632,Wolf Creek,MT,,US Highway 287,Closed at MT-434/Stearns-Augusta Rd - Road closed due to accident.
2,2019-03-18 22:46:40,46.5542,-114.1016,Stevensville,MT,4330,US Highway 93 N,Accident on US-93 Westbound at Ross Island Way.
2,2020-11-24 00:19:06,45.9328,-108.3865,Shepherd,MT,3898, Glenn Edward Rd,Incident on GLENN EDWARD RD near LENA KAY DR Expect delays.
3,2016-07-27 13:48:08,46.548,-110.4684,Martinsdale,MT,6710, US Highway 12 E,At Hobson - Accident.
2,2020-11-19 02:57:00,47.1128,-104.743,Glendive,MT,,I-94 W,Slow traffic on I-94 W from MT-16/Exit 213 (I-94) to MT-200/Exit 211 (I-94) due to accident.
2,2020-12-03 22:43:21,48.3386,-114.3359,Whitefish,MT,,Timber Ln,Incident on TIMBER LN near US-93 Drive with caution.
2,2020-12-08 17:21:53,45.8632,-108.3008,Huntley,MT,3100, White Buffalo Rd,Incident on PRYOR CREEK RD near YELLOWSTONE TRL Drive with caution.
2,2020-10-27 14:45:51,47.5461,-111.6309,Vaughn,MT,510, US Highway 89,Incident on US-89 near EDWARD LN Drive with caution.
2,2019-08-21 12:05:28,45.754,-111.1449,Belgrade,MT,,I-90 E,At MT-412/19th Ave/Exit 305 - Accident. Roadway reduced to 1 lane.
2,2020-12-20 01:34:39,46.0067,-114.1662,Darby,MT,810, S Water St,Incident on WATER ST near US-93 Drive with caution.
2,2020-10-24 19:52:07,46.9538,-114.1356,Missoula,MT,,I-90 E,Incident on I-90 EB near MT-200 Drive with caution.
2,2020-10-22 03:53:30,46.701,-113.4958,Clinton,MT,,Interstate 90,Slow traffic on I-90 from Beavertail Rd/Exit 130 (I-90) to Frontage Rd/Exit 138 (I-90) due to accident.
2,2020-12-31 13:52:46,46.9498,-114.1282,Missoula,MT,,US-93 N,Incident on I-90 WB near MT-200 Expect delays.
2,2020-11-15 03:57:26,48.4628,-114.3497,Whitefish,MT,3101, Tamarack Ln,Incident on TAMARACK DR near JUNIPER DR Drive with caution.
2,2020-11-05 18:24:41,48.9916,-111.9596,Sweet Grass,MT,,I-15 N,Incident on I-15 NB near MM 397 Expect delays.
4,2019-09-23 22:35:34,46.3064,-108.9888,Lavina,MT,9, Mile Rd,Closed at MT-300/1st St/MT-238 - Road closed due to accident.
2,2020-11-10 00:19:08,48.5587,-112.9005,Browning,MT,22700, US Highway 2,Incident on US-2 near WHITFORD RD Expect delays.
2,2020-11-24 13:10:06,46.6323,-114.0417,Florence,MT,6012, Eastside Hwy,Incident on MT-203 near EIGHT MILE CREEK RD Drive with caution.
2,2020-12-28 17:50:18,45.6565,-110.9803,Bozeman,MT,2127, Bozeman Trail Rd,Incident on BOZEMAN TRAIL RD near FORT ELLIS RD Drive with caution.
2,2020-12-28 17:16:00,47.3942,-115.4302,Saltese,MT,,I-90 E,Incident on I-90 EB near HAUGEN Expect delays.
2,2020-10-24 12:55:05,47.0188,-114.6521,Alberton,MT,,I-90 E,Incident on I-90 EB near ROAD 459 Drive with caution.
2,2019-08-16 11:04:39,46.977,-114.1261,Missoula,MT,11045, US Highway 93 N,At MT-200 - Accident. Roadway reduced to 1 lane. Lane blocked.
2,2020-11-15 12:22:12,48.2327,-114.3472,Kalispell,MT,,US-93 Alt N,Incident on US-93 near MM 7 Drive with caution.
2,2020-11-12 01:41:41,46.606,-113.012,Gold Creek,MT,,I-90 E,Incident on I-90 EB near MM 162 Drive with caution.
2,2020-11-09 16:52:08,46.6464,-111.8937,Helena,MT,4301, York Rd,Incident on LAKE HELENA DR near YORK RD Drive with caution.
2,2020-12-07 14:04:30,46.9538,-114.1356,Missoula,MT,,I-90 E,Incident on I-90 EB near MT-200 Drive with caution.
2,2020-11-13 16:04:09,46.9176,-112.12,Wolf Creek,MT,,I-15 N,Incident on I-15 NB near US-287 Expect delays.
2,2020-12-06 23:31:16,45.6709,-111.2379,Bozeman,MT,26500, Norris Rd,Incident on NORRIS RD near HORNED OWL TRL Expect delays.
2,2020-10-15 13:37:30,46.2575,-112.7579,Deer Lodge,MT,,I-90 W,Queuing traffic on I-90 from CR-273/Exit 197 (I-90) to Race Track Rd/Exit 195 (I-90) due to accident.
2,2020-10-24 20:07:35,45.6971,-108.6745,Billings,MT,10100, S Frontage Rd,Incident on FRONTAGE RD near RUDIO RD Drive with caution.
2,2020-11-26 06:46:27,47.107,-104.7277,Glendive,MT,1101, W Towne St,Incident on TOWNE ST near HARMON AVE Drive with caution.
3,2018-02-08 05:53:57,45.5257,-107.4174,Garryowen,MT,,I-90 E,At MT-451/Exit 514 - Jackknifed articulated truck.
2,2020-10-25 12:35:00,45.661,-110.6479,Livingston,MT,,I-90 E,Slow traffic on I-90 from Flynn Creek Rd/Exit 327 (I-90) to US-10/Exit 330 (I-90) due to accident.
2,2020-12-10 10:07:32,45.6628,-108.7691,Laurel,MT,,I-90 W,Incident on I-90 WB near US-212 Drive with caution.
2,2020-11-20 17:50:51,46.0083,-112.6387,Butte,MT,,I-90 W,Incident on I-90 WB near MM 219 Drive with caution.
2,2020-11-13 17:50:00,45.6467,-110.5942,Livingston,MT,,I-90 W,Stationary traffic on I-90 W - US-191 S from US-89/Exit 333 (I-90) to US-10/Exit 330 (I-90) due to accident.
2,2017-02-02 10:21:22,45.3114,-107.3446,Lodge Grass,MT,,US-87 N,Between MT-463/Exit 530 and MT-451/Exit 514 - Accident.
2,2020-12-25 03:07:41,45.8614,-114.0375,Conner,MT,6358, US Highway 93 S,Incident on US-93 near LORD LN Expect delays.
2,2020-11-08 16:06:00,47.5516,-111.4867,Great Falls,MT,,I-15 N,Slow traffic on I-15 from Manchester Rd/Exit 286 (I-15) to US-89/MT-200/Exit 290 (I-15) due to accident.
2,2019-07-13 22:53:58,46.5315,-105.6588,Ismay,MT,,I-94 W,At Valley Dr/Exit 148 - Accident. Roadway reduced to 1 lane.
2,2020-12-17 13:29:04,47.6155,-111.577,Power,MT,,I-15 S,Incident on I-15 SB near NEUMAN SCHOOL RD Drive with caution.
2,2020-11-06 00:07:00,45.6641,-111.1857,Bozeman,MT,81398, Gallatin Rd,Incident on 2ND ST near US-191 Expect delays.
2,2020-11-26 02:00:00,45.7027,-111.0057,Bozeman,MT,2302, Bridger Dr,Slow traffic on MT-86 from Powder Park Ct to Brass Lantern Ct due to accident.
2,2020-11-11 04:07:08,48.3852,-114.1948,Columbia Falls,MT,1030, Tamarack Ln,Incident on WOODLAND RD near TAMARACK LN Drive with caution.
2,2020-10-24 18:01:07,45.6801,-108.715,Laurel,MT,,I-90 W,Incident on I-90 WB near MM 452 Drive with caution.
2,2020-10-24 23:23:39.000000000,45.6653,-108.7577,Laurel,MT,,US-212 E,Incident on I-90 EB near US-212 Drive with caution.
2,2020-12-21 16:28:39.000000000,48.2067,-114.3462,Kalispell,MT,,US-93 Alt S,Incident on US-93 near MM 4 Drive with caution.
2,2020-12-01 01:23:00,47.2987,-115.1757,Saint Regis,MT,,I-90 W,Stationary traffic on I-90 W from MT-135/Exit 33 (I-90) to Exit 26 (I-90) due to accident.
2,2020-11-24 17:28:06,46.8851,-114.0392,Missoula,MT,,N Reserve St,Incident on MULLAN RD near RESERVE ST Drive with caution.
2,2020-10-31 15:35:20,47.0183,-114.2078,Frenchtown,MT,15259, Mill Creek Rd,Incident on MILL CREEK RD near ROMULUS LN Drive with caution.
4,2017-10-19 12:40:09,45.7239,-110.2449,Livingston,MT,,I-90 E,Closed at Felton Ln/Exit 352 - Road closed due to accident. Roadway reduced to 1 lane.
2,2020-12-18 03:04:35,45.772,-111.1849,Belgrade,MT,396, W Jefferson Ave,Incident on JACKRABBIT LN near JEFFERSON AVE Drive with caution.
2,2020-11-08 15:50:27,47.5571,-111.5221,Power,MT,,I-15 N,Incident on I-15 NB near MM 290 Drive with caution.
2,2020-12-12 05:22:18,45.6639,-108.7923,Laurel,MT,,I-90 E,Incident on I-90 EB near MM 434 Expect delays.
2,2020-11-08 22:38:27,45.7045,-110.2601,Livingston,MT,,I-90 E,Incident on I-90 EB near MM 340 Drive with caution.
2,2020-11-07 02:53:24,47.4811,-111.348,Great Falls,MT,,I-15 N,Incident on I-15 NB near MM 278 Drive with caution.
2,2020-11-25 23:16:28,45.6625,-108.7696,Laurel,MT,,I-90 E,Incident on I-90 EB near US-212 Drive with caution.
2,2020-12-28 02:19:43,47.4844,-112.3867,Augusta,MT,1188, US Highway 287,Incident on LOVERS LN near US-287 Drive with caution.
2,2020-10-16 12:49:40,47.4532,-110.9225,Belt,MT,575, Belt Creek Rd,Incident on BELT CREEK RD near ENGER CUTOFF RD Expect delays.
2,2020-10-20 21:56:56,47.4109,-115.5132,Saltese,MT,136, W Saltese Frontage Rd,Incident on PACKER CREEK RD near SALTESE FRONTAGE RD Drive with caution.
2,2020-12-02 21:31:28,48.1972,-114.3393,Kalispell,MT,,US-93 Alt N,Incident on US-93 near US-2 Drive with caution.
2,2020-09-24 18:43:09,45.7294,-111.1239,Bozeman,MT,1198, Harper Puckett Rd,Incident on HARPER PUCKET RD near VALLEY CENTER RD Drive with caution.
2,2020-12-15 19:00:34,45.7675,-111.1618,Belgrade,MT,,Airway Blvd,Incident on AIRWAY BLVD near FRONTAGE RD Drive with caution.
2,2020-09-28 03:43:28,47.3194,-109.9367,Denton,MT,1300, State Highway 81,Incident on MT-81 near ALTON RD Drive with caution.
2,2020-11-08 16:38:27,46.2674,-106.3514,Rosebud,MT,,I-94 E,Incident on I-94 EB near US-12 Expect delays.
2,2020-12-17 23:26:38,47.9288,-111.731,Dutton,MT,584, E Frontage Rd N,Incident on FRONTAGE RD near 13TH ST Drive with caution.
2,2020-10-24 23:23:39,45.6989,-108.6717,Billings,MT,,US-212 E,Incident on I-90 EB near US-212 Drive with caution.
2,2020-12-30 16:08:00,46.7651,-114.0804,Lolo,MT,10999, US Highway 93 S,Stationary traffic on US-12 E - US-12 W - US-93 S - US-93 N from US-93/Lewis and Clark Hwy (US-12) to Old US-93/S Reserve St (US-12) due to accident.
2,2020-10-19 16:06:57,45.4642,-108.883,Joliet,MT,103, W Pryor Rd,Incident on PRYOR RD near LESLIE RD Expect delays.
4,2020-12-17 20:32:00,47.0099,-113.0605,Ovando,MT,4898, State Highway 200,Incident on MT-200 WB near THOMPSON FALLS Road closed. Take alternate route.
2,2020-12-18 06:05:37,46.4979,-111.9606,Clancy,MT,7, Greenwood Trl,Incident on ROCK RIDGE DR near GREENWOOD TRL Expect delays.
2,2020-12-20 00:52:39,47.1135,-104.7468,Glendive,MT,798, W Thrush Ln,Incident on JEFFERSON SCHOOL RD near 4TH ST Drive with caution.
2,2020-09-22 19:51:00,45.6668,-108.7512,Laurel,MT,,I-90 W,Incident on I-90 WB near MM 434 Drive with caution.
2,2020-12-24 08:10:40,46.0065,-112.6039,Butte,MT,,I-15 S,Incident on I-15 NB near MM 122 Drive with caution.
2,2020-11-24 03:43:06,47.1627,-113.4376,Seeley Lake,MT,885, Montana Dr,Incident on MONTANA DR near GRAYLING DR Drive with caution.
2,2020-11-14 06:02:30.000000000,46.1974,-114.1548,Hamilton,MT,217, Skalkaho Hwy,Incident on SKALKAHO HWY near SLEEPING CHILD RD Drive with caution.
2,2020-11-21 06:58:59.000000000,44.6861,-111.2542,West Yellowstone,MT,1, W Denny Creek Rd,Incident on TARGHEE PASS HWY near DENNY CREEK RD Expect delays.
2,2019-02-06 08:53:57,48.5639,-109.5456,Havre,MT,9898, US Highway 2 NE,At 100th Ave NE - Accident. Roadway reduced to 1 lane. Lane blocked.
2,2020-11-25 03:00:29,46.2632,-107.1431,Forsyth,MT,,I-94 E,Incident on I-94 EB near MM 72 Drive with caution.
2,2020-12-16 01:30:59,46.9111,-114.031,Missoula,MT,,I-90 W,Incident on I-90 WB near MM 101 Drive with caution.
2,2016-12-29 11:37:28,46.5207,-105.6821,Ismay,MT,,I-94 E,At Frontage Rd/Exit 159 - Accident.
2,2018-10-18 09:40:27,46.2594,-106.925,Forsyth,MT,,I-94 W,At Reservation Creek Road/Exit 82 - Accident.
2,2020-12-12 00:00:24,45.6707,-111.1521,Bozeman,MT,1659, Bobcat Dr,Incident on BOBCAT DR near TAWNY BROWN LN Drive with caution.
