Severity,Date/Time,Latitude,Longitude,City,State,Number,Street,Description
2,2020-12-30 11:55:45,46.8726,-113.9955,Missoula,MT,301, Ryman St,Incident on I-90 EB near US-12 Drive with caution.
2,2020-12-12 03:46:30,46.8987,-112.1216,Wolf Creek,MT,,I-15 N,Slow traffic on I-15 N - US-287 N from Sieben Canyon Rd/Exit 216 (I-15) to Exit 226 (I-15) due to accident.
2,2019-01-21 07:25:37,45.8702,-111.9463,Cardwell,MT,,I-90 W,At I-90 - Jackknifed articulated truck. Lane blocked.
2,2020-12-12 16:38:02,45.6751,-111.0107,Bozeman,MT,,I-90 E,Incident on I-90 EB near MM 309 Drive with caution.
2,2020-11-11 23:05:26.000000000,48.1464,-114.1084,Bigfork,MT,6002, MT Highway 35,Incident on BASIN VIEW RD near MT-35 Drive with caution.
2,2020-11-03 02:35:21.000000000,45.8159,-108.414,Billings,MT,,Johnson Ln,Incident on JOHNSON LN near FRONTAGE RD Drive with caution.
2,2020-10-25 14:25:07,45.634,-108.9195,Park City,MT,,I-90 E,Incident on I-90 EB near MM 426 Drive with caution.
2,2020-11-09 01:55:27,48.0882,-114.0289,Bigfork,MT,301, Swan River Rd,Incident on SWAN RIVER RD near MT-83 Drive with caution.
2,2020-09-19 03:27:33,46.9176,-112.12,Wolf Creek,MT,,I-15 N,Incident on I-15 NB near US-287 Drive with caution.
2,2020-09-24 08:39:01,44.6629,-111.1085,West Yellowstone,MT,213, N Geyser St,Incident on HAYDEN ST near US-20 Drive with caution.
2,2020-11-01 17:53:34,45.8024,-108.4384,Billings,MT,1831, Old Hardin Rd,Incident on OLD HARDIN RD near SCOTT ST Drive with caution.
2,2020-11-07 13:32:24.000000000,46.7321,-112.0206,Helena,MT,8200, N Montana Ave,Incident on MONTANA AVE near COUNTY ROAD 229 Drive with caution.
2,2020-11-08 17:29:27,45.7729,-111.1999,Belgrade,MT,,Amsterdam Rd,Incident on BUSINESS HUB DR near AMSTERDAM RD Drive with caution.
2,2019-02-26 12:19:33,46.6191,-105.5379,Ismay,MT,,I-94 W,Between Frontage Rd/Exit 159 and Valley Dr/Exit 148 - Accident. Lane blocked.
2,2020-11-14 05:13:09,45.8619,-110.8442,Bozeman,MT,14862, Brackett Creek Rd,Incident on BRACKETT CREEK RD near PONY CREEK RD Drive with caution.
2,2020-10-29 02:48:30,45.7949,-111.0452,Bozeman,MT,6778, Walker Rd,Incident on WALKER RD near PENWELL BRIDGE RD Drive with caution.
2,2020-10-22 15:26:00,47.4557,-115.6951,Saint Regis,MT,,I-90 W,Slow traffic on I-90 from Exit 5 (I-90) to I-90 Bus/Exit 69 (I-90) due to accident.
2,2020-12-21 22:01:39,46.2557,-106.6979,Forsyth,MT,,I-94 E,Incident on I-94 EB near US-12 Drive with caution.
2,2020-11-07 08:36:23,48.2247,-114.3077,Kalispell,MT,1263, Whitefish Stage,Incident on RIVER VIEW DR near WHITEFISH STAGE Drive with caution.
2,2020-11-19 03:19:04,46.617,-111.9147,Helena,MT,3100, Valley Dr,Incident on CANYON FERRY RD near VALLEY DR Drive with caution.
2,2020-12-01 05:36:15,48.2404,-114.2545,Kalispell,MT,501, E Reserve Dr,Incident on HELENA FLATS RD near RESERVE DR Drive with caution.
2,2020-10-13 08:09:28,46.8916,-114.1079,Missoula,MT,2055, Cote Ln,Incident on COTE LN near MULLAN RD Drive with caution.
2,2020-11-28 01:31:46,45.559,-108.8582,Joliet,MT,,Farewell Rd,Incident on US-310 near US-212 Drive with caution.
2,2020-10-25 11:34:07,46.4647,-111.9844,Clancy,MT,1, E Clancy St,Incident on CLANCY ST near RAILROAD WAY Drive with caution.
2,2020-09-29 19:53:32,46.6096,-111.9358,East Helena,MT,2933, Wylie Dr,Incident on ELKVIEW DR near WYLIE DR Drive with caution.
2,2020-10-18 19:06:57,44.7819,-111.1133,West Yellowstone,MT,22698, Hebgen Lake Rd,Incident on US-287 near US-191 Drive with caution.
2,2020-09-25 23:32:30,48.1171,-114.2559,Kalispell,MT,105, Forest Hill Rd,Incident on FOREST HILL RD near US-93 Drive with caution.
2,2020-10-01 14:01:29,46.9551,-112.6897,Lincoln,MT,101, 1st Ave,Incident on MAIN ST near MT-200 Drive with caution.
2,2020-12-08 15:46:00,47.0741,-112.3714,Wolf Creek,MT,1, MT Highway 200,Incident on MT-200 EB near 57TH ST Right lane blocked. Expect delays.
2,2020-11-22 20:52:06,48.2259,-114.2794,Kalispell,MT,30, W Evergreen Dr,Incident on EVERGREEN DR near US-2 Drive with caution.
2,2019-07-11 13:28:56,46.4434,-114.1355,Victor,MT,2770, US Highway 93 N,At Bell Xing W - Accident. Lane blocked.
3,2019-01-06 16:36:06,46.2612,-112.1982,Boulder,MT,,I-15 S,Between Exit 160 and Exit 156 - Accident.
2,2020-12-28 21:18:57,45.5911,-111.1009,Bozeman,MT,9851, S 19th Ave,Incident on 19TH AVE near COTTONWOOD RD Drive with caution.
2,2020-12-28 15:31:43,45.7942,-108.4816,Billings,MT,,US Highway 87 E,Incident on I-90 WB near US-87 Drive with caution.
3,2019-03-17 20:13:40,47.0161,-108.0686,Winnett,MT,,State Highway 200,At MT-500/Melstone Rd - Overturned vehicle. Single alternate lane traffic.
2,2020-11-15 09:57:00,46.6034,-112.0872,Helena,MT,3298, Euclid Ave,Incident on WILLIAMS ST near US-12 Drive with caution.
2,2020-10-22 12:58:11,45.8066,-111.2364,Belgrade,MT,16649, Frontage Rd,Incident on FRONTAGE RD near TOPAZ RD Drive with caution.
2,2020-09-27 10:43:27,45.8125,-108.4139,Billings,MT,900, Johnson Ln,Incident on OLD HARDIN RD near JOHNSON LN Drive with caution.
2,2020-11-09 03:16:28,45.0838,-111.2092,Gallatin Gateway,MT,34852, Gallatin Rd,Incident on US-191 near FS ROAD 508 Drive with caution.
2,2020-10-27 12:42:51,45.7729,-111.2007,Belgrade,MT,1013, Amsterdam Rd,Incident on AMSTERDAM RD near THORPE RD Drive with caution.
2,2020-09-23 21:44:34.000000000,46.6462,-111.9328,Helena,MT,3041, York Rd,Incident on YORK RD near HEATHER DR Drive with caution.
2,2020-11-12 05:07:08,46.3272,-114.0823,Corvallis,MT,1301, Holloran Ln,Incident on HOLLORAN LN near HONEY HOUSE LN Drive with caution.
2,2020-10-24 12:19:05,46.5567,-112.8745,Garrison,MT,,I-90 E,Incident on I-90 EB near MM 170 Drive with caution.
2,2020-10-18 02:10:18,45.7848,-108.4818,Billings,MT,,I-90 E,Incident on I-90 EB near US-212 Drive with caution.
2,2020-10-25 00:36:30,45.6545,-108.8329,Laurel,MT,,I-90 W,Stationary traffic on I-90 from I-90/Exit 433 (I-90) to US-10/Exit 426 (I-90) due to accident.
2,2020-12-12 02:02:03,45.8951,-111.4924,Three Forks,MT,,I-90 E,Incident on I-90 EB near MADISON RD Drive with caution.
2,2020-10-24 03:33:30,45.6307,-109.1995,Columbus,MT,,Columbus Molt Rd,Slow traffic on I-90 from US-10/Exit 426 (I-90) to MT-78/Exit 408 (I-90) due to accident.
2,2020-09-21 03:03:33,45.2764,-111.3403,Big Sky,MT,,Lone Mountain Trl,Incident on BIG SKY SPUR RD near LONE MOUNTAIN TRL Expect delays.
2,2020-11-13 20:55:00,48.3846,-114.1158,Columbia Falls,MT,7801, US Highway 2 E,Incident on US-2 EB near COLUMBIA FALLS Road closed. Take alternate route.
2,2020-12-22 19:24:06,46.5398,-112.8313,Garrison,MT,,I-90 E,Incident on I-90 EB near MM 174 Expect delays.
2,2019-02-01 22:46:04,45.6558,-110.5372,Livingston,MT,,I-90 W,At US-89/Exit 333 - Accident. Lane blocked.
2,2020-12-12 09:32:02.000000000,45.9723,-109.262,Rapelje,MT,200, Eighth St,Incident on 8TH ST near 2ND AVE Drive with caution.
2,2020-10-22 16:46:30,45.672,-109.3467,Columbus,MT,,I-90 W,Slow traffic on I-90 from MT-78/Exit 408 (I-90) to Twin Bridges Rd/Exit 396 (I-90) due to accident.
3,2018-10-01 14:09:14,45.6537,-108.7593,Laurel,MT,1451, US Highway 212 S,At US-212/US-310/Exit 434 - Accident. Single alternate lane traffic.
3,2017-06-05 04:38:39,48.2404,-114.2763,Kalispell,MT,2, W Reserve Dr,At MT-548 - Accident.
2,2020-11-21 22:49:19,48.4317,-114.489,Whitefish,MT,7663, Farm To Market Rd,Incident on FARM TO MARKET RD near STAR MEADOW RD Drive with caution.
2,2020-10-24 01:40:06,45.8588,-110.8804,Bozeman,MT,1676, Brackett Creek Rd,Incident on BRACKETT CREEK RD near MT-86 Drive with caution.
2,2020-10-24 03:19:40,45.6339,-109.2095,Columbus,MT,,I-90 W,Incident on I-90 WB near COLUMBUS MOLT RD Expect delays.
2,2020-12-14 18:56:46,46.5398,-111.9353,Clancy,MT,2, Bessler Rd,Incident on STATE HIGHWAY 518 near MT-518 Expect delays.
2,2020-12-16 02:17:03,46.2369,-114.1544,Hamilton,MT,100, Golf Course Rd,Incident on GOLF COURSE RD near 1ST ST Drive with caution.
2,2019-02-26 12:33:02,47.1404,-110.2161,Stanford,MT,,US Highway 87,Between MT-541 and Stanford - Accident. Lane blocked.
2,2020-11-28 18:40:55,47.3122,-114.0754,Saint Ignatius,MT,14598, Watson Rd,Incident on MISSION DAM RD near WATSON RD Expect delays.
2,2020-09-14 06:02:31,45.9262,-112.3947,Whitehall,MT,,Railroad Way,Incident on DELMOE LAKE RD near CAMP CAROLINE RD Expect delays.
2,2020-10-22 19:19:05,48.7759,-104.5645,Plentywood,MT,401, W 1st Ave,Incident on MAURICE ST near 1ST AVE Drive with caution.
2,2018-12-05 09:55:33,47.1858,-111.8102,Cascade,MT,,I-15 S,At Frontage Rd/Exit 247 - Accident. Roadway reduced to 1 lane. Lane blocked.
2,2020-09-10 19:14:29,46.4603,-112.1057,Clancy,MT,749, Lump Gulch Rd,Incident on LUMP GULCH RD near CORRAL GULCH RD Expect delays.
2,2020-11-11 03:13:08,47.133,-111.8949,Cascade,MT,,I-15 N,Incident on I-15 NB near MM 240 Drive with caution.
2,2020-11-11 14:32:30,46.8987,-112.1216,Wolf Creek,MT,,I-15 N,Slow traffic on I-15 N - US-287 N from Sieben Canyon Rd/Exit 216 (I-15) to Exit 226 (I-15) due to accident.
2,2020-11-08 22:38:27,45.7084,-110.4505,Livingston,MT,,I-90 E,Incident on I-90 EB near MM 340 Drive with caution.
2,2020-11-18 01:46:02,45.7493,-108.5357,Billings,MT,4800, Midland Rd,Incident on BILLINGS BLVD near MIDLAND RD Drive with caution.
2,2020-10-26 15:06:50,46.197,-114.1484,Hamilton,MT,295, Skalkaho Hwy,Incident on SKALKAHO HWY near MUSTANG LN Drive with caution.
3,2020-06-14 10:05:58,48.0668,-114.6828,Marion,MT,9260, US Highway 2 W,At McKillip Rd - Accident.
2,2020-11-10 14:55:38,46.8215,-114.0487,Missoula,MT,5488, Miller Creek Rd,Incident on UPPER MILLER CREEK RD near MILLER CREEK RD Drive with caution.
2,2020-11-16 22:31:56,46.9066,-105.0075,Glendive,MT,,I-94 W,Incident on I-94 WB near MM 192 Drive with caution.
2,2020-11-30 01:22:28,45.6691,-111.1885,Bozeman,MT,11, Homestake Dr,Incident on SHEPHERD TRL near HOMESTAKE DR Drive with caution.
2,2020-12-30 04:46:45,46.2875,-114.103,Corvallis,MT,525, Bass Ln,Incident on FARM WAY near BASS LN Expect delays.
2,2020-09-26 09:04:05,48.0169,-114.2251,Lakeside,MT,100, Stoner Loop,Incident on BLACKTAIL RD near US-93 Drive with caution.
2,2020-12-12 00:29:43,45.883,-111.4479,Three Forks,MT,,I-90 W,Incident on I-90 WB near MM 283 Expect delays.
2,2020-12-22 22:46:40,48.2231,-114.2654,Kalispell,MT,199, Johnson Ln,Incident on JOHNSON DR near BERNARD RD Drive with caution.
2,2019-02-06 09:07:27,46.7984,-114.0986,Missoula,MT,7893, US Highway 93 S,At US-93/Lewis and Clark Hwy - Accident. Roadway reduced to 1 lane. Lane blocked.
2,2020-10-24 16:58:07,46.0519,-107.7568,Pompeys Pillar,MT,,I-94 E,Incident on I-94 EB near MM 36 Drive with caution.
2,2020-11-08 17:59:00,47.5347,-111.4105,Great Falls,MT,,I-15 N,Slow traffic on I-15 from US-87/Exit 282 (I-15) to US-89/MT-200/Exit 290 (I-15) due to accident.
2,2020-11-11 05:25:08,48.3853,-114.2409,Columbia Falls,MT,101, Blacklog Ln,Incident on BRAIG RD near HALFMOON RD Drive with caution.
2,2020-12-25 21:31:41,45.6856,-111.1453,Bozeman,MT,2200, Durston Rd,Incident on LOVE LN near DURSTON RD Drive with caution.
2,2020-10-29 18:46:43,46.804,-114.0466,Missoula,MT,6998, Linda Vista Blvd,Incident on UPPER MILLER CREEK RD near LINDA VISTA BLVD Drive with caution.
2,2020-10-17 16:25:18,45.6625,-108.7696,Laurel,MT,,I-90 E,Incident on I-90 EB near US-212 Drive with caution.
2,2020-10-27 18:18:02,45.7661,-109.7907,Greycliff,MT,,I-90 W,Incident on I-90 WB near MM 377 Drive with caution.
4,2019-12-17 13:49:54,47.4942,-111.2732,Great Falls,MT,1989, 10th Ave S,Closed at 17th St S - Road closed due to accident.
2,2020-11-12 00:17:00,45.8113,-108.4175,Billings,MT,2698, Old Hardin Rd,Stationary traffic from Rykken Cir to I-90 E / Johnson Ln due to accident.
2,2020-12-15 07:34:33,46.6779,-111.8939,Helena,MT,3699, Merritt Ln,Incident on MERRITT LN near LAKE HELENA DR Drive with caution.
4,2017-08-30 05:08:21,46.6721,-113.1537,Drummond,MT,,US-12 W,Closed between MT-1/Exit 153 and Bearmouth Rest Area - Road closed due to accident.
2,2020-12-09 05:54:04,47.4941,-111.2817,Great Falls,MT,,15th St S,Incident on US-87 near MT-200 Expect delays.
2,2019-04-12 12:17:38,46.5152,-111.9472,Clancy,MT,,I-15 S,At Exit 182 - Accident. Lane blocked.
2,2020-12-02 02:16:28,45.7031,-110.4638,Livingston,MT,,I-90 E,Incident on I-90 EB near MM 340 Drive with caution.
2,2020-12-01 17:52:28,45.1015,-111.219,Gallatin Gateway,MT,35998, Gallatin Rd,Incident on GALLATIN RD near BUFFALO HORN CREEK RD Drive with caution.
2,2020-12-29 19:17:02,48.2258,-114.271,Kalispell,MT,171, E Evergreen Dr,Incident on EVERGREEN DR near BIRCH DR Expect delays.
2,2020-11-15 00:10:37,44.5477,-112.8724,Lima,MT,,Big Sheep Creek Rd,Incident on BIG SHEEP CREEK RD near MEADOW CREEK RD Drive with caution.
2,2020-11-21 10:32:09,45.3662,-110.739,Emigrant,MT,1, Avalon Ct,Incident on AVALON CT near STORY RD Expect delays.
2,2020-10-29 10:59:52,45.6625,-108.7696,Laurel,MT,,I-90 E,Incident on I-90 EB near US-212 Drive with caution.
2,2020-10-21 20:40:00,45.7076,-112.7009,Divide,MT,,I-15 N,Incident on I-15 NB near MOOSE CRK Road closed. Take alternate route.
3,2018-10-01 06:03:15,45.6511,-110.9423,Bozeman,MT,,I-90 W,At Bozeman Trail Rd/Exit 313 - Accident. emergency vehicles at scene.
4,2017-07-03 12:51:59,47.4942,-111.2956,Great Falls,MT,698, 10th Ave S,Closed at 9th St S - Road closed due to accident.
4,2018-06-19 15:37:24,47.1992,-112.2667,Wolf Creek,MT,6704, MT Highway 200,Closed at US-287 - Road closed due to accident.
2,2020-10-13 01:45:43,46.8832,-113.9941,Missoula,MT,,I-90 W,Incident on I-90 WB near MM 104 Expect delays.
2,2020-11-08 21:31:01,46.5599,-111.9103,East Helena,MT,,MT Highway 518,Incident on MT-518 near BUFFALO RUN RD Drive with caution.
3,2018-10-30 15:22:40,48.4387,-113.2189,East Glacier Park,MT,20897, US Highway 2,At Browning - Accident. Roadway reduced to 1 lane. emergency vehicles at scene.
2,2020-10-16 08:31:40,46.6367,-114.5817,Lolo,MT,44847, Lolo Creek Rd,Incident on US-12 near LOLO CREEK RD Drive with caution.
2,2020-10-24 18:49:08,47.9982,-105.8871,Fort Peck,MT,,State Highway 528,Incident on STATE HIGHWAY 528 near PRAIRIE ELK RD Drive with caution.
2,2020-12-21 01:55:55,45.6626,-110.8403,Bozeman,MT,,I-90 E,Incident on I-90 EB near MM 319 Drive with caution.
2,2020-12-12 07:14:02,46.5937,-112.1131,Helena,MT,4950, W US Highway 12,Incident on OLD BROADWATER LN near TEN MILE VIEW RD Drive with caution.
2,2020-12-12 17:47:28,45.882,-111.4438,Three Forks,MT,,I-90 E,Incident on I-90 EB near MM 283 Drive with caution.
2,2020-12-16 16:23:57,47.3297,-115.2585,Saint Regis,MT,,I-90 E,Incident on I-90 EB near MM 22 Drive with caution.
2,2020-11-13 00:36:58.000000000,45.2907,-111.4029,Big Sky,MT,2, Moose Ridge Rd,Incident on SITTING BULL near MOOSE RIDGE RD Expect delays.
2,2020-12-02 17:07:28,47.6594,-114.6473,Hot Springs,MT,23, Garden Creek Rd,Incident on GARDEN CREEK RD near WEST RD Drive with caution.
2,2020-12-22 23:40:40,46.3123,-114.1561,Victor,MT,,US Highway 93 N,Incident on US-93 near WOODSIDE CUTOFF RD Drive with caution.
2,2020-12-08 12:46:31,46.6741,-112.0513,Helena,MT,6685, Green Meadow Dr,Incident on GREEN MEADOW DR near NORRIS RD Drive with caution.
2,2020-11-09 04:11:25,45.7949,-108.2759,Huntley,MT,,I-90 W,Incident on I-90 WB near MM 469 Drive with caution.
2,2020-12-18 06:13:46,46.6096,-111.9358,East Helena,MT,2933, Wylie Dr,Incident on WYLIE DR near ELKVIEW DR Expect delays.
2,2019-02-08 11:42:18,46.9258,-114.0736,Missoula,MT,,I-90 E,At Airway Blvd/Exit 99 - Accident. Roadway reduced to 1 lane. Lane blocked.
3,2018-10-30 15:22:40,48.4268,-113.2108,East Glacier Park,MT,20808, US Highway 2,At MT-49/S Looking Glass Hill Rd - Accident. Roadway reduced to 1 lane. emergency vehicles at scene.
2,2020-12-23 15:56:06,45.349,-109.1745,Roberts,MT,850, Dry Creek Rd,Incident on US-212 near RAILWAY ST Expect delays.
2,2020-10-25 02:40:30,45.6339,-109.2095,Columbus,MT,,I-90 W,Slow traffic on I-90 from US-10/Exit 426 (I-90) to MT-78/Exit 408 (I-90) due to accident.
2,2020-10-26 12:42:50,47.484,-111.3457,Great Falls,MT,,MT-200 E,Incident on I-15 SB near MM 278 Expect delays.
2,2020-12-19 04:49:39,48.2838,-114.1541,Columbia Falls,MT,798, Tavern Ln,Incident on TAVERN LN near MOORING RD Drive with caution.
2,2020-11-08 22:48:00,45.7084,-110.4505,Livingston,MT,,I-90 E,Incident on I-90 EB near LIVINGSTON Expect long delays.
2,2020-11-09 16:42:42,48.1788,-111.941,Conrad,MT,399, N Main St,Incident on I-15 NB near MT-91 Drive with caution.
2,2020-12-14 16:11:03,45.6588,-110.6665,Livingston,MT,822, US Highway 10 W,Incident on FRONTAGE RD near COKEDALE RD Drive with caution.
2,2020-10-14 17:42:30,48.4622,-113.168,East Glacier Park,MT,21250, US Highway 2,Stationary traffic on US-2 from US-89 (Browning) (West) (US-2) to MT-49/Looking Glass Hl (US-2) due to accident.
2,2020-11-26 07:40:27,45.8196,-108.4139,Billings,MT,1201, Johnson Ln,Incident on COULSON RD near JOHNSON LN Drive with caution.
2,2018-11-26 10:15:12,45.6827,-107.5071,Crow Agency,MT,,I-90 W,Between Exit 503 and I-90-BL/Exit 497 - Accident. Lane blocked.
2,2020-10-26 22:14:53,45.7721,-109.7959,Greycliff,MT,,I-90 W,Incident on I-90 WB near MM 377 Drive with caution.
2,2020-10-22 19:54:17,45.5675,-111.1968,Gallatin Gateway,MT,4, Hawk Hill Rd,Incident on GALLATIN RD near HAWK HILL RD Drive with caution.
2,2020-12-16 17:47:04,45.7874,-111.2123,Belgrade,MT,4440, Thorpe Rd,Incident on THORPE RD near KENDALL CT Drive with caution.
2,2020-11-10 16:07:08,48.4069,-114.2626,Whitefish,MT,2208, E Edgewood Dr,Incident on BURLY BEAR TRL near EDGEWOOD DR Drive with caution.
2,2020-12-16 08:32:03,47.3508,-115.2913,Saint Regis,MT,,I-90 E,Incident on I-90 EB near MM 18 Drive with caution.
2,2020-11-25 19:00:09,46.0711,-112.5998,Butte,MT,26, Hail Columbia Gulch Rd,Incident on HAIL COLUMBIA GULCH near SHEEP GULCH Drive with caution.
2,2020-11-07 02:59:24,48.5559,-113.0183,Browning,MT,101, 2nd St NW,Incident on US-2 near 2ND AVE Drive with caution.
2,2020-11-09 15:45:42,46.8951,-114.1663,Missoula,MT,2598, Paradise Rd,Incident on PARADISE RD near BIG FLAT RD Expect delays.
2,2020-11-12 06:34:25,45.7239,-107.6621,Hardin,MT,1801, Peritsa Creek Rd,Incident on PERITSA CREEK RD near DAVIS RD Drive with caution.
2,2020-11-14 00:11:26.000000000,48.1273,-111.9009,Conrad,MT,,I-15 N,Incident on I-15 NB near MM 335 Drive with caution.
2,2020-10-21 17:06:34,45.7766,-111.0858,Belgrade,MT,2, Willem Way,Incident on AIRPORT RD near SPRINGHILL RD Expect delays.
2,2020-10-24 18:55:00,45.6076,-109.0253,Park City,MT,,I-90 W,Slow traffic on I-90 from US-10/Exit 426 (I-90) to MT-78/Exit 408 (I-90) due to accident.
2,2020-11-06 03:03:08,45.5972,-111.0835,Bozeman,MT,8878, Fowler Ln,Incident on ALAMOSA LN near FOWLER LN Drive with caution.
2,2020-10-25 02:26:00,45.6846,-108.7011,Laurel,MT,,I-90 E,Slow traffic on I-90 from I-90/Exit 437 (I-90) to Zoo Dr/Exit 443 (I-90) due to accident.
2,2020-10-15 13:01:40,46.5418,-111.7394,East Helena,MT,5924, US Highway 287,Incident on US-12 near L F BAUM RD Drive with caution.
2,2020-09-24 23:35:00,48.373,-112.5743,Valier,MT,,US Highway 89,Incident on US-89 NB near BAGER-FISHER RD Expect delays.
2,2020-12-20 15:32:46,45.8876,-106.6306,Colstrip,MT,30, Mint Ct,Incident on POPLAR DR near LINDEN CT Drive with caution.
2,2020-10-22 13:37:47,48.1682,-114.1106,Kalispell,MT,101, Lindsey Ln,Incident on MT-35 near LINDSEY LN Drive with caution.
2,2020-10-24 12:58:05,45.6855,-109.4618,Reed Point,MT,,I-90 W,Incident on I-90 WB near MM 396 Drive with caution.
2,2020-12-24 21:55:40,48.2404,-114.3203,Kalispell,MT,748, W Reserve Dr,Incident on RESERVE DR near COUNTRY WAY Drive with caution.
2,2020-12-19 02:11:11,45.2288,-108.9578,Bridger,MT,,Highway 72,Incident on MT-72 near BROWN LN Drive with caution.
2,2020-11-08 18:23:27,46.5331,-111.9414,Clancy,MT,,I-15 N,Incident on I-15 NB near MM 187 Drive with caution.
2,2020-11-20 18:15:47,47.1846,-114.8772,Superior,MT,,I-90 W,Incident on I-90 WB near MM 47 Drive with caution.
2,2020-10-22 19:54:17,45.5675,-111.1968,Gallatin Gateway,MT,4, Hawk Hill Rd,Incident on GALLATIN RD near HAWK HILL RD Drive with caution.
3,2018-02-08 15:14:57,46.9033,-105.0145,Glendive,MT,,I-94 E,At CR-260/Exit 198 - Accident. Single alternate lane traffic.
2,2020-11-23 16:49:06,45.62,-111.5509,Gallatin Gateway,MT,1, Pole Creek Rd,Incident on NORRIS RD near MT-84 Drive with caution.
2,2020-11-11 18:43:08,46.9176,-112.12,Wolf Creek,MT,,I-15 N,Incident on I-15 NB near US-287 Drive with caution.
2,2020-12-22 21:53:40,48.298,-114.1972,Columbia Falls,MT,2100, Columbia Falls Stage,Incident on COLUMBIA FALLS STAGE near TRAP LN Expect delays.
2,2020-11-16 16:13:12,48.1864,-114.3941,Kalispell,MT,101, Smith Lake Rd,Incident on WHALEBONE DR near WINDSONG WAY Drive with caution.
2,2020-09-15 19:30:32.000000000,47.4426,-114.097,Charlo,MT,40998, US Highway 93,Incident on US-93 near MT-212 Expect delays.
2,2020-12-15 00:13:31,45.8139,-108.414,Billings,MT,999, Johnson Ln,Incident on JOHNSON LN near US-87 Drive with caution.
2,2020-11-27 01:16:27,45.6516,-109.2578,Columbus,MT,,I-90 W,Incident on I-90 WB near MT-306 Drive with caution.
2,2020-12-12 22:47:03,46.8162,-111.8094,Wolf Creek,MT,8599, Nelson Rd,Incident on NELSON RD near BEAVER CREEK RD Drive with caution.
2,2020-12-25 03:55:00,47.3702,-114.7936,Plains,MT,8367, MT Highway 200,Incident on MT-200 near PARADISE VALLEY DR Drive with caution.
2,2020-12-17 16:53:04,45.8498,-108.4558,Billings,MT,2740, US Highway 312,Incident on GRELCK LN near ROSE DR Drive with caution.
2,2020-11-14 01:43:24,48.8108,-114.9754,Eureka,MT,6091, Tobacco Rd,Incident on TOBACCO RD near APPALOOSA TRL Drive with caution.
2,2020-10-24 23:28:30,45.7848,-108.4818,Billings,MT,,I-90 E,Slow traffic on I-90 from MT-3/S 27th St/Exit 450 (I-90) to I-90 Bus/US-87/Exit 452 (I-90) due to accident.
2,2020-11-19 16:45:24,47.5199,-114.8048,Plains,MT,1492, MT Highway 28,Incident on MT-28 near CLARK CREEK RD Drive with caution.
2,2020-12-25 04:46:40,48.4704,-114.1198,Columbia Falls,MT,4389, N Fork Rd,Incident on FORK RD near BLANKENSHIP RD Drive with caution.
2,2020-10-12 23:29:56,47.0759,-109.4584,Lewistown,MT,999, Cook Ave,Incident on COOK AVE near WHITE ST Drive with caution.
2,2020-11-25 11:07:07,48.2943,-114.2082,Columbia Falls,MT,401, Windfield Ln,Incident on WINDFIELD LN near COLUMBIA FALLS STAGE Drive with caution.
2,2020-10-24 22:13:08,45.9186,-111.585,Three Forks,MT,,I-90 W,Incident on I-90 WB near MM 274 Drive with caution.
2,2017-01-13 14:34:33,46.2611,-112.1975,Boulder,MT,,I-15 S,Between Exit 160 and Exit 156 - Accident.
2,2020-12-08 02:31:31,46.6019,-111.9145,East Helena,MT,2697, Valley Dr,Incident on VALLEY DR near COBRE DR Drive with caution.
2,2020-12-22 23:16:40,46.5439,-111.9466,Clancy,MT,,I-15 S,Incident on I-15 SB near MM 187 Drive with caution.
2,2020-11-30 16:24:07,47.3231,-114.2945,Dixon,MT,98, MT Highway 212,Incident on MT-212 near HIGHWAY 212 Expect delays.
2,2020-10-20 14:31:04,48.4451,-114.036,Coram,MT,2, Desert Lodge Rd,Incident on US-2 near DESERT LODGE RD Expect delays.
2,2020-11-08 18:23:27,46.5369,-111.9431,Clancy,MT,,I-15 N,Incident on I-15 NB near MM 187 Drive with caution.
2,2020-11-10 02:25:08.000000000,48.1501,-114.1102,Kalispell,MT,101, La Brant Rd,Incident on MT-35 near DYER RD Drive with caution.
2,2020-11-24 13:34:06,46.9176,-112.12,Wolf Creek,MT,,I-15 N,Incident on I-15 NB near US-287 Drive with caution.
2,2020-11-26 20:10:27,48.6389,-112.2111,Cut Bank,MT,198, Luedtke Rd,Incident on OLD KEVIN HWY near LUEDTKE RD Expect delays.
2,2020-12-14 14:20:03,45.7515,-108.5515,Billings,MT,,I-90 W,Incident on I-90 WB near MM 446 Drive with caution.
2,2020-11-14 01:06:56,45.9885,-107.9848,Pompeys Pillar,MT,,I-94 W,Incident on I-94 WB near MM 23 Drive with caution.
2,2020-09-30 23:21:19,47.9058,-114.2086,Rollins,MT,,State Rd,Incident on US-93 near DON A LEE LN Drive with caution.
2,2020-10-26 01:45:34,48.1362,-114.7094,Marion,MT,1399, Pleasant Valley Rd,Incident on PLEASANT VALLEY RD near BITTERROOT RD Drive with caution.
3,2019-01-06 16:36:06,46.2716,-112.2422,Boulder,MT,,I-15 N,Between Exit 156 and Exit 160 - Accident.
3,2018-02-03 00:43:18,46.3923,-105.8276,Miles City,MT,,I-94 E,Between MT-59/Exit 138 and I-94-BL/US-12/Exit 141 - Accident.
2,2020-12-22 19:31:40,48.2043,-114.4009,Kalispell,MT,398, Sheepherder Hill Rd,Incident on SHEEPHERDER HILL RD near VALLEY DR Drive with caution.
2,2020-12-30 21:31:46,45.7197,-110.2541,Livingston,MT,,I-90 E,Incident on I-90 EB near MM 352 Expect delays.
2,2020-12-12 02:10:00,45.6579,-110.5345,Livingston,MT,,I-90 E,Incident on I-90 EB near LIVINGSTON Expect long delays.
2,2020-11-11 03:27:46,46.9683,-114.2294,Alberton,MT,17684, Southside Rd,Incident on SOUTHSIDE RD near ALBERT CREEK RD Drive with caution.
2,2020-12-11 22:53:02,45.8177,-108.41,Billings,MT,,I-90 W,Incident on I-90 WB near MM 455 Drive with caution.
2,2020-12-31 18:50:44,48.7917,-114.9348,Eureka,MT,2, Grave Creek Rd,Incident on GRAVE CREEK RD near US-93 Drive with caution.
2,2020-09-17 21:56:23,47.7904,-114.1739,Polson,MT,28999, Pops Pl,Incident on ROCKY POINT RD near POPS PL Expect delays.
2,2019-10-23 11:00:55,46.3134,-112.078,Boulder,MT,,I-15 S,At MT-69/Exit 164 - Accident. Roadway reduced to 1 lane. Lane blocked.
2,2020-12-13 23:07:55,45.7215,-111.1643,Bozeman,MT,3899, S Alaska Rd,Incident on ALASKA RD near VALLEY CENTER RD Drive with caution.
2,2020-11-11 16:55:08,45.8183,-114.2386,Darby,MT,6520, W Fork Rd,Incident on BOULDER CREEK RD near FORK RD Drive with caution.
2,2020-11-18 15:14:24,45.7726,-111.3096,Manhattan,MT,6162, Amsterdam Rd,Incident on AMSTERDAM RD near MT-347 Expect delays.
2,2020-10-13 17:13:40,47.0035,-114.4894,Alberton,MT,,I-90 W,Incident on I-90 WB near MM 75 Expect delays.
2,2020-11-30 20:55:28,45.7789,-111.2111,Belgrade,MT,50, E Vela Rd,Incident on MAGNOLIA DR near VELA RD Drive with caution.
2,2020-10-24 18:55:00,45.5983,-109.076,Columbus,MT,,I-90 W,Slow traffic on I-90 from US-10/Exit 426 (I-90) to MT-78/Exit 408 (I-90) due to accident.
2,2020-12-16 09:23:03,46.9422,-112.9471,Helmville,MT,30998, MT Highway 141,Incident on MT-200 near MT-141 Drive with caution.
