Severity,Date/Time,Latitude,Longitude,City,State,Number,Street,Description
2,2020-10-24 13:34:05,47.0189,-114.6538,Alberton,MT,,I-90 E,Incident on I-90 EB near MM 66 Drive with caution.
2,2020-12-11 19:22:11,47.5646,-111.5376,Vaughn,MT,,I-15 S,Incident on I-15 SB near MT-200 Expect delays.
2,2020-10-22 15:26:00,47.4547,-115.6947,Saint Regis,MT,,I-90 W,Slow traffic on I-90 from Exit 5 (I-90) to I-90 Bus/Exit 69 (I-90) due to accident.
2,2020-11-15 19:23:20,47.6602,-114.0696,Polson,MT,7000, Dubay Rd,Incident on TURTLE LAKE RD near MOUNTAIN VIEW RD Expect delays.
2,2020-11-28 10:11:25.000000000,46.6799,-112.0108,Helena,MT,4784, Frontage Dr,Incident on FRONTAGE DR near MASONIC HOME RD Drive with caution.
2,2020-09-21 12:27:34,47.0303,-114.3243,Huson,MT,23399, Mullan Rd,Incident on MULLAN RD near MAIN ST Drive with caution.
2,2020-12-01 20:04:21,45.6527,-111.1896,Bozeman,MT,80598, Gallatin Rd,Incident on GALLATIN RD near LOWER RAINBOW RD Drive with caution.
2,2020-10-22 13:55:04,45.6622,-108.8024,Laurel,MT,,I-90 W,Incident on I-90 WB near MM 447 Drive with caution.
2,2019-02-20 08:38:01,46.8646,-113.9567,Missoula,MT,,I-90 E,At MT-200/Exit 107 - Accident. Roadway reduced to 1 lane. Lane blocked.
2,2020-11-01 14:29:20,45.4198,-110.6667,Livingston,MT,3600, US Highway 89 S,Incident on US-89 near MERIDIAN RD Drive with caution.
3,2018-02-23 13:57:13,48.3005,-113.3789,Essex,MT,16905, US Highway 2 E,At MT-49/S Looking Glass Hill Rd - Accident. Jackknifed articulated truck.
2,2020-11-25 22:49:27,45.7002,-111.0952,Bozeman,MT,2100, Riata Rd,Incident on RIATA RD near BAXTER LN Drive with caution.
2,2020-11-16 21:34:01,48.012,-114.2228,Lakeside,MT,7430, Highway 93 S,Incident on US-93 near POLITICAL HILL RD Drive with caution.
2,2018-10-19 11:28:27,46.9496,-114.1278,Missoula,MT,,I-90 W,At US-93/MT-200/Exit 96 - Accident.
2,2020-12-23 01:37:43,45.6761,-111.1857,Bozeman,MT,259, Jackrabbit Ln,Incident on JACKRABBIT LN near NORTHSTAR LN Drive with caution.
2,2020-12-21 17:13:40,46.8025,-113.7735,Clinton,MT,,I-90 E,Incident on I-90 EB near MULLAN RD Drive with caution.
4,2020-12-30 23:44:37,45.6878,-110.5009,Livingston,MT,,I-90 W,I-90 W - US-191 S is closed from US-89/Exit 340 (I-90) to US-89/Exit 333 (I-90) due to accident.
2,2018-09-04 14:52:21,45.7248,-113.919,Sula,MT,8335, Lewis and Clark Trl,At Darby - Accident.
2,2020-12-22 23:16:40,46.5439,-111.9466,Clancy,MT,,I-15 S,Incident on I-15 SB near MM 187 Drive with caution.
2,2020-11-15 05:49:50,47.5006,-114.1397,Ronan,MT,49100, Rocky Butte Rd,Incident on ROCKY BUTTE RD near BOUCHARD RD Drive with caution.
2,2020-11-27 09:46:07,46.9538,-114.1356,Missoula,MT,,I-90 E,Incident on I-90 EB near MT-200 Drive with caution.
2,2020-12-17 01:43:20,47.1731,-113.4731,Seeley Lake,MT,201, Airport Rd,Incident on LOCUST LN near TAMARACK DR Drive with caution.
2,2020-12-13 20:35:03,45.671,-111.1251,Bozeman,MT,8478, Huffine Ln,Incident on GOOCH HILL RD near HUFFINE LN Drive with caution.
2,2020-11-16 00:43:12,46.8238,-113.949,Missoula,MT,3655, Pattee Canyon Rd,Incident on PATTEE CANYON RD near LUPINE RD Drive with caution.
2,2020-10-19 14:09:57,48.6153,-112.2874,Cut Bank,MT,3, Scheuren Rd,Incident on SCHEUREN RD near US-2 Drive with caution.
2,2020-11-17 04:44:11,45.7391,-111.1062,Bozeman,MT,24502, Frontage Rd,Incident on FRONTAGE RD near ARETE DR Drive with caution.
2,2020-12-26 17:10:06,45.555,-111.191,Gallatin Gateway,MT,2, Hawk Hill Rd,Incident on HAWK HILL RD near LITTLE BEAR RD Drive with caution.
2,2020-12-28 17:50:18,45.6565,-110.9803,Bozeman,MT,2127, Bozeman Trail Rd,Incident on BOZEMAN TRAIL RD near FORT ELLIS RD Drive with caution.
2,2020-10-25 00:38:30,45.6362,-108.9097,Park City,MT,,I-90 W,Slow traffic on I-90 from I-90/Exit 433 (I-90) to MT-78/Exit 408 (I-90) due to accident.
2,2020-12-03 01:38:15,45.7294,-111.1239,Bozeman,MT,1198, Harper Puckett Rd,Incident on VALLEY CENTER RD near HARPER PUCKET RD Expect delays.
2,2020-10-27 01:03:50,46.7321,-112.0206,Helena,MT,8200, N Montana Ave,Incident on MONTANA AVE near COUNTY ROAD 229 Drive with caution.
2,2020-12-27 23:07:43,45.2482,-111.3223,Big Sky,MT,999, Spruce Cone Dr,Incident on SPRUCE CONE DR near OUSEL FALLS RD Drive with caution.
2,2020-11-28 04:07:27,48.5394,-108.8085,Harlem,MT,,US Highway 2,Incident on US-2 near THIRTY MILE RD Expect delays.
2,2020-11-08 16:00:00,47.5516,-111.4867,Great Falls,MT,,I-15 N,Stationary traffic on I-15 from Manchester Rd/Exit 286 (I-15) to US-89/MT-200/Exit 290 (I-15) due to accident.
3,2018-01-19 08:34:44,44.6178,-112.5631,Lima,MT,,I-15 S,At Exit 9 - Accident involving heavy truck. Roadway reduced to 1 lane.
2,2020-10-15 13:46:30,46.8752,-113.9207,Missoula,MT,,I-90 W,Slow traffic on I-90 from MT-200/Exit 109 (I-90) to MT-200/Exit 107 (I-90) due to accident roadwork.
2,2020-10-24 23:39:30,45.9149,-111.7315,Cardwell,MT,,I-90 W,Slow traffic on I-90 from US-287/Exit 274 (I-90) to Millegan Canyon Rd/Exit 267 (I-90) due to accident.
2,2020-12-12 02:01:30,45.8967,-111.5016,Three Forks,MT,,I-90 E,Slow traffic on I-90 E from MT-2/CR-205/Exit 278 (I-90) to Buffalo Jump Rd/Exit 283 (I-90) due to accident.
2,2020-11-18 19:36:56,45.708,-108.6255,Billings,MT,8875, Stearns Cir,Incident on STEARNS CIR near STORY RD Expect delays.
2,2020-10-25 07:50:51,48.1746,-114.4265,Kalispell,MT,150, Batavia Ln,Incident on BATAVIA LN near US-2 Drive with caution.
2,2020-11-05 18:18:00,48.9939,-111.9596,Sweet Grass,MT,,I-15 N,Stationary traffic on I-15 from Border Rd/Exit 397 (I-15) to CAN--USA National Border (I-15) due to accident.
2,2020-12-15 08:10:22,46.8596,-114.0445,Missoula,MT,1, Apple Tree Ln,Incident on SPURGIN RD near 27TH AVE Drive with caution.
2,2020-10-24 14:35:38,46.7268,-113.6771,Clinton,MT,,I-90 W,Incident on I-90 WB near INTERSTATE 90 Expect delays.
2,2020-11-22 15:19:05,45.8586,-110.8809,Bozeman,MT,1599, Brackett Creek Rd,Incident on BRACKETT CREEK RD near BRIDGER CANYON RD Drive with caution.
2,2020-10-21 23:31:04,48.2063,-110.0803,Big Sandy,MT,123, Coal Mine Rd,Incident on COAL MINE RD near US-87 Drive with caution.
2,2020-12-13 01:48:59,46.2839,-114.144,Hamilton,MT,583, Old Corvallis Rd,Incident on OLD CORVALLIS RD near BLACK LN Drive with caution.
2,2020-11-10 19:19:08,47.028,-114.2936,Frenchtown,MT,21298, Frenchtown Frontage Rd,Incident on HOULE CREEK RD near BRITTANY LN Drive with caution.
2,2020-10-24 18:01:07,45.7522,-108.547,Billings,MT,,I-90 W,Incident on I-90 WB near MM 452 Drive with caution.
4,2018-12-31 16:18:03,45.7524,-108.5185,Billings,MT,,I-90 W,Closed between MT-3/27th Street/Exit 450 and Mullowney Ln/King Ave/Exit 446 - Road closed due to accident.
2,2020-09-30 18:15:49,45.7939,-112.1693,Whitehall,MT,298, Franich Ln,Incident on MT-55 near FRANICH LN Expect delays.
2,2020-11-14 03:37:42,45.9058,-108.2955,Huntley,MT,250, Highway 312,Incident on HIGHWAY 312 near 3RD ST Drive with caution.
2,2020-10-14 04:46:50,47.2997,-115.0861,Saint Regis,MT,,Mill Creek Rd,Incident on MILL CREEK RD near PIONEER LN Expect delays.
4,2019-02-26 12:35:19,45.7011,-109.3929,Columbus,MT,,I-90 E,At Springtime Road/Exit 400 - Multi-vehicle accident involving vehicle.
2,2020-09-29 02:28:28,46.6132,-105.5427,Ismay,MT,,I-94 W,Incident on I-94 WB near MM 148 Drive with caution.
2,2020-11-01 00:18:21,45.9812,-112.4887,Butte,MT,,I-15 N,Incident on I-15 NB near MM 129 Expect delays.
2,2020-10-14 13:11:24,47.6621,-114.2084,Polson,MT,3598, Kerr Dam Rd,Incident on KERR DAM RD near BROKEN WHEEL RD Drive with caution.
2,2020-12-24 04:58:49,46.391,-111.5771,Townsend,MT,2, Trailhead View Dr,Incident on US-12 near TRAILHEAD VIEW Drive with caution.
2,2020-12-15 05:23:03,45.9568,-112.4697,Butte,MT,,I-90 W,Incident on I-90 WB near MM 228 Drive with caution.
2,2020-09-26 23:52:27,47.7029,-114.6398,Lonepine,MT,55, Lonepine Rd,Incident on LONEPINE RD near WEST RD Expect delays.
2,2020-10-29 01:44:52,46.9513,-112.3352,Canyon Creek,MT,12807, Lincoln Rd W,Incident on MT-279 near PAINTBRUSH DR Drive with caution.
2,2020-12-12 22:33:38,45.9837,-111.6398,Three Forks,MT,322, Price Rd,Incident on PRICE RD near BLUEBIRD VALLEY RD Drive with caution.
2,2020-11-07 02:47:24,46.2494,-112.1159,Boulder,MT,,I-15 S,Incident on I-15 SB near MAIN ST Drive with caution.
2,2020-10-25 21:50:56,47.4531,-115.6942,Saint Regis,MT,,I-90 E,Incident on I-90 EB near MM 0 Drive with caution.
2,2020-12-23 05:50:32,47.0441,-114.0815,Missoula,MT,17964, US Highway 93,Incident on US-93 near CANDLEWICK LN Expect delays.
2,2020-10-27 19:57:45,46.6531,-112.0375,Helena,MT,5498, Robin Dr,Incident on ROBIN DR near SEWELL RD Drive with caution.
2,2020-12-16 18:28:08,47.5878,-114.0704,Ronan,MT,43249, N Foothills Dr,Incident on FOOTHILLS DR near CEMETERY RD Drive with caution.
2,2020-10-18 21:09:57,45.7291,-111.091,Bozeman,MT,,E Valley Center Rd,Incident on VALLEY CENTER RD near FRONTAGE RD Drive with caution.
2,2020-11-22 01:27:06,48.3745,-114.3355,Whitefish,MT,2, Emerald Dr,Incident on US-93 near MT-40 Drive with caution.
2,2020-10-25 22:24:50,48.1759,-114.0937,Kalispell,MT,427, S Many Lakes Dr,Incident on DOUBLE LAKE DR near MANY LAKES DR Drive with caution.
2,2020-11-30 02:28:46,46.2936,-113.9335,Corvallis,MT,,FS Road 364B,Incident on WILLOW CREEK RD near FS ROAD 364B Drive with caution.
2,2020-10-28 04:51:51,46.7105,-113.3325,Drummond,MT,,Interstate 90,Incident on I-90 WB near BEAR GULCH RD Drive with caution.
2,2020-12-08 01:00:00,45.7952,-108.4776,Billings,MT,424, US Highway 87 E,Incident on US-87 SB near BILLINGS Expect long delays.
2,2020-11-12 10:18:30,46.868,-113.9457,Missoula,MT,,I-90 W,Stationary traffic on US-12 W - I-90 W - MT-200 W from MT-200/Exit 109 (I-90) to MT-200/Exit 107 (I-90) due to accident.
2,2020-12-12 00:29:43.000000000,45.8826,-111.4378,Manhattan,MT,,Buffalo Jump Rd,Incident on I-90 WB near MM 283 Expect delays.
2,2020-12-17 16:42:19,46.9551,-112.6816,Lincoln,MT,501, Main St,Incident on MAIN ST near SLEEPY HOLLOW LN Drive with caution.
2,2020-12-09 18:20:01.000000000,45.2513,-111.3265,Big Sky,MT,500, Crown Butte Rd,Incident on SAND HILL RD near CROWN BUTTE RD Drive with caution.
2,2020-11-08 15:25:42,45.6306,-108.9303,Park City,MT,,I-90 W,Incident on I-90 WB near MM 426 Drive with caution.
2,2020-12-11 22:11:02.000000000,46.9538,-114.1356,Missoula,MT,,I-90 E,Incident on I-90 EB near COAL MINE RD Drive with caution.
2,2020-12-14 16:02:03,45.6553,-111.125,Bozeman,MT,3198, Texas Way,Incident on GOOCH HILL RD near STUCKY RD Drive with caution.
2,2019-02-16 09:05:45,47.0674,-110.1052,Stanford,MT,,US Highway 87,At MT-541 - Accident. Roadway reduced to 1 lane. Lane blocked.
2,2020-10-25 22:27:05,46.1736,-111.4893,Toston,MT,,MT Highway 285,Incident on MT-285 near SMITH LN Drive with caution.
2,2020-10-23 16:19:05,47.4781,-114.4368,Hot Springs,MT,,Melton Ln,Incident on MELTON LN near LITTLE BITTERROOT RD Expect delays.
2,2020-12-27 01:32:48,45.8563,-109.8158,Big Timber,MT,,YBR Ln,Incident on HOWIE RD near YBR LN Drive with caution.
2,2020-11-03 21:17:21,44.5578,-112.3143,Lima,MT,,I-15 N,Incident on I-15 NB near MM 0 Expect delays.
2,2020-11-25 01:40:33,47.5647,-111.5376,Vaughn,MT,,I-15 S,Incident on I-15 SB near MM 290 Drive with caution.
2,2020-11-06 04:59:23,48.3003,-113.38,Essex,MT,,US Highway 2 E,Incident on US-2 near SKYLAND RD Expect delays.
2,2020-12-22 23:40:40,46.3123,-114.1561,Victor,MT,,US Highway 93 N,Incident on US-93 near WOODSIDE CUTOFF RD Drive with caution.
2,2020-12-03 02:22:29,48.1747,-114.4223,Kalispell,MT,2898, US Highway 2 W,Incident on US-2 near BATAVIA LN Drive with caution.
2,2020-11-10 22:01:08,48.4793,-114.3988,Whitefish,MT,101, Roaring Creek Rd,Incident on ROARING CREEK RD near LAKESHORE DR Drive with caution.
2,2020-10-24 23:19:30,45.8198,-108.3481,Billings,MT,,I-90 E,Slow traffic on I-90 from I-94/Exit 456 (I-90) to Pryor Creek Rd/Exit 462 (I-90) due to accident.
2,2020-12-13 05:47:03,45.7984,-108.4483,Billings,MT,,Old Hardin Rd,Incident on OLD HARDIN RD near US-87 Drive with caution.
4,2016-08-31 14:16:35,48.1829,-114.4117,Kalispell,MT,2580, US Highway 2 W,Closed at West Valley View Dr - Road closed due to accident.
2,2020-10-24 02:10:06,48.2214,-114.349,Kalispell,MT,,US-93 Alt S,Incident on US-93 near MM 5 Drive with caution.
2,2020-12-29 15:29:53,47.1232,-104.7313,Glendive,MT,127, Highway 16,Incident on MT-16 near LEWIS AND CLARK TRL Drive with caution.
2,2020-11-11 17:46:08.000000000,46.0072,-112.6492,Butte,MT,,I-90 E,Incident on I-90 EB near MM 219 Drive with caution.
2,2020-12-11 14:54:21,47.5628,-111.5354,Power,MT,,MT-200,Incident on I-15 NB near MT-200 Drive with caution.
3,2018-01-01 06:40:44,47.2024,-114.9255,Superior,MT,,I-90 W,At Dry Creek Rd/Exit 43 - Accident involving heavy truck. Lane blocked.
2,2020-12-18 22:35:30,47.0104,-113.345,Bonner,MT,45637, MT Highway 200 E,Incident on MT-200 near SPERRY GRADE RD Drive with caution.
2,2020-10-28 09:40:51,46.5912,-111.9915,Helena,MT,2799, Prospect Ave,Incident on US-287 near MM 18 Drive with caution.
2,2020-11-16 05:00:38,46.8307,-104.2193,Wibaux,MT,6798, State Highway 7,Incident on MT-7 near HORSE POINT RD Drive with caution.
2,2020-12-02 05:16:28,48.1854,-111.9341,Conrad,MT,,Lewis and Clark Trl S,Incident on I-15 SB near MM 339 Expect delays.
2,2020-11-08 15:50:27,47.5571,-111.5221,Power,MT,,I-15 N,Incident on I-15 NB near MM 290 Expect delays.
2,2019-10-30 09:24:45,47.3439,-114.7115,Plains,MT,8834, MT Highway 200,At MT-135 - Accident. Left lane blocked.
2,2020-12-30 06:20:42,46.8817,-113.8932,Missoula,MT,7601, Carols Way,Incident on TREMPER RD near MOUNTAIN VIEW TRAILER COURT RD Expect delays.
2,2020-10-20 04:38:54,47.0896,-104.7775,Glendive,MT,,I-94 E,Incident on I-94 EB near MM 211 Expect delays.
2,2020-12-18 09:45:13,48.3637,-114.143,Columbia Falls,MT,101, Mabel St,Incident on BERNE RD near COLUMBIA MOUNTAIN RD Expect delays.
2,2020-12-31 15:28:46,45.7438,-111.1696,Bozeman,MT,750, E Cameron Bridge Rd,Incident on CAMERON BRIDGE RD near ALASKA RD Drive with caution.
2,2020-10-28 16:46:51,46.2365,-108.5044,Roundup,MT,301, Majerus Rd,Incident on MAJERUS RD near HARPER COULEE RD Drive with caution.
2,2019-10-30 12:36:00,47.296,-115.1685,Saint Regis,MT,,I-90 W,Between Two Mile Road/Exit 30 and Drexel Rd/Exit 25 - Accident. Lane blocked.
2,2020-11-13 22:49:00,45.4051,-109.3256,Roberts,MT,,Red Lodge Creek Rd,Incident on RED LODGE CREEK RD near REDDENBEAU RD Expect delays.
2,2020-10-25 22:00:50,45.8901,-111.5516,Three Forks,MT,50, E Fir St,Incident on FIR ST near MAIN ST Drive with caution.
2,2020-12-22 18:52:50,48.1648,-114.2875,Kalispell,MT,7, Lower Valley Rd,Incident on LOWER VALLEY RD near WILLOW GLEN DR Drive with caution.
2,2020-10-24 18:33:00,46.8731,-112.0696,Wolf Creek,MT,,I-15 N,Slow traffic on I-15 from Gates of the Mountain Rd/Exit 209 (I-15) to Exit 226 (I-15) due to accident.
2,2020-09-24 17:48:01,45.5237,-108.8577,Joliet,MT,4296, US Highway 310,Incident on US-212 near GRAPEVINE RD Drive with caution.
2,2019-02-05 11:29:35,46.8231,-112.0027,Wolf Creek,MT,,I-15 S,At Gates of the Mountains Rd/Exit 209 - Accident. Lane blocked.
2,2018-02-26 13:43:43,45.8562,-112.6748,Divide,MT,,I-15 S,At MT-43/Exit 102 - Accident.
2,2020-11-11 16:22:44,45.8704,-111.9599,Whitehall,MT,,I-90 E,Incident on I-90 EB near MM 256 Drive with caution.
2,2020-10-18 01:54:30,45.7705,-108.4869,Billings,MT,,I-90 E,Stationary traffic on I-90 from MT-3/S 27th St/Exit 450 (I-90) to I-90 Bus/US-87/Exit 452 (I-90) due to accident.
2,2020-11-12 20:31:09,48.4795,-114.51,Whitefish,MT,201, Lupfer Rd,Incident on LUPFER MEADOWS RD near US-93 Drive with caution.
2,2020-12-12 00:56:29,47.5418,-111.7006,Vaughn,MT,842, US Highway 89,Incident on US-89 near MT-200 Drive with caution.
2,2020-10-24 01:49:06,45.8267,-108.3958,Billings,MT,,I-94 W,Incident on I-94 WB near MM 0 Expect delays.
2,2020-11-09 04:20:30,45.7794,-108.1259,Billings,MT,,I-90 W,Slow traffic on I-90 from Fly Creek Rd/Exit 478 (I-90) to Pryor Creek Rd/Exit 462 (I-90) due to accident.
2,2020-12-06 21:26:07,45.16,-108.9648,Bridger,MT,499, N Silvertip Rd,Incident on SILVERTIP RD near DUTCH LN Expect delays.
2,2020-11-08 17:39:30,45.6805,-108.6362,Laurel,MT,4769, Duck Creek Rd,Incident on DUCK CREEK RD near FRITZ RD Drive with caution.
2,2020-12-29 02:37:44,48.0442,-113.9741,Bigfork,MT,82201, MT Highway 83,Incident on MT-83 near MT-209 Drive with caution.
2,2020-10-25 02:28:37,48.0844,-113.9753,Bigfork,MT,2401, Swan Hwy,Incident on BEAR CREEK RD near SWAN HWY Drive with caution.
2,2020-11-03 02:02:21,47.4851,-111.345,Great Falls,MT,,I-15 S,Incident on I-15 SB near MM 278 Expect delays.
2,2020-10-15 15:07:40.000000000,46.0476,-112.7481,Butte,MT,,I-90 E,Incident on I-90 EB near BOSSARD RD Expect delays.
2,2020-10-28 14:51:51,46.3454,-114.1053,Corvallis,MT,287, Popham Ln,Incident on POPHAM LN near BRITTANY WAY Drive with caution.
2,2020-12-19 05:31:32,46.3867,-112.7245,Deer Lodge,MT,299, Skyview Ln,Incident on SKYVIEW LN near EASTSIDE RD Drive with caution.
2,2020-12-22 07:28:40,45.9003,-109.5486,Reed Point,MT,2, Stephens Hill Rd,Incident on UNION HALL RD near STEPHENS HILL RD Expect delays.
2,2020-11-19 22:56:58,47.257,-111.7089,Cascade,MT,,I-15 N,Incident on I-15 NB near MM 254 Drive with caution.
4,2018-02-28 23:20:28,47.8109,-112.1835,Choteau,MT,37, W Division St,Closed between US-89/Main Ave and US Highway 408 - Road closed due to accident.
2,2020-10-16 05:49:40,46.7321,-112.0206,Helena,MT,8200, N Montana Ave,Incident on MONTANA AVE near COUNTY ROAD 229 Drive with caution.
2,2019-01-31 09:24:27,45.6682,-110.5236,Livingston,MT,,I-90 W,At US-89/Exit 333 - Accident. Roadway reduced to 1 lane. Lane blocked. Gusty winds.
2,2019-11-06 15:24:59,45.787,-110.0506,Big Timber,MT,,I-90 W,At Frontage Rd/Exit 362 - Accident. Ice. Black ice. Roadway reduced to 1 lane. Lane blocked.
2,2020-11-05 18:35:00,48.9937,-111.9596,Sweet Grass,MT,,I-15 N,Stationary traffic on I-15 from McVey Rd/Exit 394 (I-15) to CAN--USA National Border (I-15) due to accident.
2,2020-10-26 14:12:51,46.9008,-114.0552,Missoula,MT,3132, Flynn Ln,Incident on FLYNN LN near CAMDEN ST Drive with caution.
3,2018-02-05 08:23:59,45.0579,-107.3371,Wyola,MT,,Aberdeen Rd,Jackknifed vehicle on I-90 Westbound at Exit 549 Aberdeen Rd.
2,2020-10-22 08:07:04.000000000,47.159,-111.8203,Cascade,MT,,I-15 S,Incident on I-15 SB near MM 250 Drive with caution.
3,2018-02-08 08:14:48,46.3947,-105.8226,Miles City,MT,,Highway 59 S,Accident on I-94 Eastbound around MT-59 Haynes Ave.
2,2020-10-24 14:49:05,47.085,-109.4548,Lewistown,MT,1473, Joyland Rd,Incident on JOYLAND RD near TRESCH LN Drive with caution.
2,2020-11-25 12:19:06,45.7155,-112.7052,Divide,MT,,I-15 S,Incident on I-15 SB near MM 99 Drive with caution.
4,2018-12-04 03:46:02,48.3125,-113.3588,Essex,MT,16999, US Highway 2 E,Closed at Glacier RT One/Going to the Sun Hwy - Road closed due to accident.
2,2020-12-12 18:44:02,45.6959,-111.0417,Bozeman,MT,,I-90 E,Incident on I-90 EB near MM 306 Drive with caution.
4,2017-11-04 08:53:42,47.2655,-114.1733,Ravalli,MT,83736, US Highway 93,Closed at US-93 - Road closed due to accident.
2,2020-12-08 00:22:30,48.2043,-114.3303,Kalispell,MT,553, N Meridian Rd,Incident on MERIDIAN RD near TWO MILE DR Drive with caution.
2,2020-12-23 02:13:40,46.9547,-114.1372,Missoula,MT,,I-90 E,Incident on I-90 EB near MM 96 Drive with caution.
2,2020-12-11 15:02:00,47.5265,-111.3855,Great Falls,MT,,I-15 N,Slow traffic on I-15 N - MT-200 W - US-89 N from US-87/Exit 282 (I-15) to Manchester Rd/Exit 286 (I-15) due to accident.
2,2020-12-13 20:35:03,45.671,-111.1251,Bozeman,MT,8478, Huffine Ln,Incident on GOOCH HILL RD near HUFFINE LN Drive with caution.
2,2020-11-07 02:50:24,46.0174,-110.6466,Wilsall,MT,25, Daisy Dean Rd,Incident on ELK CREEK RD near DAISY DEAN RD Drive with caution.
2,2020-12-27 08:40:43.000000000,45.6798,-111.0462,Bozeman,MT,21, N 7th Ave,Incident on I-90 EB near US-191 Drive with caution.
2,2020-12-14 17:59:05,46.6022,-111.9834,Helena,MT,3098, Airport Rd,Incident on A ST near AIRPORT RD Drive with caution.
2,2020-12-16 00:08:03.000000000,48.5357,-114.5714,Whitefish,MT,,Good Creek Rd,Incident on GOOD CREEK RD near US-93 Drive with caution.
2,2020-11-11 23:25:24,45.7942,-108.4648,Billings,MT,,I-90 E,Incident on I-90 EB near US-212 Drive with caution.
2,2020-12-14 05:29:31,45.8977,-111.5179,Three Forks,MT,,I-90 E,Incident on I-90 EB near MADISON RD Drive with caution.
2,2020-10-24 03:33:30,46.9625,-114.1508,Missoula,MT,,I-90 E,Stationary traffic on I-90 from Exit 89 (I-90) to US-93/MT-200/Exit 96 (I-90) due to accident.
2,2020-12-02 01:59:02,47.484,-111.3457,Great Falls,MT,,MT-200 E,Incident on I-15 SB near MM 278 Drive with caution.
2,2018-01-19 07:06:15,47.1164,-104.7324,Glendive,MT,,I-94 W,At MT-16/Exit 213 - Jackknifed articulated truck.
2,2018-09-11 07:28:41,46.9394,-112.7958,Lincoln,MT,6999, W MT Highway 200,At MT-279 - Accident. Broken down vehicle. Lane blocked.
2,2017-12-30 11:22:00,45.6467,-110.8894,Bozeman,MT,,US-191 S,At Trail Crk Road/Exit 316 - Accident. Lane blocked.
2,2020-11-24 15:40:06,46.6754,-114.0752,Florence,MT,20415, US Highway 93 N,Incident on CARLTON CREEK RD near US-93 Drive with caution.
2,2020-12-11 14:09:36,48.1763,-111.9343,Conrad,MT,,I-15 N,Incident on I-15 NB near MM 339 Drive with caution.
2,2020-12-15 17:44:46,45.7272,-111.1851,Bozeman,MT,3938, Jackrabbit Ln,Incident on JACKRABBIT RD near VALLEY CENTER RD Drive with caution.
2,2020-12-23 01:54:27,47.0922,-114.0405,Missoula,MT,22978, US Highway 93 N,Incident on US-93 near SCHLEY CREEK RD Drive with caution.
2,2020-10-18 02:34:30,46.562,-112.8849,Gold Creek,MT,,I-90 W,Incident on I-90 WB near MM 179 Drive with caution.
2,2019-01-04 14:00:06,48.1662,-114.2895,Kalispell,MT,2858, US Highway 93 S,Between Kalispell and US-93-alt - Accident. Lane blocked.
2,2020-10-25 10:33:27,46.5935,-112.0001,Helena,MT,,US-287 N,Incident on I-15 NB near MM 192 Drive with caution.
2,2020-11-14 01:19:09,46.6205,-111.9573,Helena,MT,3199, Walter Ln,Incident on EMILY LN near WALTER LN Drive with caution.
2,2020-09-23 03:48:01,45.6347,-109.359,Columbus,MT,2, Stuart Trl,Incident on CLARK DR near CAMERON DR Expect delays.
2,2020-10-24 20:34:07,45.3219,-107.3432,Lodge Grass,MT,,I-90 W,Incident on I-90 WB near MM 530 Drive with caution.
2,2020-10-19 01:03:00,45.6801,-108.715,Laurel,MT,,I-90 W,Slow traffic on I-90 from I-90/Exit 437 (I-90) to US-212/US-310/Exit 434 (I-90) due to accident.
3,2019-02-24 00:00:02,45.7497,-112.7318,Divide,MT,,I-15 S,Between MT-43/Exit 102 and Moose CR Rd/Exit 99 - Accident.
2,2020-12-01 05:03:00,46.0476,-112.7481,Butte,MT,,I-90 E,Incident on I-90 EB near BOSSARD RD Expect delays.
2,2020-11-08 18:26:27.000000000,47.55,-111.4763,Great Falls,MT,,I-15 N,Incident on I-15 NB near MM 286 Drive with caution.
2,2020-10-18 19:58:30,45.6514,-110.943,Bozeman,MT,,I-90 E,Slow traffic on I-90 from Bozeman Trail Rd/Exit 313 (I-90) to Jackson Creek Rd/Exit 319 (I-90) due to accident.
2,2020-12-27 17:40:43,45.6527,-110.9592,Bozeman,MT,3217, Bozeman Trail Rd,Incident on BOZEMAN TRAIL RD near MOUNT ELLIS LN Drive with caution.
2,2020-12-11 22:18:00,46.3305,-111.529,Townsend,MT,7668, US Highway 287,Stationary traffic on US-12 E - US-12 W - US-287 S - US-287 N from US-287/Broadway St/S Front St (US-12) to Antelope Rd (US-12) due to accident.
2,2020-10-23 14:10:05,45.8579,-111.5956,Three Forks,MT,3586, Old Yellowstone Trl,Incident on OLD YELLOWSTONE TRL near SCHURINGA RD Drive with caution.
2,2020-12-26 21:06:09,48.4613,-114.3722,Whitefish,MT,2799, E Lakeshore Dr,Incident on LAKESHORE DR near MULE DEER TRL Drive with caution.
2,2020-10-28 02:06:51,48.174,-114.1092,Kalispell,MT,5223, MT Highway 35,Incident on MT-35 near MANY LAKES DR Drive with caution.
2,2020-11-04 00:35:21,45.7981,-108.453,Billings,MT,,I-90 W,Incident on I-90 WB near MM 452 Drive with caution.
2,2017-07-06 08:06:59,48.1648,-106.5449,Glasgow,MT,54600, US Highway 2,At Fort Peck - Accident.
2,2020-11-11 23:57:23,45.8099,-108.4231,Billings,MT,,I-90 E,Incident on I-90 EB near US-212 Drive with caution.
2,2020-11-06 12:02:23,47.5695,-114.8717,Plains,MT,,Upper Lynch Creek Rd,Incident on UPPER LYNCH CREEK RD near CEDAR CREEK RD Expect delays.
2,2020-11-13 23:42:02,48.0756,-113.9795,Bigfork,MT,2701, Swan Hwy,Incident on LANDMARK LN near MT-83 Expect delays.
2,2020-12-13 00:48:00,46.2171,-107.2515,Forsyth,MT,,I-94 W,Slow traffic on I-94 W from Exit 67 (I-94) to Exit 63 (I-94) due to accident.
2,2020-12-08 19:01:31.000000000,46.9557,-114.131,Missoula,MT,9665, Cartage Rd,Incident on CARTAGE RD near US-93 Drive with caution.
2,2020-12-21 05:18:43,48.1464,-114.2654,Kalispell,MT,764, Lower Valley Rd,Incident on LOWER VALLEY RD near FOYS BEND LN Expect delays.
2,2020-12-01 13:12:51,47.3201,-114.8784,Plains,MT,1, Frontier River Ln,Incident on MT-135 near FERRY LANDING LN Expect delays.
2,2020-12-08 01:58:30,47.1645,-113.5033,Seeley Lake,MT,1038, Snowmass Dr,Incident on SNOWMASS DR near WESTSIDE BYPASS RD Drive with caution.
2,2020-12-31 15:26:58,45.7292,-111.1644,Bozeman,MT,2935, S Alaska Rd,Incident on ALASKA RD near CAMERON BRIDGE RD Drive with caution.
2,2020-11-08 21:15:33,45.7001,-111.1509,Bozeman,MT,1707, Baxter Ln E,Incident on BLACK BULL TRL near BAXTER RD Drive with caution.
4,2017-07-21 15:53:59,46.5594,-112.4257,Garrison,MT,3938, US Highway 12 E,Closed at MT-356/Williams St - Road closed due to accident.
2,2020-11-13 01:30:05,46.206,-114.1552,Hamilton,MT,48, Skalkaho Hwy,Incident on SKALKAHO HWY near MT-38 Drive with caution.
2,2020-12-06 18:06:03,47.7729,-114.1421,Polson,MT,91, Narrows Rd,Incident on BLACK POINT RD near NARROWS RD Drive with caution.
2,2020-11-11 18:43:08,46.9545,-112.106,Wolf Creek,MT,,I-15 N,Incident on I-15 NB near US-287 Drive with caution.
2,2020-11-10 16:46:19,48.4023,-114.3807,Whitefish,MT,,Blanchard Lake Rd,Incident on US-93 near BLANCHARD LAKE RD Drive with caution.
2,2020-10-24 20:44:36,45.8601,-108.4456,Billings,MT,3349, Bitterroot Dr,Incident on BITTERROOT DR near OXBOW CIR Drive with caution.
2,2020-10-14 16:18:43,45.2973,-111.8002,Ennis,MT,265, Tobe Rd,Incident on TOBE LN near TENDOY RD Drive with caution.
