Severity,Date/Time,Latitude,Longitude,City,State,Number,Street,Description
2,2017-08-17 16:46:43,39.3525,-119.7764,Reno,NV,20368,S Virginia St,Accident on US-395 Alt Virginia St Southbound at Laramie Dr.
2,2019-10-02 19:09:05,39.2683,-119.5747,Dayton,NV,3059,US Highway 50 E,Accident on US-50 at Fortune Dr.
2,2016-10-07 13:44:31,36.1099,-115.1805,Las Vegas,NV,,I-15 N,At Flamingo Rd/Exit 38/Exit 39 - Accident.
2,2016-10-15 03:45:00,36.1929,-115.1401,North Las Vegas,NV,,I-15 N,At Lake Mead Blvd/Exit 45 - Accident.
2,2019-05-02 10:58:30,39.5461,-119.7881,Reno,NV,,Martin Luther King Jr Memorial Fwy,Accident on US-395 Northbound before Oddie Blvd.
2,2020-12-23 20:57:31,39.5057,-119.7806,Reno,NV,,Martin Luther King Jr Memorial Fwy,Slow traffic on I-580 S - US-395 S from Villanova Dr/Exit 65A (I-580/US-395) to Moana Ln/Exit 64 (I-580/US-395) due to accident.
2,2017-06-30 08:43:49,36.1751,-115.1749,Las Vegas,NV,,US-95 S,Ramp to I-15 Southbound and Martin L King Blvd - Accident.
3,2018-12-28 18:53:55,39.5041,-119.9989,Verdi,NV,353,Gold Ranch Rd,Accident on I-80 Eastbound at Exit 2 I-80-BL 3rd St.
3,2019-01-29 09:38:28,39.1892,-119.7534,Carson City,NV,,I-580 S,Accident on I-580 Northbound at College Pkwy.
2,2017-06-09 06:55:19,36.1751,-115.1798,Las Vegas,NV,,US-95 S,At Rancho Dr/Exit 77 - Accident.
2,2016-08-08 06:20:03,36.1484,-115.1675,Las Vegas,NV,,I-15 S,At Sahara Ave/Exit 40 - Accident.
3,2017-11-07 07:25:20,39.5663,-119.4868,Reno,NV,,USA Pkwy,Accident on I-80 Eastbound between Exit 28 Waltham Way and Exit 32 USA Pkwy.
2,2016-07-11 00:33:47,36.2033,-115.2059,Las Vegas,NV,2425, N Decatur Blvd,At Smoke Ranch Rd - Accident.
2,2017-01-17 17:47:04,39.0251,-119.7797,Minden,NV,2615, US Highway 395 N,At Johnson Ln - Accident.
3,2019-06-23 09:01:24,41.0997,-114.9595,Wells,NV,,I-80 E,Accident on exit ramp from I-80 Eastbound at Exits 352 352A to US-93 Southbound.
2,2016-11-03 11:57:36,36.1679,-115.1111,Las Vegas,NV,,US-93 N,At Eastern Ave/Exit 73 - Accident.
3,2019-11-15 11:05:35,39.5297,-119.8298,Reno,NV,,I-80 E,Accident on I-80 Westbound at Exit 12 Keystone Ave.
3,2019-05-03 23:18:29,39.4468,-119.7709,Reno,NV,,Martin Luther King Jr Memorial Fwy,Between Virginia St/Exit 61 and Meadows Pky/Exit 60 - Accident.
2,2019-10-31 07:22:14,39.5269,-119.7837,Reno,NV,,Martin Luther King Jr Memorial Fwy,Accident on I-580 Southbound at Glendale Ave.
2,2017-01-31 15:35:20,36.171,-115.3379,Las Vegas,NV,,County Hwy-215 S,At NV-159/W Charleston Blvd/Exit 26 - Accident.
2,2016-10-03 12:31:46,36.1741,-115.1608,Las Vegas,NV,23, S Martin L King Blvd,At US-95/Las Vegas Expy - Accident.
2,2020-12-06 13:39:26,39.5282,-119.7144,Sparks,NV,,Interstate 80 E,Incident on I-80 near SPARKS BLVD Expect delays.
3,2018-02-23 09:07:04,40.679,-118.0684,Imlay,NV,,US-95 N,Accident on I-80 Eastbound at Exit 149 NV-400 Toncston Rd.
2,2016-10-21 07:10:01,36.1294,-115.1548,Las Vegas,NV,3303, Paradise Rd,At Paradise Rd - Accident.
2,2016-12-11 00:28:05,36.1741,-115.0326,Las Vegas,NV,6396, E Bonanza Rd,At N Hollywood Blvd - Accident.
2,2019-03-07 16:04:15,39.3868,-119.3052,Silver Springs,NV,4990, US Highway 50,Between Rocky Rd/Spruce Ave/Mulberry St and Lucille Ave/Micro Rd - Accident. Lane blocked.
2,2019-12-20 05:32:10,39.1104,-119.7737,Carson City,NV,,Topsy Ln,Accident on US-395 Northbound at Topsy Ln.
2,2016-08-11 09:31:57,36.1256,-115.261,Las Vegas,NV,,Spring Mountain Rd,At Tenaya Way - Accident.
2,2020-12-14 07:23:36,40.6486,-116.3047,Crescent Valley,NV,,I-80 E,Accident on I-80 Westbound at Exit 268.
2,2018-03-08 09:41:46,40.7004,-116.1723,Crescent Valley,NV,,I-80 W,At NF-409/Exit 271 - Accident.
2,2019-05-16 17:41:07,39.5976,-119.835,Reno,NV,,Martin Luther King Jr Memorial Fwy,Between Golden Valley Rd/Exit 73 and Dandini Blvd/Parr Blvd/Exit 71 - Accident. Lane blocked.
3,2018-11-20 14:12:12,39.5372,-119.788,Reno,NV,,I-80 E,Accident on I-80 Eastbound at I-580.
2,2016-11-30 04:32:55,40.7414,-114.0634,West Wendover,NV,,US-93 Alt S,At US-93-ALT/Exit 410 - Accident.
2,2016-10-21 06:17:39,36.063,-115.1514,Las Vegas,NV,,I-215 E,At I-215/Southern Las Vegas Belt - Accident.
2,2018-09-10 14:11:33,39.5537,-115.9899,Eureka,NV,,US-50 W,Accident on NV-278 Northbound near US-50.
2,2019-02-22 21:34:18,35.1722,-114.5724,Laughlin,NV,1265,S Casino Dr,Accident on NV-163 Eastbound at Casino Dr.
4,2019-06-29 18:34:06,39.1655,-119.9298,Carson City,NV,,NV-28,Closed at Mine Shaft Rd - Road closed due to accident.
3,2020-03-17 05:45:50,39.4654,-119.7868,Reno,NV,,Martin Luther King Jr Memorial Fwy,Accident on I-580 Northbound at Exit 62 Neil Rd.
2,2016-09-08 07:44:33,36.1959,-115.2433,Las Vegas,NV,6885, W Lake Mead Blvd,At San Simeon St - Accident.
3,2018-08-15 07:01:36,40.7188,-116.1335,Carlin,NV,,I-80 W,Accident on I-80 Eastbound before Exit 279 I-80 Bus Loop Bush St.
3,2018-02-21 11:34:49,39.1748,-119.7404,Carson City,NV,,US-50 W,Accident on I-580 Westbound at Exit 39 US-395.
2,2017-03-08 08:52:56,36.2255,-115.0801,Las Vegas,NV,,N Lamb Blvd,At NV-610/N Lamb Blvd - Accident.
2,2019-11-27 08:32:11,40.6631,-116.7351,Battle Mountain,NV,,I-80 W,Accident on I-80 Westbound between NF-402 and Mosquito Canyon Rd.
3,2019-04-25 06:33:37,39.5664,-119.4874,Reno,NV,,Interstate 80 E,Accident on I-80 Eastbound after NV-439 USA Pkwy.
2,2020-12-22 22:58:47,38.9286,-119.7305,Gardnerville,NV,1252, US Highway 395 N,Incident on US-395 NB near INDUSTRIAL WAY Expect delays.
2,2020-06-17 21:23:18,39.1116,-119.9226,Glenbrook,NV,,NV-28,Accident on NV-28 Southbound near Skunk Harbor Rd.
4,2016-12-20 20:12:41,36.1299,-115.0838,Las Vegas,NV,4166, Boulder Hwy,Closed between Boulder Hwy/Exit 70 and Las Vegas - Road closed due to accident.
2,2019-04-05 08:09:49,39.1823,-119.7192,Carson City,NV,4268,US Highway 50 E,Accident on US-50 near Sherman Ln.
2,2019-04-04 06:25:03,39.4001,-119.2688,Silver Springs,NV,,US-50 W,Left lane blocked due to accident rollover involved on NV-439 Usa Pkwy Northbound after US-50.
2,2018-12-05 08:03:25,39.0991,-119.181,Yerington,NV,2,Penrose Ln,Accident on US-95-ALT Southbound at Farrell Ln.
2,2017-12-07 08:14:24,39.2188,-119.6527,Mound House,NV,10182,US Highway 50 E,Accident on US-50 both ways at Affonso Dr.
3,2017-04-24 09:29:48,36.1416,-115.1732,Las Vegas,NV,,I-15 N,At Sahara Ave/Exit 40 - Accident.
2,2018-12-26 09:18:26,39.1006,-119.9095,Glenbrook,NV,2947,US Highway 50,Left lane blocked due to accident on US-50 Eastbound at NV-28.
2,2017-07-26 09:54:01,36.1752,-115.1741,Las Vegas,NV,,US-95 S,At Rancho Dr/Exit 77 - Accident.
2,2017-10-02 05:50:57,38.7876,-119.3867,Wellington,NV,,Circle Dr,Accident on NV-823 Lower Colony Rd Southbound around Circle Dr.
2,2019-12-07 12:14:07,39.5304,-119.7153,Sparks,NV,,Sparks Blvd,Entry ramp to I-80 Westbound from Sparks Blvd Southbound lane blocked due to accident.
2,2016-08-24 14:09:51,38.9541,-119.1634,Yerington,NV,303, State Route 208,At Mason Rd/W Cremetti Ln - Accident.
4,2019-11-10 20:42:33,39.0264,-119.9457,Glenbrook,NV,1110, US Highway 50,Closed at Lake Ridge Rd/Sugar Pine Cir - Road closed due to accident.
2,2020-06-02 15:37:47,39.919,-117.1338,Austin,NV,,NV-305,Accident on NV-305 Northbound near Carico Lake Valley Rd.
2,2016-09-02 08:47:35,36.1814,-115.0621,Las Vegas,NV,,N Nellis Blvd,At Monroe Ave - Accident.
2,2018-10-31 08:34:55,39.5978,-119.227,Fernley,NV,648,Farm District Rd,Accident on NV-828 Farm District Rd at Shadow Ln.
2,2017-11-20 05:43:21,39.2683,-119.5746,Dayton,NV,3058,US Highway 50 E,Accident on US-50 both ways at Fortune Dr.
2,2020-10-25 23:51:14.000000000,39.1007,-119.9095,Glenbrook,NV,2949, US Highway 50,Incident on US-50 near NV-28 Expect delays.
3,2018-02-16 12:44:06,39.5366,-119.8067,Reno,NV,,I-80 E,At Wells Ave/Exit 14 - Accident.
3,2018-12-07 21:03:54,39.5366,-119.8033,Reno,NV,,N Wells Ave,Two lane blocked due to accident on I-80 Eastbound at Exit 14 Wells Ave.
4,2017-06-24 09:22:21,36.1147,-115.1385,Las Vegas,NV,1172, E Flamingo Rd,Closed at Flamingo Rd - Road closed due to accident.
3,2018-11-20 15:32:40,39.5367,-119.8034,Reno,NV,,N Wells Ave,Accident on I-80 Eastbound at Exit 14 Wells Ave.
2,2016-07-11 00:32:31,36.159,-115.0622,Las Vegas,NV,,Nellis Blvd,At Sloan Ln - Accident.
2,2016-10-30 01:35:50,36.1775,-115.1505,Las Vegas,NV,,I-15 N,At D St/Exit 43 - Accident.
2,2018-05-07 19:33:11,39.1766,-119.7332,Carson City,NV,3098,US Highway 50 E,Accident on US-50 Eastbound at Airport Rd.
2,2020-10-14 21:34:18,39.4965,-119.7842,Reno,NV,,Martin Luther King Jr Memorial Fwy,Incident on I-580 near MOANA LN Expect delays.
2,2019-09-25 11:34:49,39.5217,-119.4755,Sparks,NV,,W Sydney Dr,Lane blocked due to accident on NV-439 Usa Pkwy from Electric Ave to Sydney Dr.
3,2017-08-17 08:05:00,39.5334,-119.7385,Sparks,NV,,I-80 W,Accident on I-80 Westbound at Exit 19 NV-650 McCarran Blvd.
2,2019-01-10 05:35:13,40.8239,-115.727,Lamoille,NV,2397,Lamoille Hwy,Accident on NV-227 Lamoille Hwy Southbound after Powder House Rd.
2,2020-08-28 13:47:40,39.3685,-119.3552,Silver Springs,NV,5298,Stagecoach Dr,Accident on US-50 near Stagecoach Dr.
2,2018-03-15 08:27:23,39.1163,-119.8125,Carson City,NV,,US Highway 50,At Sierra Highland Dr - Accident. Right lane blocked.
2,2016-10-03 08:25:02,36.1738,-115.1523,Las Vegas,NV,,US-93 S,Ramp to I-515/US-93/US-95 Southbound - Accident.
3,2018-12-07 20:51:53,39.5361,-119.7845,Reno,NV,2401,E 5th St,Accident on I-80 Westbound at Prater Way.
2,2019-10-18 16:48:18,39.0082,-119.9472,Glenbrook,NV,775,US Highway 50,Accident on US-50 Westbound at Zephyr Cove Stables Parking Fs Rd.
3,2017-12-20 07:11:24,39.423,-119.7514,Reno,NV,,Martin Luther King Jr Memorial Fwy,Accident on I-580 Martin Luther King Jr Memorial Fwy Northbound at Exit 59 Damonte Ranch Pkwy.
2,2017-04-03 15:10:41,36.1642,-115.1603,Las Vegas,NV,,I-15 S,At Charleston Blvd/Exit 41 - Accident.
2,2019-06-14 04:07:29,41.0301,-114.4911,Wells,NV,,I-80 E,Earlier accident on exit ramp from I-80 Eastbound to NV-233.
2,2020-11-26 07:25:58,39.4863,-118.8758,Fallon,NV,77,Sheckler Cut Off,Accident on NV-117 Sheckler Cut Off Eastbound at US-50 Reno Hwy.
2,2019-04-26 08:33:15,37.3545,-115.1715,Alamo,NV,,Dump Rd,Accident on Sunset Rd at Sandhill Rd.
2,2020-08-21 12:30:15,39.5565,-119.7618,Sparks,NV,3123,N McCarran Blvd,Accident on NV-659 Mccarran Blvd Eastbound before Rock Blvd.
2,2017-01-12 18:23:55,36.1592,-115.2436,Las Vegas,NV,,W Charleston Blvd,At Rainbow Blvd - Accident.
2,2018-09-27 07:44:07,39.6165,-119.7281,Sparks,NV,,Pyramid Way,Accident on NV-445 Pyramid Way at Lazy 5 Pkwy.
2,2020-09-16 00:04:38,39.5665,-119.4914,Sparks,NV,,Interstate 80 E,Incident on I-80 WB near EXIT 28 Right lane blocked. Expect delays.
2,2016-10-10 07:48:56,36.1446,-115.208,Las Vegas,NV,2500, S Decatur Blvd,At Decatur Blvd - Accident.
3,2020-07-08 11:59:31,40.9334,-115.6658,Elko,NV,,Victory Blvd,Accident on I-80 Westbound at Exit 310 Nf-421.
3,2019-07-08 07:14:14,40.9583,-115.4681,Deeth,NV,,I-80 W,Accident on I-80 Westbound at Exit 321 NV-229.
2,2016-11-13 06:43:17,39.1983,-119.7748,Carson City,NV,,US-395 S,At Arrowhead Dr - Accident.
2,2018-10-31 09:19:16,39.1104,-119.7738,Carson City,NV,,US Highway 395 S,Accident on US-395 at Topsy Ln.
2,2016-11-28 06:53:03,36.1756,-115.1541,Las Vegas,NV,,US-93 S,Ramp to I-515/US-93/US-95 Southbound - Accident.
2,2018-07-12 20:30:01,38.9734,-119.9036,Stateline,NV,550,Kingsbury Grade,Accident on NV-207 Kingsbury Grade at Logging Road Ln.
2,2020-11-05 08:00:00,39.5304,-119.732,Sparks,NV,,I-80 E,Incident on I-80 EB near EXIT 20 Left lane blocked.
2,2020-03-25 14:35:09,39.5366,-119.8027,Reno,NV,,I-80 E,Accident on I-80 Eastbound at Exit 14 Wells Ave.
4,2018-06-04 16:12:32,39.4283,-119.1713,Silver Springs,NV,4174, Carson Hwy,Closed at FT Churchill St - Road closed due to accident.
2,2020-10-21 09:33:48,38.0737,-117.0911,Tonopah,NV,,Airport Rd,Accident on US-6 at Tonopah Speedway Rd.
2,2020-10-29 21:54:35,39.6141,-119.3139,Reno,NV,,I-80 W,Stationary traffic on I-80 from NV-427/Exit 43 (I-80) to NV-421/Exit 40 (I-80) due to accident.
2,2016-08-05 05:51:32,36.1883,-115.0922,Las Vegas,NV,1598, Stevens St,At Walnut Rd - Accident.
2,2018-09-19 09:13:42,39.1924,-119.7472,Carson City,NV,3798,Goni Rd,Accident on Goni Rd at Old Hot Springs Rd.
2,2019-03-07 13:45:41,41.1175,-114.9365,Wells,NV,,US-93 N,Accident on US-93 at Airport Rd.
2,2017-05-29 23:57:16,36.1146,-115.1464,Las Vegas,NV,799, E Flamingo Rd,At Flamingo Rd - Accident.
2,2017-06-23 17:53:52,36.1145,-115.1378,Las Vegas,NV,,S Maryland Pkwy,At Flamingo Rd - Accident.
3,2018-11-12 16:45:36,39.4675,-119.7882,Reno,NV,,Neil Rd,Accident on I-580 Martin Luther King Jr Memorial Fwy Southbound before Exit 62 NV-667 Neil Rd.
3,2016-07-18 23:20:18,36.2808,-115.288,Las Vegas,NV,,N Durango Dr,At CR-215 - Accident.
2,2016-12-02 02:48:01,36.1301,-115.0836,Las Vegas,NV,,E Desert Inn Rd,At S Lamb Blvd - Accident.
3,2017-10-04 19:28:51,40.8433,-114.2087,West Wendover,NV,,Pilot Rd,Accident on I-80 Westbound near Exit 398 Pilot Rd.
2,2020-12-18 05:32:36,39.5419,-119.7037,Sparks,NV,897,Vista Blvd,Restrictions due to earlier accident on Vista Blvd at Prater Way.
2,2017-08-15 09:29:05,37.7607,-115.1007,Hiko,NV,,NV-38,Three lanes blocked due to accident on NV-318 Southbound after Little Boulder Rd.
2,2020-11-03 08:00:00,39.5272,-119.707,Sparks,NV,,Interstate 80 E,Incident on I-80 EB near EXIT 20 Expect delays.
3,2017-06-19 04:58:49,40.9331,-117.7962,Winnemucca,NV,,I-80 W,Between I-80-BL/Exit 173 and Heckman Dr/Exit 168 - Accident.
2,2017-05-11 11:06:31,36.071,-115.1809,Las Vegas,NV,,W Sunset Rd,At I-215/Las Vegas Blvd/Exit 34 - Accident.
2,2016-06-25 00:34:53,36.1885,-115.1858,Las Vegas,NV,,N Rancho Dr,At Turquoise Rd - Accident.
2,2016-06-30 11:00:59,36.1363,-115.0829,Las Vegas,NV,2984, S Lamb Blvd,At Ridgedale Ave - Accident.
2,2019-10-18 05:25:43,39.2995,-119.5213,Dayton,NV,,Fort Churchill Rd,Right lane blocked due to accident on US-50 Westbound at Fort Churchill Rd. No recent updates.
2,2016-09-13 08:04:19,36.2331,-115.2265,Las Vegas,NV,,N Rancho Dr,At Rancho Dr - Accident.
2,2020-08-07 04:39:19,39.5319,-119.4825,Sparks,NV,2,Italy Dr,Accident on NV-439 Usa Pkwy at Germany Cir.
3,2017-08-25 10:52:58,39.5192,-119.6298,Sparks,NV,,Mustang Ranch Rd,Accident on I-80 Eastbound at Exit 23 Mustang Rd.
2,2020-11-28 07:36:08.000000000,39.525,-119.8627,Reno,NV,,N McCarran Blvd,Incident on MCCARRAN BLVD SB near I-80 Right lane blocked. Expect delays.
2,2018-06-14 15:29:45,39.5456,-119.788,Reno,NV,,Oddie Blvd,#3 lane blocked due to accident on US-395 Martin Luther King Jr Memorial Fwy Northbound at Exit 69 Oddie Blvd.
2,2018-08-10 17:11:40,38.7667,-119.3925,Wellington,NV,1,Upper Colony Dr,Accident on NV-208 at Upper Colony Dr.
2,2017-01-31 14:49:24,36.0214,-115.1187,Las Vegas,NV,9209, S Eastern Ave,At Serene Ave - Accident.
2,2017-09-06 08:52:39,39.5765,-119.7458,Sparks,NV,,Disc Dr,Accident on NV-445 Pyramid Way Southbound after Disc Dr.
2,2016-08-21 03:44:48,36.1758,-115.1858,Las Vegas,NV,,US-95 N,Between Valley View Blvd/Exit 78 and Decatur Blvd/Exit 79 - Accident.
4,2018-08-02 15:38:23,38.3181,-118.5901,Hawthorne,NV,,NV-359,Closed at Yerington - Road closed due to accident.
3,2019-01-21 07:49:49,39.524,-119.8627,Reno,NV,,I-80 W,Accident on I-80 Westbound at NV-659 Mccarran Blvd.
2,2016-08-09 07:23:51,36.1592,-115.2436,Las Vegas,NV,,W Charleston Blvd,At Westcliff Dr - Accident.
2,2017-07-24 10:11:16,39.4147,-119.7469,Reno,NV,,Martin Luther King Jr Memorial Fwy,At Damonte Ranch Pky/Exit 59 - Accident.
3,2019-01-10 07:06:15,41.0714,-115.2953,Deeth,NV,,I-80 E,Accident on I-80 Eastbound at Exit 333 CR-701.
4,2016-11-21 01:38:24,36.1047,-115.2955,Las Vegas,NV,,County Hwy-215 S,Closed at W Tropicana Ave/Exit 20 - Road closed due to accident.
2,2017-02-23 12:52:35,36.2365,-115.1061,North Las Vegas,NV,,I-15 N,At Craig Rd/Exit 48 - Accident.
2,2016-10-29 22:30:05,36.0706,-115.1812,Las Vegas,NV,6564, Dean Martin Dr,Ramp to Tropicana Ave/Exit 37 - Accident.
2,2018-05-28 12:24:56,39.4749,-118.7841,Fallon,NV,601,W Williams Ave,Accident on Allen St at US-50 Williams Ave.
2,2018-06-14 16:26:05,39.4599,-118.8755,Fallon,NV,6000,Power Line Rd,Accident on NV-117 Sheckler Cut Off at Power Line Rd.
2,2020-12-06 13:58:07.000000000,39.5286,-119.7209,Sparks,NV,,Interstate 80 E,Incident on I-80 EB near EXIT 20 Drive with caution.
2,2016-09-30 08:48:15,36.1591,-115.2803,Las Vegas,NV,,S Durango Dr,At Durango Dr - Accident.
2,2018-01-23 08:09:30,39.2827,-114.8446,Ely,NV,,State Highway 490,Accident on NV-490 Eastbound around US-93.
3,2018-10-20 14:47:15,39.4361,-119.1301,Silver Springs,NV,,Carson Hwy,At Virginia Ave - Accident.
4,2019-02-25 16:56:58,39.4031,-119.7563,Reno,NV,,Martin Luther King Jr Memorial Fwy,Closed between US-395/Virginia St/Exit 57 and US-395-ALT/NV-429/Exit 50 - Road closed due to accident.
2,2018-07-20 13:44:09,40.9583,-115.4697,Deeth,NV,,I-80 W,Entry ramp to I-80 from NV-229 Westbound closed due to stalled truck.
3,2019-09-16 13:13:25,39.534,-119.7532,Sparks,NV,,I-80 W,Accident on I-80 Eastbound at Exit 18 NV-445 Pyramid Way.
4,2017-03-25 17:19:35,36.1146,-115.173,Las Vegas,NV,3560, Las Vegas Blvd S,Closed between NV-592/E Flamingo Rd and Harmon Ave - Road closed due to accident.
2,2019-05-02 08:13:53,39.5365,-119.8002,Reno,NV,,I-80 W,Accident on I-80 Eastbound at Exit 14 Wells Ave.
2,2018-02-27 08:15:36,39.2608,-119.7566,Washoe Valley,NV,5098,Eastlake Blvd,Accident on NV-428 Eastlake Blvd at Grays Starlight Ct.
2,2017-10-31 19:33:18,39.0258,-119.7799,Minden,NV,2622,US Highway 395 N,Accident on US-395 Northbound at Johnson Ln.
4,2017-04-15 10:46:19,36.0698,-115.2794,Las Vegas,NV,6570, S Durango Dr,Closed at Post Rd - Road closed due to accident.
2,2018-11-13 06:51:09,39.5456,-119.788,Reno,NV,,Oddie Blvd,Accident on US-395 Martin Luther King Jr Memorial Fwy Southbound after Oddie Blvd.
2,2020-12-22 03:10:25,39.041,-119.9476,Glenbrook,NV,1320, US Highway 50,Incident on US-50 WB near CAVE ROCK Road closed. Take alternate route.
2,2017-03-03 08:21:52,36.0238,-115.1139,Henderson,NV,,I-215 W,At Eastern Ave/Exit 7 - Accident.
3,2018-03-25 04:47:00,41.0998,-114.9579,Wells,NV,,US Highway 93,Accident on I-80 Eastbound at Exits 352 352A US-93.
2,2017-01-31 15:58:03,36.2164,-115.1251,North Las Vegas,NV,,US-93 S,At Cheyenne Ave/Exit 46 - Accident.
2,2016-08-25 08:16:55,36.0422,-115.1183,Las Vegas,NV,,S Eastern Ave,At Eldorado Ln - Accident.
2,2019-02-20 18:04:07,38.5245,-118.6246,Hawthorne,NV,499,E St,Accident on US-95 5th St Northbound at 5th St.
2,2020-10-20 00:00:40,39.4965,-119.7842,Reno,NV,,Martin Luther King Jr Memorial Fwy,Incident on I-580 near MOANA LN Expect delays.
2,2016-06-23 12:00:51,36.1146,-115.1641,Las Vegas,NV,198, E Flamingo Rd,At Linq Ln - Accident.
3,2016-11-26 17:26:50,36.1642,-115.1603,Las Vegas,NV,,I-15 S,Between Charleston Blvd/Exit 41 and Sahara Ave/Exit 40 - Accident.
2,2018-10-29 06:54:47,39.1833,-119.7169,Carson City,NV,2601,Empire Ranch Rd,Accident on US-50 at Empire Ranch Rd.
2,2016-10-21 18:13:24,36.1739,-115.1579,Las Vegas,NV,,US-95 S,Ramp to I-15/Exit 76A - Accident.
2,2017-01-31 14:27:24,36.1957,-115.224,Las Vegas,NV,6101, W Lake Mead Blvd,At Lake Mead Blvd - Accident.
2,2020-11-18 20:09:00,39.4968,-119.7839,Reno,NV,,Martin Luther King Jr Memorial Fwy,Slow traffic on I-580 N - US-395 N from Moana Ln/Exit 64 (I-580/US-395) to McCarran Blvd/Exit 70 (US-395) due to accident.
3,2018-03-04 06:15:49,39.5264,-119.7005,Sparks,NV,,Interstate 80 E,Accident on I-80 Westbound at Exit 21 Greg St.
2,2017-10-20 09:10:24,38.9431,-119.7516,Gardnerville,NV,,High School St,Accident on US-395 both ways at High School St.
3,2016-11-09 12:41:06,36.1552,-115.1612,Las Vegas,NV,,I-15 N,At Charleston Blvd/Exit 41 - Accident.
4,2017-04-24 05:31:15,36.5647,-116.1232,Amargosa Valley,NV,,US-95 S,Closed at NV-373 - Road closed due to accident.
2,2019-02-11 07:18:47,37.6954,-117.2364,Goldfield,NV,,US-95 N,Accident on US-95 Sundog Ave Southbound near Lida Ave.
2,2016-08-31 12:37:55,36.101,-115.1733,Las Vegas,NV,,W Tropicana Ave,At Tropicana Ave/Exit 37 - Accident.
3,2017-07-27 15:01:57,39.9426,-118.7487,Fallon,NV,,US Highway 95,Accident on I-80 Eastbound at Exit 83 US-95.
2,2018-03-29 19:06:17,39.5274,-119.789,Reno,NV,,E 2nd St,Accident on NV-648 2nd St between I-580 Martin Luther King Jr Memorial Fwy and NV-667 Kietzke Ln.
2,2020-10-08 17:10:16,39.5332,-119.7379,Sparks,NV,,I-80 W,Accident on NV-659 Mccarran Blvd Northbound at Victorian Ave.
2,2020-11-03 21:34:08.000000000,39.5665,-119.4914,Sparks,NV,,Interstate 80 E,Stationary traffic on I-80 from Exit 32 (I-80) to Exit 28 (I-80) due to accident.
3,2018-05-17 16:40:49,39.5367,-119.8034,Reno,NV,,N Wells Ave,Accident on I-80 Westbound at Exit 14 Wells Ave.
2,2019-08-15 15:35:52,39.301,-119.5309,Dayton,NV,191,Six Mile Canyon Rd,Serious accident on Six Mile Canyon Rd at Roughing It Rd.
2,2016-07-20 10:30:14,36.1217,-115.1462,Las Vegas,NV,766, E Twain Ave,At Paradise Rd - Accident.
3,2018-02-05 04:48:08,39.5339,-119.7531,Sparks,NV,,I-80 E,Accident on I-80 Eastbound at Exit 18 NV-445 Pyramid Way.
2,2017-07-19 23:05:55,39.5148,-119.7816,Reno,NV,,Martin Luther King Jr Memorial Fwy,At Mill St/Exit 66 - Accident.
2,2019-11-01 07:18:30,39.5572,-119.7905,Reno,NV,2900,Clear Acre Ln,Accident on US-395 Northbound near NV-659 Mccarran Blvd.
2,2017-09-27 17:04:51,39.1888,-119.7038,Carson City,NV,3298,N Deer Run Rd,Accident on US-50 Eastbound after NV-513 Deer Run Rd.
3,2020-12-30 20:48:07,39.517,-119.6328,Sparks,NV,,Interstate 80 E,Right lane blocked due to accident on I-80 Eastbound at Exit 23 Mustang Ranch Rd.
2,2020-01-13 17:07:00,39.4684,-120.0027,Verdi,NV,,I-80 W,At California/Nevada State Line - Accident.
2,2016-12-29 07:04:55,38.9108,-119.7792,Gardnerville,NV,1082, State Route 88,At Centerville Ln - Accident.
2,2017-11-17 14:15:24,39.1207,-119.7719,Carson City,NV,,S Carson St,Accident on US-395 Carson St both ways near US-50.
2,2018-10-04 06:27:02,39.5006,-117.0838,Austin,NV,,US-50 W,Accident on NV-305 Southbound before US-50.
2,2017-11-20 08:43:10,39.5237,-119.7838,Reno,NV,,Martin Luther King Jr Memorial Fwy,At Mill St/Exit 66 - Accident. Left lane blocked.
2,2016-12-29 16:12:29,36.1517,-115.1643,Las Vegas,NV,1699, W Oakey Blvd,At Charleston Blvd/Exit 41 - Accident.
2,2018-08-15 16:35:11,39.4003,-119.2686,Silver Springs,NV,3398,Opal Ave,Accident on NV-439 at US-50.
2,2019-11-15 12:22:50,39.519,-119.7828,Reno,NV,,Martin Luther King Jr Memorial Fwy,Accident on I-580 Southbound at Exit 66 Mill St.
2,2018-12-04 20:35:31,39.7354,-119.6881,Reno,NV,14182, Pyramid Lake Rd,At Axe Handle Canyon Rd - Accident.
2,2018-11-13 07:41:10,37.5319,-115.2304,Hiko,NV,,NV-318,Accident on NV-375 Westbound near NV-318.
2,2016-11-03 09:57:57,36.1442,-115.1732,Las Vegas,NV,2301, W Sahara Ave,At I-15 - Accident.
2,2019-06-18 09:36:17,38.0175,-117.9986,Tonopah,NV,,US-6 E,Accident on US-6 Eastbound at NV-773.
2,2018-09-19 20:35:02,38.9105,-119.8312,Gardnerville,NV,1000,Foothill Rd,Accident on NV-206 Foothill Rd at NV-756 Centerville Ln.
3,2017-04-26 05:23:03,36.2782,-115.273,Las Vegas,NV,,County Hwy-215,At beyond US-95 - Accident.
2,2017-06-15 15:47:01,36.1145,-115.1678,Las Vegas,NV,115, E Flamingo Rd,At Las Vegas Blvd - Accident.
4,2018-02-15 15:34:19,39.3651,-119.3643,Silver Springs,NV,8091, US Highway 50,Closed between Lucille Ave/Micro Rd and Iron Mountain Blvd - Road closed due to accident.
3,2018-12-20 17:25:49,39.5297,-119.8297,Reno,NV,,I-80 E,Accident on I-80 Westbound after Exit 12 Keystone Ave.
4,2016-10-04 20:29:05,36.172,-115.2241,Las Vegas,NV,111, S Jones Blvd,Closed at Edgewood Cir - Road closed due to accident.
2,2020-06-03 12:42:29,39.1804,-119.7238,Carson City,NV,3885,US Highway 50 E,Accident on US-50 at Fairview Dr.
2,2020-03-14 21:57:00,39.514,-119.9869,Verdi,NV,,I-80 W,At Verdi Rd/Crystal Peak Rd/Exit 3 - Accident.
2,2019-02-13 07:24:32,39.5377,-119.2309,Fernley,NV,1971,US Highway 95A S,Accident on US-50-Alt Northbound at Speedway.
3,2019-08-27 22:54:39,39.5355,-119.7896,Reno,NV,698,Threlkel St,Accident on entry ramp to I-580 Southbound at Exit 15 from I-80 Eastbound.
2,2019-07-17 16:14:35,39.5364,-119.7867,Reno,NV,545,Depaoli St,Right lane blocked due to accident on US-395 Northbound at Exits 68 68B I-80 Exit 15.
2,2018-02-05 13:11:28,39.5768,-119.7457,Sparks,NV,,Pyramid Way,At NV-659/N McCarran Blvd - Accident.
2,2016-07-08 14:32:24,36.1038,-115.1728,Las Vegas,NV,,MGM Grand,At Las Vegas Blvd - Accident.
3,2019-05-08 10:12:59,39.3376,-119.8719,Reno,NV,7601,Bums Gulch Rd,Main roadway closed due to accident on NV-431 Mt Rose Hwy both ways between Mt Rose East Bowl Rd and Old Mt Rose Hwy.
2,2019-10-03 11:44:07,39.4003,-119.2687,Silver Springs,NV,,USA Pkwy,Accident on US-50 Westbound near NV-439 Usa Pkwy.
2,2020-01-21 13:22:00,39.0913,-119.7751,Carson City,NV,,US Highway 395 S,Accident on Mica Dr at US-395.
2,2017-05-05 07:01:13,36.0623,-115.1499,Las Vegas,NV,586, George Crockett Rd,Ramp to I-215/Southern Las Vegas Belt - Accident.
2,2020-09-23 21:48:12,39.5893,-119.4248,Sparks,NV,,I-80 E,Incident on I-80 EB near EXIT 36 Expect delays.
2,2020-09-02 17:02:53,39.534,-119.7532,Sparks,NV,,I-80 W,Accident on I-80 Westbound before Exit 18 NV-445 Pyramid Way.
4,2018-08-16 15:59:50,39.534,-119.7877,Reno,NV,,Martin Luther King Jr Memorial Fwy,Ramp closed to US-395/Exit 15 - Road closed due to accident.
2,2019-12-19 17:28:44,39.1166,-119.7727,Carson City,NV,5634,S Carson St,Lane blocked due to accident on US-395 Southbound at Frontage Rd.
3,2017-12-12 19:34:38,39.5059,-119.7805,Reno,NV,,Martin Luther King Jr Memorial Fwy,Accident on I-580 Northbound before Plumb Ln.
2,2017-06-20 15:58:56,36.1744,-115.155,Las Vegas,NV,,I-15 S,At I-15/Exit 76B - Accident.
3,2018-08-09 20:57:39,39.534,-119.7656,Sparks,NV,,I-80 W,Left lane blocked due to accident on I-80 Eastbound at Exit 17 Rock Blvd.
3,2018-06-27 10:37:49,40.6592,-116.262,Crescent Valley,NV,,I-80 W,Accident on I-80 Westbound before Exit 271 Palisade.
2,2020-05-14 21:15:39,38.984,-119.9428,Zephyr Cove,NV,,Elks Point Rd,Accident on US-50 Lake Tahoe Blvd at Elks Point Rd.
