Severity,Date/Time,Latitude,Longitude,City,State,Number,Street,Description
2,2017-05-11 15:39:27,36.1216,-115.0741,Las Vegas,NV,,Indios Ave,At E Flamingo Rd - Accident.
3,2019-11-27 06:06:11,39.5212,-119.6259,Sparks,NV,584,E Mustang Rd,Accident on entry ramp to I-80 Eastbound from Mustang Ranch Rd Westbound.
2,2018-08-30 07:55:30,39.4524,-119.7801,Reno,NV,,Martin Luther King Jr Memorial Fwy,At Virginia St/Exit 61 - Accident.
3,2018-03-13 09:32:59,39.5197,-119.7835,Reno,NV,,Martin Luther King Jr Memorial Fwy,Restrictions due to accident on I-580 Martin Luther King Jr Memorial Fwy Northbound at Exit 66 Mill St.
4,2017-02-24 21:59:11,38.7653,-119.3892,Wellington,NV,1452, State Route 208,Closed at Smith Gage Rd - Road closed due to accident.
2,2020-02-27 06:12:04,41.604,-117.7827,Orovada,NV,,US-95 N,At NV-793/Cordero Mine Rd - Accident. Police activity ongoing.
3,2018-07-26 20:59:07,39.5339,-119.7531,Sparks,NV,,I-80 E,Accident on I-80 Westbound at Exit 18 NV-445 Pyramid Way.
2,2019-11-23 06:05:24,39.4602,-118.7629,Fallon,NV,1029,Wildes Rd,Accident on NV-118 Wildes Rd both ways at Harrigan Rd.
3,2019-02-04 10:51:36,39.3056,-119.826,Washoe Valley,NV,,I-580 N,Left lane blocked due to accident on I-580 Northbound near Bowers Mansion Rd.
2,2019-11-11 19:34:34,39.5164,-119.8863,Reno,NV,,I-80 W,Accident on I-80 Westbound at Exit 9 Robb Dr.
3,2018-12-18 08:06:12,40.6545,-116.9559,Battle Mountain,NV,,I-80 W,Accident on I-80 Westbound after Exit 229 I-80-BL.
2,2020-09-26 06:16:18,39.5335,-119.7657,Sparks,NV,,S Rock Blvd,Incident on ROCK BLVD near I-80 Drive with caution.
3,2020-01-30 16:22:50,39.5045,-119.781,Reno,NV,,Martin Luther King Jr Memorial Fwy,Accident on I-580 Northbound at Exit 65 Plumb Ln.
3,2018-05-08 16:41:16,39.528,-119.6175,Sparks,NV,,Interstate 80 E,Accident on I-80 Westbound at Mustang Rd.
3,2017-09-30 13:27:34,39.5274,-119.784,Reno,NV,,Martin Luther King Jr Memorial Fwy,One lane closed due to accident on I-580 Martin Luther King Jr Memorial Fwy Southbound at Exits 66 67 NV-648 2nd St.
3,2020-01-24 18:20:20,39.501,-119.9985,Verdi,NV,,I-80 E,Lane blocked due to accident on I-80 Eastbound at Exits 1 2 I-80-BL.
2,2020-04-14 15:32:37,39.1506,-119.7449,Carson City,NV,,I-580 S,Accident on I-580 at Exit 38 Fairview Dr.
2,2019-11-26 21:26:07,39.5996,-119.8373,Reno,NV,,Martin Luther King Jr Memorial Fwy,Accident on US-395 Southbound at Exit 73 Golden Valley Rd.
3,2019-08-21 13:16:19,41.3958,-117.7824,Winnemucca,NV,101, Denio Highway 140,At NV-140 - Accident. Lane blocked.
2,2016-08-31 15:40:54,36.2005,-115.1367,North Las Vegas,NV,,US-93 S,At Lake Mead Blvd/Exit 45 - Accident.
2,2017-03-01 14:46:48,36.0528,-115.0257,Henderson,NV,,US-95 S,At Lake Mead Dr/Exit 61 - Accident.
2,2017-03-30 12:41:46,36.1739,-115.1579,Las Vegas,NV,,US-95 S,Ramp to Rancho Dr/Exit 77 - Accident.
2,2018-12-12 06:37:45,39.34,-119.2407,Silver Springs,NV,7336,US Highway 95A S,Accident on US-95-ALT at Crest Dr.
2,2020-08-21 09:45:38,39.3977,-119.7356,Reno,NV,953,Geiger Grade Rd,Accident on Toll Rd at NV-341 Geiger Grade Rd.
2,2016-07-11 06:28:12,36.1443,-115.0654,Las Vegas,NV,,S Nellis Blvd,At NV-589/E Sahara Ave - Accident.
4,2016-11-07 02:42:43,36.1758,-115.1858,Las Vegas,NV,,US-95 N,Closed at Valley View Blvd/Exit 78 - Road closed due to accident.
2,2020-12-10 09:02:38,39.5319,-119.4824,Sparks,NV,2239, USA Pkwy,Incident on NV-439 NB near ITALY DR Expect delays.
2,2020-12-08 04:01:49,39.5309,-119.7854,Reno,NV,,Martin Luther King Jr Memorial Fwy,Incident on I-580 NB near I-80 Expect delays.
2,2017-03-19 23:06:48,36.1711,-115.116,Las Vegas,NV,500, N Eastern Ave,At Walnut Ave - Accident.
2,2019-12-01 13:57:54,39.4811,-119.7896,Reno,NV,4944,S Virginia St,Accident on I-580 Southbound at Exit 63 US-395-BR Virginia St.
2,2020-05-27 17:23:47,39.6108,-119.8508,Reno,NV,,Martin Luther King Jr Memorial Fwy,Accident on US-395 Southbound at Exit 74 Lemmon Dr.
2,2016-11-15 07:52:06,39.5346,-119.7482,Sparks,NV,,I-80 W,At NV-445/Pyramid Way/Exit 18 - Accident.
2,2016-11-04 19:19:19,36.1749,-115.1371,Las Vegas,NV,499, E Bonanza Rd,At NV-604/N Las Vegas Blvd - Accident.
4,2018-11-04 19:32:13,39.5213,-119.9771,Verdi,NV,,County Road 130,Closed at Fallbrook Dr - Road closed due to accident.
2,2016-06-27 09:45:36,36.1962,-115.043,Las Vegas,NV,5931, E Lake Mead Blvd,At Mt Hood St - Accident.
2,2017-02-14 15:30:46,36.0953,-115.1806,Las Vegas,NV,,I-15 N,At I-15/Desert Inn Rd - Accident.
2,2018-08-17 07:29:30,39.587,-119.7804,Sun Valley,NV,5341,Sun Valley Blvd,Accident on Sun Valley Blvd at Gepford Pkwy.
3,2018-08-13 15:00:43,39.4929,-119.7848,Reno,NV,916,E Moana Ln,Accident on I-580 Martin Luther King Jr Memorial Fwy Northbound at Exit 64 Moana Ln.
3,2016-10-07 00:27:51,36.1202,-115.1808,Las Vegas,NV,,Dean Martin Dr,At Flamingo Rd/Exit 38/Exit 39 - Accident.
2,2016-09-29 14:42:11,36.0793,-115.1806,Las Vegas,NV,,I-15 N,Between I-15/W Russell Rd and I-15/Desert Inn Rd - Accident.
2,2016-11-29 14:52:12,36.1682,-115.159,Las Vegas,NV,,I-15 N,Between I-515/US-95/Exit 42 and D St/Exit 43 - Accident.
3,2020-01-30 16:47:20,39.5369,-119.8056,Reno,NV,,I-80 W,Entry ramp to I-80 Westbound from N Wells Ave lane blocked due to accident.
2,2019-03-29 13:31:48,39.5906,-119.827,Reno,NV,,Martin Luther King Jr Memorial Fwy,At US-395-BR/Exit 72 - Accident. Right lane blocked.
2,2020-12-31 05:34:19,39.5332,-119.8206,Reno,NV,,I-80 E,Accident on exit ramp from I-80 Eastbound to N Sierra St.
2,2020-07-01 14:46:01,40.6424,-116.9323,Battle Mountain,NV,255,N Reese St,Accident on Nv-806 at 1st St.
2,2017-07-11 18:28:47,36.1783,-115.2665,Las Vegas,NV,,Summerlin Pkwy W,At Durango Dr - Accident.
2,2020-10-20 06:49:26,39.1506,-119.7449,Carson City,NV,,I-580 S,Accident on Fairview Dr Northbound at I-580 . No recent updates.
2,2016-11-02 04:56:55,36.158,-115.1602,Las Vegas,NV,,I-15 N,At Charleston Blvd/Exit 41 - Accident.
2,2020-05-27 15:56:10,39.6137,-119.2185,Fernley,NV,,I-80 W,Accident on I-80 Eastbound between Exit 46 US-95-ALT and Exit 48 NV-343.
2,2018-10-26 14:27:03,38.8653,-118.7882,Hawthorne,NV,1596, US Highway 95,At US-95-ALT/Veterans Memorial Hwy - Accident. look out for flagman.
3,2019-04-25 14:45:32,40.9211,-117.3903,Golconda,NV,,I-80 E,Serious accident on I-80 Westbound at Exit 200.
2,2016-08-05 21:20:27,36.1484,-115.1675,Las Vegas,NV,,I-15 S,At Sahara Ave/Exit 40 - Accident.
3,2016-09-01 15:28:50,36.0844,-115.0322,Las Vegas,NV,,Boulder Hwy,Between Boulder Ranch Ave and Las Vegas - Accident.
2,2018-08-27 08:15:43,39.5574,-119.7725,Sparks,NV,,N McCarran Blvd,Accident on NV-650 McCarran Blvd at Sullivan Ln.
2,2020-03-01 07:48:53,39.197,-119.7732,Carson City,NV,,I-580 S,Accident on I-580 Northbound at Exit 42 Arrowhead Dr.
2,2019-02-12 15:15:51,35.1721,-114.5724,Laughlin,NV,1264,S Casino Dr,Accident on NV-163 Eastbound at Casino Dr.
4,2018-02-13 16:25:48,39.4894,-117.0627,Austin,NV,,US-50 W,Closed between Reese St/Water St and Gabbs - Road closed due to accident.
2,2017-05-30 23:52:47,36.101,-115.1731,Las Vegas,NV,,W Tropicana Ave,At NV-593/Tropicana Ave - Accident.
4,2017-05-03 12:15:58,36.1148,-115.1464,Las Vegas,NV,4099, Swenson St,Closed at Paradise Rd - Road closed due to accident.
2,2017-01-31 19:00:58,36.1147,-115.261,Las Vegas,NV,,S Buffalo Dr,At Flamingo Rd - Accident.
2,2020-08-05 04:02:24,36.7709,-114.2354,Overton,NV,,I-15 N,Accident on I-15 Northbound between Exit 100 Carp Elgin Rd and Exit 112 NV-170.
3,2018-03-06 14:41:04,39.122,-119.7716,Carson City,NV,,S Carson St,At Appion Way - Accident.
2,2016-07-27 10:02:48,36.2632,-115.2424,Las Vegas,NV,,N Rainbow Blvd,At Maverick St - Accident.
2,2020-01-24 16:51:14,39.2959,-119.5276,Dayton,NV,4806,US Highway 50 E,Accident on US-50 at Occidental Dr.
3,2018-10-10 16:51:40,39.5293,-119.8308,Reno,NV,,I-80 W,Accident on I-80 Westbound at Exit 12 Keystone Ave.
3,2018-12-20 20:37:36,39.2134,-119.8065,Washoe Valley,NV,,I-580 N,Accident on I-580 Northbound before Exit 44 Eastlake Blvd.
2,2020-10-28 04:34:05,39.611,-119.8511,Reno,NV,,Lemmon Dr,Accident on US-395 Southbound at Lemmon Dr.
2,2020-09-27 17:04:57,38.5304,-118.265,Luning,NV,,US-95 S,Incident on US-95 SB near MM 27 Road closed. Take alternate route.
3,2018-08-29 17:13:07,39.5282,-119.715,Sparks,NV,,Sparks Blvd,Accident on I-80 Eastbound at Exit 20 Sparks Blvd.
2,2019-03-22 09:24:51,39.5272,-119.7326,Sparks,NV,745,E Glendale Ave,Accident on Glendale Ave near Watson Way.
2,2019-11-06 21:42:17,39.2683,-119.5747,Dayton,NV,3059,US Highway 50 E,Accident on US-50 at Fortune Dr.
2,2020-12-28 13:21:13,39.4678,-119.7874,Reno,NV,,N Frontage Rd,Incident on I-580 near NEIL RD Expect delays.
3,2019-10-22 19:06:24,39.4496,-119.7752,Reno,NV,,Martin Luther King Jr Memorial Fwy,#2 lane blocked due to accident on I-580 Northbound at Exit 61 Virginia St.
3,2019-05-08 13:40:03,39.3966,-119.758,Reno,NV,,I-580 N,Lane blocked due to accident on I-580 Southbound at Exit 56 NV-431 Mt Rose Hwy.
3,2017-10-26 14:12:50,39.5274,-119.784,Reno,NV,,Martin Luther King Jr Memorial Fwy,Accident on I-580 Martin Luther King Jr Memorial Fwy Southbound at Exits 66 67 NV-648 2nd St.
3,2017-12-20 09:33:44,40.9491,-115.5522,Elko,NV,,I-80 E,Accident on I-80 Eastbound after Exit 317 Old Devils Gate Rd.
2,2020-12-02 14:47:18,39.1942,-119.7754,Carson City,NV,3998, N Carson St,Incident on N CARSON ST SB near SILVER OAK DR Drive with caution.
2,2017-11-28 17:58:08,36.6351,-114.601,Overton,NV,,I-15 N,At Hidden Valley Rd/Exit 88 - Accident. in the left lane.
3,2017-10-19 07:34:25,39.5334,-119.7385,Sparks,NV,,I-80 W,Accident on I-80 Eastbound at Exit 19 NV-650 McCarran Blvd.
2,2020-05-25 12:18:50,40.6228,-116.9141,Battle Mountain,NV,,Hilltop Rd,Accident on I-80 Westbound between Exit 244 Mosquito Canyon Rd and Exit 233 I-80-BL.
2,2019-03-08 04:24:11,38.0308,-117.8886,Tonopah,NV,,US-6 E,Accident on US-6 Westbound after US-95.
2,2017-02-01 11:33:45,36.2708,-115.5435,Las Vegas,NV,14669, Kyle Canyon Rd,At NV-158/Deer Creek Hwy - Accident.
2,2017-10-17 13:29:27,39.5362,-119.7365,Sparks,NV,,Nichols Blvd,Accident on NV-650 McCarran Blvd at Nichols Blvd.
2,2017-03-22 07:24:48,36.1414,-115.1734,Las Vegas,NV,,I-15 N,At Sahara Ave/Exit 40 - Accident.
2,2017-09-20 15:51:10,39.5059,-119.7805,Reno,NV,,Martin Luther King Jr Memorial Fwy,Accident on I-580 Martin Luther King Jr Memorial Fwy Northbound at Plumb Ln.
2,2017-05-25 11:10:18,36.1826,-115.3417,Las Vegas,NV,,County Hwy-215 N,At W Summerlin Pky/Exit 28 - Accident.
3,2019-02-04 11:15:28,39.1913,-119.7564,Carson City,NV,,I-580 S,Accident on exit ramp from I-580 Southbound to E College Pkwy.
2,2017-10-16 15:48:36,39.5563,-119.7884,Reno,NV,,N McCarran Blvd,Accident on US-395 Martin Luther King Jr Memorial Fwy Southbound at NV-650 McCarran Blvd.
3,2020-07-14 17:03:13,39.5164,-119.8863,Reno,NV,,I-80 W,Accident on I-80 Eastbound at Exit 9 Robb Dr.
2,2018-05-18 13:34:55,39.0359,-119.7379,Minden,NV,2701,Sylvia St,Accident on Sylvia St near Cathy Ln.
2,2020-11-29 20:17:00,39.6724,-119.9999,Reno,NV,,Martin Luther King Jr Memorial Fwy,JSO OF HALLALUJAH JCT. MAPS SHOWS HER ON A UNKNOWN ROAD
2,2016-08-12 23:06:10,36.2942,-115.2818,Las Vegas,NV,,US-95 N,At Durango Dr/Exit 93 - Accident.
2,2019-12-07 07:10:17,38.728,-119.5553,Gardnerville,NV,3398,Highland Way,Accident on US-395 at NV-208.
3,2019-12-19 14:18:01,39.5095,-119.7804,Reno,NV,2063,Villanova Dr,Accident on I-580 Southbound at Exit 65A Matley Ln.
2,2020-03-19 08:14:16,38.9323,-119.7794,Gardnerville,NV,901,Waterloo Ln,Accident on NV-88 at NV-207 Waterloo Ln. No recent updates.
2,2017-05-31 03:34:02,36.1148,-115.1192,Las Vegas,NV,,E Flamingo Rd,At Flamingo Rd - Accident.
2,2019-11-14 05:34:59,40.7666,-115.9201,Elko,NV,,I-80 E,Accident on I-80 Westbound near Exit 292 Nf-406.
3,2017-05-17 07:57:40,36.0325,-115.0242,Henderson,NV,,I-215 E,At I-515/NV-564/Exit 1 - Accident.
3,2020-10-03 07:56:16,39.5364,-119.7867,Reno,NV,545,Depaoli St,Accident on I-580 Northbound at Exit 36A I-80 Exit 15.
3,2020-01-16 20:05:39,39.4396,-119.7656,Reno,NV,,Martin Luther King Jr Memorial Fwy,Accident on I-580 at Exit 60 Meadows Pkwy.
3,2017-12-16 04:39:46,40.8704,-117.2441,Golconda,NV,,I-80 E,Jackknifed truck and accident on I-80 Eastbound after Exit 205 Pumpernickel Valley Rd.
4,2019-10-29 13:06:03,39.4019,-118.6504,Fallon,NV,42999, Austin Hwy,Closed at Fallon - Road closed due to accident.
2,2020-09-16 12:40:11,39.4396,-119.7656,Reno,NV,,Martin Luther King Jr Memorial Fwy,Accident on I-580 Northbound at Exit 60 Meadows Pkwy.
2,2019-05-01 08:03:51,39.5572,-119.7905,Reno,NV,2900,Clear Acre Ln,Accident on US-395 Southbound at NV-659 Mccarran Blvd.
2,2019-02-15 09:39:30,39.3059,-119.8263,Washoe Valley,NV,,I-580 S,Accident on I-580 Southbound before Bowers Mansion Rd.
2,2019-03-01 05:51:01,39.5273,-119.7397,Sparks,NV,,S McCarran Blvd,Accident on NV-659 Mccarran Blvd at Glendale Ave.
2,2020-01-15 19:08:33,39.5137,-118.9404,Fallon,NV,9654,Reno Hwy,Accident on US-50 Carson Hwy both ways at US-50-ALT Reno Hwy.
3,2018-10-09 06:50:32,39.528,-119.6175,Sparks,NV,,Interstate 80 E,Accident on I-80 Westbound at Mustang Rd.
2,2016-10-30 00:29:50,36.1761,-115.1647,Las Vegas,NV,,US-95 N,Ramp to US-95 Northbound and N Rancho Dr - Accident.
3,2017-07-21 08:33:46,35.9667,-115.1815,Las Vegas,NV,,I-15 N,At NV-146/Exit 27 - Accident.
2,2016-09-27 10:58:48,36.1256,-115.1694,Las Vegas,NV,3298, Las Vegas Blvd S,At Sands Ave/Spring Mountain Rd - Accident.
2,2016-10-01 23:49:49,36.0674,-115.2134,Las Vegas,NV,,County Hwy-215 E,At Decatur Blvd/Exit 13 - Accident.
2,2020-03-18 18:33:58,39.5911,-119.3707,Sparks,NV,,I-80 E,At NV-421/Exit 40 - Accident.
2,2020-03-20 09:11:39,39.523,-119.7401,Sparks,NV,1245, S McCarran Blvd,At E Greg St - Accident.
2,2020-05-26 11:00:03,38.5245,-118.6246,Hawthorne,NV,499,E St,Accident on US-95 5th St Northbound at NV-359.
2,2016-11-11 15:55:47,39.5484,-119.7527,Sparks,NV,1655, Pyramid Way,At Greenbrae Dr - Accident.
3,2018-06-14 15:41:26,39.5598,-119.5532,Reno,NV,,Interstate 80 E,Accident on I-80 Westbound at Exit 28 Waltham Way.
2,2020-08-12 06:19:47,38.5458,-118.6477,Hawthorne,NV,,US Highway 95,Accident on US-95 near 10th St.
2,2016-12-19 04:38:02,36.1076,-115.0583,Las Vegas,NV,,Boulder Hwy,At E Harmon Ave - Accident.
3,2019-07-05 11:21:53,39.5286,-119.7155,Sparks,NV,,Sparks Blvd,Accident on I-80 Eastbound at Exit 20 Sparks Blvd.
2,2017-11-09 05:55:37,39.4813,-118.8203,Fallon,NV,3000,Reno Hwy,Accident on US-50 Reno Hwy both ways at River Village Dr.
3,2019-01-15 21:16:23,39.4925,-119.7847,Reno,NV,,Martin Luther King Jr Memorial Fwy,Accident on I-580 Southbound at Exit 64 Moana Ln.
4,2017-03-30 01:59:40,40.681,-118.0654,Imlay,NV,,I-80 W,Closed between NV-400/Exit 149 and NF-416/Exit 145 - Road closed due to accident.
3,2017-11-14 16:41:33,39.5598,-119.5532,Reno,NV,,Interstate 80 E,Accident on I-80 Westbound at Exit 28 Waltham Way.
2,2020-12-18 14:18:30,39.5665,-119.747,Sparks,NV,3554, Pyramid Lake Hwy,Slow traffic on NV-445 from NV-659/N McCarran Blvd (Pryamid Way/NV-445) to Los Altos Pkwy (Pyramid Way/NV-445) due to accident.
2,2017-03-06 06:45:05,36.1748,-115.1973,Las Vegas,NV,,US-95 S,At Valley View Blvd/Exit 78 - Accident.
2,2020-05-16 18:35:40,39.3351,-119.2411,Silver Springs,NV,7708, US Highway 95A S,At Ramsey Cutoff - Accident.
2,2016-11-29 11:07:45,36.1716,-115.1328,Las Vegas,NV,,US-93 N,At Las Vegas Blvd/Exit 75 - Accident.
4,2016-09-14 23:15:14,36.1665,-115.2444,Las Vegas,NV,496, S Rainbow Blvd,Closed between Alta Dr and NV-589/W Sahara Ave - Road closed due to accident.
2,2019-06-26 11:39:06,38.9324,-119.7496,Gardnerville,NV,1302,Centerville Ln,Accident on Waterloo Ln at NV-756 Centerville Ln.
4,2018-06-04 15:44:45,39.5124,-118.9429,Fallon,NV,9664, Carson Hwy,Closed between US-50-ALT/Reno Hwy and Veterans Memorial Hwy - Road closed due to accident.
2,2017-07-05 11:20:34,36.1751,-115.1749,Las Vegas,NV,,US-95 S,Ramp to I-15 Southbound and Martin L King Blvd - Accident.
2,2020-06-02 14:35:27,39.5286,-119.7155,Sparks,NV,,Sparks Blvd,Accident on I-80 Eastbound at Exit 20 Sparks Blvd.
3,2020-02-22 07:21:36,39.5286,-119.7155,Sparks,NV,,Sparks Blvd,Left lane blocked due to accident on I-80 Eastbound from Exit 19 NV-659 Mccarran Blvd to Exit 20 Sparks Blvd.
2,2020-03-14 05:26:58,39.2774,-119.8203,Washoe Valley,NV,,I-580 S,At Bellevue Rd/Exit 44 - Accident. Incident. Lane blocked.
2,2017-11-22 09:40:45,39.4747,-118.8467,Fallon,NV,4497,Alcorn Rd,Accident on McLean Rd both ways at Alcorn Rd.
2,2017-02-01 07:36:45,36.1661,-115.062,Las Vegas,NV,378, N Nellis Blvd,At Stewart Ave - Accident.
3,2017-03-16 05:56:18,39.5189,-119.63,Sparks,NV,,Interstate 80 E,At CA-80/Mustang Ranch Rd/Exit 23 - Accident.
2,2019-07-15 12:20:12,38.9661,-118.8096,Schurz,NV,,US-95 N,Accident on Sunset Dr Eastbound at US-95.
3,2018-05-04 17:04:09,39.5242,-119.8626,Reno,NV,,I-80 W,Accident on I-80 Eastbound at Exit 10 NV-651 McCarran Blvd.
3,2019-02-15 04:45:59,39.5213,-119.6269,Sparks,NV,,Interstate 80 E,Accident on I-80 Westbound before Exit 23 Hwy 80.
2,2016-11-19 23:35:51,36.035,-115.3586,Las Vegas,NV,11494, Blue Diamond Rd,At NV-159/Blue Diamond Rd - Accident.
2,2020-11-26 07:47:01,36.8045,-114.1026,Mesquite,NV,,I-15 S,Incident on I-15 SB near MM 120 Expect delays.
2,2018-09-10 06:07:09,39.7813,-119.3536,Wadsworth,NV,,State Highway 447,At BIA-3 - Accident.
2,2018-05-09 09:51:11,39.4028,-119.7462,Reno,NV,,S Virginia St,Slow traffic due to accident on NV-341 Geiger Grade Rd both ways at US-395 Alt Virginia St.
2,2019-04-09 06:39:48,39.2959,-119.5276,Dayton,NV,4806,US Highway 50 E,Accident on US-50 at Occidental Dr.
2,2018-03-09 10:55:39,39.2248,-119.6029,Carson City,NV,1001,US Highway 50 W,Accident on US-50 at Winters Pkwy.
2,2020-07-17 09:53:20,39.5112,-119.6547,Sparks,NV,,Interstate 80 E,Accident on I-80 Eastbound after Exit 22 Canyon Rd.
2,2016-10-05 13:58:56,36.0555,-115.2793,Las Vegas,NV,,S Durango Dr,At W Windmill Ln - Accident.
3,2019-09-25 12:42:26,39.5355,-119.7786,Sparks,NV,2648,Prater Way,Lane blocked due to accident on I-80 Eastbound at Exit 16 Prater Way.
3,2019-12-24 14:59:50,39.2775,-119.5589,Dayton,NV,4015, US Highway 50 E,At Hart St - Accident.
2,2016-11-28 06:53:03,36.1772,-115.1517,Las Vegas,NV,,US-93 S,Ramp to I-515/US-93 Southbound and US-95 and Martin L King Blvd - Accident.
3,2020-08-06 07:40:06,39.5339,-119.7569,Sparks,NV,,I-80 E,Exit ramp from I-80 Eastbound at Exit 18 to Pyramid Way Southbound lane blocked due to accident.
4,2017-06-24 09:18:33,36.1146,-115.1464,Las Vegas,NV,799, E Flamingo Rd,Closed at Maryland Pkwy - Road closed due to accident.
2,2019-04-02 04:08:17,41.1042,-114.9755,Wells,NV,,I-80 E,Left hand shoulder blocked due to accident on I-80 Eastbound at Exit 351 I-80-BL.
2,2017-09-07 07:57:34,39.5456,-119.788,Reno,NV,,Oddie Blvd,Accident on US-395 Martin Luther King Jr Memorial Fwy Southbound at Exit 69 Oddie Blvd.
2,2018-03-21 14:08:31,39.1019,-119.7748,Carson City,NV,,Jacks Valley Rd,Accident on NV-206 Jacks Valley Rd at US-395.
2,2017-05-31 07:18:21,36.194,-115.2239,Las Vegas,NV,1943, N Jones Blvd,Between Carl Ave and Turmon Ave - Accident.
2,2019-01-16 18:32:38,39.2205,-119.6469,Mound House,NV,10223,US Highway 50 E,Accident on US-50 Eastbound at NV-341.
4,2018-11-16 05:24:58,36.7745,-114.2477,Overton,NV,,I-15 N,Closed between Carp Elgin Rd/Exit 100 and Lower Flat Top Dr - Road closed due to accident.
2,2020-07-14 08:10:25,39.5269,-119.7837,Reno,NV,,Martin Luther King Jr Memorial Fwy,Accident on I-580 Southbound at Exit 67 NV-648 2nd St.
2,2019-05-01 07:35:04,39.6275,-119.7205,Sparks,NV,8428,Pyramid Way,Accident on NV-445 Pyramid Way Southbound after Dolores Dr.
2,2017-02-09 11:05:48,36.0325,-115.0242,Henderson,NV,,I-215 E,At I-515/NV-564/Exit 1 - Accident.
2,2016-11-03 06:40:10,36.1745,-115.2241,Las Vegas,NV,6, N Jones Blvd,At US-95 - Accident.
2,2016-10-07 17:03:54,36.1262,-115.2081,Las Vegas,NV,4900, Spring Mountain Rd,At Spring Mountain Rd - Accident.
2,2017-12-20 16:07:04,40.6589,-116.4082,Crescent Valley,NV,,I-80 E,At Exit 268 - Accident.
2,2020-06-01 16:18:24,40.8255,-114.9998,Wells,NV,,NV-232,Accident on NV-232 Northbound at US-93.
2,2018-02-28 07:41:30,38.9548,-119.7652,Minden,NV,,6th St,Accident on US-395 Southbound at 6th St.
2,2018-05-08 06:31:59,39.5563,-119.7884,Reno,NV,,N McCarran Blvd,Accident on US-395 Martin Luther King Jr Memorial Fwy Southbound at Exits 70 70A 70B NV-651 McCarran Blvd.
2,2018-07-10 11:07:57,40.938,-115.4157,Spring Creek,NV,,NV-229,Accident on NV-229 Westbound before McIntyre Rd.
3,2017-09-26 11:14:26,41.0903,-114.7101,Wells,NV,,Independence Vly,Accident on I-80 Eastbound at Exit 365 Independence Vly.
2,2020-05-08 12:43:00,39.5338,-119.7668,Sparks,NV,,I-80 E,Accident on I-80 Westbound at Exit 17 Rock Blvd.
2,2019-08-28 17:00:19,39.2866,-118.1624,Fallon,NV,,Dixie Valley Rd,Accident on US-50 Austin Hwy Westbound at NV-121 Dixie Valley Rd.
2,2017-01-03 07:12:23,39.618,-119.876,Reno,NV,,Martin Luther King Jr Memorial Fwy,At Stead Blvd/Exit 76 - Accident.
2,2016-11-21 17:23:15,36.1743,-115.1551,Las Vegas,NV,,US-95 S,At I-15/Exit 76A - Accident.
2,2018-10-23 13:22:46,38.2375,-114.5918,Pioche,NV,,US-93 N,Accident on US-93 at Mt Wilson Rd.
4,2017-02-20 21:03:51,39.5139,-119.9875,Verdi,NV,,I-80 W,Closed between Verdi Rd/Crystal Peak Rd/Exit 3 and I-80-BL/Exit 2 - Road closed due to accident.
3,2020-03-19 11:51:06,39.4235,-119.7523,Reno,NV,,Martin Luther King Jr Memorial Fwy,Accident on I-580 Southbound at Exit 59 Damonte Ranch Pkwy.
2,2020-10-22 12:13:14,39.5275,-119.7837,Reno,NV,,Martin Luther King Jr Memorial Fwy,Accident on I-580 Northbound at Glendale Ave.
3,2017-12-04 07:09:19,39.4787,-119.7899,Reno,NV,,Martin Luther King Jr Memorial Fwy,Accident on I-580 Martin Luther King Jr Memorial Fwy Southbound at Exit 63 McCarran Blvd.
2,2020-11-03 08:00:00,39.5552,-119.5629,Sparks,NV,,Interstate 80 E,Incident on I-80 EB near EXIT 28 Left lane blocked.
3,2019-07-25 17:37:19,39.5227,-119.6246,Sparks,NV,,Interstate 80 E,Accident on I-80 Eastbound from Exit 23 Mustang Ranch Rd to Mustang Ranch Rd.
2,2020-12-21 08:31:48,39.2424,-114.8684,Ely,NV,1801,Great Basin Blvd,Accident on US-50 Great Basin Hwy at Highland Dr.
2,2019-07-26 05:04:33,40.0652,-114.6139,Ely,NV,,US-93 Alt N,Accident on US-93-ALT Northbound at US-93 Great Basin Hwy.
2,2020-07-28 18:27:18,39.5897,-119.4237,Sparks,NV,,I-80 W,Accident on entry ramp to Derby Dam Westbound at Exit 36 from I-80 Westbound.
2,2019-08-15 20:01:24,39.5348,-119.7529,Sparks,NV,,Pyramid Way,Lane blocked due to accident on Victorian Ave at NV-445 Pyramid Way.
4,2019-02-17 20:41:56,36.8105,-114.0685,Mesquite,NV,,I-15 N,Closed between I-15-BL/Pioneer Blvd/Exit 122 and Arizona/Nevada State Line - Road closed due to accident.
2,2019-08-19 16:39:02,39.1104,-119.7737,Carson City,NV,,Topsy Ln,Accident on US-395 Northbound at Topsy Ln.
2,2020-11-05 15:38:21,39.2922,-119.5339,Dayton,NV,4412, US Highway 50 E,Incident on US-50 WB near OCCIDENTAL DR Expect delays.
4,2019-12-13 15:43:21,39.5016,-119.7825,Reno,NV,,Martin Luther King Jr Memorial Fwy,Closed between Plumb Ln/Exit 65 and Mill St/Exit 66 - Road closed due to accident.
2,2019-02-14 18:10:31,36.6354,-114.602,Overton,NV,,I-15 S,Between Hidden Valley Rd/Exit 88 and Exit 84 Rest Area - Accident.
3,2017-08-09 17:08:13,39.4498,-119.7761,Reno,NV,,Martin Luther King Jr Memorial Fwy,Accident on I-580 Martin Luther King Jr Memorial Fwy Southbound at Exit 61 Virginia St.
2,2019-02-01 10:30:18,41.8756,-114.7105,Jackpot,NV,,US-93 N,Accident on US-93 Southbound after CR-772.
2,2018-08-24 06:33:11,40.7243,-115.5671,Spring Creek,NV,,Lamoille Hwy,Accident on NV-227 Lamoille Hwy at Thistle Jct.
3,2019-10-20 14:56:00,41.0985,-115.1109,Wells,NV,,I-80 E,Accident on I-80 Westbound at Exit 343 NV-230.
3,2018-09-26 18:57:17,39.5533,-119.5672,Sparks,NV,,Interstate 80 E,Accident on I-80 Westbound at Exit 28 Reno Technology Pkwy.
2,2020-10-30 05:26:39,39.5411,-119.7879,Reno,NV,,Martin Luther King Jr Memorial Fwy,Incident on US-395 NB near ODDIE BLVD Expect delays.
2,2017-10-03 18:32:26,39.5446,-119.7875,Reno,NV,,Martin Luther King Jr Memorial Fwy,Accident on exit ramp from Martin Luther King Jr Memorial Fwy Northbound to Oddie Blvd Southbound.
3,2018-09-08 07:27:22,39.5375,-119.7838,Reno,NV,,I-80 W,Accident on entry ramp to I-580 Southbound at Exit 15 from I-80 Westbound.
4,2019-07-25 15:44:43,39.1483,-119.1828,Yerington,NV,272, US Highway 95A N,Closed at US-95-alt - Road closed due to accident.
2,2019-10-01 11:33:06,39.3986,-114.7822,Ely,NV,77,S 4th St,Accident on US-93 Great Basin Hwy Northbound at A Ave.
2,2018-11-30 18:18:13,40.8361,-115.7889,Elko,NV,,Mountain City Hwy,Accident on NV-225 Mountain City Hwy Northbound at I-80.
2,2016-09-15 07:36:54,36.1756,-115.1709,Las Vegas,NV,,US-95 S,Between Rancho Dr/Exit 77 and I-15/Exit 76B - Accident.
2,2020-12-17 17:08:29,36.5945,-114.4838,Logandale,NV,2992, N Moapa Valley Blvd,Incident on MOAPA VALLEY near RICE Expect delays.
2,2018-04-26 15:07:04,39.5233,-119.8253,Reno,NV,,W 1st St,Accident on Keystone Ave Westbound near 1st St.
3,2017-08-03 09:07:14,39.5372,-119.788,Reno,NV,,I-80 E,Accident on I-80 Eastbound at I-580.
2,2020-12-20 05:44:00,39.4682,-120.0027,Verdi,NV,,I-80 E,EB JEO CO LINE * STARTED EB EO FARAD. C80-011 INQ W/ ETA FRM CAL NV
2,2016-10-20 10:03:13,36.1295,-115.2429,Las Vegas,NV,,S Rainbow Blvd,At NV-595/S Rainbow Blvd - Accident.
3,2020-03-17 05:26:57,39.5114,-119.9657,Verdi,NV,,I-80 W,Accident on I-80 Westbound at Exit 4 Boomtown Garson Rd.
2,2017-02-08 10:33:43,36.1818,-115.0803,Las Vegas,NV,923, N Lamb Blvd,At Washington Ave - Accident.
3,2018-10-17 17:11:37,39.5138,-119.6431,Sparks,NV,,Interstate 80 E,Accident on I-80 Westbound after Exit 23 Canyon Park.
2,2017-01-20 12:48:18,36.1262,-115.1804,Las Vegas,NV,2841, Spring Mountain Rd,At I-15/Desert Inn Rd - Accident.
2,2016-08-11 16:42:46,36.0471,-115.1348,Las Vegas,NV,,I-215 E,At Windmill Ln/Exit 8 - Accident.
3,2019-09-04 18:28:02,39.4654,-119.7868,Reno,NV,,Martin Luther King Jr Memorial Fwy,Queueing traffic and 2nd lane blocked due to accident on I-580 Northbound at Exit 62 Neil Rd.
