Severity,Date/Time,Latitude,Longitude,City,State,Number,Street,Description
2,2019-02-20 16:19:13,39.244,-119.9987,Crystal Bay,NV,448,Lakeshore Blvd,Accident on NV-28 North Lake Rd both ways at Gonowabie Rd.
2,2019-11-07 21:29:51,39.5327,-119.7391,Sparks,NV,150,S McCarran Blvd,Accident on NV-659 Mccarran Blvd at Nugget Ave.
3,2017-12-20 06:57:36,39.397,-119.7581,Reno,NV,,US-395 N,Accident on I-580 Northbound at Exit 56 NV-431 Mount Rose Hwy.
2,2020-06-11 16:07:59,40.96,-117.7369,Winnemucca,NV,1076,Grass Valley Rd,Accident on NV-294 Grass Valley Rd at Sunny Dr.
2,2019-10-14 06:59:08,39.4018,-118.8005,Fallon,NV,1770,Lone Tree Rd,Accident on Lone Tree Rd at Allen Rd.
2,2020-06-03 17:30:05,38.3898,-118.1081,Luning,NV,,Front St,Accident on US-95 Front St Southbound near 11th St.
2,2019-11-12 11:05:49,39.603,-119.8409,Reno,NV,,Martin Luther King Jr Memorial Fwy,At Golden Valley Rd/Exit 73 - Accident.
2,2017-03-27 01:57:03,36.1148,-115.1746,Las Vegas,NV,1574, W Flamingo Rd,At I-15 - Accident.
2,2019-02-18 09:59:24,39.5571,-119.7791,Sparks,NV,,N McCarran Blvd,Accident on NV-659 Mccarran Blvd at El Rancho Dr.
2,2016-07-24 01:35:45,36.2011,-115.3411,Las Vegas,NV,,County Hwy-215 N,At W Lake Mead Blvd/Exit 29 - Accident.
3,2019-09-04 18:02:08,39.519,-119.7828,Reno,NV,,Martin Luther King Jr Memorial Fwy,2nd lane blocked due to accident on I-580 Northbound at Exit 66 Mill St.
2,2019-09-20 12:33:54,38.9576,-119.7724,Minden,NV,,US Highway 395 N,Accident on US-395 Northbound at Lucerne St.
2,2018-10-08 08:52:42,39.6237,-119.7236,Sparks,NV,3806, Erin Dr,At Erin Dr - Accident.
3,2018-02-12 08:16:06,40.6632,-116.7353,Battle Mountain,NV,,I-80 W,Accident on I-80 Westbound at Exit 244.
2,2017-06-03 23:16:01,36.1961,-115.2446,Las Vegas,NV,,US-95 S,At Lake Mead Blvd/Exit 82 - Accident.
4,2017-05-05 11:22:12,38.9286,-119.8384,Gardnerville,NV,104, Mottsville Ln,Closed at NV-88 - Road closed due to accident.
2,2020-08-04 10:51:12,39.5364,-119.7867,Reno,NV,545,Depaoli St,Accident on I-80 Westbound at Exit 15 I-580 Exit 68A.
2,2020-06-11 14:14:32,38.9395,-119.7461,Gardnerville,NV,,Mission St,Accident on US-395 Northbound at Mission St.
2,2019-04-07 02:08:41,39.513,-119.9286,Reno,NV,,I-80 E,At 4th St/Mogul Rd/Exit 7 - Accident.
2,2016-07-22 12:15:39,36.1445,-115.2968,Las Vegas,NV,9228, W Sahara Ave,Between Crystal Water Way and Grand Canyon Dr - Accident.
2,2016-08-05 12:31:04,36.1147,-115.0663,Las Vegas,NV,4917, Boulder Hwy,At E Flamingo Rd - Accident.
3,2018-07-08 16:24:27,39.654,-119.1618,Fernley,NV,,I-80 W,Accident on I-80 Westbound at mm 53.
2,2020-11-09 03:10:00,39.5316,-119.8254,Reno,NV,,I-80 W,Stationary traffic on I-80 from Virginia St/Exit 13 (I-80) to Keystone Ave/Exit 12 (I-80) due to accident.
2,2020-05-17 10:38:58,39.2308,-114.8978,Ely,NV,,US-6 W,Between CR-44a/NF-440 and US-93/Great Basin Blvd - Accident.
2,2016-12-19 14:40:44,36.1397,-115.1749,Las Vegas,NV,,I-15 N,At Sahara Ave/Exit 40 - Accident.
2,2020-01-16 18:43:17,39.5996,-119.8373,Reno,NV,,Martin Luther King Jr Memorial Fwy,Left lane blocked due to accident on US-395 Southbound at Exit 73 Golden Valley Rd.
2,2016-10-06 15:54:47,36.1398,-115.1748,Las Vegas,NV,,I-15 N,At Sahara Ave/Exit 40 - Accident.
2,2018-07-09 17:36:46,39.338,-119.8727,Reno,NV,21000,Mount Rose Hwy,Accident on NV-431 Mount Rose Hwy at Sky Tavern Rd.
2,2016-09-14 10:35:05,36.159,-115.0802,Las Vegas,NV,4398, E Charleston Blvd,At Charleston Blvd - Accident.
4,2017-06-03 11:34:52,36.1591,-115.2622,Las Vegas,NV,7798, W Charleston Blvd,Closed between Buffalo Dr and Shelter Island Way - Road closed due to accident.
2,2020-01-16 16:42:03,39.4635,-119.786,Reno,NV,,Martin Luther King Jr Memorial Fwy,Accident on exit ramp from I-580 Northbound at Exit 62 to Us-395 Northbound.
2,2020-10-10 12:32:17,39.5664,-119.4917,Sparks,NV,,Interstate 80 E,Incident on I-80 EB near USA PKWY Expect delays.
2,2018-12-04 18:13:48,39.616,-119.2632,Fernley,NV,,US-95 Alt S,At US-95-ALT/Exit 46 - Accident.
2,2018-04-12 04:41:13,39.611,-119.8511,Reno,NV,,Martin Luther King Jr Memorial Fwy,Accident on US-395 Martin Luther King Jr Memorial Fwy Northbound before Exit 74 Lemmon Dr.
2,2016-07-03 23:54:44,36.2136,-115.1269,North Las Vegas,NV,,I-15 N,At Cheyenne Ave/Exit 46 - Accident.
2,2016-09-13 10:06:55,36.0998,-115.2431,Las Vegas,NV,,W Tropicana Ave,At Torrey Pines Dr - Accident.
4,2017-05-05 14:04:13,36.1437,-115.1574,Las Vegas,NV,,Sahara Ave,Closed between NV-604/S Las Vegas Blvd and Fairfield Ave - Road closed due to accident.
2,2019-10-31 06:56:43,40.9496,-115.5943,Elko,NV,,I-80 E,Accident on I-80 Westbound at Exit 314 CR-721A.
2,2020-12-24 21:36:26,39.6183,-119.8789,Reno,NV,,Martin Luther King Jr Memorial Fwy,Stationary traffic on US-395 S from Stead Blvd/Exit 76 (US-395) to E Golden Valley Rd/Exit 73 (US-395) due to accident.
4,2020-04-02 11:17:32,39.6151,-119.2129,Fernley,NV,,I-80 W,Closed between NV-343/Exit 48 and US-95-ALT/Exit 46 - Road closed due to accident.
2,2016-12-19 08:21:21,36.1891,-115.0799,Las Vegas,NV,1629, N Lamb Blvd,At NV-147/E Lake Mead Blvd - Accident.
2,2020-06-24 15:51:58,39.4418,-119.7715,Reno,NV,9750,S Virginia St,Accident on Virginia St at Meadows Marketplace Dr.
2,2019-07-12 12:20:56,39.2451,-119.9373,Incline Village,NV,,Tahoe Blvd,Accident on NV-28 Tahoe Blvd at Country Club Dr.
2,2020-10-21 16:32:23,39.5563,-119.7525,Sparks,NV,,Pyramid Way,Incident on NV-445 SB near MCCARRAN BLVD Expect long delays.
2,2019-11-03 11:48:47,39.4588,-118.7441,Fallon,NV,2063,Wildes Rd,Accident on NV-118 Wildes Rd Eastbound from Rogers Rd to Testolin Rd.
2,2019-05-10 16:31:31,39.5275,-119.7398,Sparks,NV,,E Glendale Ave,Accident on NV-659 Mccarran Blvd at NV-648 Glendale Ave.
2,2020-04-19 06:24:09,41.1127,-114.8036,Wells,NV,,I-80 W,Accident on I-80 Eastbound between Exit 352B 6th St and Exit 360 Moor Interchange Hwy.
3,2017-05-21 02:12:02,36.1753,-115.1608,Las Vegas,NV,,N Martin L King Blvd,Between I-15/ML King Blvd/Exit 76B and Rancho Dr/Exit 77 - Accident.
3,2018-12-03 13:11:47,39.19,-119.7543,Carson City,NV,,I-580 S,Accident on I-580 Southbound at Exit 41 College Pkwy.
3,2019-02-04 17:44:16,39.4104,-119.7495,Reno,NV,,Martin Luther King Jr Memorial Fwy,Accident on I-580 Southbound at Virginia St.
3,2017-10-16 09:25:42,40.7666,-115.9204,Elko,NV,,I-80 W,Accident on I-80 Westbound after Exit 292 Maggie Creek Ranch Rd.
3,2019-08-15 15:21:22,39.2462,-119.8136,Washoe Valley,NV,,I-580 N,Accident on I-580 Southbound from Exit 50 NV-429 to Exit 46 Bellevue Rd.
2,2017-01-31 07:33:05,36.2632,-115.2424,Las Vegas,NV,,N Rainbow Blvd,At Rainbow Blvd - Accident.
3,2017-10-19 06:38:42,39.397,-119.7581,Reno,NV,,US-395 N,Accident on I-580 Southbound at Exit 56 NV-431 Mount Rose Hwy.
2,2016-12-01 05:56:02,36.0793,-115.1806,Las Vegas,NV,,I-15 N,At I-15/W Russell Rd - Accident.
2,2018-11-06 20:12:14,39.5337,-119.8647,Reno,NV,,Mae Anne Ave,Accident on NV-651 McCarran Blvd at Mae Anne Ave.
2,2017-07-04 02:55:44,36.1659,-115.1502,Las Vegas,NV,,S Main St,At S Main St - Accident.
2,2019-05-17 09:31:12,40.8368,-115.7864,Elko,NV,,I-80 W,Accident on exit ramp from I-80 Westbound at Exit 301 to NV-225.
2,2017-06-09 07:47:50,36.1705,-115.2061,Las Vegas,NV,254, S Decatur Blvd,At Mayflower Ln - Accident.
3,2019-02-14 05:52:13,39.4496,-119.7753,Reno,NV,,Martin Luther King Jr Memorial Fwy,Accident on I-580 Southbound at Exit 61 Virginia St.
2,2016-09-28 14:00:36,36.1146,-115.1641,Las Vegas,NV,198, E Flamingo Rd,Between Flamingo Rd and Las Vegas Blvd - Accident.
2,2018-08-13 16:38:38,39.5563,-119.7884,Reno,NV,,N McCarran Blvd,Right lane closed due to accident on US-395 Martin Luther King Jr Memorial Fwy Northbound at Exits 70 70A 70B NV-651 McCarran Blvd.
2,2018-10-08 08:23:27,39.5832,-119.7433,Sparks,NV,,Pyramid Way,At Los Altos Pkwy - Accident.
2,2019-06-12 09:45:48,39.1794,-119.7261,Carson City,NV,3648,US Highway 50 E,Accident on US-50 Westbound at Brown St.
2,2017-03-10 12:30:32,36.0329,-115.0185,Henderson,NV,,W Lake Mead Pkwy,Ramp to I-515/NV-564/Exit 1 - Accident.
2,2020-09-25 00:12:45,39.2091,-119.8049,Carson City,NV,,I-580 N,Incident on I-580 NB near EASTLAKE BLVD Right lane blocked. Expect delays.
3,2019-10-01 15:38:39,40.7666,-115.9201,Elko,NV,,I-80 E,Accident on I-80 Eastbound between Exit 282 I-80-BL and Exit 292 Nf-406.
3,2019-02-10 06:11:34,39.3066,-119.8252,Washoe Valley,NV,1211,US Highway 395 N,Accident on I-580 Northbound at Exit 50 NV-429.
2,2019-09-22 04:32:23,35.1306,-114.6253,Laughlin,NV,3669,Needles Hwy,Accident on Needles Hwy at James A Bilbray Pkwy.
2,2016-09-12 10:30:49,36.2182,-115.2581,Las Vegas,NV,7422, W Cheyenne Ave,At Ronemus Dr - Accident.
2,2020-06-09 12:16:16,39.4228,-119.7515,Reno,NV,,Damonte Ranch Pkwy,Accident on I-580 Southbound at Exit 59 Damonte Ranch Pkwy.
2,2017-03-19 23:05:18,36.1146,-115.2339,Las Vegas,NV,4098, S Torrey Pines Dr,At Redwood St - Accident.
2,2019-02-28 06:09:48,39.5284,-119.7154,Sparks,NV,,Sparks Blvd,Accident on I-80 Eastbound at Exit 20 Sparks Blvd.
2,2020-12-07 00:24:34,39.6005,-119.8362,Reno,NV,,E Golden Valley Rd,Incident on US-395 near GOLDEN VALLEY RD Expect delays.
3,2019-10-04 14:50:52,39.534,-119.7532,Sparks,NV,,I-80 W,Accident on I-80 Eastbound at Exit 18 NV-445 Pyramid Way.
2,2018-07-03 21:38:47,38.9285,-119.839,Gardnerville,NV,1247,Foothill Rd,Accident on NV-207 Mottsville Ln at NV-206 Foothill Rd.
2,2019-08-23 13:26:12,39.5461,-119.7881,Reno,NV,,Martin Luther King Jr Memorial Fwy,Left lane blocked due to accident on US-395 Southbound at Exit 69 Oddie Blvd.
2,2020-09-16 14:26:30,39.6101,-119.8506,Reno,NV,,Martin Luther King Jr Memorial Fwy,Stationary traffic on US-395 from Stead Blvd/Exit 76 (US-395) to Dandini Blvd/Parr Blvd/Exit 71 (US-395) due to accident.
2,2017-02-02 08:45:34,36.2094,-115.2055,Las Vegas,NV,,N Decatur Blvd,At Rancho Dr - Accident.
2,2020-12-22 01:30:33,39.532,-119.8035,Reno,NV,800, E 4th St,Incident on I-80 near WELLS AVE Expect delays.
2,2020-03-11 21:36:36,39.5344,-119.7476,Sparks,NV,,I-80 E,At McCarran Blvd/Exit 19 - Accident.
2,2018-04-10 06:50:25,39.5589,-119.7914,Reno,NV,,Martin Luther King Jr Memorial Fwy,Accident on US-395 Martin Luther King Jr Memorial Fwy Southbound at Clear Acre Ln.
2,2020-11-03 08:00:00,39.5272,-119.707,Sparks,NV,,Interstate 80 E,Incident on I-80 EB near EXIT 20 Expect delays.
2,2017-07-10 07:00:59,39.5015,-119.7828,Reno,NV,,Martin Luther King Jr Memorial Fwy,At Moana Ln/Exit 64 - Accident.
2,2020-11-17 08:29:55,39.2624,-119.957,Incline Village,NV,506,College Dr,Accident on NV-431 Mt Rose Hwy at College Dr.
2,2019-04-30 07:48:10,39.5303,-119.8283,Reno,NV,,I-80 E,Accident on entry ramp to I-80 Eastbound from Keystone Ave.
3,2019-09-06 15:21:17,39.519,-119.7828,Reno,NV,,Martin Luther King Jr Memorial Fwy,Accident on I-580 Northbound at Exit 66 Mill St.
2,2020-05-20 11:37:36,39.6163,-119.2652,Fernley,NV,,State Route 427,Accident on I-80 Westbound at Exit 46 US-95-ALT.
2,2019-02-26 07:23:36,39.0405,-119.9477,Glenbrook,NV,1309,US Highway 50,Accident on US-50 at Cave Rock Dr.
2,2017-01-31 16:08:17,36.1935,-115.3238,Las Vegas,NV,1899, Anasazi Dr,At Anasazi Dr - Accident.
2,2016-07-10 02:24:32,36.0766,-115.0399,Henderson,NV,,US-95 S,At Sunset Rd/Exit 64 - Accident.
2,2016-08-08 15:39:28,36.0308,-115.0356,Henderson,NV,,I-215 E,At Gibson Rd/Exit 2 - Accident.
3,2017-12-22 05:37:48,39.3053,-119.8262,Washoe Valley,NV,,Old US Highway 395 N,Accident on I-580 Northbound after Exit 50 US-395 Alt.
3,2018-07-16 08:11:17,39.5211,-119.784,Reno,NV,,Martin Luther King Jr Memorial Fwy,Accident on exit ramp from I-580 Southbound to Mill St.
2,2016-09-26 07:03:57,36.1298,-115.1369,Las Vegas,NV,,S Maryland Pkwy,At S Maryland Pky - Accident.
2,2017-01-10 17:12:38,36.1452,-115.1371,Las Vegas,NV,2360, S Maryland Pkwy,At NV-589/E Sahara Ave - Accident.
2,2019-06-02 10:52:47,39.0021,-119.9557,Zephyr Cove,NV,641,US Highway 50,Accident on US-50 at Martin Dr.
4,2018-02-15 15:34:19,39.3631,-119.3698,Silver Springs,NV,8399, US Highway 50,Closed between Iron Mountain Blvd and Lucille Ave/Micro Rd - Road closed due to accident.
2,2017-08-22 07:06:10,39.6075,-119.2224,Fernley,NV,170,Commerce Way,Accident on US-95 Alt Commerce Way at Fremont St.
4,2017-07-11 15:58:52,36.2397,-115.2328,Las Vegas,NV,,N Rancho Dr,Closed between Craig Rd and Jones Blvd - Road closed due to accident.
2,2018-10-30 08:53:10,39.4157,-119.2264,Silver Springs,NV,,Goldfield St,Accident on US-50 Eastbound near Goldfield St.
2,2020-08-04 10:37:37,39.2364,-119.5894,Dayton,NV,3,US Highway 50 W,Accident on US-50 at Dayton Valley Rd.
2,2019-11-24 18:11:30,39.5284,-119.72,Sparks,NV,,Interstate 80 E,Accident on exit ramp from I-80 Eastbound at Exit 20 to Sparks Blvd Northbound.
3,2018-08-31 15:08:04,39.4929,-119.7848,Reno,NV,916,E Moana Ln,Accident on I-580 Martin Luther King Jr Memorial Fwy Northbound at Exit 64 Moana Ln.
2,2017-11-24 13:03:23,39.5277,-119.7769,Sparks,NV,2427,Glendale Ave,Accident on NV-648 Glendale Ave at Galletti Way.
2,2017-10-12 15:13:21,39.2492,-119.9462,Incline Village,NV,953,Tahoe Blvd,Accident on NV-28 Tahoe Blvd at Northwood Blvd.
2,2016-09-29 11:32:16,40.9494,-115.5451,Deeth,NV,,I-80 W,At NF-423/Exit 317 - Accident.
2,2020-12-30 00:22:59,36.8045,-114.1025,Mesquite,NV,,I-15 S,Incident on I-15 SB near MM 120 Expect delays.
3,2017-11-16 07:04:53,39.5264,-119.7005,Sparks,NV,,Interstate 80 E,Accident on I-80 Westbound at Vista Blvd.
3,2020-05-18 08:51:05,39.5134,-119.9884,Verdi,NV,,I-80 W,Lane blocked due to accident on I-80 Eastbound at Exit 3 Verdi Rd.
3,2017-09-08 04:37:03,39.2471,-119.8136,Washoe Valley,NV,,US-395 N,Accident on I-580 Northbound at Exit 46 Bellevue Rd.
2,2018-04-25 12:17:28,39.4457,-118.7816,Fallon,NV,3031,Schurz Hwy,Accident on US-95 Schurz Hwy at Drumm Ln.
2,2017-04-28 07:47:22,36.3025,-115.2899,Las Vegas,NV,,US-95 S,At Durango Dr/Exit 93 - Accident.
2,2020-08-06 16:20:33,39.5835,-119.743,Sparks,NV,,Los Altos Pkwy,Accident on NV-445 Pyramid Way at Los Altos Pkwy.
2,2019-03-06 07:11:44,39.501,-115.9589,Eureka,NV,,Diamond Mine,Accident on US-50 Main St near Diamond Mine Rd.
2,2019-12-12 17:53:39,39.4635,-119.786,Reno,NV,,Martin Luther King Jr Memorial Fwy,At Del Monte Ln/Exit 62 - Accident.
3,2017-10-04 10:57:59,39.1501,-119.7449,Carson City,NV,,US-50 E,Accident on I-580 Southbound between Exit 39 and Exit 38.
2,2016-06-27 02:41:44,36.1154,-115.208,Las Vegas,NV,,W Flamingo Rd,At Flamingo Rd - Accident.
4,2020-06-08 21:37:33,39.0082,-119.9472,Glenbrook,NV,777, US Highway 50,Closed at Lake Ridge Rd/Sugar Pine Cir - Road closed due to accident.
2,2016-08-03 06:23:25,36.0863,-115.1898,Las Vegas,NV,5700, S Valley View Blvd,At S Decatur Blvd - Accident.
2,2017-10-10 09:34:43,39.611,-119.8511,Reno,NV,,Martin Luther King Jr Memorial Fwy,Restrictions due to accident on US-395 Martin Luther King Jr Memorial Fwy both ways at Exit 74 Lemmon Dr.
2,2017-03-03 10:39:37,36.1588,-115.1409,Las Vegas,NV,908, E Charleston Blvd,At 8th St - Accident.
2,2018-09-06 07:53:11,39.5739,-119.8086,Reno,NV,,E Parr Blvd,Accident on US-395 Martin Luther King Jr Memorial Fwy Northbound after Parr Blvd.
2,2017-07-06 14:58:53,36.1589,-115.3321,Las Vegas,NV,10899, W Charleston Blvd,Between Canyon Pointe and Durango Dr - Accident.
3,2020-11-27 14:52:30,39.5045,-119.781,Reno,NV,,Martin Luther King Jr Memorial Fwy,Accident on I-580 Northbound at I-580 Exit 33A / Plumb Ln.
2,2016-07-20 12:03:37,36.181,-115.2062,Las Vegas,NV,903, N Decatur Blvd,At Minnesota St - Accident.
2,2017-09-12 16:50:27,39.504,-118.9125,Fallon,NV,8002, Reno Hwy,At Jasper Rd - Accident.
3,2018-09-02 14:32:13,38.5493,-118.6539,Hawthorne,NV,1476, US Highway 95,At Thorne Rd - Accident.
2,2019-08-06 05:25:09,39.2512,-114.8809,Ely,NV,1698,Aultman St,Accident on US-50 Southbound near Ely Ave.
3,2018-08-08 17:41:59,39.5351,-119.7892,Reno,NV,,Martin Luther King Jr Memorial Fwy,Accident on entry ramp to US-395 Southbound at Exit 15 from I-80 Eastbound.
3,2017-10-04 18:40:47,39.5334,-119.7385,Sparks,NV,,I-80 W,Accident on I-80 Westbound at Exit 19 NV-650 McCarran Blvd.
2,2016-08-19 09:48:40,36.0711,-115.1723,Las Vegas,NV,,Las Vegas Blvd S,At Las Vegas Blvd - Accident.
2,2020-08-11 15:18:09,40.8355,-115.7885,Elko,NV,2175,Mountain City Hwy,Accident on I-80 Westbound between Exit 303 I-80-BL and Exit 301 NV-225.
2,2020-04-03 17:46:41,39.5364,-119.7867,Reno,NV,545,Depaoli St,Accident on I-580 at I-80 Exit 15 /.
2,2019-03-21 11:09:32,39.1112,-119.7736,Carson City,NV,,US Highway 395 S,Accident on US-395 Northbound at Topsy Ln.
2,2018-04-12 04:04:06,39.5372,-119.788,Reno,NV,,I-80 E,Accident on US-395 Martin Luther King Jr Memorial Fwy Southbound at Exit 68 I-80.
2,2017-05-12 16:34:18,36.143,-115.172,Las Vegas,NV,,I-15 N,At Sahara Ave/Exit 40 - Accident.
2,2019-10-01 09:40:36,37.3653,-115.1598,Alamo,NV,159,US Highway 93,Accident on US-93 Southbound at Lamb Blvd.
2,2017-10-20 20:11:48,39.5319,-119.4825,Sparks,NV,2235,USA Pkwy,Accident on USA Pkwy at Germany Cir.
2,2016-11-14 16:27:43,36.1002,-115.084,Las Vegas,NV,,E Tropicana Ave,At I-515 - Accident.
3,2017-11-03 04:17:34,41.0776,-114.5697,Wells,NV,,US-93 Alt S,Accident on I-80 Eastbound between Exit 365 Independence Vly and Exit 373.
2,2017-01-12 15:02:37,36.1798,-115.2448,Las Vegas,NV,,US-95 S,Ramp to Summerlin Pky/Exit 81 - Accident.
2,2017-05-30 14:44:39,36.1303,-115.0891,Las Vegas,NV,,US-93 N,Between Boulder Hwy/Exit 70 and Charleston Blvd/Exit 72 - Accident.
3,2019-10-13 13:28:01,39.2054,-119.7887,Carson City,NV,,I-580 S,Accident on I-580 Southbound at Exit 43 US-395-BR Carson St.
2,2019-06-12 14:49:40,38.9543,-119.1913,Yerington,NV,298,State Route 339,Accident on NV-339 at Mason Rd.
4,2016-11-27 02:12:44,39.4978,-119.9981,Verdi,NV,,I-80 W,Closed between Exit 1 and Nevada/California State Line - Road closed due to accident.
2,2020-12-22 03:10:25,39.041,-119.9476,Glenbrook,NV,1320, US Highway 50,Incident on US-50 WB near CAVE ROCK Road closed. Take alternate route.
2,2017-10-24 10:28:22,39.5613,-119.7517,Sparks,NV,3430,Pyramid Way,Accident on Farr Ln both ways at NV-445 Pyramid Way.
3,2019-05-29 06:57:44,39.1207,-119.7716,Carson City,NV,,I-580 N,Accident on I-580 Northbound at US-395. No recent updates.
2,2016-11-22 09:48:22,36.2397,-115.2604,Las Vegas,NV,4362, N Buffalo Dr,At Craig Rd - Accident.
3,2016-07-23 07:07:58,36.1552,-115.1612,Las Vegas,NV,,I-15 N,At Charleston Blvd/Exit 41 - Accident.
3,2018-09-20 07:51:36,39.3958,-119.7586,Reno,NV,,I-580 S,Accident on I-580 Martin Luther King Jr Memorial Fwy Southbound after Exit 56 NV-431 Mount Rose Hwy.
3,2019-05-08 08:44:00,39.7457,-117.1502,Austin,NV,,NV-305,At US-50 - Accident. Lane blocked.
2,2020-10-25 07:00:28,39.2134,-119.8065,Washoe Valley,NV,,I-580 N,Accident on I-580 Southbound at Exit 10 Eastlake Blvd.
3,2020-09-18 16:15:03,39.5366,-119.8027,Reno,NV,,I-80 E,Accident on I-80 Eastbound at Exit 14 Wells Ave.
2,2017-11-17 18:20:12,39.2683,-119.5746,Dayton,NV,3058,US Highway 50 E,Accident on US-50 at Fortune Dr.
2,2019-02-15 04:21:20,39.4805,-119.7888,Reno,NV,,Martin Luther King Jr Memorial Fwy,Accident on I-580 Southbound at Exit 63 US-395-BR Virginia St.
3,2020-09-02 15:30:51,39.5282,-119.7841,Reno,NV,,Martin Luther King Jr Memorial Fwy,Left lane blocked due to accident on I-580 Southbound at Glendale Ave.
3,2019-05-08 08:44:00,39.7163,-117.1691,Austin,NV,,NV-305,At Lovelock - Accident. Lane blocked.
3,2019-02-27 17:38:32,39.5339,-119.7665,Sparks,NV,,I-80 E,Accident on I-80 Eastbound at Exit 17 Rock Blvd.
2,2017-12-19 12:28:20,39.5365,-119.7972,Reno,NV,,I-80 E,At US-395/Exit 15 - Accident.
2,2017-10-24 07:41:32,39.6252,-119.91,Reno,NV,,Martin Luther King Jr Memorial Fwy,Accident on exit ramp from US-395 Westbound to Red Rock Rd.
2,2016-09-11 22:18:06,36.1262,-115.1819,Las Vegas,NV,2993, Spring Mountain Rd,At Spring Mountain Rd/Desert Inn Rd - Accident.
4,2017-04-14 15:37:21,39.6314,-119.7174,Sparks,NV,8852, Pyramid Way,Closed at Sparks - Road closed due to accident.
2,2018-05-01 15:37:57,39.5739,-119.8086,Reno,NV,,E Parr Blvd,Accident on US-395 Martin Luther King Jr Memorial Fwy Southbound at Exit 71 Parr Blvd.
2,2020-10-18 22:50:44,39.5251,-119.6961,Sparks,NV,,Interstate 80 E,Incident on I-80 WB near VISTA BLVD Expect delays.
2,2016-08-23 10:17:12,36.1591,-115.2239,Las Vegas,NV,6099, W Charleston Blvd,At Upland Blvd - Accident.
4,2016-11-07 05:28:45,39.6273,-119.1951,Fernley,NV,,US-95 Alt N,Closed at Nightingale Rd/Exit 65 - Road closed due to accident.
2,2016-11-10 12:54:51,36.1716,-115.1328,Las Vegas,NV,,US-93 N,At Las Vegas Blvd/Exit 75 - Accident.
2,2020-05-14 07:12:20,40.8395,-115.8,Elko,NV,3002,Mountain City Hwy,Accident on NV-225 Northbound at Jennings Way.
2,2017-11-30 13:14:38,40.6577,-116.2656,Crescent Valley,NV,,I-80 E,At NF-409/Exit 271 - Accident. Roadway reduced to 1 lane.
2,2016-08-08 07:42:00,36.1755,-115.145,Las Vegas,NV,,US-95 S,At Casino Center Blvd/Exit 75 - Accident.
3,2016-07-02 15:22:43,41.0975,-115.1164,Wells,NV,,I-80 E,Between NV-230/Exit 343 and 6th St/Exit 348 - Accident.
2,2019-08-01 17:09:32,40.6586,-116.2619,Crescent Valley,NV,,I-80 E,Accident on I-80 Eastbound at Exit 271 Nf-409.
2,2016-12-09 10:14:08,36.1667,-115.1552,Las Vegas,NV,,W Bonneville Ave,At S Grand Central Pky - Accident.
2,2020-09-01 07:50:37,39.6162,-119.7284,Sparks,NV,7879,Pyramid Way,Accident on NV-445 Pyramid Way Southbound at Lazy 5 Pkwy.
2,2019-09-06 16:52:50,38.9273,-119.7293,Gardnerville,NV,,Industrial Way,Queueing traffic due to accident on US-395 Main St Northbound at Industrial Way.
3,2019-10-30 16:08:23,39.5286,-119.7209,Sparks,NV,,Interstate 80 E,At Sparks Blvd/Exit 20 - Accident.
2,2019-01-16 16:38:09,39.001,-119.7797,Minden,NV,2308,US Highway 395 N,Accident on US-395 Northbound at NV-759 Airport Rd.
2,2016-07-25 16:33:45,36.1155,-115.19,Las Vegas,NV,,S Valley View Blvd,At Palms Winner Way - Accident.
2,2019-10-29 12:36:53,40.2129,-118.4178,Lovelock,NV,511, Frontage Rd,At I-80-BL/Exit 107 - Accident. Right lane blocked.
2,2018-08-20 10:10:05,39.5339,-119.7713,Sparks,NV,,I-80 E,At Rock Blvd/Nugget Ave/Exit 17 - Accident.
2,2017-07-17 22:54:01,39.5234,-119.7835,Reno,NV,,Martin Luther King Jr Memorial Fwy,At Glendale Ave/Exit 67 - Accident.
2,2019-08-19 04:15:19,39.2626,-119.9306,Incline Village,NV,,Mount Rose Hwy,Accident on NV-431 Mt Rose Hwy Southbound at Fairview Blvd.
2,2019-03-29 15:20:19,40.7796,-115.6546,Spring Creek,NV,,Tres Cartes Ave,Accident on NV-227 Lamoille Hwy both ways at Trescartes Ave.
3,2019-03-29 18:00:57,39.483,-119.994,Verdi,NV,,I-80 E,Left lane closed due to accident on I-80 Eastbound at mile marker 1.
3,2016-12-02 23:01:52,36.1326,-115.1802,Las Vegas,NV,,I-15 S,At Spring Mountain Rd/Exit 39 - Accident.
2,2017-11-02 13:50:52,39.1888,-119.7038,Carson City,NV,3298,N Deer Run Rd,Left lane closed due to accident on US-50 Eastbound at NV-513 Deer Run Rd.
2,2019-02-27 13:45:29,35.1721,-114.5725,Laughlin,NV,1264,S Casino Dr,Accident on NV-163 Westbound before Casino Dr.
2,2020-10-01 22:50:57,39.0037,-119.9476,Zephyr Cove,NV,737, US Highway 50,Incident on US-50 near LAKEVIEW Expect delays.
2,2016-10-18 15:45:45,36.0806,-115.0445,Henderson,NV,,US-93 N,At Russell Rd/Exit 65 - Accident.
2,2020-09-02 14:42:04,39.5364,-119.7867,Reno,NV,545,Depaoli St,Accident on I-580 at Exit 68A I-80 Exit 15.
2,2018-12-14 14:49:16,39.248,-114.8715,Ely,NV,700,Avenue M,Accident on US-50 Great Basin Blvd at Avenue M.
2,2020-06-17 18:04:46,40.8938,-115.8821,Elko,NV,6376,Sagecrest Dr,Accident on NV-225 Southbound near El Ranchero Dr.
2,2020-03-20 17:36:56,39.5108,-119.6576,Sparks,NV,,Interstate 80 E,Between Canyon Rd/Exit 22 and Vista Blvd/Greg St/Exit 21 - Accident.
2,2019-03-07 06:52:31,39.338,-119.8728,Reno,NV,20990, Mount Rose Hwy,At Sky Tavern Rd - Accident.
2,2016-07-20 08:29:35,36.1682,-115.159,Las Vegas,NV,,I-15 N,At I-515/US-95/Exit 42 - Accident.
2,2017-11-07 17:10:54,38.5502,-118.472,Hawthorne,NV,,Garfield Flats Rd,Accident on US-95 Southbound near Garfield Flats Rd.
2,2016-06-29 08:16:02,36.1437,-115.1572,Las Vegas,NV,2499, Las Vegas Blvd S,At Paradise Rd - Accident.
3,2020-12-24 12:33:20,39.4928,-119.7846,Reno,NV,,E Moana Ln,Accident on I-580 Southbound at Exit 32 Moana Ln.
2,2019-11-27 04:28:46,39.5996,-119.8373,Reno,NV,,Martin Luther King Jr Memorial Fwy,Accident on US-395 Northbound at Exit 73 Golden Valley Rd.
2,2020-07-15 15:59:41,39.5565,-119.7522,Sparks,NV,,Pyramid Way,Accident on NV-659 Mccarran Blvd Westbound at NV-445 Pyramid Way.
4,2019-07-05 16:04:53,39.4769,-119.7895,Reno,NV,,S McCarran Blvd,Between US-395-BR/S Virginia St and NV-659/S McCarran Blvd - Accident. Turning lane closed.
3,2017-12-20 15:57:58,40.6527,-116.3886,Crescent Valley,NV,,I-80 W,Lane blocked due to accident on I-80 Westbound at mm 263.
3,2017-06-30 10:12:59,39.5365,-119.7983,Reno,NV,,I-80 E,At before US-395/Exit 15 - Accident.
2,2019-11-16 08:24:13,39.4162,-119.225,Silver Springs,NV,2099,US Highway 95A N,Accident on US-50 Westbound at US-50-ALT.
2,2019-10-07 15:36:59,39.3915,-119.7831,Reno,NV,3700,Mount Rose Hwy,Accident on NV-431 Mt Rose Hwy at Edmonton Dr.
3,2018-09-07 10:55:16,39.4498,-119.7761,Reno,NV,,Martin Luther King Jr Memorial Fwy,Accident on I-580 Martin Luther King Jr Memorial Fwy Southbound at Exit 61 Virginia St.
2,2020-06-30 21:23:06,39.1019,-119.7748,Carson City,NV,,Jacks Valley Rd,Accident on US-395 at Jacks Valley Rd.
2,2016-11-09 07:16:34,36.2122,-115.2462,Las Vegas,NV,,US-95 S,At Lake Mead Blvd/Exit 82 - Accident.
2,2017-07-25 00:12:01,36.0863,-115.1242,Las Vegas,NV,,S Surrey St,At S Eastern Ave - Accident.
2,2020-11-16 08:13:14,39.534,-119.7532,Sparks,NV,,I-80 W,Accident on I-80 Eastbound at Exit 18 NV-445 Pyramid Way.
3,2019-01-04 16:07:03,39.1209,-119.7717,Carson City,NV,,I-580 S,Accident on I-580 Southbound at US-50.
2,2016-08-04 12:47:31,36.196,-115.2517,Las Vegas,NV,7301, W Lake Mead Blvd,At Lake Mead Blvd/Exit 82 - Accident.
3,2017-07-21 07:36:46,35.9538,-115.1819,Sloan,NV,,I-15 N,At NV-146/Exit 27 - Accident.
2,2020-12-03 17:40:59,39.5275,-119.7398,Sparks,NV,,E Glendale Ave,Accident on NV-659 Mccarran Blvd at NV-648 Glendale Ave.
