Severity,Date/Time,Latitude,Longitude,City,State,Number,Street,Description
2,2020-12-03 02:09:48,32.1292,-106.6408,Vado,NM,,US-180 W,Incident on I-10 WB near MM 155 Road closed. Take alternate route.
3,2019-11-20 09:10:13,35.0805,-106.6375,Albuquerque,NM,,I-25 S,Right lane closed and right hand shoulder closed due to accident on I-25 Southbound at Exits 224A 224B Oak St.
2,2018-04-23 14:16:55,35.116,-106.6152,Albuquerque,NM,2600,Candelaria Rd NE,Accident on Candelaria Rd at Vassar Dr.
3,2018-02-08 14:03:51,35.1533,-106.5885,Albuquerque,NM,,I-25 N,2 right lane blocked due to accident on I-25 Northbound around Exit 230 Osuna Rd.
4,2020-10-17 06:34:21,35.0173,-106.6391,Albuquerque,NM,,I-25 N,Incident on I-25 NB near MM 220 Road closed. Take alternate route.
3,2017-08-15 15:08:21,35.089,-106.5473,Albuquerque,NM,,Coronado Fwy W,At Wyoming Blvd/Exit 164 - Accident.
2,2018-01-30 14:45:41,35.1292,-106.6397,Albuquerque,NM,,2nd St NW,Accident on NM-47 2nd St at Griegos Rd.
2,2019-01-06 12:00:54,35.1413,-106.5956,Albuquerque,NM,,I-25 N,Accident on Jefferson St at I-25.
3,2019-02-27 14:45:03,35.0914,-106.6345,Albuquerque,NM,,Lomas Blvd NE,Accident on I-25 Northbound at Lomas Blvd.
3,2018-08-23 18:58:36,35.0475,-106.6377,Albuquerque,NM,,Sunport Blvd SE,Accident on I-25 Southbound at Exit 221 Sunport Blvd.
2,2018-03-30 19:23:58,35.1386,-106.6412,Albuquerque,NM,400,Montano Rd NW,Accident on NM-556 4th St at Montano Rd.
2,2020-01-21 10:17:59,35.1599,-106.5873,Albuquerque,NM,,I-25 S,Right hand shoulder blocked and right lane blocked due to accident on I-25 Northbound at San Antonio Dr.
3,2020-12-26 12:26:37,35.0976,-106.569,Albuquerque,NM,,Louisiana Blvd NE,Accident on I-40 Westbound at Exit 162 Louisiana Blvd.
3,2018-08-02 11:46:55,35.1329,-106.6098,Albuquerque,NM,,US-85 S,Queueing traffic and roadway reduced from four lanes to one lane due to accident on I-25 Northbound at Exit 228 Pan American West Fwy.
2,2017-05-12 14:32:01,35.0979,-106.6313,Albuquerque,NM,,Odelia Rd NE,At I-25/Route 66 - Accident.
3,2019-10-11 13:25:11,35.5831,-105.7677,Glorieta,NM,,I-25 N,2 right lane blocked due to accident on I-25 Southbound at Exit 299 NM-50.
2,2018-06-07 15:58:30,35.0772,-106.7228,Albuquerque,NM,,Unser Blvd,Accident on Central Ave at NM-345 Unser Blvd.
2,2018-01-10 10:24:40,32.2392,-107.4216,Deming,NM,,US-180 E,At CR-B049/Gerano Rd/Exit 102 - Accident. Right lane blocked.
2,2020-11-05 22:32:30,32.2555,-107.8805,Deming,NM,,I-10 E,Stationary traffic on I-10 from NM-418/Exit 86 (I-10) to I-10 Bus/Exit 81 (I-10) due to accident.
2,2019-05-27 10:31:28,35.109,-106.5705,Albuquerque,NM,6648,Menaul Blvd NE,Accident on Menaul Blvd at Coronado Ctr.
3,2018-08-13 04:04:26,35.0036,-104.5228,Cuervo,NM,,Historic US 66 E,One lane blocked due to accident on I-40 Eastbound after Exit 284.
2,2018-08-23 10:05:07,35.0498,-106.6308,Albuquerque,NM,,University Blvd SE,Accident on University Blvd at Woodward Rd.
2,2018-02-13 15:56:52,35.1015,-106.5154,Albuquerque,NM,1799,Juan Tabo Blvd NE,Accident on Juan Tabo Blvd at Indian School Rd.
3,2018-11-03 14:48:39,35.0826,-106.6367,Albuquerque,NM,,Central Ave SE,Accident on I-25 Southbound near Exits 224A 224B Central Ave.
2,2018-05-01 14:05:01,35.1142,-106.625,Albuquerque,NM,,Candelaria Rd NE,Accident on Pan American Fwy at Candelaria Rd.
3,2019-01-23 14:54:50,35.1052,-106.671,Albuquerque,NM,,Rio Grande Blvd NW,Left lane blocked due to accident on I-40 Eastbound at Exit 157A NM-194 Rio Grande Blvd.
2,2020-11-25 10:53:56,35.0585,-106.622,Albuquerque,NM,,Gibson Blvd SE,Accident on Yale Blvd at Gibson Blvd.
2,2018-05-11 16:04:16,35.0909,-106.5687,Albuquerque,NM,7099,Mountain Rd NE,Accident on Mountain Rd at Louisiana Blvd.
3,2018-06-12 09:25:28,34.1252,-105.6871,Corona,NM,,County Road A035,Restrictions due to accident on US-54 both ways between Elda Rd and County Road A035.
4,2020-06-03 10:26:35,35.0371,-106.7122,Albuquerque,NM,2783, Coors Blvd SW,Closed at Blake Rd SW - Road closed due to accident.
2,2020-12-03 01:51:30,32.1004,-106.6256,Vado,NM,,I-10 W,Stationary traffic on US-85 N - I-10 W - US-180 W from NM-404/Exit 162 (I-10) to NM-228/Exit 151 (I-10) due to accident.
4,2017-07-18 15:08:12,35.7115,-105.9398,Santa Fe,NM,,Taos Hwy,Closed at NM-599/Veterans Memorial Hwy - Road closed due to accident.
1,2020-04-10 07:11:22,35.0251,-106.6465,Albuquerque,NM,3874, Broadway Blvd SE,At NM-47/Broadway Blvd SE - Accident.
4,2020-11-13 02:47:57.000000000,36.197,-105.8863,Dixon,NM,219, State Road 75,Incident on NM-75 EB near MM 2 Road closed. Take alternate route.
2,2019-04-15 07:55:07,35.0759,-106.5686,Albuquerque,NM,,Louisiana Blvd NE,Accident on Central Ave at Louisiana Blvd.
3,2020-08-15 14:41:14,35.0058,-105.5219,Moriarty,NM,,Historic US 66 E,Right lane closed due to accident on I-40 Eastbound at Exit 226.
2,2018-03-13 09:14:25,35.1353,-106.6195,Albuquerque,NM,,Montano Rd NE,Accident on Montano Rd at Renaissance Blvd.
2,2020-10-23 10:59:10,35.0727,-106.5686,Albuquerque,NM,396,Louisiana Blvd SE,Accident on Louisiana Blvd at Zuni Rd.
4,2018-10-13 17:47:22,32.3454,-103.9274,Loving,NM,,NM-128,Closed at NM-31 - Road closed due to accident.
2,2018-10-18 16:57:14,35.0834,-106.6422,Albuquerque,NM,100,Edith Blvd SE,Accident on Central Ave at Edith Blvd.
4,2017-04-18 22:13:59,35.0727,-106.573,Albuquerque,NM,6703, Zuni Rd SE,Closed at Florida St SE - Road closed due to accident.
3,2017-06-21 12:04:20,35.1802,-106.5826,Albuquerque,NM,,US-85 S,At NM-423/Paseo Del Norte/Exit 232 - Accident.
2,2019-04-03 12:15:37,35.106,-106.6086,Albuquerque,NM,,Coronado Fwy E,At Carlisle Blvd/Exit 160 - Accident. Left lane blocked.
2,2020-08-13 21:29:27,35.0784,-106.6274,Albuquerque,NM,1799,Lead Ave SE,Accident on Lead Ave at University Blvd.
3,2018-05-02 16:42:10,35.0698,-106.6395,Albuquerque,NM,,I-25 N,Left lane blocked due to accident on I-25 Southbound at Exit 223 Avenida Cesar Chavez.
3,2019-11-01 16:59:42,35.1052,-106.605,Albuquerque,NM,,Coronado Fwy W,Lane blocked due to accident on I-40 Westbound at Exit 160 Carlisle Blvd.
2,2020-10-24 18:20:00,35.0695,-104.2296,Cuervo,NM,,I-40 E,Stationary traffic on I-40 from NM-129/Exit 300 (I-40) to Historic US-66/Exit 311 (I-40) due to accident.
2,2017-11-02 17:23:32,35.0252,-106.7312,Albuquerque,NM,,Unser Blvd SW,Accident on Unser Blvd at Dennis Chavez Blvd.
2,2017-04-17 10:11:45,35.1049,-106.6754,Albuquerque,NM,,Coronado Fwy E,At Rio Grande Blvd/Exit 157 - Accident.
3,2018-03-07 07:33:00,35.1052,-106.6708,Albuquerque,NM,,Coronado Fwy W,Accident on I-40 Eastbound at Exit 157A Rio Grande Blvd.
2,2017-08-28 07:58:13,35.1862,-106.6626,Albuquerque,NM,,Irving Rd NW,Delays due to accident on NM-448 Coors Blvd Southbound at Irving Blvd. No recent updates.
4,2019-04-05 13:15:45,32.3422,-104.002,Loving,NM,,NM-31,Closed between NM-31 and Carlsbad - Road closed due to accident.
2,2017-11-08 08:03:17,35.2058,-106.6752,Albuquerque,NM,,McMahon Blvd NW,Accident on Golf Course Rd at McMahon Blvd.
3,2017-12-28 14:35:49,35.1533,-106.5885,Albuquerque,NM,,I-25 N,Right lane blocked due to accident on I-25 Southbound at San Mateo Blvd.
2,2020-11-24 20:28:06,34.9909,-107.2201,Laguna,NM,,Historic US 66 W,Incident on I-40 WB near MM 120 Left lane blocked.
2,2020-11-14 19:14:57,35.5498,-106.7785,San Ysidro,NM,23187, Highway 44,Incident on US-550 SB near MM 22 Road closed. Take alternate route.
2,2017-09-25 15:04:38,32.3481,-106.7698,Las Cruces,NM,,US-70 W,Right lane blocked due to accident on US-70 Westbound before I-25.
3,2018-03-01 08:27:21,35.0766,-106.515,Albuquerque,NM,,Coronado Fwy W,Accident on I-40 Eastbound at Exit 166 Juan Tabo Blvd.
2,2019-01-18 06:54:44,35.1738,-106.5887,Albuquerque,NM,7981,Headline Blvd NE,Accident on I-25 Northbound at Exit 232 NM-423 Paseo Del Norte.
3,2017-09-17 16:49:50,34.9881,-105.2215,Vaughn,NM,,Historic US 66 W,Accident on I-40 Westbound at Exit 243 Mesa de Leon Rd.
2,2020-12-17 14:11:33,34.3902,-103.0799,Clovis,NM,338, US 60 70 84,Construction on US-60 near MM 395 Expect delays.
3,2018-10-04 11:13:53,35.0309,-104.41,Cuervo,NM,,Historic US 66 E,Lane blocked due to accident on I-40 Eastbound at Exit 291 County Road 2.
2,2016-10-24 09:16:15,35.1302,-106.6137,Albuquerque,NM,,I-25 N,At Montano/Montgomery/Exit 228 - Accident.
3,2019-08-28 13:54:34,35.2061,-106.5767,Albuquerque,NM,,I-25 S,Left lane closed due to accident on I-25 Northbound at Exit 234 NM-556 Tramway Blvd.
2,2019-04-08 07:22:45,35.1055,-106.5864,Albuquerque,NM,2397,San Mateo Pl NE,Accident on San Mateo Pl at Cutler Ave.
2,2019-04-14 11:04:01,35.1307,-106.5157,Albuquerque,NM,4365,Juan Tabo Blvd NE,Accident on Montgomery Blvd at Juan Tabo Blvd.
3,2017-12-17 13:52:09,32.2592,-106.7308,Las Cruces,NM,,US-85 S,Left lane closed due to accident on I-10 Eastbound at Exit 144 I-25.
2,2016-10-25 06:53:48,35.0852,-106.6359,Albuquerque,NM,,Dr Martin Luther King Jr Ave NE,Between I-25 and Walter St NE - Accident.
3,2017-09-02 14:02:41,35.083,-106.5314,Albuquerque,NM,,Coronado Fwy W,Accident on I-40 Westbound at Exit 165 Eubank Blvd.
4,2019-02-17 18:47:45,34.2447,-105.5953,Corona,NM,202, Main St,Closed at Cr-a027 - Road closed due to accident.
2,2020-12-08 20:50:47,35.1788,-106.6256,Albuquerque,NM,,Paseo del Norte W,Incident on NM-423 WB near MM 2 Right lane blocked. Expect delays.
2,2020-09-24 08:33:20,35.0871,-106.7281,Albuquerque,NM,747,Unser Blvd NW,Accident on NM-345 Unser Blvd at Los Volcanes Rd.
2,2018-04-28 11:06:37,35.0473,-106.5058,Albuquerque,NM,1099,Wagon Train Dr SE,Accident on Wagon Train Dr both ways at Santa Ana Ave.
2,2019-02-21 08:05:59,35.0819,-106.6546,Albuquerque,NM,404,6th St SW,Accident on 6th St at Lead Ave.
3,2019-09-18 16:01:38,35.0481,-106.6377,Albuquerque,NM,,I-25 N,Accident on I-25 Northbound at Exit 221 Sunport Blvd.
3,2019-06-05 15:13:58,35.0695,-106.497,Albuquerque,NM,,Coronado Fwy E,Left lane blocked and left hand shoulder blocked due to accident on I-40 Eastbound at Exit 167 NM-556 Tramway Blvd.
2,2019-06-26 10:26:37,35.1062,-106.6577,Albuquerque,NM,,Coronado Fwy E,At 6th St/Exit 158 - Accident. Right lane blocked.
2,2020-08-13 17:08:06,35.2167,-106.7016,Albuquerque,NM,11017,Dreamy Way Dr NW,Accident on Dreamy Way Dr at Night Rose Ave.
2,2020-12-22 17:23:01,35.1062,-106.6573,Albuquerque,NM,,Coronado Fwy E,Incident on I-40 EB near MM 158 Right lane blocked. Expect delays.
3,2019-08-16 08:12:51,35.1063,-106.6602,Albuquerque,NM,,Coronado Fwy W,Gore point obstructed due to accident on I-40 Eastbound at Exit 157B 12th St.
2,2018-09-28 16:03:04,35.1092,-106.5992,Albuquerque,NM,2599,Morningside Dr NE,Accident on Menaul Blvd at Morningside Dr.
2,2020-10-22 21:43:44,35.1488,-106.5269,Albuquerque,NM,,Eubank Blvd NE,Accident on Eubank Blvd at Juan Tabo Blvd.
3,2018-02-23 08:57:11,35.0904,-106.5508,Albuquerque,NM,,Wyoming Blvd NE,2 left lane blocked due to accident on I-40 Eastbound at Exit 164 Wyoming Blvd.
1,2020-06-04 15:06:09,35.104,-106.7311,Albuquerque,NM,7946, Ladera Dr NW,At NM-345/Unser Blvd - Accident.
4,2018-05-05 01:10:06,34.811,-106.7624,Los Lunas,NM,,I-25 N,Closed between NM-6/Exit 203 and NM-317/Exit 209 - Road closed due to accident.
2,2019-03-08 08:18:33,35.4798,-108.4339,Continental Divide,NM,,Historic US 66 W,At Exit 39 - Accident.
3,2019-10-02 22:05:43,35.0695,-106.6395,Albuquerque,NM,,I-25 S,2-right lane blocked due to accident on I-25 Northbound at Exit 223 Avenida Cesar Chavez.
2,2018-04-11 13:45:39,35.1386,-106.6412,Albuquerque,NM,400,Montano Rd NW,Accident on NM-556 4th St at Montano Rd.
3,2017-12-12 16:01:20,35.1416,-106.595,Albuquerque,NM,5199,Jefferson St NE,Center lane blocked due to accident on I-25 Northbound at Exit 229 Jefferson St.
2,2020-11-06 19:44:03,35.1216,-106.604,Albuquerque,NM,3554,Cherokee Rd NE,Accident on Carlisle Blvd at Cherokee Rd.
3,2018-01-25 09:57:07,35.1054,-106.6307,Albuquerque,NM,,Coronado Fwy W,Accident on I-40 Westbound at Exits 159B-C 159C-B 159D I-25.
2,2019-04-05 14:50:37,35.0728,-106.5809,Albuquerque,NM,5887,Zuni Rd SE,Accident on Valencia Dr at Zuni Rd.
4,2017-04-15 22:43:14,33.8942,-105.8202,Carrizozo,NM,,County Road A015,Closed at Carrizozo - Road closed due to accident.
3,2016-10-01 05:01:54,35.6772,-105.9537,Santa Fe,NM,1001, S Saint Francis Dr,At NM-14/NM-510/Cerrillos Rd - Accident.
2,2020-05-13 05:09:37,35.0584,-106.6133,Albuquerque,NM,2905,Gibson Blvd SE,Accident on Gibson Blvd around Girard Blvd. No recent updates.
3,2018-05-14 17:00:17,32.2592,-106.7308,Las Cruces,NM,,US-85 S,Accident on I-10 Westbound at Exit 144 I-25.
2,2017-02-22 19:33:26,34.4049,-103.2625,Clovis,NM,1376, US 60 84,At Thunderbird St - Accident.
2,2018-04-27 16:23:13,35.0701,-106.5152,Albuquerque,NM,11899,Central Ave NE,Accident on Central Ave around Juan Tabo Blvd.
4,2019-06-23 19:05:55,33.1666,-104.4494,Dexter,NM,7311, SE Main St,Closed at NM-560/E Shawnee Rd - Road closed due to accident.
2,2020-07-31 19:01:39,35.1163,-106.5767,Albuquerque,NM,6300,Candelaria Rd NE,Accident on Candelaria Rd at Arizona Pl.
2,2020-01-22 19:47:36,35.1233,-106.5865,Albuquerque,NM,3599,San Mateo Blvd NE,Accident on Comanche Rd at San Mateo Blvd.
2,2020-10-30 00:05:10,34.9879,-107.1001,Laguna,NM,,Historic US 66 W,Incident on I-40 WB near MM 131 Expect delays.
2,2019-10-25 07:39:05,35.0633,-106.785,Albuquerque,NM,12663,Central Ave NW,Accident on Central Ave at Tierra West Dr.
2,2019-06-17 14:24:42,35.1073,-106.6196,Albuquerque,NM,,Coronado Fwy W,Ramp to I-25/Historic Route 66 - Accident. in the right lane.
2,2018-06-23 15:16:58,35.203,-106.6473,Albuquerque,NM,,Coors Blvd NW,Accident on NM-528 Alameda Blvd at NM-448 Coors Blvd.
3,2017-08-14 18:40:10,35.1055,-106.6452,Albuquerque,NM,,Coronado Fwy E,Accident on I 40 Frontage Rd at NM-314 2nd St.
3,2018-12-09 10:16:34,35.1052,-106.671,Albuquerque,NM,,Rio Grande Blvd NW,1 Left lane blocked due to accident on I-40 Eastbound at Exit 157A NM-194 Rio Grande Blvd.
3,2018-08-16 08:19:36,35.1056,-106.6292,Albuquerque,NM,,I-25 N,Delays expected and Two Center lane blocked due to accident on I-40 Eastbound near Pan American East Fwy.
2,2019-12-20 07:44:16,35.1062,-106.6587,Albuquerque,NM,,Coronado Fwy E,Left hand shoulder blocked due to accident on I-40 Eastbound after Exit 157B 12th St.
2,2019-03-14 14:28:41,35.7002,-105.9508,Santa Fe,NM,,N Saint Francis Dr,At NM-599/Veterans Memorial Hwy - Accident. Right lane blocked.
2,2019-03-20 12:44:15,35.1383,-106.6367,Albuquerque,NM,5601,2nd St NW,Accident on NM-47 2nd St at Montano Rd.
3,2017-08-18 07:35:13,35.0595,-106.6381,Albuquerque,NM,,I-25 N,Right lane closed due to accident on I-25 Southbound at Exits 222 222A 222B Gibson Blvd.
2,2019-02-22 07:27:56,35.1136,-106.512,Albuquerque,NM,11603,Lexington Ave NE,Accident on Lexington Ct at Lexington Ave.
2,2017-12-19 13:45:36,35.0984,-106.5199,Albuquerque,NM,11498,Mahlon Ave NE,Accident on Tomasita St at Mahlon Ave.
2,2018-10-31 16:55:12,35.1318,-106.6082,Albuquerque,NM,3204,Montgomery Blvd NE,Accident on Pan American Fwy at Montgomery Blvd.
4,2016-07-29 11:27:55,35.1323,-106.6103,Albuquerque,NM,,I-25 N,Closed between Montano/Montgomery/Exit 228 and Jefferson St/Exit 229 - Road closed due to accident.
2,2019-06-20 11:54:20,35.0783,-106.5913,Albuquerque,NM,101,Monroe St SE,Accident on Central Ave at Monroe St.
2,2020-02-07 20:06:42,35.0943,-106.7096,Albuquerque,NM,6051,Fortuna Rd NW,Accident on NM-448 Coors Blvd both ways at Fortuna Rd.
2,2017-08-29 08:21:31,35.067,-106.5163,Albuquerque,NM,,Juan Tabo Blvd SE,Accident on Juan Tabo Blvd at Southern Ave.
2,2020-12-02 18:23:00,35.0324,-107.3795,Casa Blanca,NM,,I-40 E,Stationary traffic on I-40 E from NM-23/Exit 108 (I-40) to NM-124/Exit 114 (I-40) due to accident.
2,2016-11-21 06:32:06,35.5137,-108.8061,Gallup,NM,,I-40 W,At I-40-BL/NM-118/Exit 16 - Accident.
2,2018-11-14 09:16:38,35.0801,-106.5323,Albuquerque,NM,499,Eubank Blvd NE,Accident on Eubank Blvd at Copper Ave.
2,2020-12-02 17:26:58,35.0344,-107.3754,Casa Blanca,NM,,I-40 E,Incident on I-40 EB near MM 114 Expect delays.
3,2017-03-23 10:06:01,35.082,-106.529,Albuquerque,NM,,Coronado Fwy W,At Eubank Blvd/Exit 165 - Accident.
2,2020-12-13 15:18:31,36.6238,-108.0164,Farmington,NM,4267, Highway 44,Incident on US-550 SB near MM 145 Right lane blocked. Expect delays.
4,2016-08-08 02:30:46,36.6412,-104.4998,Raton,NM,,I-25 N,Closed at CR-A9/Exit 435 - Road closed due to accident.
3,2017-03-25 18:40:32,34.9808,-105.074,Vaughn,NM,,Historic US 66 W,Between York Rd/Payne Rd/Russell Rd/Exit 252 and Encinosa Rd/Exit 239 - Accident.
2,2020-09-17 15:48:54,35.1004,-106.7071,Albuquerque,NM,,Hanover Rd NW,Accident on NM-448 Coors Blvd at Hanover Rd.
2,2020-04-21 16:43:23,35.0711,-106.5015,Albuquerque,NM,,Coronado Fwy E,At Tramway BL/Central Ave/Exit 167 - Accident. Two lanes blocked.
3,2018-09-15 13:01:14,35.0475,-106.6377,Albuquerque,NM,,Sunport Blvd SE,1 Right lane blocked due to accident on I-25 Southbound at Exit 221 Sunport Blvd.
4,2020-04-10 06:41:19,35.0251,-106.6465,Albuquerque,NM,3874, Broadway Blvd SE,Closed at NM-47/Broadway Blvd SE - Road closed due to accident.
2,2020-12-30 23:04:52,32.2764,-107.7097,Deming,NM,,I-10 E,Incident on I-10 EB near MM 101 Expect delays.
2,2020-10-19 08:05:18,35.0805,-106.6439,Albuquerque,NM,399,Lead Ave SE,Accident on Arno St at Lead Ave.
3,2019-12-05 17:50:27,35.1053,-106.6291,Albuquerque,NM,,I-25 N,Accident on I-25 Southbound at I-40 Exit 159B-C.
2,2017-11-14 17:07:54,35.0841,-106.6261,Albuquerque,NM,,Dr Martin Luther King Jr Ave NE,Accident bicyclist involved on University Blvd at Dr Martin Luther King Jr Ave.
2,2020-07-17 17:03:37,35.1184,-106.7016,Albuquerque,NM,3205,Coors Blvd NW,Accident on NM-448 Coors Blvd at Redlands Rd.
2,2016-08-08 10:12:54,35.5213,-106.1766,Santa Fe,NM,,US-85 S,At CR-57/Exit 267 - Accident.
2,2018-08-27 16:58:45,35.5267,-108.7661,Gallup,NM,,I-40 E,At US-666/Munoz Blvd/Exit 20 - Accident. Right lane closed.
1,2020-04-30 09:19:44,35.1062,-106.629,Albuquerque,NM,,I 40 Frontage Rd NE,At I-40/Exit 226 - Accident.
2,2020-01-16 19:10:43,35.5454,-106.1302,Santa Fe,NM,,I-25 N,At CR-50F/Exit 271 - Accident. Right lane blocked.
2,2020-12-20 04:39:30.000000000,34.9904,-107.0914,Laguna,NM,,Historic US 66 E,Stationary traffic on I-40 E - Historic US 66 E from Canoncito School Rd/Exit 131 (I-40) to Indian Service Rd/Exit 140 (I-40) due to accident.
2,2020-10-15 00:08:44,35.1788,-106.6256,Albuquerque,NM,,Paseo del Norte W,Incident on NM-423 WB near MM 1 Right lane blocked. Expect delays.
2,2017-09-01 09:57:00,35.0731,-106.5152,Albuquerque,NM,257,Juan Tabo Blvd NE,Accident on Juan Tabo Blvd Northbound at Hopi Rd.
3,2019-06-22 20:14:09,34.1022,-106.9006,Magdalena,NM,,I-25 S,Earlier accident on I-25 Northbound at Exit 152 The West Rd.
2,2019-02-09 21:20:32,35.6313,-105.9653,Santa Fe,NM,,I-25 N,At US-84/US-285/St Francis Dr/Exit 282 - Accident. Lane blocked.
3,2019-09-08 10:41:41,32.2606,-106.7307,Las Cruces,NM,,I-25 S,Accident on I-10 Eastbound at Exit 144 I-25.
2,2018-11-26 17:56:01,35.1019,-106.5866,Albuquerque,NM,2151,San Mateo Blvd NE,Accident on Indian School Rd at San Mateo Blvd.
2,2019-03-01 16:16:33,35.0856,-106.7164,Albuquerque,NM,6799,Bluewater Rd NW,Accident on Bluewater Rd at Airport Dr.
3,2017-10-19 13:31:13,35.0787,-106.6373,Albuquerque,NM,1000,Coal Ave SE,Right lane blocked due to accident on I-25 Northbound at Exit 224A Oak St.
2,2018-08-24 09:21:09,35.1066,-106.6493,Albuquerque,NM,,Coronado Fwy W,At 6th St/Exit 158 - Accident. Left lane closed.
2,2020-10-29 21:28:30,35.0106,-107.0288,Laguna,NM,,Historic US 66 W,Stationary traffic on I-40 from Indian Service Rd/Exit 140 (I-40) to Canoncito School Rd/Exit 131 (I-40) due to accident.
2,2020-10-18 00:14:30,35.0676,-107.5284,Casa Blanca,NM,,I-40 E,Stationary traffic on I-40 from Indian Service Rte 30/Exit 102 (I-40) to Indian Service Rte 491/Exit 117 (I-40) due to accident.
2,2018-05-19 10:20:08,35.1233,-106.5865,Albuquerque,NM,3594,San Mateo Blvd NE,Accident on Comanche Rd at San Mateo Blvd.
2,2018-02-02 17:21:49,35.075,-106.5603,Albuquerque,NM,7811,Central Ave NE,Accident on Central Ave at Dallas St.
3,2019-11-15 14:08:22,35.1052,-106.605,Albuquerque,NM,,Coronado Fwy W,3 right lane blocked and shoulder blocked due to accident on I-40 Westbound at Exit 160 Carlisle Blvd.
3,2019-10-28 08:54:16,35.1061,-106.6476,Albuquerque,NM,,4th St NW,Left lane blocked and left hand shoulder blocked due to accident on I-40 Eastbound at Exits 158 4th St.
4,2017-05-16 08:53:38,35.4515,-108.9517,Gallup,NM,,Historic US 66 W,Closed between NM-118/Exit 8 and Grants Rd/Exit 359 - Road closed due to accident.
3,2018-02-02 07:49:53,35.1238,-106.6217,Albuquerque,NM,,Comanche Rd NE,Left lane blocked due to accident on I-25 Southbound near Exit 227 Comanche Rd.
4,2020-06-19 15:07:06,34.988,-107.0996,Laguna,NM,,Historic US 66 W,Closed at NM-6/Exit 126 - Road closed due to accident.
4,2018-10-27 13:17:23,34.5946,-105.1815,Vaughn,NM,276, US Highway 54,Closed at US-54 (East) - Road closed due to accident.
2,2020-10-03 01:23:09.000000000,35.4722,-106.2995,Santo Domingo Pueblo,NM,,I-25 N,Incident on I-25 near MM 264 Right lane blocked. Expect delays.
2,2017-10-13 17:57:51,35.1307,-106.5245,Albuquerque,NM,10401,Montgomery Blvd NE,Accident on Montgomery Blvd at Morris St.
3,2019-05-16 17:52:07,35.1052,-106.6707,Albuquerque,NM,,Coronado Fwy W,Left lane blocked due to accident on I-40 Westbound at Exit 157A NM-194 Rio Grande Blvd.
3,2019-06-30 20:16:06,32.338,-108.6741,Lordsburg,NM,,I-10 E,Between Motel Dr/Exit 24 and NM-113/Exit 34 - Accident. Left lane blocked.
2,2020-04-17 08:19:19,35.0559,-106.6377,Albuquerque,NM,,I-25 N,At Gibson Blvd/Exit 222 - Accident.
2,2020-12-03 04:43:26,35.099,-106.5731,Albuquerque,NM,,Coronado Fwy E,Incident on I-40 near MM 163 Expect long delays.
3,2018-05-18 17:10:05,35.0236,-106.6381,Albuquerque,NM,,I-25 N,Accident on I-25 Southbound at Exit 220 NM-500 Rio Bravo Blvd.
3,2018-08-30 09:14:57,35.1056,-106.6292,Albuquerque,NM,,I-25 N,Right lane blocked due to accident on I-25 Southbound near I-40.
2,2018-02-14 13:29:32,35.1092,-106.5956,Albuquerque,NM,,Washington St NE,Accident on Menaul Blvd near Washington St.
2,2020-10-15 03:55:57,36.0089,-104.7107,Wagon Mound,NM,,I-25 N,Incident on I-25 NB near MM 388 Expect delays.
3,2020-11-15 18:05:17,35.1066,-106.3414,Tijeras,NM,,Access Rd,Right lane closed due to accident on I-40 Westbound at Exit 178 Salt Missions Trl.
2,2016-07-21 13:59:01,35.0841,-106.6365,Albuquerque,NM,,US-85 S,At Lead Ave/Exit 224 - Accident.
2,2017-10-16 09:18:35,35.1523,-106.4973,Albuquerque,NM,,Tramway Blvd NE,Accident on NM-556 Tramway Blvd at Academy Rd.
2,2020-10-16 05:14:52,36.8968,-106.5818,Chama,NM,1030, Terrace Ave,Incident on NM-17 NB near MM 1 Expect delays.
4,2020-02-05 15:27:27,35.1394,-106.599,Albuquerque,NM,,I-25 S,Right lane blocked due to accident on I-25 Northbound from Montgomery Blvd to Pan American West Fwy.
3,2019-04-02 08:09:44,35.0594,-106.6382,Albuquerque,NM,,I-25 N,Left lane blocked due to accident on I-25 Northbound at Gibson Blvd.
3,2020-06-19 10:55:14,34.988,-107.0996,Laguna,NM,,Historic US 66 W,At NM-6/Exit 126 - Accident.
2,2017-04-07 15:33:30,35.0429,-106.6378,Albuquerque,NM,,I-25 N,At Sunport Blvd/Exit 221 - Accident.
2,2020-08-17 07:34:07,35.1386,-106.5864,Albuquerque,NM,5199,McLeod Rd NE,Accident on San Mateo Blvd at Mcleod Rd. No recent updates.
3,2018-02-15 07:50:38,35.1051,-106.604,Albuquerque,NM,,Carlisle Blvd NE,Accident on I-40 Eastbound at Exit 160 Carlisle Blvd.
4,2018-07-15 10:53:58,35.3171,-106.5336,Placitas,NM,,I-25 N,Closed between NM-44/NM-165/Exit 242 and NM-474/Exit 248 - Road closed due to accident.
4,2017-06-29 11:12:16,34.984,-107.1764,Laguna,NM,,Historic US 66 E,Closed between NM-6/Exit 126 and Bernalillo/Cibola Countyline - Road closed due to accident.
2,2020-12-13 18:39:00,36.6409,-108.0066,Farmington,NM,3953, Highway 44,Stationary traffic on NM-44 - US-550 S from US-64/W Broadway Ave (NM-44/S Bloomfield Blvd/US-550) to Road 7150 (NM-44/US-550) due to accident.
2,2020-11-12 09:34:29,35.1009,-106.646,Albuquerque,NM,1698,2nd St NW,Accident on 2nd St near Aspen Ave.
2,2019-06-25 04:15:09,35.0582,-106.6043,Albuquerque,NM,3600,Gibson Blvd SE,Accident on Gibson Blvd at Carlisle Blvd. On the median. Involving a vehicle fire.
1,2020-06-19 16:55:46,35.1791,-106.627,Albuquerque,NM,,Paseo del Norte W,At NM-194/Rio Grande Blvd NW - Accident.
2,2017-09-08 19:18:47,35.1128,-106.5863,Albuquerque,NM,5198,Claremont Ave NE,Slow traffic due to accident and police incident on Claremont Ave at San Mateo Blvd.
3,2018-01-27 18:22:00,35.0698,-106.6395,Albuquerque,NM,,I-25 N,Two lanes blocked due to accident on I-25 Southbound at Exit 223 Avenida Cesar Chavez.
2,2019-11-05 06:31:41,35.0951,-106.6496,Albuquerque,NM,399,Mountain Rd NW,Accident on 4th St at Mountain Rd.
2,2018-11-03 11:11:21,35.1015,-106.5154,Albuquerque,NM,1799,Juan Tabo Blvd NE,Accident on Juan Tabo Blvd at Indian School Rd.
2,2020-10-27 05:15:26,35.4251,-108.3153,Continental Divide,NM,,Historic US 66 W,Incident on I-40 WB near MM 63 Expect delays.
2,2020-05-11 06:20:59,35.0975,-106.5685,Albuquerque,NM,,Coronado Fwy W,Accident on I-40 Westbound from Exit 164 Wyoming Blvd to Winrock Ctr. No recent updates.
2,2019-06-21 16:09:20,35.1019,-106.5663,Albuquerque,NM,,Indian School Rd NE,Accident on Uptown Loop near Indian School Rd.
3,2017-12-06 12:49:01,35.0944,-106.7299,Albuquerque,NM,,Unser Blvd NW,Accident on I-40 Westbound at Exit 154 NM-345 Unser Blvd.
4,2019-10-06 13:37:08,35.446,-108.363,Gallup,NM,,Historic US 66 E,Right lane blocked due to accident and earlier accident on I-40 Eastbound from Exit 39 Giant Xing to Exit 44.
3,2018-02-01 15:45:07,35.0236,-106.6381,Albuquerque,NM,,I-25 N,Right lane closed due to accident on I-25 Southbound at Exit 220 NM-500 Rio Bravo Blvd.
2,2017-04-26 14:02:01,35.0898,-106.6352,Albuquerque,NM,,US-85 S,At ML King Jr/Exit 224 - Accident.
2,2018-08-16 11:49:03,35.2058,-106.6752,Albuquerque,NM,,McMahon Blvd NW,Accident on Golf Course Rd at McMahon Blvd.
2,2018-05-18 09:34:59,35.1453,-106.498,Albuquerque,NM,,Tramway Blvd NE,Accident on Spain Rd near NM-556 Tramway Blvd.
