Severity,Date/Time,Latitude,Longitude,City,State,Number,Street,Description
3,2018-11-19 18:16:18,35.1057,-106.6285,Albuquerque,NM,,Coronado Fwy W,Left lane closed due to accident on I-40 Westbound at Exits 159B-C 159C-B 159D I-25.
4,2020-06-19 10:52:34,35.0315,-106.9495,Laguna,NM,,Historic US 66 W,Closed between Atrisco Vista Blvd/Exit 149 and Bernalillo/Cibola Countyline - Road closed due to accident.
4,2019-10-30 16:57:00,32.2754,-107.7171,Deming,NM,,US-180 E,Closed between I-10-BL/Motel Dr/Exit 85 and NM-549/Exit 116 - Road closed due to accident. Police activity ongoing. emergency vehicles at scene.
2,2018-02-13 13:28:51,35.1066,-106.6493,Albuquerque,NM,,Coronado Fwy W,At 6th St/Exit 158 - Accident.
2,2017-06-19 07:10:50,35.0789,-106.6375,Albuquerque,NM,,US-85 S,At Coal Ave/Exit 224 - Accident.
3,2019-06-18 21:58:11,35.1229,-106.6216,Albuquerque,NM,,Pan American Fwy NE,3-right lane blocked due to accident on I-25 Northbound at Exit 227 Pan American Fwy.
2,2017-09-14 14:11:47,35.0939,-106.6359,Albuquerque,NM,898,Mountain Rd NE,Accident on Mountain Rd at Woodward Pl.
2,2018-03-15 05:06:24,35.2178,-106.6965,Albuquerque,NM,5799,Black Arroyo Blvd,Accident on Black Arroyo Blvd both ways at Unser Blvd.
2,2017-09-22 06:51:32,35.1123,-106.658,Albuquerque,NM,2599,12th St NW,Accident on Menaul Blvd both ways at 12th St.
2,2018-02-09 07:17:51,35.0743,-106.5862,Albuquerque,NM,,San Mateo Blvd SE,Accident on Highland Ave at San Mateo Blvd.
2,2019-07-18 18:57:43,35.0355,-106.9319,Bosque Farms,NM,,Historic US 66 W,At Exit 140 - Accident. Left lane blocked.
2,2018-04-02 11:51:24,35.1061,-106.6661,Albuquerque,NM,,Coronado Fwy W,At Rio Grande Blvd/Exit 157 - Accident. Left lane blocked.
2,2020-12-19 23:34:09,35.0103,-107.0287,Laguna,NM,,Historic US 66 E,Incident on I-40 EB near MM 139 Road closed. Take alternate route.
3,2019-10-30 19:53:16,35.158,-106.5875,Albuquerque,NM,,I-25 N,At Ellison St/Exit 231 - Accident. Right lane blocked.
3,2020-06-16 05:49:25,35.1072,-106.7036,Albuquerque,NM,,Coronado Fwy W,Right and left lane blocked due to earlier accident on I-40 Westbound at Exit 155 NM-448 Coors Blvd.
2,2017-09-28 16:34:37,34.2154,-103.3001,Portales,NM,42634,US 70,Restrictions due to accident on US-70 between Roosevelt Rd and Roosevelt Road 3.
2,2020-12-11 09:43:20,35.1184,-106.7039,Albuquerque,NM,3011,Atrisco Dr NW,Accident on Atrisco Dr at Redlands Rd.
2,2020-10-21 17:00:12,35.0269,-106.6804,Albuquerque,NM,,Isleta Blvd SW,Accident on NM-500 Rio Bravo Blvd at NM-314 Isleta Blvd.
2,2019-03-13 17:14:23,36.0197,-108.6651,Shiprock,NM,,Indian Service Route 692,At BIA-9652 - Accident.
2,2020-09-18 18:44:02,35.1788,-106.6256,Albuquerque,NM,,Paseo del Norte W,Incident on NM-423 WB near MM 2 Left lane blocked.
2,2019-02-06 12:32:04,35.1091,-106.5394,Albuquerque,NM,9199,Menaul Blvd NE,Accident on Menaul Blvd at Northeastern Blvd.
4,2019-04-26 16:50:34,32.123,-103.1591,Jal,NM,142, E State Highway 128,Closed at Jal Airport Rd - Road closed due to accident.
4,2017-01-27 17:27:44,35.6653,-105.972,Santa Fe,NM,1804, Cerrillos Rd,Closed at Monterey Dr - Road closed due to accident.
3,2017-12-27 14:55:12,35.1056,-106.6292,Albuquerque,NM,,I-25 N,Accident on I-40 Westbound at I-25 .
3,2020-07-29 16:14:39,35.1053,-106.6291,Albuquerque,NM,,I-25 N,Left lane blocked due to accident on I-25 Southbound around Exit 226B-A I-40 Exit 159B-C.
2,2020-12-02 19:00:59,35.0631,-107.7069,Cubero,NM,,I-40 E,Incident on I-40 EB near MM 95 Expect delays.
2,2019-03-15 14:10:37,35.0777,-106.6222,Albuquerque,NM,2178,Lead Ave SE,Accident on Lead Ave at Yale Blvd.
3,2019-03-17 08:25:43,35.0065,-105.9146,Moriarty,NM,,Historic US 66 E,Left lane blocked due to accident on I-40 Eastbound near Exit 203.
3,2019-09-11 16:04:07,35.0948,-106.73,Albuquerque,NM,,Unser Blvd NW,Lane blocked due to accident on I-40 Westbound at Exit 154 NM-345 Unser Blvd.
2,2018-05-16 11:35:56,35.4109,-103.3618,Logan,NM,7901,Quay Road T,Lane blocked due to accident on US-54 Northbound at Quay Road T.
3,2019-06-06 16:45:02,32.3485,-106.7693,Las Cruces,NM,,US-70 W,Lane blocked due to #2 accident on I-25 Northbound at Exit 6 US-70.
3,2017-12-01 11:04:54,35.1529,-106.5886,Albuquerque,NM,,I-25 N,Right lane blocked due to accident on I-25 Northbound at Exit 230 Osuna Rd.
2,2020-07-15 15:01:59,35.0726,-106.7427,Albuquerque,NM,,98th St NW,Accident on 98th St at Central Ave.
3,2017-09-11 16:31:52,35.1052,-106.6708,Albuquerque,NM,,Coronado Fwy W,Accident on I-40 Westbound at Exit 157A Rio Grande Blvd.
2,2017-05-25 13:00:24,35.0728,-106.64,Albuquerque,NM,,US-85 S,At Ave Cesar Chavez/Exit 223 - Accident.
3,2020-08-17 14:53:43,35.1066,-106.6554,Albuquerque,NM,,Coronado Fwy E,Right lane closed due to accident on I-40 Eastbound at Exits 158 159A Indian School Rd.
2,2020-11-10 01:07:02,35.1745,-106.5863,Albuquerque,NM,,Paseo del Norte NE,Incident on NM-423 WB near MM 5 Left lane blocked.
4,2019-04-19 22:50:54,32.2988,-103.8053,Loving,NM,,NM-128,Closed at Eunice - Road closed due to accident. emergency vehicles at scene.
2,2018-12-13 14:15:11,35.0295,-106.7311,Albuquerque,NM,,Anderson Hill Ave SW,Accident on Unser Blvd at Anderson Hill Ave.
2,2018-11-18 12:49:31,35.1019,-106.5866,Albuquerque,NM,2151,San Mateo Blvd NE,Accident on San Mateo Blvd at Indian School Rd.
4,2016-11-04 04:52:15,34.4251,-106.5192,Socorro,NM,,Highway 60,Closed at Carrizozo - Road closed due to accident.
3,2020-12-07 05:39:26,35.1724,-106.5844,Albuquerque,NM,,I-25 S,One lane blocked due to accident on I-25 Southbound at Exit 232 Pan American East Fwy.
3,2018-11-08 18:03:46,35.4706,-106.304,Santo Domingo Pueblo,NM,,US-85 S,Accident on I-25 Northbound at Exit 259 NM-22.
2,2017-08-16 09:09:01,32.3511,-106.7662,Las Cruces,NM,,US-70 W,Right lane blocked due to accident on US-70 Westbound at I-25.
2,2017-03-27 07:35:18,35.0696,-106.6455,Albuquerque,NM,,Avenida Cesar Chavez SE,At NM-47/Broadway Blvd - Accident.
2,2020-09-10 14:48:00,34.9886,-107.2063,Laguna,NM,,Historic US 66 E,Slow traffic on I-40 from Indian Service Rte 491/Exit 117 (I-40) to NM-6/Exit 126 (I-40) due to accident.
4,2018-08-14 08:02:37,32.7976,-104.1686,Artesia,NM,,NM-360,Closed at Hagerman - Road closed due to accident.
2,2018-07-09 03:13:35,35.0998,-106.5741,Albuquerque,NM,,Coronado Fwy W,Between Louisiana Blvd/Exit 162 and San Mateo Blvd/Exit 161 - Accident.
2,2016-06-29 07:51:17,35.1043,-106.5993,Albuquerque,NM,,Coronado Fwy W,At Carlisle Blvd/Exit 160 - Accident.
4,2016-08-29 15:23:41,32.228,-108.0916,Deming,NM,,I-10 E,Closed between CR-D004/Exit 62 and NM-418/Exit 86 - Road closed due to accident.
4,2017-05-27 09:45:24,35.1049,-106.6754,Albuquerque,NM,,Coronado Fwy E,Closed at Rio Grande Blvd/Exit 157 - Road closed due to accident.
2,2020-03-31 17:26:10,35.0876,-107.7741,Grants,NM,,I-40 W,At I-40-BL/Exit 85 - Accident.
3,2019-10-03 18:20:05,35.0977,-106.569,Albuquerque,NM,,Louisiana Blvd NE,Accident on I-40 Eastbound at Exit 162 Louisiana Blvd.
3,2020-08-30 10:33:06,35.0307,-106.9477,Laguna,NM,,Frontage Rd NW,Lane blocked due to accident on I-40 Eastbound from Canoncito School Rd to Central Ave.
2,2019-03-19 06:54:57,35.6342,-106.0203,Santa Fe,NM,4319,Cerrillos Rd,Accident on NM-14 Cerrillos Rd at Wagon Rd.
2,2019-09-10 10:09:47,32.314,-106.7473,Las Cruces,NM,,I-25 N,Accident on I-25 Northbound before Exit 3 NM-342 Lohman Ave.
2,2020-12-19 23:56:00,34.9829,-107.1149,Laguna,NM,,Historic US 66 E,Stationary traffic on I-40 E - Historic US 66 E from NM-6/Exit 126 (I-40) to Indian Service Rd/Exit 140 (I-40) due to accident.
2,2020-10-27 05:15:26,35.365,-108.0561,Prewitt,NM,,I-40 W,Incident on I-40 WB near MM 63 Expect delays.
2,2020-12-02 18:45:58,35.0685,-106.6309,Albuquerque,NM,,Avenida Cesar Chavez SE,Accident on University Blvd at Avenida Cesar Chavez.
3,2018-12-31 07:24:48,35.2523,-105.3834,Ribera,NM,,NM-3,At Edgewood - Accident. Roadway reduced to 1 lane.
2,2020-10-15 01:39:30,35.5093,-108.5364,Gallup,NM,,I-40 E,Stationary traffic on I-40 from NM-400/Exit 33 (I-40) to Historic Rte 66/Exit 36 (I-40) due to accident.
3,2020-05-21 14:53:43,35.0846,-107.7702,Cubero,NM,,NM-117,Accident on I-40 Eastbound at Exit 89 NM-117.
2,2018-09-20 18:12:28,35.0728,-106.5775,Albuquerque,NM,499,San Pedro Dr SE,Accident on San Pedro Dr at Zuni Rd.
2,2020-05-15 21:50:45,35.1758,-106.5688,Albuquerque,NM,,Holly Ave NE,Accident on Louisiana Blvd at Holly Ave.
3,2019-04-20 16:58:09,35.1252,-106.6207,Albuquerque,NM,,I-25 N,Two lanes blocked due to accident on I-25 Northbound at Pan American Fwy.
3,2017-08-15 06:39:25,35.083,-106.6365,Albuquerque,NM,,I-25 N,Left lane blocked due to accident on I-25 Northbound between Exit 223 Avenida Cesar Chavez and Exits 224A 224B Central Ave.
2,2019-09-16 09:04:58,34.3469,-106.8769,San Acacia,NM,,US-60 E,At Exit 169 - Accident. Right lane blocked.
4,2019-02-07 14:32:14,35.1557,-107.878,Grants,NM,,I-40 E,Closed at NM-53/Exit 81 - Road closed due to accident.
4,2019-12-24 09:00:34,32.6587,-103.1275,Hobbs,NM,,E Llano Grande Dr,Closed at Hobbs South Byps - Road closed due to accident.
2,2018-09-13 15:01:25,35.099,-106.6274,Albuquerque,NM,1600,University Blvd NE,Accident on Indian School Rd at University Blvd.
3,2019-08-08 14:16:16,35.1053,-106.6291,Albuquerque,NM,,I-25 N,Right lane blocked due to accident on I-40 Westbound at Exit 159B-C I-25.
3,2018-06-07 18:06:57,35.1067,-106.7044,Albuquerque,NM,,Coors Blvd NW,Accident on I-40 Eastbound at Exit 155 NM-448 Coors Blvd.
2,2018-02-06 13:11:12,35.131,-106.5853,Albuquerque,NM,5231, Montgomery Blvd NE,At San Mateo Blvd - Accident.
2,2017-11-10 07:48:52,35.0688,-106.5034,Albuquerque,NM,13000,Central Ave NE,Accident on Dorado Pl both ways at Central Ave.
2,2017-11-10 08:30:58,35.0697,-106.6456,Albuquerque,NM,,Avenida Cesar Chavez SE,Accident on Avenida Cesar Chavez at NM-47 Broadway Blvd.
2,2019-01-24 17:04:11,35.0904,-106.6253,Albuquerque,NM,,Lomas Blvd NE,Accident on Lomas Blvd Westbound at University Blvd.
3,2018-08-23 10:04:45,35.1238,-106.6217,Albuquerque,NM,,Comanche Rd NE,Jackknifed vehicle on I-25 Southbound at Exit 227 Pan American Fwy.
2,2020-11-10 08:37:48,35.1059,-106.7039,Albuquerque,NM,1751,57th St NW,Accident on entry ramp to I-40 Eastbound from Coors Blvd Nw Northbound.
2,2020-01-15 08:13:56,35.0863,-106.6441,Albuquerque,NM,,Broadway Blvd NE,Accident on NM-47 Broadway Blvd Southbound at Dr Martin Luther King Jr Ave.
2,2019-02-09 10:32:45,35.091,-106.6486,Albuquerque,NM,208,Lomas Blvd NW,Accident on 3rd St at Lomas Blvd.
3,2018-09-01 05:11:05,35.3964,-108.2234,Thoreau,NM,,Historic US 66 W,Accident on I-40 Westbound at Exit 53 NM-612 Bluewater Rd.
2,2017-08-18 14:04:36,35.3123,-106.5343,Bernalillo,NM,,I-25 N,At NM-44/NM-165/Exit 242 - Accident.
4,2019-05-05 09:29:59,35.3632,-108.0521,Prewitt,NM,,Historic US 66 E,Earlier accident on I-40 Westbound from Exit 72 Main St to Exit 63 NM-412. All lanes have been re-opened.
2,2018-11-14 15:33:02,35.2178,-106.6966,Albuquerque,NM,,Black Arroyo Blvd NW,At McMahon Blvd - Accident.
2,2018-09-21 17:08:48,35.1004,-106.7071,Albuquerque,NM,1499,Coors Blvd NW,Accident on Hanover Rd at NM-45 Coors Blvd.
2,2017-08-29 19:31:07,35.1809,-106.6681,Albuquerque,NM,,Paseo del Norte W,2-Left lane closed due to accident on NM-448 Coors Blvd Westbound at NM-423 Paseo del Norte.
4,2018-08-07 15:36:20,35.0348,-107.3428,Casa Blanca,NM,,Historic US 66 E,Closed at BIA-491/Exit 117 - Road closed due to accident.
2,2020-11-27 16:58:26,35.5274,-108.7643,Gallup,NM,,I-40 W,Incident on I-40 WB near MM 17 Expect delays.
2,2020-02-21 07:02:24,35.1124,-106.7037,Albuquerque,NM,2601,57th St NW,Accident on Ouray Rd near 57th St.
2,2017-11-08 15:48:01,35.1845,-106.5859,Albuquerque,NM,5203,Alameda Blvd NE,Accident on NM-528 Alameda Blvd at San Mateo Blvd.
2,2019-01-02 07:55:07,35.1326,-106.6097,Albuquerque,NM,,I-25 N,Accident on I-25 Northbound at Montana Rd.
3,2019-12-20 07:25:45,35.0833,-106.5328,Albuquerque,NM,,Coronado Fwy E,Accident on I-40 Westbound at Exit 165 Eubank Blvd.
4,2018-03-21 11:14:32,35.183,-107.8973,Grants,NM,,Horizon Ave,Closed between 605 and Milan St - Road closed due to accident.
2,2020-11-12 05:12:27,35.3547,-108.0315,Prewitt,NM,,I-40 E,Incident on I-40 EB near MM 64 Right lane blocked. Expect delays.
3,2019-06-11 16:49:13,35.1777,-106.5832,Albuquerque,NM,,I-25 S,Right lane blocked due to accident on I-25 Northbound at Exit 232 Pan American West Fwy.
3,2018-02-16 07:44:46,35.106,-106.6474,Albuquerque,NM,,4th St NW,Right lane blocked due to accident on I-40 Westbound at Exits 158 159A NM-556 4th St.
4,2018-01-04 12:21:41,35.1608,-106.7266,Albuquerque,NM,,Unser Blvd NW,Closed at Montano Rd - Road closed due to accident.
2,2019-11-25 08:17:10,35.0588,-106.6308,Albuquerque,NM,2286,University Blvd SE,Accident on Gibson Blvd at University Blvd.
3,2019-05-07 17:43:10,35.1068,-106.6501,Albuquerque,NM,,6th St NW,Accident on I-40 Westbound at Exits 158 159A Indian School Rd.
3,2019-11-05 18:31:11,35.1352,-106.6059,Albuquerque,NM,,I-25 S,Center lane blocked due to accident on I-25 Southbound at Exit 228 Pan American West Fwy.
3,2017-08-18 07:28:49,35.1533,-107.8734,Grants,NM,,NM-53,Right lane closed and right hand shoulder closed due to accident on I-40 Westbound between Exit 89 NM-117 and Exits 81 81A 81B NM-53.
3,2017-07-31 18:14:36,35.1036,-106.5839,Albuquerque,NM,,Coronado Fwy W,At San Mateo Blvd/Exit 161 - Accident.
2,2017-03-22 14:33:01,33.0612,-107.3088,Caballo,NM,,I-25 N,At CR-B076/Exit 71 - Accident.
3,2018-11-22 08:34:53,35.1066,-106.6503,Albuquerque,NM,,6th St NW,Accident on I-40 Eastbound at 6th St.
2,2020-01-15 06:24:45,35.0557,-106.7407,Albuquerque,NM,,Sage Rd SW,Accident on 98th St at Sage Rd.
3,2017-10-23 07:59:52,35.0977,-106.5689,Albuquerque,NM,,Coronado Fwy W,Accident on I-40 Eastbound at Exit 162 Louisiana Blvd.
2,2020-06-24 06:44:39,35.1057,-106.6452,Albuquerque,NM,,Coronado Fwy E,Between 4th St/Exit 159A and I-25/Exit 159B - Accident. Right lane blocked. on the right.
2,2020-10-26 23:40:58,35.0118,-107.322,Casa Blanca,NM,,Indian Service Route 491,Incident on I-40 EB near MM 114 Left lane blocked.
2,2020-10-27 02:43:30,35.365,-108.0561,Prewitt,NM,,I-40 W,Slow traffic on I-40 from NM-412/Exit 63 (I-40) to NM-371/Exit 53 (I-40) due to accident.
2,2017-04-07 13:47:41,35.08,-106.7104,Albuquerque,NM,,Central Ave NW,At Coors Blvd - Accident.
2,2018-08-16 10:32:58,35.1329,-106.6098,Albuquerque,NM,,US-85 S,Accident on Montano Rd at I-25.
4,2017-10-04 13:21:24,36.6172,-103.6894,Grenville,NM,3088, Raton Hwy,Closed at CR-A012/Gallegos Rd - Road closed due to accident.
3,2017-10-26 18:09:27,35.1067,-106.7044,Albuquerque,NM,,Coors Blvd NW,Right lane blocked due to accident on I-40 Westbound at Exit 155 NM-448 Coors Blvd.
2,2017-12-07 13:45:58,35.0981,-106.649,Albuquerque,NM,1400,4th St NW,Accident on Kinley Ave at NM-556 4th St.
2,2019-06-05 17:16:21,35.7837,-105.9487,Santa Fe,NM,,Bishops Lodge Rd,One lane blocked due to accident on US-84 Southbound at Exit 172 Frontage Rd.
2,2018-06-28 17:41:36,35.1284,-106.616,Albuquerque,NM,4096,Vassar Dr NE,Accident on Vassar Dr at Pan American Fwy.
3,2020-10-25 06:21:43,35.0176,-104.4408,Cuervo,NM,,Historic US 66 W,Left lane blocked due to accident on I-40 Westbound at Old Cuervo 66 / Cuervo Ln.
3,2019-12-06 17:40:36,35.1072,-106.7036,Albuquerque,NM,,Coronado Fwy W,Lane blocked due to accident on I-40 Westbound at Exit 155 NM-448 Coors Blvd.
2,2019-11-26 09:03:15,35.0664,-106.6753,Albuquerque,NM,,Bridge Blvd SW,Lane blocked due to accident on Bridge Blvd Eastbound at Sunset Rd.
4,2020-12-19 23:34:09,34.9829,-107.1149,Laguna,NM,,Historic US 66 E,Incident on I-40 EB near MM 139 Road closed. Take alternate route.
3,2019-06-29 17:33:14,35.5305,-108.6697,Gallup,NM,,E Historic Highway 66,Accident on I-40 Eastbound at Exit 26 I-40-BL Historic Highway 66.
2,2020-06-26 17:09:55,35.1054,-106.6406,Albuquerque,NM,,Coronado Fwy W,Ramp to I-40 Westbound - Accident. Right lane blocked.
2,2019-03-02 19:34:01,35.1238,-106.6218,Albuquerque,NM,,I-25 N,Accident on Pan American Fwy at Comanche Rd.
3,2018-03-16 06:28:32,35.366,-106.4853,Algodones,NM,,US-85 S,Right lane blocked due to accident on I-25 Southbound after Exit 248 NM-315.
2,2018-10-31 15:22:35,35.0697,-106.6419,Albuquerque,NM,698,Avenida Cesar Chavez SE,Accident on Avenida Cesar Chavez at Walter St.
2,2018-05-10 14:58:10,35.1113,-106.5598,Albuquerque,NM,2714,Pennsylvania St NE,Accident on Pennsylvania St Northbound at Phoenix Ave.
4,2018-05-16 14:01:27,35.6995,-105.9882,Santa Fe,NM,,Veterans Memorial Hwy,Closed at CR-77/Camino La Tierra/Paseo Nopal - Road closed due to accident.
4,2018-08-30 04:47:04,34.6924,-104.3842,Santa Rosa,NM,,US-84 N,Closed at CR-217/Potrillo Rd - Road closed due to accident.
3,2018-05-31 09:36:16,35.1047,-106.6289,Albuquerque,NM,,I 40 Frontage Rd NE,Entry ramp to I-25 Northbound from I-40 Eastbound lane blocked due to accident.
2,2016-07-05 15:44:51,35.139,-106.5992,Albuquerque,NM,,I-25 N,Between Jefferson St/Exit 229 and Osuna Rd/Exit 230 - Accident.
2,2018-01-22 15:37:31,35.1888,-106.7475,Albuquerque,NM,,Paseo Norte NW,Accident on Paseo Norte at Ventana West Pkwy.
2,2019-10-01 07:11:06,35.2415,-106.697,Rio Rancho,NM,,Southern Blvd SE,Multi-vehicle accident on Unser Blvd at Southern Blvd.
2,2018-10-15 16:52:21,35.1451,-106.6929,Albuquerque,NM,,Coors Blvd NW,Accident on NM-448 Coors Blvd at Dellyne Ave.
2,2016-08-11 11:57:01,34.9447,-104.6727,Santa Rosa,NM,,Historic Route 66,At I-40-BL/Exit 275 - Accident.
2,2019-10-31 17:51:43,33.0439,-106.0084,Tularosa,NM,7678,Highway 54 70,3rd lane blocked due to accident on US-54 Northbound at Sun Valley Rd.
2,2018-08-15 18:18:39,35.1389,-106.5334,Albuquerque,NM,9668,Spain Rd NE,Accident on Eubank Blvd at Spain Rd.
2,2017-09-18 07:05:25,35.1109,-106.6466,Albuquerque,NM,363,Menaul Blvd NW,Accident on NM-556 4th St at Menaul Blvd.
3,2019-09-06 16:47:55,35.1052,-106.6707,Albuquerque,NM,,Coronado Fwy W,3 right lane blocked due to accident on I-40 Westbound at Exit 157A NM-194 Rio Grande Blvd.
3,2018-01-15 15:21:33,32.2392,-107.4184,Deming,NM,,US-70 W,Right lane blocked due to accident on I-10 Eastbound at Exit 102 Frontage Rd.
2,2018-05-18 14:23:31,35.1598,-106.6794,Albuquerque,NM,6365,Coors Blvd NW,Accident on NM-448 Coors Blvd at La Orilla Rd.
3,2018-08-01 06:59:20,35.1063,-106.3414,Tijeras,NM,,I-40 W,Restrictions due to accident on I-40 Westbound between Exit 181 NM-306 Sedillo Hill Rd and Exit 178 Access Rd.
2,2018-08-01 11:05:33,35.0749,-106.5592,Albuquerque,NM,,Pennsylvania St SE,Accident on Central Ave at Pennsylvania St.
2,2018-03-29 20:25:14,35.102,-106.5508,Albuquerque,NM,8500,Indian School Rd NE,Queueing traffic due to accident on Wyoming Blvd Southbound at Indian School Rd.
2,2020-12-19 23:34:09,35.0103,-107.0287,Laguna,NM,,Historic US 66 E,Incident on I-40 EB near MM 139 Road closed. Take alternate route.
2,2017-10-03 11:06:22,35.0902,-106.6253,Albuquerque,NM,976,University Blvd NE,Accident on University Blvd at Lomas Blvd.
3,2020-10-23 15:51:32,32.2819,-106.8827,Las Cruces,NM,,I-10 E,Left lane blocked due to accident on I-10 Westbound from NM-292 Motel Blvd to US-70 Picacho Ave.
3,2018-05-08 16:56:16,35.1602,-106.587,Albuquerque,NM,,I-25 N,Left lane blocked due to accident on I-25 Southbound at Exit 231 Pan American Fwy.
3,2018-02-22 17:05:43,35.1533,-106.5885,Albuquerque,NM,,I-25 N,Right lane blocked due to accident on I-25 Southbound at Exit 230 Osuna Rd.
3,2017-11-20 07:49:44,35.1047,-106.6289,Albuquerque,NM,,I 40 Frontage Rd NE,Exit ramp from I-40 Eastbound at Exits 159B-C 159C-B 159D to I-25 Northbound lane closed due to accident.
2,2019-01-29 07:24:43,35.1898,-106.6842,Albuquerque,NM,4817,Paradise Blvd NW,Accident on Golf Course Rd at Paradise Blvd.
3,2020-01-16 07:13:06,32.1255,-106.6392,Vado,NM,,I-10 E,Restrictions due to accident on I-10 Westbound at Exit 155 NM-227 Vado Dr.
3,2018-08-27 16:52:45,35.1043,-106.5993,Albuquerque,NM,,Coronado Fwy W,At Carlisle Blvd/Exit 160 - Accident. Emergency vehicle. 3 right lanes closed.
2,2018-02-27 11:15:23,35.1956,-106.6584,Albuquerque,NM,,Coors Byp NW,Accident on Coors Byp at Cottonwood Loop.
2,2020-12-24 16:17:13,36.797,-108.6905,Shiprock,NM,,US-491 N,Incident on US-491 NB near MM 93 Expect delays.
2,2020-12-13 19:38:30,35.1533,-107.8733,Grants,NM,,I-40 E,Stationary traffic on I-40 E from I-40/Exit 79 (I-40) to NM-117/Exit 89 (I-40) due to accident.
2,2018-02-27 12:05:09,35.1309,-106.5932,Albuquerque,NM,4498,Montgomery Blvd NE,Accident on Montgomery Blvd at Jefferson St.
2,2018-04-23 10:20:31,35.1066,-106.6956,Albuquerque,NM,,Coronado Fwy E,At Rio Grande Blvd/Exit 157 - Accident.
3,2019-12-03 08:26:21,35.1052,-106.6707,Albuquerque,NM,,Coronado Fwy W,Right lane blocked and right hand shoulder blocked due to accident on I-40 Eastbound at Exit 157A NM-194 Rio Grande Blvd.
2,2020-12-31 18:53:00,32.6157,-106.9552,Las Cruces,NM,,I-25 N,Stationary traffic on US-85 N - I-25 N from Exit 19 (I-25) to Exit 32 (I-25) due to accident.
2,2019-05-16 07:18:58,35.1019,-106.6471,Albuquerque,NM,1801,3rd St NW,Accident on Hannett Ave at 3rd St.
2,2019-05-20 16:29:55,35.0945,-106.5328,Albuquerque,NM,1397,Eubank Blvd NE,Accident on Eubank Blvd at Constitution Ave.
2,2018-02-15 09:57:50,35.1809,-106.6681,Albuquerque,NM,,Paseo del Norte W,Accident on NM-448 Coors Blvd at NM-423 Paseo del Norte.
4,2016-10-05 08:29:12,32.8325,-106.0661,Alamogordo,NM,20697, Highway 70 W,Closed between US-54 (West) and Alamogordo - Road closed due to accident.
2,2020-08-21 13:49:19,35.1052,-106.6387,Albuquerque,NM,,Coronado Fwy W,Accident on I-40 Westbound at Exit 159B-C I-25 Exit 226B-A.
2,2020-12-03 02:09:48,32.1292,-106.6408,Vado,NM,,US-180 W,Incident on I-10 WB near MM 155 Road closed. Take alternate route.
2,2019-04-25 15:33:46,35.1184,-106.7016,Albuquerque,NM,3205,Coors Blvd NW,Accident on NM-448 Coors Blvd at Redlands Rd.
2,2018-05-18 14:34:24,35.1067,-106.7044,Albuquerque,NM,,Coors Blvd NW,Accident on NM-448 Coors Blvd at I-40.
2,2018-05-20 10:13:28,35.099,-106.6274,Albuquerque,NM,1600,University Blvd NE,Accident on Indian School Rd at University Blvd.
2,2020-11-13 15:37:12,35.1838,-106.6736,Albuquerque,NM,,Eagle Ranch Rd NW,Accident on Paradise Blvd at Eagle Ranch Rd.
2,2017-09-08 12:20:26,35.1092,-106.6204,Albuquerque,NM,2101,Menaul Blvd NE,Accident on Menaul Blvd at Princeton Dr.
2,2020-01-31 07:52:11,35.117,-106.6357,Albuquerque,NM,,Franciscan St NE,Accident on NM-47 Candelaria Rd at Franciscan St.
3,2018-11-15 18:55:11,32.314,-106.7475,Las Cruces,NM,,E Lohman Ave,Accident on I-25 Southbound between Exit 6 US-70 and Exit 3 Lohman Ave.
2,2020-10-27 08:39:30,32.2493,-107.4652,Deming,NM,,I-10 E,Stationary traffic on I-10 from CR-B041/Lewis Flats Rd NE (I-10) to NM-549/Exit 116 (I-10) due to accident.
3,2016-12-08 11:04:17,35.1073,-106.6196,Albuquerque,NM,,Coronado Fwy W,Ramp to I-25/Historic Route 66 - Accident.
2,2020-11-12 21:06:37,35.1791,-106.6276,Albuquerque,NM,,Paseo del Norte E,Incident on NM-423 near MM 3 Expect long delays.
2,2017-06-09 15:13:15,35.396,-108.2225,Thoreau,NM,,Historic US 66 E,Between NM-371/Exit 53 and NM-412/Exit 63 - Accident.
2,2017-06-01 11:49:57,35.0582,-106.577,Albuquerque,NM,5856, Gibson Blvd SE,At Arizona St SE - Accident.
2,2019-04-12 17:48:25,35.1165,-106.5864,Albuquerque,NM,5200,Candelaria Rd NE,Accident on Candelaria Rd at San Mateo Blvd.
2,2020-06-16 16:59:47,35.1073,-106.6184,Albuquerque,NM,,Coronado Fwy E,At University Blvd/Exit 159D - Accident. Right lane blocked.
1,2020-06-29 08:14:25,35.1671,-106.7249,Albuquerque,NM,6801, Rainbow Blvd NW,At Unser Blvd NW - Accident.
2,2019-03-05 07:55:57,35.0902,-106.5509,Albuquerque,NM,,Coronado Fwy W,Accident on I-40 Eastbound at Exit 164 Wyoming Blvd.
2,2017-12-13 08:25:30,35.0789,-106.5209,Albuquerque,NM,,Coronado Fwy W,Right lane blocked due to accident on I-40 Westbound at Exit 166 Juan Tabo Blvd.
2,2019-05-22 18:43:38,35.0697,-106.6456,Albuquerque,NM,,Avenida Cesar Chavez SE,Accident on Avenida Cesar Chavez at NM-47 Broadway Blvd.
3,2017-12-13 18:17:55,35.0559,-106.6377,Albuquerque,NM,,I-25 N,At Gibson Blvd/Exit 222 - Accident. Left lane blocked.
4,2019-08-25 14:36:16,35.1515,-103.7406,Tucumcari,NM,,I-40 E,Closed between Camino Del Coronado/Exit 331 and NM-104/NM-209/1st St/Exit 332 - Road closed due to accident.
2,2017-11-13 17:20:57,35.0847,-106.6132,Albuquerque,NM,2899,Campus Blvd NE,Accident on Campus Blvd at Girard Blvd. Police directing traffic.
2,2018-09-07 18:15:11,36.0836,-104.6884,Wagon Mound,NM,,I-25 N,Between Exit 393 and NM-569/Exit 404 - Accident. Lane blocked.
3,2019-11-05 08:56:45,35.1052,-106.6707,Albuquerque,NM,,Coronado Fwy W,Left lane blocked and left hand shoulder blocked due to accident on I-40 Westbound between Exit 157B 12th St and Exit 157A NM-194 Rio Grande Blvd.
3,2018-12-13 16:15:51,35.1052,-106.671,Albuquerque,NM,,Rio Grande Blvd NW,Accident on I-40 Westbound at Exit 157A NM-194 Rio Grande Blvd.
2,2016-12-12 10:39:05,35.1815,-106.5821,Albuquerque,NM,,I-25 N,At Alameda Blvd/NM-528/Exit 233 - Accident.
2,2019-03-06 11:54:45,35.148,-106.5864,Albuquerque,NM,,Academy Rd NE,Accident on San Mateo Blvd at Academy Rd.
3,2019-01-07 12:42:38,35.1069,-106.704,Albuquerque,NM,,Coronado Fwy W,Right lane blocked due to accident on I-40 Westbound at Exit 155 NM-448 Coors Blvd.
2,2017-06-15 15:28:55,35.4227,-108.31,Continental Divide,NM,,Historic US 66 W,At Exit 47 - Accident.
2,2019-09-02 14:54:17,32.2405,-108.9495,Lordsburg,NM,,I-10 W,At NM-80/Exit 5 - Accident. Left lane blocked.
3,2019-10-04 12:47:54,35.1052,-106.605,Albuquerque,NM,,Coronado Fwy W,Right lane blocked due to accident on I-40 Westbound at Exit 160 Carlisle Blvd.
3,2018-08-17 17:15:20,35.1416,-106.595,Albuquerque,NM,5199,Jefferson St NE,Right lane blocked due to accident on I-25 Southbound at Exit 229 Pan American Fwy.
2,2018-04-19 09:04:00,35.1054,-106.643,Albuquerque,NM,,Coronado Fwy E,At I-25/Exit 159B - Accident. Left lane closed.
2,2018-09-24 14:25:34,34.6008,-108.3967,Cubero,NM,,NM-117,Lane blocked due to accident on NM-117 Southbound at NM-36 NM-117.
